username,tweet
Abdee,operasi buru teroris kawasan tnll akibat objek wisata tutup hambat program konservasi
Abdee,komunitas motor giat alam bebas touna kolaborasi tanam mangrove
Abdee,pandemi corona bawaslu sulteng inovasi koperasi konvensional virtual
Abdee,geliat lingkung hidup dunia pesisir teluk tomini parigi moutong
Abdee,kelompok kups alitupu ajar pascapanen kopi dombu
Abdee,tengah kalla grup luncur toyota raize palu
Abdee,tuduh mahasiswa uang bwss ii oknum akitivis lapor polda gorontalo
Abdee,dpd knpi morowali balut resmi beku
Abdee,anak terima harga lomba luk tema corona hutan program
Abdee,saing pria himran daur ulang lagu legendaris vose sakaya
Abdee,gelar duta narkotika psikotropika obat terlarang tengah pandemi bnnp sulteng paksa batas
Abdee,hadir rapat paripurna panitia corona dprd touna tunda
Abdee,layan optimal tim pungli kunjung samsat palu
Abdee,terorisme poso warga takut wabup yasin temu presiden jokowi
Abdee,kapolda sulteng target berantas kelompok mit
Abdee,gubernur sulteng ajak usaha genjot vaksinasi gotong royong
Abdee,dana stimulan salur walikota palu tanggal insya tuhan selesai
Abdee,wahyu hidayat sudirman resmi jabat wakil ketua dprd morut
Abdee,reuni alumni smansa poso angkat raymon anwar hafid duduk
Abdee,abdee negara angkat komisaris pt telekomunikasi indonesia
Abdee,kunker poso tojo unauna panglima tni kapolri kuat sinergitas
Abdee,wamen pupr pemerintah kota palu peduli selesai huntap
Abdee,prosesi ibadah raya waisak kota palu batas ketat prokes
Abdee,desa tangguh lurah birobuli selatan palu zero corona
Abdee,gempa maag guncang palu rups lb bank sulteng hambur
Abdee,silaturahmi bangsa pks nasdem sulteng topik gempa terorisme
Abdee,tanah gugat tum pb alkhairaat ganggu singa tidur
Abdee,morut raih opini wtp
Abdee,karyawan imip jalan vaksinasi corona
Abdee,buaya ukur jumbo tangkap donggala warga
Abdee,pegawai bps papar corona jalan vaksinasi
Abdee,polsek toili ikan edukasi prokes operasi yustisi
Abdee,kecam aksi terorisme pemuda tentena tni polri usut poso
Abdee,karyawan imip terima vaksin corona
Abdee,pegawai bnn poso sunti vaksin corona
Abdee,unjuk kait nyonya listrik amm kepala pln copot
Abdee,duga jambret karyawan bank poso bekuk polisi warga ampana
Abdee,temu gubernur longki kepala bank btn cabang palu papar
Abdee,anggota bhayangkari polres palu vaksinasi dosis
Abdee,polres sigi laksana oke yd imbau kendara patuh protokol sehat
Abdee,menteri ekonomi jokowi kadin sulteng dukung ars pimpin kadin indonesia
Abdee,himpun tani kamanuru target tanam kopi hektar
Abdee,pemerintah daerah poso gandeng tokoh lintas agama bahas terorisme
Abdee,sigi terima harga susun lkpd
Abdee,cepat layan izin dinas pmptsp morowali integrasi
Abdee,tnk belas kasihan juara turnamen gratis api tentena
Abdee,anwar hafid temu bupati morowali tuntas insfrastruktur masjid agung
Abdee,suara palestina rachmat gobel mundur wakil ketua dpr republik indonesia
Abdee,pasca aksi teroris mit warga timur trauma kebun
Abdee,ijasah si imran latjedi ancam batal kais waket dprd sigi
Abdee,polisi selidik bakar rujab pimpin dprd parigi moutong
Abdee,rujab ketua dprd parigi moutong wakil ludes bakar
Abdee,sispek tutup ramadhan
Abdee,wartawan morowali paket lebaran kaum dhuafa
Abdee,serah terima jabatan polres morowali nama nama
Abdee,kodim morowali ikan harga veteran warakauri
Abdee,lupa saudara unsimar poso santun panti asuh kaum duafa
Abdee,reses sakinah aljufri serap aspirasi konstituen
Abdee,kapolres morowali periksa pos aman idul fitri
Abdee,cegah kanker payudara astra agro gelar agrovaria lovepink
Abdee,jelang idul fitri pt imip salur paket sembilan bahan pokok ribu masker kaum dhuafa
Abdee,peduli hipmi poso santun anak yatim
Abdee,sidang paripurna dprd morowali hasil reses anggar apbd ubah
Abdee,kadin peduli dorong sejahtera masyarakat ramadhan
Abdee,keluh kesah dagang pakai muslimah palu pandemi ramadhan
Abdee,bupati poso izin sholat idul fitri jamaah
Abdee,kapolres poso mudik lintas batas pulang
Abdee,gugat moeldoko cs tolak adil mehbob berani gugat berani hadir
Abdee,potong donasi alfamidi komplain disperindag parigi moutong inspeksi mendadak
Abdee,putus rantai corona samapta polres morowali patroli turjawali
Abdee,ajar tatap muka poso laksana juli
Abdee,lebaran usaha wajib bayar thr
Abdee,wilayah sulteng masyarakat pergi
Abdee,pemerintah daerah touna alokasi dana rp juta pasar lelang area
Abdee,komunitas pemuda poso paket cemil sahur
Abdee,tindaklanjuti temu republik indonesia pemerintah daerah morowali gelar rapat koordinasi
Abdee,lonjak pelni palu pergi tumpang larang mudik
Abdee,esports indonesia poso santun santri panti asuh yayasan faradhila
Abdee,spim aspirasi dialogis
Abdee,jelang idul fitri kapolda sulteng maklumat
Abdee,lantik bupati morut delis tancap ayo penuh
Abdee,kapolda sulteng kelompok teroris ali kalora cs serah
Abdee,gubernur area area hubung sulteng mudik
Abdee,wabup parigi moutong marah jabat abai lhkpn
Abdee,bnn poso ajak kaum milenial narkotika psikotropika obat terlarang
Abdee,musisi sulteng jakarta rilis tunggal religi nuzulul quran
Abdee,panen jagung perdana tani jono bina ypi hasil ton hektar
Abdee,safari ramadan sulteng ahy pikir ulama butuh negara
Abdee,realisme bantal skbs parigi moutong awas legislatif lemah eksekutif keliru
Abdee,latih ramadhan
Abdee,duga leceh karyawan usaha wna tiongkok morut lapor polisi
Abdee,buka pintu demokrat kubu klb moeldoko ahy maaf lupa
Abdee,butuh uang kartal sulteng rp ramadan idul fitri
Abdee,aktifitas tumpang bandara mutiara saudara wanita al jufrie palu prediksi turun
Abdee,dprd sulteng sosialisasi peraturan daerah nomor tahun
Abdee,ajar bencana palu rizal revisi rtrw
Abdee,program bupati poso darmin sigilipu janji politik
Abdee,buron asn koruptor jembatan torate donggala ciduk kantor binamarga sulteng
Abdee,tangan musibah pemerintah kota palu bentuk satgas reaksi cepat
Abdee,warga lurah palu sanksi rp juta
Abdee,kartini reny lamadjido perempuan inovasi
Abdee,ajar tatap muka fisip untad palu tunggu putus perintah
Abdee,kisah kartini juang pandemi
Abdee,gubernur longki kartini dorong saudara laki perhati eksistensi perempuan
Abdee,ramadhan
Abdee,walikota palu asn pemerintah kota disiplin
Abdee,pemkab sigi bni jajak kerjasama pintar kota
Abdee,polres morowali sedia parkir sandang disabilitas
Abdee,video nelayan parimo temu gorontalo hilang hantam badai
Abdee,tafakur ramadhan
Abdee,video cabul anak tiri usia tahun pria parigi ringkus polisi
Abdee,tps morowali utara gelar psu pilih bupati wakil bupati
Abdee,puting beliung terjang desa meko warga temu tinggal
Abdee,richard djanggola lantik jabat bupati tojo unauna
Abdee,ramadhan kualitas
Abdee,oknum polisi duga aniaya anak parigi
Abdee,kejat sulteng sangka duga korupsi jembatan torate
Abdee,tingkat huni kamar hotel sulteng tingkat persen
Abdee,semangat ramadhan
Abdee,galungan puasa umat hindu palu ajak jaga toleransi
Abdee,kendara keluh jalan lubang camat palu selatan
Abdee,buru hotel ancyra poso sedia promosi ramadhan
Abdee,maritim nelayan lanal palu kal transportasi
Abdee,pondok sulawesi tengah sederhana
Abdee,hmi touna nyonya pln defisit daya
Abdee,polisi aman sembilan pasang mesum bahodopi
Abdee,ramadhan
Abdee,rachmat gobel tantang syarief mbuinga pilgub gorontalo
Abdee,pawai obor sambut ramadhan poso ribu umat islam
Abdee,temu sajam blok tahan kalapas askar kreatif
Abdee,arkom sintas tompe donggala bangun huntap
Abdee,forum prb sigi kuat mekanisme kerjasama saudara laki
Abdee,korupsi jembatan palu jaksa rugi negara rp miliar
Abdee,rektor unismuh palu rajindra lantik
Abdee,kkntt sulteng buka posko peduli bencana banjir bandang ntt
Abdee,rapat koordinasi pasuk ibadah puasa pemcam timur
Abdee,pemerintah kota palu program bedah rumah rumah susun warga
Abdee,gedung ruang praktek smk palu sigi resmi
Abdee,ungsi banjir bandang desa beka rumah
Abdee,bpc hipmi morowali kunjung makassar ajak usaha investasi area
Abdee,urus pwi poso bakti resmi lantik
Abdee,sembilan jabat pimpin tinggi pratama pemerintah daerah morowali lantik
Abdee,timbun tengah kilogram sabu pria bangga bekuk polisi
Abdee,anindya arsjad caketum nilai pimpin kadin indonesia
Abdee,disperindag parigi moutong tera ulang spbu
Abdee,pemerintah daerah morowali target tingkat pajak rp miliar
Abdee,tes genose bandara mutiara saudara wanita al jufri palu
Abdee,paskah pendeta jefri adrianus imbau jaga rukun umat agama
Abdee,tim mobile legends tentena juara turnamen esi poso
Abdee,bijak pemerintah daerah morowali larang pasar ramadhan sorot
Abdee,polres kodim gelar patroli skala morowali
Abdee,duta promosi sehat corona palu kukuh
Abdee,anggota pfi palu sabet gelar foto tahun apfi
Abdee,parigi moutong tangan stunting sulteng
Abdee,fkub sulteng imbau ketat aman raya jumat agung
Abdee,dukung esports wabup poso silah karya
Abdee,morowali potensi edar narkotika psikotropika obat terlarang
Abdee,wakil ketua ii dprd parigi moutong resmi jabat alfres tonggiroh
Abdee,lkpj walikota palu realisme bantal capai rp miliar
Abdee,negeri palu sabet medali ajang pasga pramuka
Abdee,pmi sulteng stok darah pandemi corona
Abdee,syarat calon jamaah haji usia sulteng vaksinasi corona
Abdee,silaturahmi wartawan morowali danlanal palu ajak bangun sinergitas
Abdee,mui palu kutuk keras aksi bom gereja katedral makassar
Abdee,bom ikan pulau toge buru
Abdee,dukung daur ulang plastik pakai palu
Abdee,kecam aksi bom gereja katedral makassar fkub morowali provokasi
Abdee,kisruh henti wakil ketua ii dprd parigi moutong
Abdee,morowali krisis listrik anleg dpr republik indonesia bicara suluttenggo
Abdee,tanggap keluh warga birobuli selatan ir elisa evaluasi
Abdee,ratus warga dampak banjir bandang beka sigi
Abdee,bangun jembatan jalan lingkar parigi moutong tunda
Abdee,bulog sulteng stok beras aman tujuh
Abdee,antisipasi pandemi fifgroup luncur dana gulir umkm lembaga astra
Abdee,lurah tatura selatan imbau masyarakat waspada pencurian kendaraan bermotor narkotika psikotropika obat terlarang
Abdee,tingkat minat baca masyarakat forum tbm poso bentuk
Abdee,dpo sangka korupsi cristian andi pelang palu
Abdee,innalillahi anggota dprd sulteng budi luhur larengi kabar tinggal dunia
Abdee,gelar aksi aliansi tani lee tolak tinjau pt spn
Abdee,pemerintah daerah parimo gandeng kemenag adil negeri cegah menikah anak usia
Abdee,reses parigi moutong zalzulmida djanggola masyarakat
Abdee,dprd parigi moutong gelar rdp validasi data masyarakat prasejahtera
Abdee,temu wawali palu tim dokter tanggap bencana tawar program mobile oke
Abdee,keras jurnalis alsih tutup kapolres palu maaf
Abdee,moeldoko reforma agraria alih isu partai demokrat
Abdee,kodim morowali vaksinasi corona tahap ii
Abdee,maaf wartawan wijaya tugas periksa
Abdee,bnn palu gandeng lembaga adat tekan edar narkotika psikotropika obat terlarang
Abdee,dpw perindo sulteng benah
Abdee,guru kota palu jalan vaksinasi corona
Abdee,muscab issi palu helmy umar pilih aklamasi
Abdee,sulteng dukung jenderal listyo sigit tum pb issi
Abdee,dprd parigi moutong laksana vaksinasi corona tahap
Abdee,kejar morowali musnah gram sabu butir pil
Abdee,pemerintah kota palu tunda ajar tatap muka april
Abdee,dpd demokrat sulteng serah dokumen sah kemenkumham
Abdee,gilir wartawan palu suntik vaksin corona
Abdee,disperindag palu jual ayo kilogram het sanksi
Abdee,disperindag palu awas bahan pokok jelang ramadhan
Abdee,personel polres poso vaksinasi corona tahap
Abdee,kalla toyota ajak warga manfaat program ppnbm
Abdee,saka bhayangkara polsek dolo responsif bencana
Abdee,lolos seleksi oke personel polda sulteng pergi didik
Abdee,aplikasi aduh masyarakat luncur pemerintah kota palu
Abdee,sambut nyepi tahun saka umat hindu palu ibadah melasti batas
Abdee,operator alat berat tahan polisi kait peti buranga
Abdee,selesai polemik pt poso energi warga wabup yasin prioritas pemerintah daerah
Abdee,viral video anak paksa tua jual anggota dprd palu
Abdee,dukung kreativitas milenial walikota palu bangun gedung seni
Abdee,polsek bahodopi ringkus edar sabu kos kos bahomakmur
Abdee,daya masyarakat domestik lukito pt scem tumpu prekonomian
Abdee,anak duga emis aman satpol pulang pergi trisno paksa
Abdee,lokasi huntap becus evaluasi
Abdee,dinas pmptsp morowali kantor
Abdee,paripurna dprd morowali agenda bahas pokok pikir
Abdee,mimbar bebas solidaritas juang perempuan palu internasional wanita
Abdee,luhut bangun infrastruktur palu walikota menteri bijak
Abdee,nyonya listrik morowali prihatin anwar hafid butuh kerjasama pemerintah daerah pln
Abdee,kolom implementasi pimpin teladan muka example
Abdee,otk tembak nelayan morowali tugas psdkp bitung samar
Abdee,tekan angka keras anak dp sulteng butuh peran organisasi perempuan
Abdee,komunitas sampah sih sampah bantaran sungai pondo palu
Abdee,awat morowali tinggal dunia seret minibus
Abdee,sdc kutuk keras aksi tembak nelayan morowali
Abdee,warga bahodopi temu mayat anak bawa sungai
Abdee,anwar hafid milik suara partai demokrat sulteng padat dukung ahy tolak rencana klb ilegal inkonstitusional
Abdee,kapal tangkap ikan morowali aman
Abdee,mayoritas urus dpd dpc partai demokrat padat pimpin anwar hafid
Abdee,kontak senjata kelompok ali kalora poso anggota brimob gugur
Abdee,jelang ramadhan huntap pombewe balai misi sulteng daya
Abdee,sisa sembilan kapolda sulteng sayang simpatisan dpo mit poso
Abdee,musrenbang rkpd balaesang makmur wujud visi misi bupati donggala
Abdee,guru honorer poso biaya kuliah si profesi ojek online
Abdee,komisoner kpu poso periksa dkpp aduh langgar fatal pecat
Abdee,tim sar temu jenazah timbun lokasi longsor peti buranga
Abdee,anniversary ancyra hotel poso sedia kamar promosi diskon persen
Abdee,polsek tengah gelar kryd botol topi tikus sita
Abdee,polsek tengah operasi patroli rutin kapolsek mari jaga percaya masyarakat
Abdee,malam ourcitrus hadir poso anggota raup omzet ratus juta rupiah
Abdee,video tugas sar temu potong tubuh lokasi longsor peti buranga
Abdee,walhi temu gali tambang emas ilegal parigi moutong
Abdee,video polisi proses hukum pasca longsor peti buranga
Abdee,ekspor perdana ton rempah rempah sulteng terbang negeri matahari terbit
Abdee,polisi janji usut peristiwa longsor lokasi peti buranga
Abdee,pemerintah daerah aparat tutup tambang ilegal parigi moutong
Abdee,cari puluh korban timbun longsor peti buranga kendala lumpur
Abdee,pimpin serah terima jabatan kapolres bangga lantik ganti
Abdee,pasien rumah sakit undata beli lengkap cuci darah mandiri
Abdee,polsek bahodopi ringkus pemuda edar sabu kos kos bahomakmur
Abdee,polres morowali gelar serah terima jabatan kepala satuan kapolsek
Abdee,pamit darmin pimpin opd layan masyarakat poso penuh hati
Abdee,pln ampana jamin nyonya listrik ramadhan
Abdee,turun tangan sih sampah tumpuk lokasi likuifaksi balaroa palu
Abdee,hpsn morowali desa dorong pilot proyek tps
Abdee,koni poso esports rangkul pemuda prestasi
Abdee,krisis udara bersih pt cpm bakrie jujur salur alat murni udara
Abdee,kunjung panglima tni kapolri danlanal palu kejar kelompok mit
Abdee,bicara manfaat bantu sosial pwi poso hadir dinsos pt pos
Abdee,had reni walikota wakil walikota palu
Abdee,kpu verna yasin menang pemilihan kepala daerah serentak poso
Abdee,urus mui dorong urus jenazah materi agama anak didik
Abdee,kejar palu sangka duga korupsi bebas lahan jembatan lalove
Abdee,musrenbang pesisir wabup najamudin realisme program tahap
Abdee,ternak ayam palu keluh anjlok harga telur
Abdee,sikap harga ayo elpiji kilogram dprd pemkab morowali gelar rdp
Abdee,gelar kuat poin lalulintas satlantas polres morowali imbau prokes
Abdee,gelar kuat poin lalulintas satlantas polres morowali imbau prokes
Abdee,dprd fc takluk pt imip fc skor drama aduh finalty
Abdee,kendara motor palu tinggal dunia akibat tabrak minibus
Abdee,danlanal palu hadir vidcon rapim tni polri mapolda sulteng
Abdee,buka musrenbang barat najamudin terakomodir visi misi
Abdee,sayutin budianto pemkab polres parigi moutong investigasi peti buranga
Abdee,surat cepat palsu polres palu proses lidi
Abdee,buka daftar stimulan bpbd palu daftar
Abdee,skenario vaksinasi usia sulteng
Abdee,tata jalan poros sulteng sultra halang lumpur tambang pt cbp
Abdee,morut touna daftar putus perkara pemilihan kepala daerah
Abdee,raya tahun imlek kota palu
Abdee,resah klinik agung palu polisi usut tuntas oknum surat cepat palsu
Abdee,hpn pwi bangga gelar kampanye waspada transmisi domestik corona kalang wartawan
Abdee,hpn kapolres poso ajak wartawan bangun sinergitas
Abdee,komorbid kendala vaksinasi corona nakes palu
Abdee,omzet jual pernak pernik imlek palu turun akibat pandemi
Abdee,ketua dpc pdi misi parigi moutong resmi tahan jaksa
Abdee,peduli nutrisi nusantara salur bantu sayur sayur korban gempa sulbar
Abdee,kunjung untad palu sakinah aljufri serah bantu beasiswa
Abdee,rumah gedung pasar pulau morowali roboh hantam puting beliung
Abdee,sindikat edar narkotika psikotropika obat terlarang internasional sembilan personel polsek balesang harga
Abdee,sayutin budianto informasi vaksinasi corona parigi moutong batas
Abdee,dkpp republik indonesia gelar sidang sengketa pemilihan kepala daerah poso
Abdee,polres morowali operasi rutin imbau masyarakat patuh protokol corona
Abdee,intip sibuk warga tionghoa palu sambut tahun sapi pandemi
Abdee,tilik sampah palu kian pelik
Abdee,ratus warga parigi moutong jaring operasi yustisi
Abdee,personel gabung morowali semprot disinfektan
Abdee,bayar hutang lapor jambret
Abdee,sayutin budianto pemkab parigi moutong hati hati dana rp miliar
Abdee,polisi tangkap duga judi kartu remi parigi moutong
Abdee,ajar jarak maksimal dinas didik poso selamat siswa
Abdee,rampok hipnotis resah warga bahodopi
Abdee,curi kulkas oknum asn tolitoli tangkap polisi
Abdee,laksana ibadah haji tunggu putus menteri
Abdee,polisi janji tindak aksi balap bohong poso
Abdee,patroli polres morowali sambang ramai imbau prokes
Abdee,bank muamalat luncur fitur qris aplikasi mobile banking
Abdee,pemerintah kota palu alokasi dana tangan corona rp miliar
Abdee,polres poso tangkap duga pencurian kendaraan bermotor
Abdee,hipmi bantu kembang potensi wisata donggala
Abdee,kodim morowali masker kampanye prokes
Abdee,masker puluh warga palu jaring razia
Abdee,kodim poso gelar patroli tangan corona
Abdee,polres morowali sih lingkung objek wisata fafobaho
Abdee,raba payudara siswa pria istri poso tangkap polisi
Abdee,phri vaksinasi industri hotel restoran sulteng
Abdee,kpp pratama palu canang bangun zona integritas bebas korupsi
Abdee,jembatan iv palu kejat sulteng bantah duga jaksa terima proyek
Abdee,rainforest sekutu pemkab poso gelar lokakarya regional
Abdee,nakes palu suntik vaksin corona dosis
Abdee,heboh warga temu serpih pesawat udara donggala
Abdee,polisi ringkus duga curi bakar rumah
Abdee,aktifitas gempa tingkat masyarakat panik
Abdee,kapolri gubernur sulteng pilih tindak aktivitas tambang ilegal
Abdee,sinergi kawal utuh nkri polres bangga pasang spanduk tni polri padat
Abdee,tim resmob polres parigi moutong tangkap duga pencurian kendaraan bermotor
Abdee,warga palu aksi galang dana korban gempa sulawesi barat
Abdee,jajar tingkat patroli razia pekat kapolres bangga ikan imbau humanis
Abdee,mantan kades tampiala ancam kurung penjara umur hidup
Abdee,bangga zona merah konfirmasi corona
Abdee,tengah asyik judi kartu remi warga aman reserse kriminal polres bangga
Abdee,grebek judi sabung ayam taopa polsek moutong aman warga barang bukti
Abdee,masjid baiturrahman roboh akibat gempa september palu bangun
Abdee,aduh sekolah parigi moutong ambruk akibat terjang angin puting beliung
Abdee,sensus duduk sulteng laki laki banding perempuan
Abdee,alumni negeri palu cemil gratis tengah pandemi corona
Abdee,tim medis nasdem sulteng fasilitas korban gempa area pensil sulbar
Abdee,iain palu salur bantu sembilan bahan pokok butuh anak sintas gempa sulawesi barat
Abdee,larang ambil gambar buka kotak suara kpu touna sorot gugat
Abdee,tugas medis parigi moutong layan sehat korban gempa majene
Abdee,golkar sulteng serah bantu korban gempa sulbar
Abdee,polda sulteng target kantong darah korban gempa sulbar
Abdee,truk bantu nasdem gelombang sulbar
Abdee,sedia elpiji korban gempa sulbar aman
Abdee,cinta motor jejak palu bantu korban gempa sulbar
Abdee,dongkrak produksi tani masyarakat sigi pasca bencana ypi kenal mesin tanam padi demoplot
Abdee,wujud peduli pt welmy pratama indah ikan bantu korban bencana gempa sulbar
Abdee,abai protokol sehat warga ungsi seruduk rujab wabup mamuju bantu logistik
Abdee,polda sulteng steril jalur bansos palu mamuju
Abdee,kpa khatulistiwa tanam bibit mangrove kemas bentuk camping tanah diskusi lingkung
Abdee,aksi bersih bersih sampah komunitas sampah sukarelawan palu rifaldi direspon masyarakat
Abdee,dpw nasdem sulteng kirim personel selamat misi kemanusian sulbar
Abdee,agung maleo hotel sulbar saksi bisu ganas gempa
Abdee,bantu korban gempa bumi sulbar dinsos parigi moutong kirim tagana
Abdee,jabat poso vaksin corona
Abdee,gempabumi tektonik sr guncang majene jumat subuh bangun roboh
Abdee,sekolah terima bos parigi moutong bimtek adrudin kepala sekolah guru minimum informasi
Abdee,instruksi gubernur pepes kosong daerah batas
Abdee,bank mega syariah palu target biaya capai miliar
Abdee,rumah sakit sulteng persen kapasitas tidur pasien corona
Abdee,polisi tangkap bobol website universitas tadulako
Abdee,dosis vaksin corona palu distribusi nakes suntik
Abdee,juta dana tabung baca palu raib kuasa hukum tempuh jalur hukum selesai
Abdee,jelang vaksinasi corona tahap palu
Abdee,tahun rusak parah jalan desa walandano donggala
Abdee,polres parigi moutong jajar vaksinasi corona andi batara perintah
Abdee,temu bayi laki laki geger warga mamboro kardus bekas
Abdee,edufair palu guru tinggi libat
Abdee,pemkab parimo hektar lahan makam jenazah pasien corona
Abdee,lawan tangkap remaja pencurian kekerasan palu dor polisi
Abdee,vaksinasi corona parigi moutong januari
Abdee,ormas rawan merah putih sulteng gelar musyawarah
Abdee,positif corona olahraga jalan raya wakil gubernur sulteng protes warga
Abdee,sah nur rahmatu pimpin kadin sulteng periode
Abdee,dprd palu temu fisik apbd rampung
Abdee,jabat parigi moutong positif corona juru bicara satgas hasil kepel massal
Abdee,positif corona gubernur wakil gubernur sulteng isolasi mandiri
Abdee,geger temu bangkai kapal udara donggala polisi
Abdee,data langgar lalulintas satlantas polres palu bukti pelanggaran tegur
Abdee,inflasi sulteng tahun kota palu catat inflasi tinggi
Abdee,perbarui corona sulteng sembuh tinggal dunia
Abdee,besok palu wajib cepat anti gen
Abdee,vaksin corona sulteng palu
Abdee,gempa tektonik sr morowali rumah warga bahodopi alami rusa
Abdee,kepala bkpsdm parigi moutong zulfinasran jabat lulus seleksi
Abdee,perbarui corona sulteng sembuh tinggal dunia
Abdee,cinta motor raja deklarasi klub dolo selatan
Abdee,sekkab parigi moutong jabat hadiah dipertanggungjawabkan dunia akhirat
Abdee,pemdes lembobelala morowali utara bentuk gugus tugas cegah sebar corona
Abdee,tambang pt trio kencana luas hektar parigi moutong fmmt dampak buruk
Abdee,perindo dorong pemerintah kota palu cepat psbb
Abdee,tni polri aman senja ganti tahun morowali libat satpol pulang pergi dishub
Abdee,aman senja ganti tahun polda sulteng kerah personel
Abdee,bnnp sulteng edar narkotika psikotropika obat terlarang tahun
Abdee,narkotika parigi moutong tingkat persen
Abdee,asik pesta sabu kos kos edar narkotika psikotropika obat terlarang morowali bekuk polisi
Abdee,protokol sehat tolitoli ketat edar bupati moh saleh bantilan
Abdee,jelang musyawarah daerah kadin hipmi sulteng kader
Abdee,perbarui corona sulteng desember sembuh
Abdee,corona tingkat sulteng wajib cepat antigen
Abdee,puluh tenaga didik papar corona disdik palu tunda rencana ajar tatap muka
Abdee,cerita awat ubah rawat pasien corona keluarga
Abdee,bnn palu narkotika psikotropika obat terlarang tahun
Abdee,bpom palu musnah picis obat cemil ilegal
Abdee,bukit salena palu kian ramai kunjung wisatawan libur natal tahun
Abdee,warga usia kawatuna palu antusias posyandu usia tengah pandemi
Abdee,perbarui corona sulteng sembuh tinggal dunia
Abdee,muskot perbakin palu irsan satria pilih aklamasi
Abdee,mantan bupati poso piet inkiriwang tutup usia
Abdee,perbarui corona sulteng sembuh tinggal dunia
Abdee,buru rupiah pasar kejut palu musim pagebluk
Abdee,giat rutin polsek bahodopi aman motor maklumat kapolri
Abdee,narapidana lembaga pemasyarakatan parigi remisi natal
Abdee,narapidana remisi natal
Abdee,anggap sesuai standar periksa rehabilitasi kantor dprd palu
Abdee,bnn poso libat netizen cegah edar narkotika psikotropika obat terlarang
Abdee,resmob polres tolitoli bekuk duga curi uang tunai rp juta
Abdee,dukung lancar operasi lilin tinombala bank mandiri palu ikan masker polda sulteng
Abdee,pemuda tahun parigi moutong lapor hilang laut
Abdee,operasi yustisi warga palu pakai masker sanksi sosial
Abdee,corona sulteng tembus angka
Abdee,vakum akibat pandemi jalan ras sukses gelar morowali
Abdee,polres palu musnah kilogram sabu
Abdee,polda sulteng ketat aman natal tahun
Abdee,patroli laut palu ditpolairud bksda sulteng warga ancam buaya corona
Abdee,tenaga honorer pemkab bangkep bpjs ketenagakerjaan
Abdee,akibat cuaca buruk nelayan parigi moutong lapor hilang laut
Abdee,berkah tengah pandemi nelayan talise kota palu tingkat pesat
Abdee,edar sabu pria sulawesi selatan bekuk polisi morowali
Abdee,rekapitulasi suara pemilihan kepala daerah palu kpu waktu selai paslon aju gugat
Abdee,ojk nilai sektor jasa uang stabil jaga
Abdee,penuh hak sintas prioritas had reny
Abdee,perbarui corona sulteng desember sembuh tinggal
Abdee,partisipasi pilih sandang disabilitas kota palu turun drastis pemilihan kepala daerah
Abdee,perbarui corona sulteng desember tinggal sembuh
Abdee,kapolres sigi aman proses rekapitulasi pemilihan kepala daerah
Abdee,juang tni kodim poso pangdam xi merdeka gelar doa
Abdee,bawaslu sigi pantau proses rekapitulasi suara
Abdee,tengah pandemi dpmd desa dampal donggala contoh balai ajar desa
Abdee,polres sigi kawal ketat distribusi kotak suara
Abdee,tokoh agama poso dukung bnn berantas narkotika psikotropika obat terlarang
Abdee,kejar bangga sukses
