username,tweet
Alaniafitri,ngezoom tengah materi guru nyala kamera panik
Alaniafitri,ager malam
Alaniafitri,september harap heran hebat rezeki amin
Alaniafitri,episode bosan episode seru banget gasabar tunggu
Alaniafitri,ganda campur janji adnan mychelle kualitas
Alaniafitri,tawa terlambat selesai tonton tonton az
Alaniafitri,favorit
Alaniafitri,kasih cemil kecewa anak cemil tanah
Alaniafitri,iya sayang
Alaniafitri,rindu cemil tembalang
Alaniafitri,ketemu abda iya malu
Alaniafitri,pamulang bawa motor mantap gel
Alaniafitri,tawa suasana hati banget anjiir sumber dri instagram
Alaniafitri,sumpah kemarin untung benang refleks menunduk
Alaniafitri,tertawa sial samsung ajaib pakai detik
Alaniafitri,ios kokk
Alaniafitri,chariesty listra teliti tugas skripsi sesuai kriteria subje
Alaniafitri,dengar dexamethasone salep kulit pakai sih kayaknya
Alaniafitri,haloo kenal annisa salah pasien thalassemia jakarta teman sekolah
Alaniafitri,tertawa parah tagih
Alaniafitri,sih seliwer beranda pindah nyala terima tawa sayang jungpal
Alaniafitri,anthony sinisuka ganteng refleksi tanding kesan kenang karirny
Alaniafitri,suasana
Alaniafitri,tonton itaewon kelas terlambat
Alaniafitri,ahahahahahahahahahahahahahahahahahahahahahahahhaahahah lambung sakit tenggorok sakit hahahahahahahahahahabaha kucin
Alaniafitri,canggih sency
Alaniafitri,geprek lovyu
Alaniafitri,tika senang ulang tahun
Alaniafitri,gemesh selamat ulang tahun atuy
Alaniafitri,habis telemedicine dokter gizi anak anak gizi anak serius meleset dikit efek
Alaniafitri,salah sayang
Alaniafitri,tinggal saudara laki jakarta jakartanya selatan saudara laki bintaro pesanggrahan si
Alaniafitri,nganga alias bajing
Alaniafitri,salah cemil sih sial lelah kulit
Alaniafitri,dagang tawa
Alaniafitri,biaya awat wisma atlet hasil kepel rujuk diagnosa bronchopneumonia bp
Alaniafitri,kejut gila aktor gadis pria keren berkumpul coba bayangkan film bumilangit cinematic
Alaniafitri,hasil karantina rumah
Alaniafitri,kuak rahasia bilang ajar nilai bagus
Alaniafitri,kenal asuh anak anak gadget permainan internet
Alaniafitri,tawa gasihh gemessh
Alaniafitri,tuli pergi bank tengah pandemi hormat kurniawan satuan pengamanan cabang jati raya banyuma
Alaniafitri,mantap teman debut internasyionel
Alaniafitri,baca jurnal seru tekan akademik
Alaniafitri,tulus sih cinta
Alaniafitri,yaallah gabuka twitter buka renti tawa beranda saudara bes twitter
Alaniafitri,anak saudara laki umur suruh jaga istri mandi buka suprise
Alaniafitri,saudara laki agung sih hibur
Alaniafitri,diinget teman boongnya orangtua kadang orangtua ngeb
Alaniafitri,tubuh serang ebola utas juni dunia kejut wabah
Alaniafitri,indonesian parents psikolog psikiater buang buang uang ibadah antem
Alaniafitri,anak tahun bunuh bayi serah polisi ramai bilang psikopa
Alaniafitri,minions mjd atlet indonesia daftar forbes under daftar tenis dunia ashleigh barty
Alaniafitri,mahir masak membedakan kencur kunyit lengkuas teman pasang ayo
Alaniafitri,dips rindu malu
Alaniafitri,maaf adek atuy haji endo sejarah coba juara emas olympic
Alaniafitri,parah dichat balas iya maaf niat nunda balas obrolan bentar eh
Alaniafitri,pb idi ajak peduli jawat jawat garis
Alaniafitri,takut tuhan corona takut tuhan corona
Alaniafitri,gakbisa bantu kecuali doa pikir buruk
Alaniafitri,sulit tenaga sehat sulit wabah menger
Alaniafitri,netizen fesbuk instagram twitter netizen youtube utas
Alaniafitri,urus pusat pbsi ambil bijak hindar sebar corona pemusatan latihan nasional cipayung tinggi
Alaniafitri,wkwkwkwkk sih nada lupa
Alaniafitri,dikerjain rumah hidup
Alaniafitri,iya
Alaniafitri,emas tokyo olympic amin
Alaniafitri,wt finals jepang kasih ruang minions serang comfortable defens
Alaniafitri,sabar lawan yuta endo tahan bagus paham
Alaniafitri,kalah juang keren semoga kalah iya minions selamat
Alaniafitri,selamat madu pasangan
Alaniafitri,parah keren ucok melati utama peluk lapang
Alaniafitri,praveen jordan melati daeva oktavianti menang fifteen matches europe conquered denmark
Alaniafitri,xd praveen jordan melati daeva oktavianti ina lawan dechapol puavanukroh sapsiree taerattanachai tha
Alaniafitri,ayo cok kasih kendur
Alaniafitri,mon maaf utama badminton tawur desa ramai
Alaniafitri,video keren cok nontonlah menit paham pola sebar corona ker
Alaniafitri,heartbreak england gembira indonesia olahraga terbaik
Alaniafitri,ayo menang iya madu pasangan ucok luk mel
Alaniafitri,izin keluarga kepala rumah sakit menhub mensesneg pratikno
Alaniafitri,lucu corona anak nyala pict
Alaniafitri,pasien positif corona sabtu total
Alaniafitri,saudara wanita tonton tanding seru titik ketat bas popor ciamik
Alaniafitri,batal
Alaniafitri,breaking mini ulang officially opened log nyala rt suka tweet ulang po
Alaniafitri,rindu belanja tukang sayur masak fara bukber
Alaniafitri,cantik mel
Alaniafitri,breaking ranking points finals menang praveen jordan melati daeva oktavianti accu
Alaniafitri,sumpah tonton pasrah permainan tinggal
Alaniafitri,tawa putar ulang ketawa
Alaniafitri,pagi tahan nang sedih tahun eh temu tweet otomatis mewek allengland
Alaniafitri,batal
Alaniafitri,tanyarl gadis
Alaniafitri,tawa kemarin doa jodoh atlet feb
Alaniafitri,minat minions rekues foto foto marcus kevin
Alaniafitri,teriak histeris tawa
Alaniafitri,tawa aurat tunggu
Alaniafitri,aplod foto maass ken kevin pakai lekbong
Alaniafitri,foto kevin pakai lekbong sih temu
Alaniafitri,iya ampun gemesh sih saudara yutaa minum bengong
Alaniafitri,tawa nasihat terdebest
Alaniafitri,tawa kecewa utama cantik
Alaniafitri,bentar siwon wni
Alaniafitri,tawa iya candid candid tahan emosi kasar
Alaniafitri,nessie hakim masak
Alaniafitri,mengetik iya tuhan jo jo ayo tahun
Alaniafitri,bagus banget
Alaniafitri,ayo hubungan jarak jakarta tawa
Alaniafitri,baca teman tulis maklum rabun
Alaniafitri,sumpah corona manusia jakarta polusi polusi
Alaniafitri,iya amponn gemeshh sih saudara saudara
Alaniafitri,saudara wanita deh sobi malam peka bosan banget tawa
Alaniafitri,saudara laki pesan informasi doongg
Alaniafitri,iya ampun cahaya
Alaniafitri,tonton ganteng youtube indosport gemas banget
Alaniafitri,hidup tebak rencana tib
Alaniafitri,sicepat cepat sih tangkap
Alaniafitri,turun gojek lupa lepas kemudi nyelonong jalan panggil saudara laki ramemalu
Alaniafitri,saudara laki ramen
Alaniafitri,bentar kayaknya kelompok pasca tawa
Alaniafitri,diapalin
Alaniafitri,ironi iya harga masker lipat cegah tular corona
Alaniafitri,isi ulang produk unilever toko saruga sedia kecap bango sinar matahari rinso molto superpell susul sabun
Alaniafitri,muhammadiyah
Alaniafitri,far sekolah
Alaniafitri,kucing oren tukang onar
Alaniafitri,jalan banjir rumah udara tinggi pinggir triplek kayu
Alaniafitri,user judgemental omong omong coba screening kandidat based nyala kompetensi ujung nilai user
Alaniafitri,malang jakarta via
Alaniafitri,dikirimin niken via pos
Alaniafitri,sesuai target syukur
Alaniafitri,hua sedih tinggal ci butet tahun performa pasang
Alaniafitri,bismillah jual barang obat istri
Alaniafitri,kuat sih sperma hidup kolam tembus celana renang vagina
Alaniafitri,isi tas pria telepon dompet minyak wangi isi tas gadis telepon dompet gincu eyeliner minyak wangi tisu isi tas pulang ngaj
Alaniafitri,suguh dagel abraham damar anggap langgar etika utama timnas jumat coret sa
Alaniafitri,hapus gertak struktur tua pribadi usaha kepala sekolah dap
Alaniafitri,aska tangis peluuk tahan kuat jahat saudara
Alaniafitri,informasi iya puskesmas psikolog biaya konsultasi
Alaniafitri,pundak sandar sajadah sujud rahang
Alaniafitri,trauma kanak alarm sistem aktif tubuh pikir waspada pelatuk sederhana
Alaniafitri,iya tuhan kuat ngebayangin bcl
Alaniafitri,anak tambun tawa
Alaniafitri,celaka kapok batas meter maki
Alaniafitri,sumpah iya batas jalan tol loh motor nekat lawan arah
Alaniafitri,jahat jahat bai
Alaniafitri,podium foto indonesia pria si tim foto lengkap skuat regu putra indonesia jari alias gelar juara
Alaniafitri,merah putih
Alaniafitri,pria si tim ina saudara laki md mohammad ahsan fajar alfian ina lawan ong yew dosa teo ee saudara laki kejut
Alaniafitri,iya tuhan jo jo
Alaniafitri,gila kurus gila kurus tulang
Alaniafitri,isi pita payudara selai kosong omong omong saudara laki
Alaniafitri,breaking selamat dunia puncak pria si singles his menang brings his hitung least enough
Alaniafitri,psikolog dokter rusak profesi fisika kawatir cari
Alaniafitri,bidang cegah bunuh paham konsep terapi dengar kisah suka duka konsumen sehat jiwa si
Alaniafitri,hidup keluh terkadang hidup syukur
Alaniafitri,malu terima kasih sele tunggu video tiktoknya iya malu saudara wanita tiktok
Alaniafitri,tawa mantap sele debut
Alaniafitri,senang ulang tahun favorit pria kamura san harap hebat blessful tahun
Alaniafitri,indonesia si badminton kualitas athletes marcus fernaldi gideon kevin sanjaya sukamuljo md
Alaniafitri,breaking following his menang lawan heo kwang hee anthony sinisuka ganteng istirahat dunia puncak pria
Alaniafitri,pesawat kasih menu takut virus menu gambar ayam ikan saus pedas
Alaniafitri,kurus gila takut kurus
Alaniafitri,inap rumah rumah boongin dosa iya
Alaniafitri,kuliah lulus tikar an skripsi lulus lulus nglamar kesana
Alaniafitri,lekas sembuh momota rindu lapang
Alaniafitri,konfirmasi dokter cina bahaya virus corona tinggal dunia akibat virus
Alaniafitri,skizofrenia takut sakit kognitif jenis skizofrenia bagus profil
Alaniafitri,ayo
Alaniafitri,semarang pindah bandung
Alaniafitri,admin sopir gojek tipu hipnotis mengaku gojek puncak gopay oke
Alaniafitri,syukur kemarin walapun padat giat lelah bahagia
Alaniafitri,ngecekin pintu pergi matiin kompor ngecekin barang tinggal ocd
Alaniafitri,ayo tunggu aksi bambank
Alaniafitri,saudara wanita ekspresi raja kilometer ganteng menang lawan saudara laki anton
Alaniafitri,haid singles podium ganteng juara hancur losses tahun ganteng has redeemed himself
Alaniafitri,iya tuhan ting spesialis lari selamat
Alaniafitri,karier tinggi ranking congratulations anthony sinisuka ganteng reaching dunia puncak pria si singles
Alaniafitri,iya tuhan nang juang greysia apri poin huu kecewa
Alaniafitri,waaw duga minions daddies utama tengah seru
Alaniafitri,presenting richelle setiawan chayra ahsan beda doa makna nilai
Alaniafitri,breaking berita kemudi yahya buka suara reporter asumsi hadir konferensi pers eks dirut tvri mem
Alaniafitri,waktu three indonesian md pairs main semifinals ss super turnamen indonesia
Alaniafitri,gila daddies mantap
Alaniafitri,eh wkwkwkk
Alaniafitri,main badminton kento asked his latih taman joo bong kento ayo
Alaniafitri,batal
Alaniafitri,iya anak taat tua tutup tua hyperparenting mesti
Alaniafitri,kento momota lapor alami patah tulang hidung pipi terima jahit bibir korban
Alaniafitri,batal
Alaniafitri,raja momota semoga iya tangis menang
Alaniafitri,batal
Alaniafitri,telepon selai habis bahan obrol gosip bentar cari bahan obrol si
Alaniafitri,bismillah semoga ajar hati hati media sosial utas
Alaniafitri,tangis istri hakim jamaluddin bunuh november foto sempurna tangis penuh sedih
Alaniafitri,batal
Alaniafitri,fokus asumsi bohong lupa
Alaniafitri,pancen marketinge shopee ambyarr tenan parodine puncak
Alaniafitri,pagi ayo gerak
Alaniafitri,australia nyala api nearly tengah milyar animals bunuh juta hektar burned iklim sih
Alaniafitri,sial habis telepon nopal pikir
Alaniafitri,jjakarta floating pasar
Alaniafitri,si daughters cinta
Alaniafitri,banjir kemarin kasih abay jebak kandang burung saudara laki selamat
Alaniafitri,isuzu harimau kumbang jalan setuju sukses
Alaniafitri,temu guppy seri sungguh makes ayah lembut lucu
Alaniafitri,warga jakarta rumah jalan banjir dilewatin
Alaniafitri,banjir syukur alhamdulillah semoga berkah tahun
Alaniafitri,malas libur temu keluarga wajah bahagia pura pura beber
Alaniafitri,unggul terbaik doing milik terbaik
Alaniafitri,sen gojek ambil gofood grabfood belanja online sopir nganter bua
Alaniafitri,tunggu rumah
Alaniafitri,sholat redam gelisah hati doa pasrah tuhan
Alaniafitri,terima kasih tahan hebat kuat
Alaniafitri,kasih hadiah juang tahan hebat harga milik
Alaniafitri,parah tukang saing nih tawa
Alaniafitri,kesal motor malam dingin gelap tipu ngerem eh bayang tiang listrik polisi tidur
Alaniafitri,rumah ponakan sepi banget rebah kamar selai
Alaniafitri,wih tuuhh
Alaniafitri,sadar selesai bisnis lupa abai selesai
Alaniafitri,omong omong jeli potter banget murce varian rebuu testimoninya saudara febri
Alaniafitri,iya tuhan rindu badminton
Alaniafitri,notif ngajakin rapat rindu
Alaniafitri,tasya farasya edukasi bahaya produk palsu behel lapis krim muka rias pil langsing
Alaniafitri,terngakak tolong kasih gedung fisika nan mewah kantin saudara wanita
Alaniafitri,amin serius dunia
Alaniafitri,tawa siyapp
Alaniafitri,breaking si resmi marcus fernaldi gideon kevin sanjaya sukamuljo pria si doubles longest perintah
Alaniafitri,persija senja tonton laga pisah maestro sepak bo
Alaniafitri,jakmania resmi tawa cinta persija
Alaniafitri,yaallah sumpah berani tonton habis jahanam sih
Alaniafitri,lingkar cahaya hendra setiawan lubang piala wilayah menara https
Alaniafitri,bapake kirim foto lari pagi kelompok keluarga lari pagi kejut memfoto hayo hpnya
Alaniafitri,tulis larang pegang larang foto indah museum pamer jenis butuh kon
Alaniafitri,cinta ajar baca ilmu pintar pintar
Alaniafitri,photos pria si doubles champions camera
Alaniafitri,ajar lumayan isi waktu
Alaniafitri,sejarah created daddies mohammad ahsan hendra setiawan has become md pasang menang england
Alaniafitri,bukti setiawan mabrur endo alhamdulillah
Alaniafitri,rio habis tahun takluk turnamen du
Alaniafitri,pria si singles podium congratulations both finalists tanding
Alaniafitri,ganteng kalah saudara wanita senyum sumringah lawan ganteng kayaknya momota
Alaniafitri,replynya gedung bagus gedung bagus iya gedung sekolah en
Alaniafitri,momogi yeaay ayo ting
Alaniafitri,kasih agama gambar
Alaniafitri,kkn
Alaniafitri,kamura sonoda salah utama suka lapang kamura sabar penuh senyum meskip
Alaniafitri,sih santai sukaak ayo besok juara
Alaniafitri,individual tournaments finals daddies ahsan hendra indonesia masters england singapo
Alaniafitri,sf md mohammad ahsan hendra setiawan ina lawan lee wang chi lin tpe menang daddies keren
Alaniafitri,parah kalah lawan yuta endo sedih akutuhh
Alaniafitri,ll tinggal twitter
Alaniafitri,tolong tolong biarkan minions menang iya yuta endo
Alaniafitri,ayo yutaa dukung menang xd md minions menang iya maruk menang xd md
Alaniafitri,ejek tungau bajing tawa beda deh sih ahli tungau
Alaniafitri,bentar bentar bajing kasar bajing nama hewan nih tawa ambigu
Alaniafitri,dipaksain feb jaga kondisi
Alaniafitri,senang temu cari gugel muas pria
Alaniafitri,pikir acak senja tungau salah sumber alergi tat
Alaniafitri,consumer topikal analgesik industri tolong temu products milik figuratively jompo hidup
Alaniafitri,parah yuta endo bagus seru tonton
Alaniafitri,kento sih celana warna kuning iya baju garis kuning dikit dikit
Alaniafitri,yaallah engap nontonin wd menit cari poin gima
Alaniafitri,iya ampun yuta sih
Alaniafitri,goodluck
Alaniafitri,tawa naro selip sepatu
Alaniafitri,cinta tulus sejati
Alaniafitri,terima kasih terima kasih terima kasih
Alaniafitri,bangga teman teman
Alaniafitri,indonesia
Alaniafitri,candid wahyu saudara bagus banget terkadang untung harap saudara laki
Alaniafitri,hua bajing iya
Alaniafitri,merinding baca terima kasih edgar juang indonesia
Alaniafitri,terima kasih
Alaniafitri,semoga lekas pulih grego
Alaniafitri,terima kasih edgar
Alaniafitri,senyum manis sumringah banget
Alaniafitri,yaallah muka cerah habis menang
Alaniafitri,ramai berita monggo baca sudut baca gembar gembor keluarga silah baca terang
Alaniafitri,dim menyusul menikah sibuk pecah latih hati
Alaniafitri,wow owi apri mantap tunggu nih apri utama sektor
Alaniafitri,sih saudara teriakin suruh sholat dhuha astaga iya
Alaniafitri,cerita budak korporat duduk laptop hospitalized
Alaniafitri,tangis sedih baca cerita yuk
Alaniafitri,wkwkk anjiirr
Alaniafitri,gila promosi gratis sih tangkap beli
Alaniafitri,tawa iz
Alaniafitri,alam ajar ayo tawa
Alaniafitri,sih iz isiin pulsa ngeblok
Alaniafitri,resah pakai kacamata minus motor hujan pakai kacamata lensa embun lepas kacamata buram
Alaniafitri,tolong bantu hasil tonton
Alaniafitri,bingung bika ambon tipikal medan
Alaniafitri,batal
Alaniafitri,daddies ganteng kalah senang adek yuta menang bahagia tawa
Alaniafitri,twitter tolong milik sihir butuh responden kriteria wanita usia tahun domisili jabodetabek pe
Alaniafitri,ubah hasil semoga wasit tegur
Alaniafitri,atur bwf perhati shuttlecock posisi jemput area
Alaniafitri,ganteng kecewa kalah adil hasil curang wasit lee cheuk sadar poi
Alaniafitri,ayo ting semangat semoga bajing rezeki asli hongkong ganteng keren sih juang
Alaniafitri,iya tuhan sesak tonton titik ganteng sedih ganteng
Alaniafitri,parah kemarin ciamik banget tinggal kejar kuat nontonnya
Alaniafitri,batal
Alaniafitri,somehow insta hidup gim tekan
Alaniafitri,batal
Alaniafitri,salah minum kopi malam tidur perut panas
Alaniafitri,iya ampun tampan
Alaniafitri,menang juara untun juara fuzhou cina buka juara bwf dunia wisata
Alaniafitri,pakai losion dokter hubung sih kulit kemarin
Alaniafitri,kelas pagi
Alaniafitri,penyet kos nih
Alaniafitri,tingkat sadar sehat mental serba takut diagnose dasar sosial media
Alaniafitri,versi suara
Alaniafitri,teliti anggap ganggu jiwa kait gangg
Alaniafitri,minimum mental sehat salah obat rohani salah bahk
Alaniafitri,subjek skripsi bawa anak diagnosa skizo obat spritual
Alaniafitri,depresi butuh dengar depresi butuh dengar dengar menyembu
Alaniafitri,rebana temu abad abad
Alaniafitri,nenek nganggo nik rasah nggo
Alaniafitri,niat
Alaniafitri,tinggal meanwhile anak tinggal
Alaniafitri,lingkar cahaya teman teman twitterku buka usaha an bantu biaya kemotherapy bayar uang
Alaniafitri,ukhti tolong santai
Alaniafitri,rindu kereta yogyakarta
Alaniafitri,juara tembus kalah bolos latih ancam coret dar
Alaniafitri,kualitas pairs campur aduk doubles praveen jordan melati daeva oktavianti ina tanggal kualitas
Alaniafitri,breaking xd pasang penuh syarat guangzhou kebaji ranking points dunia prav
Alaniafitri,karet hasil turnamen praveen jordan melati daeva oktavianti layak saudara
Alaniafitri,sejarah has created an muda has become youngest main menang ssp super judul kalah caroli
Alaniafitri,kemarin waktu matkul kelas teman panik kunci motor hilang parkir motor hilang
Alaniafitri,aduh an muda iri bawa iya tunggal putri atlet si
Alaniafitri,gila an muda keren tahun
Alaniafitri,nih
Alaniafitri,sangka iya sih hebat sangka iya sih sukses lain-lain wil
Alaniafitri,sulit hidup krisis
Alaniafitri,rindu thukthuk fani rumah iya
Alaniafitri,acia cermin perilaku wanita menstruasi pasang
Alaniafitri,gisel lupa gempi baca
Alaniafitri,bantu adelia diva nuraini mulyadi mhs fh undip minggu pulang kos kuliah
Alaniafitri,nadiem mendikbud bayar cemil kantin pakai gopay bayar spp seragam buku lain-lain pakai gopay jemput
Alaniafitri,silah sebar butuh daftar layan psikolog klinis puskesmas jakarta bp
Alaniafitri,iya tuhan kesal tetangga model urus jodoh rezeki diurusi
Alaniafitri,gugup an banget drama selamat pra mel
Alaniafitri,gila tahun indonesia minions lawan daddies mantaapp
Alaniafitri,kemarin streaming fajri tinggal poin niat streaming minions lawan wo
Alaniafitri,adek yuta lucu sih gemas
Alaniafitri,semarang ngobrol ngobrol ayo acara rangka sehat jiwa bi
Alaniafitri,tawa saudara gila cemil iya saudara
Alaniafitri,podium foto indonesia menang suhandinata cangkir waktu bangga
Alaniafitri,terima kasih muda
Alaniafitri,sih tonton regu gugup gugup an parah banget utama bagus banget ngeett ngeet
Alaniafitri,indonesia juara bobby setiabudi alami mimpi buruk hidup
Alaniafitri,bobby tumpu indonesia utama tangis nyeseq semoga sete
Alaniafitri,iya tuhan sedih tonton huu bobbyaseli nang
Alaniafitri,ngumpulin uang foya yogyakarta wkwwkwk
Alaniafitri,ken tinggal kos yogyakarta
Alaniafitri,tuh terimakasih ide sisturr wkwkwkk
Alaniafitri,indonesian televisi kpi lsf
Alaniafitri,cari teman kaji tawa kocag
Alaniafitri,iya oke misi oke saudara
Alaniafitri,iya ampun yuta cocok teman kelas mengajari
Alaniafitri,parah banget berat gara gila skripsi selesai waktu apaka
Alaniafitri,oh tenang sedia jasa titip yuk tawa
Alaniafitri,nang kesini
Alaniafitri,mantap tahun selamat ulang tahun twitter
Alaniafitri,batal
Alaniafitri,tolong tawa banget
Alaniafitri,twitter saudara odgj diagnosa skizofrenia juang lawan sakit stigm
Alaniafitri,selamat fajri tangis selamat rangking
Alaniafitri,gilakk smashnya rian poin ciamik
Alaniafitri,tangis ayo saudara laki aa besok bismillah
Alaniafitri,mobil avanza xenia hasil
Alaniafitri,tolong kasih nomor pribadi izin kasih sembarang izin bers
Alaniafitri,tawa kesal tangkap tawa jalan pikir
Alaniafitri,najwa tangkap
Alaniafitri,mahasiswa tugas ajar dpr tugas situasi jalan mahasiswa su
Alaniafitri,hemat bakar gedung tawa
Alaniafitri,faiz tolong polbek tawa
Alaniafitri,kejut buka telepon tawa ngakakk terima kasih iya admin okendel senang
Alaniafitri,tegang md
Alaniafitri,seru tonton tanding ganteng momota banding minions daddies iya buang bola
Alaniafitri,utama cepat iya tinggal bentar permainan selesai
Alaniafitri,dapur bilang ganteng utama eh kamar tonton doa
Alaniafitri,indonesia has become negara sapu super md titles kalender tahun england moh
Alaniafitri,bangga instagram aryono miranat
Alaniafitri,yeess ganteng temu momota
Alaniafitri,bapil radang hehee
Alaniafitri,dokter jalan
Alaniafitri,astagfirullah narapidana gaji
Alaniafitri,ken rt kasar
Alaniafitri,sangka senang sosok beliau dukung pemuda atlet olahr
Alaniafitri,tolong ambyar
Alaniafitri,bantu rt iya teman
Alaniafitri,tolong rindu kevin kevin sanjaya
Alaniafitri,raja rimba raja
Alaniafitri,batal
Alaniafitri,jual cepat alas surup
Alaniafitri,tutorial pepes
Alaniafitri,twitter tolong sihir lingkar cahaya kenal annisa mahasiswi fisika mercu buana teliti
Alaniafitri,tugas senang cinta
Alaniafitri,bantu teman teman dom semarang bantu beli dagang mbah sumarjo mbah jual daun saudara wanita kelor
Alaniafitri,ikuti akun konsisten bahas rokok juli fokus bahas audisi
Alaniafitri,kertas bak pahlawan anak bunuh impi anak seb
Alaniafitri,pulang pergi pbsi sayang sikap kpai tengah sulit regenerasi pebulutangkis jalan bibit tutu
Alaniafitri,eh nabrak gaess semoga keong saudara laki hidup
Alaniafitri,miris kpai lentera anak mati an henti audisi beasiswa djarum beasiswa
Alaniafitri,anak audisi beasiswa djarum calon jaya owi butet kevin ahsan lain-lain
Alaniafitri,tahun bulutangkis sumbang emas an medali indonesia unggul
Alaniafitri,eh deng saudara tuding eksploitasi anak
Alaniafitri,kak ngerubah nama nama djarum singgung rokok
Alaniafitri,sedih banget cita ngenalin elnino badminton atl
Alaniafitri,sengaja ngebuka cerita ken buka buka aplikasi
Alaniafitri,teman screening sederhana dinkes dki aplikasi bagus sehat jiwa sila unduh
Alaniafitri,badulim milik favorit warna ganteng hitam badulim ganteng pria hitam
Alaniafitri,selamat ulang tahun momota
Alaniafitri,hasil selpi kepala miring muka tengah
Alaniafitri,senayan bentar panas bentar pulang pusing dasar lemah
Alaniafitri,kucing ajar sembahyang dimasuki dewa kah
Alaniafitri,salah cemil cocok obat dokter kulit kebal obat parah gatal
Alaniafitri,tawa nih teman pengertiaan
Alaniafitri,aduh maaf paham kualitatif tawa
Alaniafitri,metodologi kualitatif iya anak
Alaniafitri,siang az berani baca
Alaniafitri,coba simpul halaman
Alaniafitri,rem sih pik takut gaberani
Alaniafitri,sumpah penasaran kkn tari berani penasaran gaberani
Alaniafitri,tawa bakti orangtua kron
Alaniafitri,edisi isi waktu luang bosan bosan rumah
Alaniafitri,butuh bantu dar retweet harga saudara sekolah tanggung
Alaniafitri,buang sampah rawat kulit sampah elektronik donasi baju bekas saudara
Alaniafitri,spesial gelar juara dunia spesial juara usia
Alaniafitri,saudara wanita maaf iya rt putar badminton
Alaniafitri,mohammad ahsan hendra setiawan dunia championships dunia championships dunia championships md pai
Alaniafitri,batal
Alaniafitri,sayang tolong calon customernya kasih erti takut tunggu gara saudara wanita nyepeda htt
Alaniafitri,tawa kasih juned dimusuhin
Alaniafitri,hendra setiawan mohammad ahsan juara dunia juara dunia juara unbeat
Alaniafitri,raya pegang merah putih flag indonesia bangga teman teman
Alaniafitri,terima kasih daddies kibar bendera indonesia puncak tinggi terima kasih fajri greyap
Alaniafitri,tonton momota antonsen daddies
Alaniafitri,kasar tvri tonton badminton bola bom selesai
Alaniafitri,labrak istri kernet bis gara telepon suami sen tiket bis jalan pulang issa tingkat
Alaniafitri,terimakasih juang bawa medali perunggu indonesia fajri semoga senja daddies bawa med
Alaniafitri,terimakasih fajar rian hendra ahsan mesin lari
Alaniafitri,terima kasih fajri balas kalah minions menang
Alaniafitri,iya kak tinggal jojo tunggal
Alaniafitri,bohong via isaactkv instagram
Alaniafitri,kemarin minions ganteng pramel sanggup kejurdun tahun
Alaniafitri,yaallah gantengnyaa
Alaniafitri,batal
Alaniafitri,nama pasar buah video berhenti gera kolaborasi indomusikgram sangatbagus typographer bakat
Alaniafitri,sedih minions
Alaniafitri,agnezmo milik aura apotek
Alaniafitri,kejurdun anjaay gasabar tunggu abad lage https
Alaniafitri,kantuk tidur otak pikir
Alaniafitri,selamat tinggal tahap tangis menang
Alaniafitri,saudara laki maaf jin konseling ibadah iya iya ilmiah
Alaniafitri,haluan nyawa bom kumpul taking tingkat
Alaniafitri,surabaya keren
Alaniafitri,anti rokok usaha objektif liput audisi kudus
Alaniafitri,kejut yaallah
Alaniafitri,tembalang dingin
Alaniafitri,menikah pakai undang
Alaniafitri,tangis saudara laki ctc ku
Alaniafitri,sadar tanggal tanggal merah sisa tahun jatuh sabtu minggu
Alaniafitri,old butuh
Alaniafitri,kroon umur
Alaniafitri,yaallah arindaa cryy jodoh teman sepupu saudara
Alaniafitri,utas cv efektif tarik hati rekruter user buah usaha
Alaniafitri,kacamata bijak gudang garam pergi tenis meja produksi atlet puncak
Alaniafitri,desa iya saudara laki kalimantan jakarta tahun
