username,tweet
Abdee,gelar giat rutin polres morowali aman motor knalpot bogar
Abdee,gelar apel serentak kpu sigi coklit desa dolo
Abdee,skb cpns gelar september sesuai protokol corona
Abdee,komisi tunggu wakil ketua dpr rapat djoktjan
Abdee,gandeng sinema elektronik aldi taher rusli palabbi cita cita gubernur
Abdee,pemilihan kepala daerah serentak pdip resmi usung hidayat habsa
Abdee,bpbd ungsi banjir parimo jiwa
Abdee,serat optik rusak hantam banjir telekomunikasi jaring internet sigi normal
Abdee,fpi sulteng turun lokasi bencana parimo sih lumpur banjir
Abdee,udara sungai luap bahodopi warga evakuasi
Abdee,sambut adhyaksa kejat sulteng ratus paket sembilan bahan pokok
Abdee,kunker poso pangdam xi merdeka resmi masjid al hasanah
Abdee,resmi kantor dpmptsp sulteng kepala bkpm usaha atur perintah
Abdee,kpu morut tunda bimtek ppdp camat
Abdee,darmin sigilipu genggam suka pasang calon partai golkar
Abdee,rawat rspad gubernur papua sembuh pulang jayapura
Abdee,sabhara polres bangga patroli rutin masker
Abdee,hasil diagnosa dokter kait mati sangka wn prancis sel
Abdee,pesta seks ajar raya ulang tahun tugas temu kondom obat kuat
Abdee,tim sar hilang sungai desa tambayoli temu selamat
Abdee,tahun tinggal corona kenal profil
Abdee,pdip angkat suara isu reshuffle kabinet jokowi
Abdee,disdik kota palu instruksi larang aktifitas tatap muka
Abdee,juta positif corona brasil ribu tinggal
Abdee,positif ribu jurus buntu jokowi lawan corona
Abdee,pasca banjir rumah sakit torabelo sigi layan sehat
Abdee,siksa kuli dpr polisi watak militer orba
Abdee,damkar kota palu bantu armada jepang
Abdee,tahan titip kejar parimo pindah lembaga pemasyarakatan kelas parigi
Abdee,yasonna negara eropa coba suap cegah ekstradisi maria
Abdee,kemendikbud prediksi ubah didik pandemi
Abdee,peti jenazah pasien corona bongkar istri polisi aman provokator
Abdee,pemuda bekuk polisi lantar curi laptop
Abdee,sulteng juara futsal piala presiden
Abdee,muhammad irwan resmi nahkoda pcnu sigi
Abdee,pria bangga bekuk polisi transaksi sabu
Abdee,bebas corona komisioner pegawai kpu poso jalan cepat uji
Abdee,website umkm milik bri tanggap usaha
Abdee,yayasan cci bantu sepeda motor paramitha korban lumpuh akibat gempa palu
Abdee,mensesneg menteri bagus isu reshuffle relevan
Abdee,isu komunisme tarik masyarakat
Abdee,gerindra kawal lapor denny siregar polisi
Abdee,hasto pdip tolak ideologi ganti pancasila
Abdee,panitia awas pasigala tinjau lokasi korban likuefaksi bangun huntap
Abdee,jokowi kampus kokoh bangsa antikorupsi harga demokrasi
Abdee,personel polisi siaga pemilihan kepala daerah serentak
Abdee,polisi india tembak mati tangkap sangka bunuh
Abdee,polisi tangkap pegawai starbucks duga intip payudara
Abdee,indera cium mayoritas pasien corona pulih
Abdee,kapolri polisi narkotika psikotropika obat terlarang hukum mati
Abdee,pemkab sigi terima bantu ton beras bulog sulteng
Abdee,normal imip salur alkes cegah corona
Abdee,tni personel bantu polri operasi tinombala tahap
Abdee,token listrik gratis pln
Abdee,kisah pilu ungsi katung katung serang tengah laut aegean
Abdee,perintah bayar hutang nasib kimia farma
Abdee,skema utbk untad tengah pandemi virus corona
Abdee,tni dangdut wisma atlet sebentar sesuai protokol
Abdee,asrianti duta baca sulawesi tengah gala gera masyarakat gemar baca
Abdee,bakti sosial babinsa koramil ampana payudara bantu warga sih salur udara
Abdee,ancam reshuffle marah jokowi lamban menteri
Abdee,bupati morowali resmi taman wisata mangrove bangun sumber dana desa
Abdee,sungai salju bkt durian sawit warga sibuk swafoto
Abdee,barcelona tim buruk menit liga
Abdee,kuat sinergitas bri cabang poso gandeng jurnalis
Abdee,bantu warga dampak corona pemerintah kota bengkulu seragam gratis siswa
Abdee,dagang ludah bakso cuanki jalan cepat uji corona hasil
Abdee,pesta sabu warga besusu barat ciduk polisi
Abdee,bnn sulteng kampanye bahaya narkotika psikotropika obat terlarang bunga stiker masyarakat
Abdee,muhadjir risma tekan sebar virus corona pasar
Abdee,pencurian kekerasan tondo tangkap polisi
Abdee,bakar bendera mesti pdip maaf
Abdee,pondok kabupaten sigi sanggah ekonomi ibukota republik indonesia
Abdee,gelombang ii corona korea selatan catat puluh
Abdee,wujud ekonomi sit kck xi merdeka
Abdee,bartholomeus silaturahmi morowali maju pilgub sulteng
Abdee,ribu tinggal virus corona
Abdee,polisi cari senpi john kei cs aksi hijau danau kota
Abdee,kpu milu undur
Abdee,serang hijau danau polisi buru anak buah john kei
Abdee,mahasiswa untad tuntut petinggi universitas adakan dialog ringan ukt pandemi
Abdee,senonoh facebook ketua pajero indonesia lapor kad perindagkop touna polisi
Abdee,bareng musisi sulawesi tengah lintas generasi lintas kota tengah pandemi corona
Abdee,mui sumut imbau warga salat sunah gerhana matahari besok
Abdee,perintah verifikasi data positif corona
Abdee,pasien corona sumbar sembuh
Abdee,ppk pps morut aktif
Abdee,peti tata kelola tindak lemah
Abdee,kunjung danrem tadulako pemerintah daerah morowali lahan bangun batalyon
Abdee,hani bnn poso pesan anti narkotika psikotropika obat terlarang rumah ibadah
Abdee,bi turun suku bunga persen
Abdee,tolak pakai masker tumpang american airlines turun pesawat
Abdee,pln sulit bangun transmisi listrik corona
Abdee,obat dexamethasone selamat pasien corona inggris
Abdee,muncul klaster corona beijing tingkat status darurat
Abdee,polda sulteng bebas biaya sim lahir tanggal juli
Abdee,perintah alih laboratorium flu burung teliti vaksin corona
Abdee,polda metro jaya tangkap buron fbi
Abdee,satgas cepat bangun pasca bencana tindak oknum hambat rehabilitasi rekon
Abdee,sorot keran mprs bubar pki ruu panggul
Abdee,tenaga sehat gorontalo konfirmasi positif corona
Abdee,pasien positif corona palu jalan awat rumah sakit
Abdee,sorot resmi sekretariat gtra aktivis eva bande agraria selesai
Abdee,pasien positif corona poso sembuh masyarakat lena
Abdee,kampanye pemilihan kepala daerah serentak september jadwal lengkap
Abdee,polisi selidik mati remaja korban perkosa tangerang
Abdee,novel harap jokowi benah hukum compang camping
Abdee,pecah rekor positif corona transisi normal
Abdee,musnah barang bukti polisi aduk kilogram sabu udara didih medan
Abdee,longgar psbb sekretaris jenderal mui indonesia aman corona
Abdee,putus komunikasi korea selatan korut intervensi
Abdee,buntut demo ras patung columbus penggal kepala
Abdee,sembuh corona pria bandung barat sambut rebana arak warga
Abdee,ketua aji palu media peran transisi setuju aman corona produktif
Abdee,kait salah tembak warga poso anggota satgas tinombala periksa markas polri
Abdee,hasil kepel danrem tadulako brigjen tni farid makruf istri negatif corona
Abdee,biaya cepat uji poso gratis warga ajar pergi
Abdee,edar sabu rumah tangga dampal utara ringkus polisi
Abdee,ribu layat ikan hormat george floyd
Abdee,bupati sigi optimistis huntap pombewe warga agustus
Abdee,pemerintah kota kepel massal gratis
Abdee,kontak tembak poso anggota satgas tinombala tembak
Abdee,zona hijau parimo donggala positif corona
Abdee,lingkung hidup cpm gelar aksi tanam pohon
Abdee,kolom anomali protokol sehat pasca terap psbb sektor ekonomi kabupaten buol
Abdee,sembuh pasien corona poso pulang
Abdee,normal karang taruna desa tangkura sedia cuci tangan rumah ibadah
Abdee,cegah corona dinas didik poso terap teknis terima siswa
Abdee,warga keluh advokat yams desak pemerintah daerah poso gratis biaya cepat uji
Abdee,kadin sulteng sembilan bahan pokok apd panti asuh labkes
Abdee,corona polisi poso tangkap warga curi susah ekonomi
Abdee,sorot salah tembak warga poso ls adi tuntut kapolda sulteng copot jabat
Abdee,catut nama petinggi partai sulteng tipu pria tangkap polisi tatanga
Abdee,angkut guru tua saudara wanita aljufri sederhana streaming
Abdee,bandara saudara wanita al jufri operasi batas catat maskapai pergi
