username,tweet
Abdee,bnn poso masker kampanye upaya cegah corona
Abdee,pengkot perbakin palu gelar muskot
Abdee,bri poso dukung giat positif olahraga
Abdee,tim pubg kompetisi turnamen resmi pb esi poso
Abdee,upt kph dolago tanggunung promosi produk kelompok tani hutan
Abdee,polres palu patroli siang senja monitoring logistik pemilihan kepala daerah
Abdee,jelang sidang kode ketik anggota dkpp komisioner kpu sulteng jalan cepat uji
Abdee,polsek banawa aman puluh botol minuman keras donggala
Abdee,transdata menang had reny pemilihan kepala daerah kota palu
Abdee,bapilu hanura sulteng raih menang area pemilihan kepala daerah serentak
Abdee,selamat had reny aristan titip pesan korban bencana
Abdee,dakwa cemar nama bupati poso vonis penjara
Abdee,anti korupsi kejat sulteng papar capai bidang pidsus
Abdee,menang telak versi quick hitung cagub rusdi mastura gelar selebrasi
Abdee,selesai hak pilih pesan calon gubernur sulteng
Abdee,polres tolitoli kawal distribusi logistik pemilihan kepala daerah
Abdee,polsek sirenja aman tps
Abdee,tim advokasi hukum das amal lapor video detik paslon verna yasin
Abdee,pemilihan kepala daerah pam tps bahodopi gelar apel siaga
Abdee,sulit fasilitas hemodialisa harap pasien cuci darah bupati poso pilih
Abdee,ops mantap praja polda sulteng terima personel bko brimob nusantara
Abdee,distribusi logistik pemilihan kepala daerah tawaeli palu utara jaga ketat polisi
Abdee,sosialisasi didik pilih kpu poso sasar organisasi pemuda
Abdee,upacara pondok morowali gelar sederhana bupati sdm kunci hasil sukses
Abdee,personel kerah aman pemilihan kepala daerah sigi
Abdee,polres palu bekal tugas perlindungan masyarakat jelang pemilihan kepala daerah serentak
Abdee,inflasi sulteng capai persen november
Abdee,gubernur sulteng resmi kantor cabang parigi
Abdee,edukasi prokes pemilihan kepala daerah permainan among tiffanny ardillah juara lomba kpu sulteng
Abdee,doa lintas iman kumandang korban kejam terorisme lembantongoa sigi
Abdee,pjs bupati poso dukung paslon jaga aman jelang pemilihan kepala daerah
Abdee,gubernur aparat tumpas teroris sulteng
Abdee,perintah bangun rumah lembantongoa sigi bakar kelompok mit
Abdee,oktober ekspor impor sulteng jeblok
Abdee,perbarui corona sulteng desember sembuh
Abdee,pasu panglima tni palu aparat optimis tumpas ali kalora cs
Abdee,kpu donggala simulasi mungut suara pilgub
Abdee,temu kapolda sikap tokoh lintas agama sulteng kait bunuh warga lembantongoa sigi
Abdee,bunuh lembantongoa sigi knpi palu cedera manusia
Abdee,milik kilogram sabu palu anak duga jaring internasional
Abdee,basarnas terima lapor nelayan parigi moutong kabar hilang
Abdee,bunuh warga sigi komnas daging masyarakat sulteng provokasi
Abdee,nelayan paranggi kabar hanyut udara bolano
Abdee,warga lembantongoa sigi tewas bunuh otk duduk ungsi
Abdee,polres palu temu saudara wanita cina isi kilogram sabu milik pemuda tahun
Abdee,perbarui corona sulteng tinggal sembuh
Abdee,terima lapor tuntut narkotika psikotropika obat terlarang kejat sesuai atur jagung sulteng salah
Abdee,perbarui corona sulteng tinggal sembuh
Abdee,breaking berita gudang jalan tanamea kota palu bakar
Abdee,perbarui corona sulteng tinggal sembuh
Abdee,cegah corona ruang lipat sortir surat suara pemilihan kepala daerah tol tol semprot disinfektan
Abdee,bawaslu catat langgar netralitas asn pemilihan kepala daerah sulteng
Abdee,bolong buaya ukur meter sojol hasil evakuasi bksda sulteng
Abdee,jelang pemilihan kepala daerah personel polres palu latih kendali massa
Abdee,acuh protap tinggi corona poso
Abdee,jelang pemilihan kepala daerah polres tol tol razia inap hibur senja
Abdee,bri poso serah beasiswa bantu indonesia cerdas mahasiswa unsimar stikes husada mandiri
Abdee,warga donggala jaring razia palu akibat bawa sabu
Abdee,duga edar sabu tujuh perempuan palu aman polisi
Abdee,pemkab parigi moutong dprd setuju kua ppas apbd tahun anggar
Abdee,warung kopi sudimari oke wifi utama biliard gratis
Abdee,panin peduli bantu rumah ibadah diffabel
Abdee,pt bank mega syariah palu dorong progam digital banking ikan edukasi nasabah
Abdee,perbarui corona sulteng tinggal sembuh
Abdee,perbarui corona sulteng sembuh
Abdee,konfirmasi positif corona kondisi sehat anwar hafid
Abdee,tindak sulteng kukuh urus mppi
Abdee,panglima tni kukuh ketua umum forki
Abdee,oktober sulteng inflasi persen
Abdee,sesuai smk palu lega cari tengah pandemi
Abdee,kubur polisi makam duga teroris gali keluarga
Abdee,raih medali nasional
Abdee,kodim poso gelar giat tingkat apkowil babinsa
Abdee,jenazah anggota mit poso rumah sakit bhayangkara polda sulteng
Abdee,bea cukai palu tindak pabrik minum alkohol ilegal pengawu
Abdee,kepala bnn poso konfirmasi corona aktifitas kantor tutup
Abdee,kepung mamboro anggota kelompok mit tewas tembak parigi moutong
Abdee,plt bupati sigi nota apbd
Abdee,korem tadulako ban juara buka turnamen tenis siranindi vl
Abdee,kahmi touna bangun graha insan cita
Abdee,perbarui corona tanggal november sembuh
Abdee,ratus personel polisi siaga debat buka putar ii cagub cawagub sulteng
Abdee,pemuda sulteng lulus seleksi bintara polri
Abdee,pdip alih dukung paslon darmin amjad pemilihan kepala daerah poso
Abdee,niat tulus angkat ukm eddy tarung ban tum hipmi poso
Abdee,aliansi sulteng saudara milik huni layak pasca tahun bencana
Abdee,pt hengjaya mineralindo cetak biru ppm
Abdee,pemerintah daerah poso terima piagam harga opini wtp tahun
Abdee,satlantas polres palu masker operasi zebra
Abdee,worshop marketing online ikm kawal program hasil
Abdee,wabup badrun nggai kukuh urus komda usia parigi moutong
Abdee,tingkat disiplin anggota sih propam polres palu gelar gaktibplin
Abdee,spn morowali gelar aksi unjukrasa desak perintah upah minimum
Abdee,unjung taman likuefaksi sigi wajib terap prokes
Abdee,dakwa yahdi basma henti anggota dprd sulteng
Abdee,kunker palu doni monardo warga patuh larang bangun kawasan zona merah
Abdee,luncur forum keren sulteng rangkai tabur bunga tmp
Abdee,personel polisi aman kampanye hidayat bartho tawaeli
Abdee,dosen tarbiyah universitas iain palu latih tulis jurnal internasional
Abdee,operasi cari korban tenggelam udara bangga laut henti
Abdee,sulteng pasien positif corona morowali sumbang
Abdee,upaya guru palu ajak didik toreh prestasi tengah pandemi
Abdee,ketat ruang gerak duga teroris aparat gelar razia lokasi kota palu
Abdee,destinasi pariwisata pohon pinus lantolongke kembang morowali
Abdee,ardi kadir pimpin pemkab parigi moutong sosialisasi mpp wilayah ii menteri panci ribu
Abdee,perbarui corona jumat tinggal dunia sembuh
Abdee,unsimar poso bantah tuding politik praktis giat wisuda
Abdee,lahan iup pt bcpm bupati morowali pemdes usaha musyawarah
Abdee,asisten perintah kesejahteraan rakyat wakil bupati parigi moutong buka latih dampak negatif lingkung responsif jenis kelamin
Abdee,disperindag sulteng launching startup domestik tahun
Abdee,paslon pemilihan kepala daerah poso hadir wisuda bem unsimar politik praktis kampus
Abdee,aristan wahyudin paslon pemilihan kepala daerah palu sumbang dana kampanye
Abdee,bioskop xxi grandmall palu resmi operasi besok
Abdee,draiv solusi anak muda bangun ekonomi kabupaten poso bas online
Abdee,kapolres poso jabat akbp rentrix
Abdee,hadir maulid rasul muhammad saw polda sulteng syekh ali jaber ikan tausyah
Abdee,personel polres palu tes psikolog syarat pegang senpi
Abdee,berita palsu anggota dprd sulteng yb ancam pidana tahun penjara
Abdee,perbarui corona sulteng pasien positif sembuh tinggal dunia
Abdee,kapal hantam ombak calon wakil bupati bangga laut tinggal tenggelam
Abdee,buka turnamen futsal dandim poso cangkir tim tuna pasepo raih juara
Abdee,kpu poso gelar debat publik paslon putar
Abdee,cegah tular corona disperdagin palu dagang beli wajib patuh protokol sehat
Abdee,angin kencang hujan tiang listrik tumbang morowali
Abdee,beasiswa aspirasi hj sakinah salur sekolah non muslim
Abdee,teliti klaim pemuda sulteng malu bahasa area
Abdee,debat cagub cawagub sulteng enam segmen
Abdee,sumpah pemuda bem unsimar poso gelar fgd bahas uu cipta
Abdee,sulteng setuju investasi indonesia hidayat lamakarate komitmen tingkat potensi pemuda
Abdee,debat perdana pemilihan kepala daerah sigi harap referensi warga pilih
Abdee,jelang sumbang darah komunitas motor tolitoli materi aman kuda
Abdee,dukung warga camat nambo fm bendung
Abdee,kampanye batas rusdy mamun ahmad ali persen menang morowali
Abdee,warga poso positif corona tinggal dunia
Abdee,jelang pemilihan kepala daerah serentak kapolres sigi pantau situasi aman udara
Abdee,libur maulid muhammad saw pertamina jamin stok bbm lpg sulawesi aman
Abdee,sekda parigi moutong sosialisasi didik anti korupsi virtual
Abdee,imbau keamanan ketertiban masyarakat bhabinkamtibmas polres palu rutin kunjung masyarakat
Abdee,jelang libur kelola wisata sulteng ketat protokol sehat
Abdee,listrik dewua sangginora pulih pasca longsor pln poso politik
Abdee,pasien corona sulteng sembuh konfirmasi positif
Abdee,pfi palu buka daftar anggota
Abdee,posko corona pemerintah kota palu tawaeli periksa jalan
Abdee,bantah sita paksa kendara konsumen kepala cabang sms uang luwuk mobil tarik pindah tangan
Abdee,yolanda antuke seru kader simpatisan golkar wilayah menang fm
Abdee,kapolres palu ikan bantu sembilan bahan pokok urus masjid selai tawaeli
Abdee,corona transaksi bursa efek sulteng cetak rekor transaksi tinggi
Abdee,gubernur sulteng harap rei sulteng bangkit
Abdee,forum pemuda toraja deklarasi marsel komitmen maju area
Abdee,untad bank sulteng jalin kolaborasi pulih ekonomi sektor ikan
Abdee,kuasa hukum paslon vy lapor media sosial memposting cemar nama
Abdee,intensitas hujan kota palu dampak buruk produksi distribusi garam talise
Abdee,bintara polda sulteng resmi lantik perwira
Abdee,warga palu diakomodir dptb
Abdee,pasha prihatin jurnalis unjukrasa omnibus hukum
Abdee,corona dinkes sulteng rekor
Abdee,ahmad ali bawa rp miliar bantu pusat sektor tani
Abdee,polsek batu aman sepeda motor hasil curi hasil buram
Abdee,operasi yustisi pasar tim gabung pemerintah provinsi sulteng jaring langgar
Abdee,menang gugat pt tun makassar herwin mustar pemilihan kepala daerah bangga
Abdee,maruf jamin vaksin corona jalan syariat islam
Abdee,perbarui corona sulteng positif sembuh
Abdee,al quran utuh rumah ludes bakar surabaya
Abdee,pjs bupati poso buka turnament badminton dandim cangkir ii
Abdee,perbarui corona sulteng positif sembuh tinggal dunia
Abdee,jalur palu sabang tolitoli buka tutup
Abdee,sidang mediasi pt fif palu salah konsumen temu sepakat
Abdee,safari jumat polsek balaesang sosialisasi keamanan ketertiban masyarakat
Abdee,kpu donggala
Abdee,jaga keamanan ketertiban masyarakat jelang pemilihan kepala daerah serentak polres palu rutin gelar patroli
Abdee,usaha parawisata ekonomi keratif palu daftar ki
Abdee,mahasiswa bandung gelar aksi tolak uu ciptaker
Abdee,rapat koordinasi virtual mendagri bahas regulasi omnibus hukum sikap dprd bangga
Abdee,alpukat inovasi akte lahir online kota palu
Abdee,imbau keamanan ketertiban masyarakat anggota polres palu sambang warga lolu
Abdee,naskah tolak ditandatangani dprd sbsi bangga omnibus hukum cipta buruh
Abdee,kuat materi ranperda misi tawa panitia dprd palu kunjung kabupaten parimo
Abdee,massa demo omnibus hukum padat patung kuda
Abdee,bawa busur demo mahasiswa kota palu aman polisi
Abdee,rusak kendara dinas milik polisi mahasiswa demo tangkap
Abdee,polda sulteng aman ton tenaga surya duga
Abdee,fikep sbsi morowali deklarasi dukung rumah pilgub sulteng
Abdee,personel polsek palu barat jaga kampanye aristan wahyudin ujuna
Abdee,oktober pemkab parimo ketat periksa pintu batas
Abdee,produksi garam talise turun dian pasok makassar
Abdee,duga libat oknum polisi atur antre jerigen tenaga surya spbu kapolres parimo pulbaket lidi
Abdee,wabup badrun prevalensi stunting target turun persen
Abdee,cipayung sulteng presiden perpu batal omnibus hukum
Abdee,jurnalis sulteng korban tindak represif aparat polisi
Abdee,dprd palu sesal sikap represif aparat mutmainah keras solusi
Abdee,polisi pasang kawat dur tutup akses istana
Abdee,dukung program tahan pangan nasional kapolda sulteng kunker morowali
Abdee,bni cabang palu kucur dana rp miliar tengah pandemi corona
Abdee,botol cair vape batang rokok ilegal musnah bea cukai palu
Abdee,bawaslu sigi tertib apk sesuai pkpu
Abdee,fraksi pdi misi sikap kait putus raperda lindung anak
Abdee,pkbi jmk oxfam bentuk forum kelompok rentan desa tingkat provinsi
Abdee,antisipasi mogok buruh polres palu siaga ratus personel
Abdee,serah apk bk pemilihan kepala daerah pesan kpu kota palu
Abdee,ridwan kamil tunda salur bansos area gelar pemilihan kepala daerah
Abdee,kadin buruh mogok nasional tolak ruu cipta
Abdee,dokter awat rumah sakit anutapura positif corona besok pasien batas
Abdee,personel polsek palu barat jaga aman kampanye had reny
Abdee,ojk sektor industri jasa uang sulteng stabil
Abdee,pemerintah kota palu usaha langgar prokes tutup izin usaha pergi
Abdee,plt walikota palu pasha inspeksi mendadak pos batas watusampu
Abdee,kapolres palu intens sosialisasi keamanan ketertiban masyarakat jelang pemilihan kepala daerah serentak
Abdee,mudah warga akta lahir pemkab sigi gandeng puskesmas rumah sakit
Abdee,untad batas aktivitas mahasiswa lingkung kampus
Abdee,kejut api abadi mrapen padam total
Abdee,maruf polri netral pemilihan kepala daerah serentak
Abdee,yappika actionaid serah apd tenaga medis sulteng
Abdee,sembilan pasien positif corona parimo sembuh rawat
Abdee,sukses tourney perdana november esi poso adakan turnamen esports
Abdee,rilis prakira gera tanah menteri esdm sekda parimo sosialisasi
Abdee,siswa palu pulsa gratis pandemi
Abdee,bersih bahan banjir area irigasi dinas puprp parimo desak tani desa
Abdee,kapolda sulteng anggota netral kandidat
Abdee,enam karyawan telekomunikasi sulteng konfirmasi positif corona
Abdee,plt walikota palu pasha ziarah makam massal pasca tahun bencana
Abdee,bantu siswa ajar online polda sulteng ikan bantu wifi gratis
Abdee,zona merah corona oktober donggala selai senja
Abdee,besok pemkab morowali wajib jalan pacar kepel tes
Abdee,kapolres palu larang iring iring konser kampanye pemilihan kepala daerah
Abdee,esports poso sukses gelar turnamen skala nasional
Abdee,tim pso juara turnament pubg anak poso
Abdee,positif corona sulteng capai angka
Abdee,kpu sigi sosialisasi pkpu kampanye
Abdee,polsek balaesang gencar imbau cegah corona keamanan ketertiban masyarakat ibadah
Abdee,polsek sirenja imbau humanis protokol sehat masjid
Abdee,masker puluh warga donggala sanksi sih sampah
Abdee,sinergitas polda sulteng korem tadulako gelar baksos salur karung beras
Abdee,nomor urut irwan samuel menang nomor urut husen paulina nomor
Abdee,dinkes sulteng palu donggala morowali zona merah corona
Abdee,gilir wakil ketua ii dprd parimo kejar sangka
Abdee,kemenparekraf republik indonesia salur bahan lauk saji warga sulteng
Abdee,dinkes palu hasil cepat uji jamin jalan bebas corona
Abdee,ajar tatap muka sman madani palu ajak tua siswa rapat
Abdee,satpol pulang pergi perlindungan masyarakat kota palu gelar apel jelang pam pemilihan kepala daerah
Abdee,tim satgas corona personel gabung parimo razia masker
Abdee,juara bulutangkis gebyar merdeka morowali tim laju semifinal
Abdee,mobil milik pria paruh baya palu tembak otk
Abdee,bangun tanggul abrasi pantai kota palu anggap langgar tata ruang
Abdee,corona rawan merah putih dukung rusdy mastura mamun amir batal deklarasi
Abdee,rumah warga labu donggala bobol maling uang milyar gram emas raib
Abdee,armin pilih nahkoda koalisi sulteng hebat kota palu
Abdee,sangka mutilasi kalibata kota tidur jenazah
Abdee,fpti sulteng optimis raih medali pon papua
Abdee,dampak pandemi corona dagang pasar tradisional palu jerit
Abdee,personel gabung morowali semprot disinfektan
Abdee,idi cemas indonesia episentrum corona dunia
Abdee,tim hidayat bartholomeus morowali strategi menang
Abdee,polsek batu sita motor hasil pencurian kendaraan bermotor poso
Abdee,kadin palu imbau usaha domestik sulteng saing gufron tonton
Abdee,sembilan narapidana pria luwuk bekuk tim jatanras polres bangga
Abdee,sulteng darurat bencana ekologis walhi lingkung hidup kapitalisme
Abdee,iain palu laksana seleksi kompetensi bidang cpns berani
Abdee,polres palu kodim donggala masker gratis warga
Abdee,syarifudin odjobolo harap kandidat bohong publik
Abdee,sulteng peringkat edar narkotika psikotropika obat terlarang indonesia
Abdee,layan masyarakat camat sigi kota resmi
Abdee,tangan duga langgar asn bawaslu parimo bentuk tim investigasi
Abdee,arteria dahlan sahroni aduh rahang rapat bareng polri
Abdee,usaha psbb anies larang makan malam mati
Abdee,sekolah partai gelombang pdi misi bartholomeus tandigala
Abdee,perbarui corona september positif sembuh
Abdee,pemilihan kepala daerah kota palu hidayat habsa kembang bangun kota sektor jasa
Abdee,muda palu tinggal gantung
Abdee,gugat calon pemilihan kepala daerah sigi putus september
Abdee,dpr larang sri mulyani defisit apbn
Abdee,istana responsif negara tolak wni
Abdee,mudah nasabah transaksi bank muamalat palu sedia fasilitas berhenti services
Abdee,polda sulteng kampanye gera pakai masker masker
Abdee,musnah barang bukti kejar parimo abai sosial jarak
Abdee,anwar hafid pilih pimpin negara dermawan area
Abdee,jelang sidang jerinx istri aju tangguh tahan
Abdee,sri mulyani klaim aman aset properti blbi
Abdee,anwar hafid gabung cudi mamun menang pemilihan kepala daerah sulteng
Abdee,rujab direktur ditpolair polda sulteng ajar berani
Abdee,pasang calon maju pemilihan kepala daerah poso
Abdee,aksara internasional bangun narasi adab intelektual
Abdee,terima negara capai rp agustus
Abdee,balon pemilihan kepala daerah palu jalan periksa sehat
Abdee,tantang kandidat pemilihan kepala daerah palu mahir golkar gerindra daftar kpu
Abdee,calon lawan gibran ribu daftar pemilihan kepala daerah solo
Abdee,polda sulteng kirim personilnya misi damai pbb
Abdee,pertamina latih ajar anak butuh
Abdee,pdip massa gibran bobby pesta lupa bahaya
Abdee,tahap daftar bapaslon kpu poso jaga ketat polisi
Abdee,siaga personel kpu palu kapolres palu terap prokes bubar
Abdee,dinas tahun hidayat lamakarate pilih maju gubernur sulteng
Abdee,golkar hanura resmi usung cudi mamun pemilihan kepala daerah sulteng kepala kepala
Abdee,puluh warga probolinggo rumah sakit terima pasien vonis corona
Abdee,istana dorong jerinx proses adil transparan
Abdee,ratus kader nasdem bumi raya lantik ketua dpd instruksi dpp jalan kecuali
Abdee,edar sabu nenek paruh baya tawaeli tangkap polisi
Abdee,banggar disdikbud sulteng prioritas anggar tingkat sdm
Abdee,rugi materil akibat bakar kampus stisip pb palu taksir
Abdee,indonesia ambang resesi usaha banten
Abdee,kontras seret tni serang polsek ciracas adil umum
Abdee,kpu sulteng daftar calon gubernur wakil gubernur
Abdee,ratus santri positif corona banyuwangi karantina pesantren
Abdee,buruh tambak bulukumba sulsel tewas tikam pacar
Abdee,ombudsman sorot bangun tanggul laut palu milik izin
Abdee,target bebas stunting upaya pemkab sigi
Abdee,ypi crs tas siaga bencana desa lurah
Abdee,dpw pks sulteng serah kwk bapaslon
Abdee,atlet hapkido sulteng kejuaraan nasional online buka
Abdee,mundur asn hidayat lamakarate bukti serius maju pilgub
Abdee,pemkab parimo target turun stunting persen
Abdee,sosialisasi sekolah ramah anak wakil bupati morowali jaga lindung anak prioritas
Abdee,pilgub sulteng pdip resmi usung hidayat bartho
Abdee,sekolah poso buka september paud jadwal november
Abdee,bangga jual es gabus surabaya biaya anak sarjana
Abdee,nadiem geser anggar organisasi gerak pulsa guru
Abdee,disdik palu target september sekolah ajar tatap muka
Abdee,jokowi takut korupsi penjara neraka
Abdee,walikota palu gelar dzikir syukur resmi jembatan lalove
Abdee,tingkat tangguh masyarakat ypi crs ribu poster kesiapsiagaan bencana donggala
Abdee,derita huntara sintas loli donggala tuntut huntap
Abdee,polres bangga intesifkan latih tfg jelang pemilihan kepala daerah serentak
Abdee,area aju pinjam rp perintah pusat tahun
Abdee,pasang remaja terjun sungai mus larang pacar temu tewas
Abdee,delapan jabat teras lingkup polda sulteng resmi lantik
Abdee,pantai tanjung karang donggala ramai kunjung warga tengah pandemi corona
Abdee,kereta api bandara yogyakarta operasi
Abdee,risiko bencana ypi crs pasang rambu bencana warga sigi
Abdee,muswil rapi bangga gelar wabup mustar pemkab sinergi
Abdee,tangkap polisi kait ganja drummer batu korban
Abdee,gempa magnitudo guncang sigi masyarakat imbau panik
Abdee,polsek bunta sita kantong minuman keras aman bas motor
Abdee,jasa influencer pesan bias perintah masyarakat
Abdee,cepat uji corona temu gubernur presiden bem gorontalo reaktif
Abdee,pusar kalah peluru kritik jokowi
Abdee,palu topang pindah kota negara walikota selatan kawasan wisata utara kawasan buah
Abdee,duga curi uang nila rp juta pria tangkap polisi
Abdee,karaoke surabaya tawar lc prostitusi mami sangka
Abdee,tinggal kursi kapolda sulteng syafril nursal lamar cawagub jambi damping tahana
Abdee,lantik firdaus resmi jabat wakajati sulteng
Abdee,impor anjlok persen bukti domestik merosot
Abdee,alesandro delpiero temu tewas gantung lorong brendi
Abdee,dtph sulteng komoditas bawang sulawesi tengah
Abdee,mega surabaya upacara agustus virtual istana merdeka
Abdee,pondok republik indonesia gubernur sulteng paket hhbk buka gerai kph
Abdee,tingkat partisipasi pilih kpu palu adakan lomba lukis dinding cerdas cermat
Abdee,kapolres morowali pimpin serah terima jabatan jabat
Abdee,personil bko markas tni palu kapolda sulteng optimis kelompok mit poso
Abdee,jabat eselon iv parimo diwarning wajib penuh
Abdee,jenderal polisi jaksa acara seret djoktjan
Abdee,paripurna dprd morowali agenda serah kupa ppas kua
Abdee,himbauan tni warga palu luang waktu menit nyanyi lagu indonesia raya sambut pondok republik indonesia
Abdee,rangka pondok republik indonesia bank bukopin hadir program deposito merdeka seru
Abdee,kpu morowali utara jamin hak pilih warga umur
Abdee,kpu donggala bimtek susun daftar pilih hasil mutakhir
Abdee,tegak hukum selediki duga proyek fiktif negeri tatura
Abdee,kisruh lahan sawit pt mamuang somasi tani walhi sulteng henti kriminalisasi tani
Abdee,bawaslu sulteng temu warga milik dokumen duduk parimo
Abdee,partai karya logo tera brosur salah cagub ilegal
Abdee,tuntut hasil tanah objek reforma agraria tani sigi pandemi corona bukti tahan tani
Abdee,basarnas palu gelar simulasi tangan korban tema semangat lawan corona
Abdee,komnas daging sulteng sorot libat tni berantas terorisme
Abdee,kepala bnpt imbau waspada teror pemilihan kepala daerah sulteng
Abdee,okupansi hotel santika palu juli
Abdee,gerindra sulteng prabowo pilih demokratis
Abdee,warga poso sandera kelompok mit tinggal dunia
Abdee,nelayan ampibabo hilang lokasi selai touna
Abdee,tindak sulteng salur pangan gratis warga palu
Abdee,banjir bandang lawi rusak rumah warga
Abdee,demokrat ekonomi minus perppu alas
Abdee,pondok polisi wanita polda sulteng bantu bibit ikan tomat warga donggala
Abdee,suhardi sih rajin meubel alumunium desa apbd
Abdee,jual sabu pria tol tol bekuk polisi
Abdee,palasa tinggi malaria turun drastis
Abdee,selamat sumber daya alam sulteng tuntut henti operasi tambang ilegal morut
Abdee,jokowi duka cita ledak libanon
Abdee,bank muamalat terap kas kelola sistem mudah akses transaksi nasabah
Abdee,tugas ppdp pps cermat menginput data
Abdee,buruh kawasan industri morowali berunjukrasa dedy usaha prioritas karyawan
Abdee,pemerintah provinsi sulteng dorong bawang putih komoditas unggul sigi
Abdee,reses hadir ahmad ali kader nasdem
Abdee,kilas cerita suasana senja takbir idul adha posko ungsi korban banjir luwu utara
Abdee,libat narkotika psikotropika obat terlarang selingkuh personil polda sulteng pecat
Abdee,walikota palu resmi mushola bantu bni
Abdee,kapasitas fiskal sulteng kategori rendah rumah pimpin
Abdee,hilang gunung mepanga anak saudara saudara temu
Abdee,aparat gabung bakar sabung ayam bahodopi
Abdee,pt cpm salur hewan kurban lurah palu
Abdee,viral warna rambut alas wawali palu pasha
Abdee,pesta sabu oknum wartawan parimo ciduk polisi
Abdee,sembelih sapi kambing tindak sulteng sulteng gandeng lembaga turki bmh
Abdee,anwar hafid butuh kursi partai politik harap
Abdee,imip ekor sapi kurban
Abdee,rindu suasana takbir ribu warga poso pawai kendara sambut idul adha
Abdee,dagang hewan kurban palu resah sepi beli jelang lebaran
Abdee,duga depresi warga tengah temu tewas gantung
Abdee,sistim ajar parimo metode luring alas
Abdee,gerindra tunggu rekomendasi pdip optimistis dukung golkar pdip
Abdee,horseback panah laksana streaming
Abdee,jelang muscab iv hipmi kota palu kriteria calon ketua umum
Abdee,joppi hidayat ketua pdi misi palu ashar yahya mundur
Abdee,tahun alumni akpol salur paket sembilan bahan pokok
Abdee,huntap satelit sintas petobo saran huntap sedia
Abdee,lolos putera sampoerna nadiem tuding profesional industri rokok
Abdee,fraksi nasdem donggala sorot lantik kades mutasi asn anak gizi buruk
Abdee,ketua garda pemuda nasdem sulteng farid podungge prakarsa gera poso tanam
Abdee,penggal cerita aktifitas rawan gabung cinta alam bantu ungsi korban banjir bandang luwu utara
Abdee,hadir sosialisasi mutakhir data pilih poso
Abdee,lipi kunci jepang corona patuh duduk
Abdee,laga amal korban banjir ramai utama bintang
Abdee,boeing qantas terbang rute gambar kanguru
Abdee,purnomo positif corona istana batas temu jokowi
Abdee,rumah warga jalan patimura palu ludes bakar
Abdee,operasi patuh tinombala polres bangga kendara pakai masker razia
Abdee,pemuda tangkap polisi jual telepon hasil curi
Abdee,polres palu hasil curi duga
Abdee,tuding gelap dana bos guru staf smpn palu walikota ganti kepala sekolah
Abdee,jiwa terima dana santun duka tahap ii
Abdee,jokowi kirim bantu sembilan bahan pokok korban banjir masamba
Abdee,klepon jajan islami dagang pasuruan radang
Abdee,tanoto bantah terima hibah rp kemendikbud
Abdee,smkn palu tekan kreativitas guru pandemi corona
Abdee,jokowi uang rakyat dipertanggungjawabkan
Abdee,bkf dilema sehat ekonomi corona
Abdee,edar sabu kayumalue bekuk polisi perempuan
Abdee,bpbd parimo susun syarat dsp huni korban banjir
