username,tweet
Alaniafitri,iya tuhan rindu
Alaniafitri,tawa iya pop pulang cepat kejurdun
Alaniafitri,area potensi tsunami dasar model kota kabupaten provinsi status pandeglang ba
Alaniafitri,maag aug wib lok ls bosan kilometer baratdaya sumur banten kilometer potensi tsuna
Alaniafitri,selamat ulang tahun kezeyengan semoga poppy muka bumi
Alaniafitri,senang tahun ulang tahun pria si doubles main capai bwf ranking points kevin sanjaya sukamuljo
Alaniafitri,juara dunia selenggara agustus basel swiss skuat indonesia
Alaniafitri,tamu rumah tembalang penuhh
Alaniafitri,breaking dunia pria si doubles following kedaluwarsa dunia championships ranking
Alaniafitri,tawa rindu
Alaniafitri,iya ampun gemas sih momota dadah
Alaniafitri,tawa anak panah yess sibuk damar meja sampah plastik
Alaniafitri,wwkwk saudara cemil
Alaniafitri,sial bilang wkwkwkk omong warga jaksel pinggir
Alaniafitri,ayam bal motekar sih kak mantap
Alaniafitri,cepat semarang beli batagor jurbel
Alaniafitri,habis beli batagor rindu batagor jurbel pakai kentang
Alaniafitri,turun kilogram yan takut kebaya wisuda wkwkkwwkk
Alaniafitri,temu cerita whatsapp
Alaniafitri,pikir injak eskalator omong omong
Alaniafitri,fase malas cemil takut kurus
Alaniafitri,mantaapp dukung daddies goes olympic
Alaniafitri,gilaakk leo muda senior kevin
Alaniafitri,indonesia raya kumandang suzhou olympic olahraga centre sembah leo indah hasil ban gelar juara
Alaniafitri,gantung tahun iya kak
Alaniafitri,kereta model pijak kaki diilangin
Alaniafitri,kereta model jelek pijak kaki sindoro saudara laki
Alaniafitri,kak waktu taksaka kereta sindoro kereta bagus
Alaniafitri,ih kak waktu sindoro iya semoga pokok pijak kaki
Alaniafitri,si hebat far wins xd md minions mohammad ahsan hendra
Alaniafitri,iya ampun antonsen baju dimasuki anak olahraga
Alaniafitri,admins minions nyala adil
Alaniafitri,gila tty unggul ws kalah sih fukushima unggul wd kalah kejut semoga nan
Alaniafitri,waaw tty kalah indonesia buka jepang buka tanda tty lelah juara
Alaniafitri,monmaap dar gaji
Alaniafitri,kemarin surat rumah polisi kejut buka surat bukti pelanggaran online duga terobos lampu
Alaniafitri,saudara kelas bom gadis iya tuhan saudara saudara laki iri
Alaniafitri,penasaran motivasi ahsan hendra gebrak bilang md konsist
Alaniafitri,iya besok momogi temu
Alaniafitri,tetangga saudara
Alaniafitri,iya dasar anak jaman
Alaniafitri,lucu baca komentar netijen perkara kevin bawa gendong anak podium
Alaniafitri,hidup goal
Alaniafitri,minions menang semangat turun daddies menang rangking
Alaniafitri,saudara laki ctc menang antonsen bagus utama
Alaniafitri,rindu semarang
Alaniafitri,iya adegan antem tonton
Alaniafitri,tanding menang peduli asih
Alaniafitri,sejarah ulang tahun kejut indonesian md indonesia buka
Alaniafitri,iyakk tampang mpin menyebalkan utama duo menara
Alaniafitri,kevin tarik latih naga api wkwkkwwk
Alaniafitri,paraahh cepat minions utama popp basa basi wkwkk
Alaniafitri,saudara laki chou tien chen ken harga
Alaniafitri,psikoedukasi keluarga kenal skizofrenia tanggal sabtu juli wib lokasi sekretariat kpsi
Alaniafitri,aduh saudara laki ctc tolong kondisi segar pukau
Alaniafitri,mauul ceritaa
Alaniafitri,daddies mental juara puncak daahh
Alaniafitri,respsct earned given shi yuqi
Alaniafitri,semoga daddies fajri
Alaniafitri,unggul gugur bio tahun semoga besok unggul md indonesia menang
Alaniafitri,lemah
Alaniafitri,cerita sedih senja cerita malam sen gofood sadar telepon saudara laki tunggu
Alaniafitri,babang juki cepat sembuh
Alaniafitri,tekad raih menang laga salah gemar indonesia gemar kemarin sa
Alaniafitri,kemarin semarang sih ikhlas nge istora kota gojek
Alaniafitri,perkara tonton badminton nge istora nang daahh
Alaniafitri,rindu owi butet
Alaniafitri,gila tanding fajar rian degdeg an buah manis tengkyu fajri
Alaniafitri,chen tua betah liatinnya tinggal nyalip ujung unggul
Alaniafitri,anak ips kasih kelas laboratorium
Alaniafitri,streaming semoga besok tonton
Alaniafitri,pesan main besok
Alaniafitri,tiati candu gadget teman teman
Alaniafitri,kahitna tonton
Alaniafitri,tawa siyaapp tonton popp
Alaniafitri,tanda menemani tonton badminton tangis
Alaniafitri,sabar blibli indonesia buka ajak tonton badminton bcs teman tonton
Alaniafitri,huu mpin tampan muka gakeliatan
Alaniafitri,aware ubah polusi udara jakarta pulang
Alaniafitri,tunggu indonesia buka minggu bagus untung super friends
Alaniafitri,beda juara indonesia htt
Alaniafitri,hati dukung indonesia cinta support atlet atlet indonesia blibli indones
Alaniafitri,temannya sih bol
Alaniafitri,yaallah lucu sih saudara laki
Alaniafitri,rahang plester andien teman buruk diskusi
Alaniafitri,psikolog sih teman teman bingung sih
Alaniafitri,kevin pakai baju celana model bolong tampan
Alaniafitri,maximize milik potensi linkedin teman instagram coba bagikan informasi puluh
Alaniafitri,lari lantun
Alaniafitri,cantik memakai iya iya memakai fungsi rias tumpeng
Alaniafitri,sutopo okok beliau okok pasif derita kanker paru papar asap rokok
Alaniafitri,obrol senja tema beasiswa si si yaallah bimbang
Alaniafitri,pancing ribut
Alaniafitri,innalilahi whatsapp inna ilaihy raji ujian nasional keluarga bmkg duka pulang salah putra bangsa bap
Alaniafitri,kayaknya rambut diapakan bagus pop
Alaniafitri,pergi jumat versi aladdin
Alaniafitri,tinggal dunia minggu july waktu guangzhou wib doa
Alaniafitri,yaallah pop otomatis tangkap tawa
Alaniafitri,ayo kak tunggu malu
Alaniafitri,yaallah kuat akutuuh
Alaniafitri,tawa iya sih okee terima kasih inspirasi kak hahaa
Alaniafitri,kemarin mantap si waktu iya si dilema
Alaniafitri,tawa wisuda saudara acara keluarga
Alaniafitri,malas wisuda fakultas bilang iya
Alaniafitri,hujat iya ges bosan manusia blender
Alaniafitri,alas uji tuhan tuhan senang utas uji untung tuhan
Alaniafitri,teman cari inspirasi
Alaniafitri,oh pikir
Alaniafitri,sepeda jalan kaki um iya
Alaniafitri,hitung habis
Alaniafitri,dikirimin foto nyebrang lampung lampung
Alaniafitri,eh
Alaniafitri,sopir ambil manja anak
Alaniafitri,bilang kamar kos rapi uang kamar luas barang barang kal
Alaniafitri,kemarin grup keluarga isi gosip rencana lampung yudisium grup
Alaniafitri,utas wawancara bayar perhati rekrutmen usaha
Alaniafitri,jalan setuju kondisi berani cari tolong
Alaniafitri,bahas instagram tahap sadar alami alami depr
Alaniafitri,ayo buang kosmetik utas
Alaniafitri,utas pustaka nasional dikenal pusnas anak jabodetabek sia nyiakan uang sia nyiakan waktu
Alaniafitri,eh psikiater psikolog baca coba baca pribadi
Alaniafitri,nang sih yudisium jalan
Alaniafitri,lebaran kemarin ajak saudara laki heri lampung tanggal tanggal yudisium habis
Alaniafitri,saudara
Alaniafitri,tawa iya tuhan az
Alaniafitri,antisipasi tuduh kentut ramai ramai kejut
Alaniafitri,anggep semarangnya libur yudisium tawa
Alaniafitri,libur potong yudisium kron
Alaniafitri,hamdalah tunggu jadwal utama tawa
Alaniafitri,pagi semarang jalan jakarta iya ampun krl jakarta bogor
Alaniafitri,iya ampun samping pria bagus tunggu kereta cemil bekel jarang temu cowok
Alaniafitri,depresi syukur konsultasi depresi urus jalan depresi menggangg
Alaniafitri,olah marah ujung musibah bina hubung kunjung marah lumrah
Alaniafitri,maaf sih maaf lupa maaf sakit oke
Alaniafitri,perut panas
Alaniafitri,perkara habis lebaran cemil mie mie mie goreng spageti mie ayam bihun
Alaniafitri,momen ani yudhoyono prize uang srikandi indonesia lari beliau dukung
Alaniafitri,sulit hindar senja ngemil cemil sikat gigi sih
Alaniafitri,sih cari tolong sih teknik swabantu tolong sembuh cari nakal
Alaniafitri,rumah paket saudara saudara
Alaniafitri,damai
Alaniafitri,breaking marcus fernaldi gideon kevin sanjaya has become indonesian main pasang accumulated weeks
Alaniafitri,parah parah parah budak cinta kevin tawa
Alaniafitri,nang
Alaniafitri,suka sedih porter tua angkat barang langgan bawa iya
Alaniafitri,terima kasih tim indonesia juang
Alaniafitri,tunggu harga tiket juli tiket beli via
Alaniafitri,ih tangkap lelah bolak hubung putus vpn
Alaniafitri,olimpiade
Alaniafitri,suka pikir egois harga waktu urus
Alaniafitri,kontribusi indonesia menteri andai pilih pria
Alaniafitri,pbsi jaya indonesia juara
Alaniafitri,piala sudirman situasi negeri panas utama fokus
Alaniafitri,pikir jahat jahat pikir sa
Alaniafitri,whatsapp instagram turun meminimalisir gambar video edar twitter gambar video
Alaniafitri,detikers ayo dukung tim bulutangkis indonesia piala sudirman lawan denmark tanding sakit
Alaniafitri,admin haeus sabar
Alaniafitri,semoga polisi tugas lindung tuhan suci semoga gaduh
Alaniafitri,semoga rumah rusuh jalan pulang tanah saudara laki
Alaniafitri,aduh bagus sih
Alaniafitri,parah pop iya pria bagus
Alaniafitri,sih pasu sudirman kesini bagus kojeng tawan
Alaniafitri,sambut nanning wni terima kasih dukung
Alaniafitri,suruh bawa pulang
Alaniafitri,bismillah bawa pulang piala sudirman
Alaniafitri,cepat pulang rumah packing barang sih malas gerak barang
Alaniafitri,turun turun malu turun pintu gerbong kereta tutup cua
Alaniafitri,tawa mantaapp cari lucu dipakein sosis
Alaniafitri,iya temu
Alaniafitri,siang puasa telur dadar
Alaniafitri,gebetanq ajar ih ruma mati lampu assalamualaikum sayang
Alaniafitri,sayang lada potts morgan telanjang peter parker harley keener avengers
Alaniafitri,earphone daiso meter tali skipping
Alaniafitri,pbsi kado pondok raih juara umum terima kasih mohamm
Alaniafitri,tanda ramadan sih biskuit bingung anak mengaku danish pakai monde perancis gambar
Alaniafitri,rumah pel rumah sapu cuci piring astaghfirullah dikerjain rumah iya
Alaniafitri,kemarin ketemu saudara laki heri bilang kurus iya waktu kirim foto fara azkia bilang kur
Alaniafitri,podium foto selamat chan goh pramel coba turnamen
Alaniafitri,baca nama zayn malik pikir bahasa indonesia oh salah baca
Alaniafitri,video lengkap tenggelam kapal ilegal tangkap ikan pulau datuk kalimantan barat daulat sumber daya laut
Alaniafitri,uu tahun sehat jiwa sepakat ganggu jiwa odgj
Alaniafitri,manusia prestasi hebat teman teman
Alaniafitri,kucing iya
Alaniafitri,gila tuhan
Alaniafitri,teman hiv buah sakit hiv nama buah virus sakit kumpul gejala muncul
Alaniafitri,lucu jakarta
Alaniafitri,malas tolong posisi tolong mer
Alaniafitri,makasyi
Alaniafitri,taurus giveaway selai tangan ripcurl laki laki perempuan
Alaniafitri,gugup an kejar waktu revisi cepat libur sih
Alaniafitri,salah sih ambis salah sih ken kadang lelah jahat
Alaniafitri,seksi newws tanggal mei liliyana natsir herry ip rionny mainaky resmi gabung pb djarum bute
Alaniafitri,perak wuhan emas tokyo
Alaniafitri,yaallah polos salah
Alaniafitri,cemas nasib tawa
Alaniafitri,revisi buka naskah tolong tulis baca tulis
Alaniafitri,berita odgj hak milik hak suara odgj kondisi
Alaniafitri,habis baca komentar berita pikir odgj hak pilih kondisi
Alaniafitri,terima kasih informasi harga virgio
Alaniafitri,kantor unilever amsterdam belanda raksasa plastik setuju kantor nestl vevey swiss aktivis greenpea
Alaniafitri,besok niat beli saudara wanita kemas alfamart korban saudara wanita kemas hasil sunti
Alaniafitri,isya habis beli saudara wanita kemas indomaret minum aneh asam
Alaniafitri,foto momota seliwer iya bagus
Alaniafitri,tawa kayaknya asa sih menang pop minions kalah mer
Alaniafitri,besok minions lawan fajri
Alaniafitri,lingkar cahaya jual popcorn harga ribu karamel seaweed mentega cokelat cheese greentea saltedegg dija
Alaniafitri,suruh korban damai ajak duduk bilang mukaknya audrey anak
Alaniafitri,ppt bagus inspirasi desain pinterest unduh template kece slides unduh infografik tab
Alaniafitri,fajri menang minions tangis
Alaniafitri,iya lupa sih pacar kota waktu hutan
Alaniafitri,keluh kesah maah teman nopal febri nopal nopal nopal febri nopal
Alaniafitri,iya niat golongan putih niat pulang malu
Alaniafitri,oke gila tengah gambar perhati ayo mari kontrol gila tidur senja saudara
Alaniafitri,iya sen tiket pulang
Alaniafitri,lupa daftar calon pilih milu semarang mencoblos pulang rumah
Alaniafitri,tangis semoga daddies fajri balas dendam minions tawa
Alaniafitri,iya ampun tega patah hati sedih tawa
Alaniafitri,tonton sedih pop minions iya menang
Alaniafitri,sedih wooyy babak minions kalah utama indonesia kalah babak pe
Alaniafitri,zayn malik warung zayn beli warung beli saudara zayn
Alaniafitri,keyboard rusak butuh laptop ganti keyboard nang wooy
Alaniafitri,tawa ngakaakk banget
Alaniafitri,iya ampun banget pacar pendekatan jaman tawa sho
Alaniafitri,bibir tipis prabowo fokus tawa
Alaniafitri,semangat sistuurr
Alaniafitri,periksa dar konsul psikolog sikiater umum oke gantung rumah sakit
Alaniafitri,iya ngobrol hans bawa tegang sejuk terapi langsun
Alaniafitri,eh ngepick banget cemil ngepick pesan
Alaniafitri,mon maaf kesal lelah habis bimbing bolak kampus perkara gosend
Alaniafitri,alas lucu takut rampok saudara wanita sakit maz jalan raya ramai buka
Alaniafitri,habis magrib pesan gosend drivernya nge pilih an sopir batal
Alaniafitri,bicara kaki
Alaniafitri,lucu huang yaqiong niupin tangan tawa jimat iya
Alaniafitri,sedih banget marin cedera menang saina tangis
Alaniafitri,batal
Alaniafitri,semoga tanding ci butet menang
Alaniafitri,fajri lawan minions maennya ajegile bagus minions terbaik daddies ho oh bangga
Alaniafitri,asli sedih fajri kalah minions sedih juang lawan minions si
Alaniafitri,senam jantung tonton sedih fajri kalah minions ikhlas
Alaniafitri,kalah kento momota dukung ting tawa
Alaniafitri,gila seru tonton fajri lawan minions permainan teriak kamar
Alaniafitri,gagal tonton indonesia kuasa ngejualin tiket ken beli sayang rumah
Alaniafitri,doa sembuh sakit informasi bencana tanah udara syukur
Alaniafitri,malaysia masters greysia apriyani henti lari
Alaniafitri,malaysia masters kevin marcus raih gelar
Alaniafitri,minions sih cedera pop tawa tonton salamin jombang tawa februari kayaknya pop
Alaniafitri,tonton indonesia kuasa pop
Alaniafitri,iya ampun kutu kalah sf jepang bukti tangis bang
Alaniafitri,pop abu faal tangis gila semifinal
Alaniafitri,ahay
Alaniafitri,nabung waktu tonton salur successbefore situ singgung investasi
Alaniafitri,tunggu apdetan iya sebentar kampus tur gedung fisika tawa
Alaniafitri,ngintipin duga kes serius galak ken tawa
Alaniafitri,gila seru ajar tabung investasi logam mulia investasi properti investasi saham rek
Alaniafitri,candu tawa candu wattpad
Alaniafitri,mantap budak wattpad hahahaa
Alaniafitri,ubah terima
Alaniafitri,kadang bingung hidup yogyakarta hogwarts
Alaniafitri,tahun panik bawa bayi dokter tolongin dokter anak demam tinggi diminumin obat
Alaniafitri,bilang indonesia antre
Alaniafitri,makasiyy
Alaniafitri,ketemu kron konsultasi tawa ketemu
Alaniafitri,sedih sedih sedih
Alaniafitri,siyaapp
Alaniafitri,tawa mengantri dokter iya
Alaniafitri,aduh takut capslock
Alaniafitri,sogok saudara tingkat dosen pasal saudara tingkat nyerobot
Alaniafitri,tawa asli sih tawa cil prihatin
Alaniafitri,makasiih lili
Alaniafitri,terimakasih stella
Alaniafitri,tunggu ruang selai ngobrol bentar selai bicara besok pagi iya rumah si
Alaniafitri,janji bimbing selai selai ngabarin undur selai rapi tinggal jalan
Alaniafitri,iya tuhan malu sujud buru buru nikmat ribu
Alaniafitri,batal
Alaniafitri,kondisi gunung anak krakatau video kiri teluk cirebon pads wib erupsi berlangsun
Alaniafitri,duka musibah tsunami kabupaten pandeglang lampung selatan semoga korban selamat
Alaniafitri,bahan pijar gunung anak krakatau lontar kilometer warga waspada pvmbg selengk
Alaniafitri,data dampak tsunami pantai kabupaten pandeglang serang lampung selatan wib ter
Alaniafitri,mantap jaya raya menang
Alaniafitri,mampir semarang az tawa
Alaniafitri,azz tiket
Alaniafitri,iya kak
Alaniafitri,sedih sesuai ekspektasi gagal libur
Alaniafitri,tawa iya tuhan persis saudara dikosan iya hidupnya tawa
Alaniafitri,bayang libur kalong eh periksa tiket kereta limpah ruah
Alaniafitri,ih kayaknya indonesia kuasa insyaallah juni juli
Alaniafitri,tawa az belah kiri cahaya muka kuat bandingkan muka
Alaniafitri,tonton titip maz jom tawa
Alaniafitri,yaallah maz muka cahaya sih kuat
Alaniafitri,poppy iri tangis
Alaniafitri,ken tonton kejuaraan nasional
Alaniafitri,whatsapp pagi insinyur kenya
Alaniafitri,serius teman teman tahun krusial ras olympic butuh support menyenangkan berusahala
Alaniafitri,ih poppy minions harap indonesia tinggal haf glo tommy nih
Alaniafitri,tolak ukur bangkit ganda putra jaman kalah minions
Alaniafitri,bangun tidur nyawa genep telepon nyebut jeneng iya oke
Alaniafitri,turnamen tutup tahun bwf dunia wisata finals gelar saing pebulutangkis dunia saksik
Alaniafitri,rekor bimbing selai selesai selai kelaperan sholat dzuhur rumah
Alaniafitri,uang bentuk doa kabul
Alaniafitri,rajin rajin tidur
Alaniafitri,beli baju online takut cocok
Alaniafitri,lanjur tahan tawa
Alaniafitri,selai perang ngemil malam pasrah pilih gofood selai oke
Alaniafitri,pindah gedung tawa omong omong tutup tuh
Alaniafitri,kabar kampus
Alaniafitri,batal
Alaniafitri,rayu beli
Alaniafitri,mii
Alaniafitri,kantuk berat contoh rapat kopi jalan sih
Alaniafitri,kayaknya ton
Alaniafitri,ajak saudara malu
Alaniafitri,tahun pikirin desember besok malam tahun iya yogyakarta
Alaniafitri,kabul
Alaniafitri,tahan nang nyanyi lagu blackpink
Alaniafitri,tolong tuhan tolong usaha tuhan bagianny
Alaniafitri,tontowi ahmad liliyana natsir duet daihatsu indonesia masters htt
Alaniafitri,intai bingung kejuaraan nasional siar tvri dec daihatsu masters kompas televisi
Alaniafitri,tawa habis jalan
Alaniafitri,teman rasulullah saw ajar salah senyum sakit uji saudara
Alaniafitri,idih tawa
Alaniafitri,teman senja minggu sebar salah bantu teman jaga asupan cemil efektif
Alaniafitri,tawa anjaz roja
Alaniafitri,pusing tawa
Alaniafitri,indonesia lawan indonesia
Alaniafitri,anak fisika tubuh psikis sehat terkadang misi
Alaniafitri,iya ampun daftar ajar raf tawa
Alaniafitri,teman followerku tahun generasi andal indonesia rubah
Alaniafitri,teman bangun beli pakai uang hasil uang tendang sala
Alaniafitri,batal
Alaniafitri,suasana latih tim indonesia kemarin jelang
Alaniafitri,netizen ajar bahasa
Alaniafitri,badan otak pesan kirim sinyal kantuk selai ujung tidur selai ju
Alaniafitri,otomatis ngerekam raf tawa netijen twitter
Alaniafitri,buang udara balon
Alaniafitri,yaallah tawa
Alaniafitri,tangis sedih tinggal warga tambun
Alaniafitri,teman coba usap perut kiri mrasakan nyeri tusuk bakar dicengkram saudara
Alaniafitri,ikat batin anak saudara bes iya kondisi badan
Alaniafitri,ikhlas hati teman hati paksa ganti paksa rodi mnerus regenerasi samp
Alaniafitri,saudara hobi jodoh adeknya temannya saudara mup nyala takut
Alaniafitri,peluk sombong terima tuduh dukung juta
Alaniafitri,batal
Alaniafitri,yaallah sedih kabar fajar rian mundur utama denmark french buka sedih saudara
Alaniafitri,ketemu kota hubung jejak kaki
Alaniafitri,kota sulit temu iya alas layak kaup
Alaniafitri,hamdalah tinggal harta iya sih gendut
Alaniafitri,utas kumpul cerita informasi manfaat teman teman twitter nyatuin mudah
Alaniafitri,semangat
Alaniafitri,iya ampun pedih
Alaniafitri,pesan moral istimewa kalah juang sesal datengnya mas dion saudara
Alaniafitri,pikir tinggal sisa buah kenang kese
Alaniafitri,terkadang topeng sembunyi sembunyi beban ujian nasional
Alaniafitri,yogya kota yogya kota ideal seyogyanya sejakartanya bandung
Alaniafitri,lu
Alaniafitri,beli harga anak jakut puluh ribu anak jaktim mapuluhrebu anak jaksel fifty
Alaniafitri,rian tampan sih kuat instagram tawa
Alaniafitri,tawa flu
Alaniafitri,rindu tertawa acak habis
Alaniafitri,gerimis susah napas
Alaniafitri,ayo azkia dukung tawa
Alaniafitri,begadang tonton youtube begadang nyekrip susah banget selesai kuliah
Alaniafitri,garis suka eror
Alaniafitri,rindu tonton laut games tahun tonton badminton gbk tangis
Alaniafitri,muslim athletes conducted prayers pagi led syeik huseen jaber atlet desa celebrate eid al
Alaniafitri,unggah foto barang rahasia kagum wkwkwkwkkw
Alaniafitri,inisiatif iktikad maaf asik unggah
Alaniafitri,far
Alaniafitri,jahat nakal pintar utama peran
Alaniafitri,selai tunggu pikir
Alaniafitri,setya novanto nazaruddin baca alquran disidak tim ditjen aktin
Alaniafitri,sekian twitter tawa
Alaniafitri,bem psi undip
Alaniafitri,febrina ketep lulus
Alaniafitri,febrina ketep lulus
Alaniafitri,posted foto http cowok tofcv sokp
Alaniafitri,posted foto poo kong http cowok shy
Alaniafitri,kedips fakultas fisika undip semarang pic
Alaniafitri,senang cari bahagia consists http cowok rhbxfhcz
Alaniafitri,posted foto krakal pantai yogyakarta http cowok qsthbvrv
Alaniafitri,tunggu matahari terbit febrina arinda pantai krakal
Alaniafitri,yogyakarta yogyakarta febrina elvira rumah raminten
Alaniafitri,posted foto http cowok ykf xah
Alaniafitri,posted foto http cowok rvruhjbx
Alaniafitri,pasta pabrik
Alaniafitri,edisi pasta pabrik
Alaniafitri,posted foto http cowok arvmf pt
Alaniafitri,oh iyaudah saudara terimakasih iya malu
Alaniafitri,saudara cheppy lani wawancara saudara tugas lkmm
Alaniafitri,aman terbang jaga sehat iya nana yisc al azhar pic
Alaniafitri,aman terbang jaga sehat iya semoga nana yisc al azhar pic
Alaniafitri,tanda ishmanajya nama alania fitri suka nama alania lahir http cowok etfktnsqbl
Alaniafitri,pulang
Alaniafitri,malming tawa praditaa mal ciputra
Alaniafitri,nyamuk krantz
Alaniafitri,rindu pic
Alaniafitri,isi perut kelas tawa
Alaniafitri,kuliah phpin dosen tawa
Alaniafitri,fisika pic
Alaniafitri,udaah iya biil tawa
Alaniafitri,pkmb semoga mimpi udara balon tiup angin pic
Alaniafitri,ngedm
Alaniafitri,malas
Alaniafitri,yeeh pesan ulang saudara
Alaniafitri,temu fisika dewi lombok idjo
Alaniafitri,tawa okeedeeh
Alaniafitri,syok beli lauk ribu tambahkan harga
Alaniafitri,nyemarang dadah jakarta temu stasiun pasar senen
Alaniafitri,senang ulang tahun kesal nan sombong repot mudah an cepat jodoh tawa
Alaniafitri,mahasiswa psiko
Alaniafitri,saudara mengetik mars hymne psiko lebar hvs lembar
Alaniafitri,pesan saudara
Alaniafitri,lucu nametag tawa pic
Alaniafitri,saudara pakai gesper
Alaniafitri,mampir isi perut
Alaniafitri,dadak peri tawa yuly pintu senayan
Alaniafitri,miin batas transfer
Alaniafitri,yeeh tawa
Alaniafitri,tawa rumah
Alaniafitri,dunia jo trans
Alaniafitri,tonton mdl joo hahahha ngeri
Alaniafitri,tawa yoi
Alaniafitri,dilema teruus tawa
Alaniafitri,pesan pin iya taar via bbm malu
Alaniafitri,yoi tawa
Alaniafitri,malu kembang eh iya pin bb
Alaniafitri,cie saudara malu
Alaniafitri,duuh omong tahan tawa
Alaniafitri,takut tawa
Alaniafitri,bilang retweetnya sheil malu
Alaniafitri,retweet akun pmb seeil nyala malu
Alaniafitri,tawa pop nasib
Alaniafitri,cie resmi anak kos tawa
Alaniafitri,sabtu libur selai ajar tawa
Alaniafitri,sih lumayan malu menit
Alaniafitri,loh tinggal kos arah kampus patung kuda raa
Alaniafitri,area sumurboto ra
Alaniafitri,malu iya ra tinggal kos
Alaniafitri,malu pergi tanggal pagi raa
Alaniafitri,cantik kook
Alaniafitri,baca buku tingkat baca pikir
Alaniafitri,iya
Alaniafitri,sudaah
Alaniafitri,kak perempuan wajib rok pakai celana
Alaniafitri,jees iya
Alaniafitri,miin pakai flatshoes iya malu
Alaniafitri,okee terimakasih iya miin
Alaniafitri,sip rok lebar iya admin jilbab
Alaniafitri,admin perempuan kemeja batik
Alaniafitri,yailah curahan hati colongan tawa
Alaniafitri,admin umum pmb
Alaniafitri,iya
Alaniafitri,id garis malu
Alaniafitri,grup garis psiko
Alaniafitri,okee
Alaniafitri,iya kenal lani jakarta
Alaniafitri,iya iya
Alaniafitri,id garis
Alaniafitri,garis psiko undip
Alaniafitri,kenal lani jakarta
Alaniafitri,sudaah
Alaniafitri,habis selai smartphone kanker otak teliti universitas bordeaux
Alaniafitri,sip deh terimakasih ra
Alaniafitri,angkat beli loh sesuai warna fakultas ambil fast http cowok twha
Alaniafitri,bahasa jawanya
Alaniafitri,beli kamus bahasa jawa laah hahahha emangada
Alaniafitri,tawa saudara
Alaniafitri,tawa paham
Alaniafitri,kalah tawa
Alaniafitri,alaah gaya paham bahasa jawa tawa
Alaniafitri,tawa mudah an temu psiko ra
Alaniafitri,cari temeen ramai malu
Alaniafitri,jakarta tawa paham sih yaudahlah
Alaniafitri,sih ragu tonton deh
Alaniafitri,transfer
Alaniafitri,boleeh malu tiwas saudara
Alaniafitri,kamus bahasa jawa deh tawa
Alaniafitri,sen
Alaniafitri,feb tonton tulus bbm silang
Alaniafitri,salep setia menemani kuliah http cowok lxyakqrbq
Alaniafitri,syarah nomor sih tawa
Alaniafitri,beban pikir gila umum insomnia
Alaniafitri,oke
Alaniafitri,iya li
Alaniafitri,ayo banget
Alaniafitri,pengeen feeb london bagus banget
Alaniafitri,malaa iya
Alaniafitri,pasrah tuhan lohsalahfokus haahaha
Alaniafitri,iya feeb
Alaniafitri,doa hilang tawa tawa
Alaniafitri,iya feeb rumit malu
Alaniafitri,selamat tanggal alhamdulillah
Alaniafitri,orientasi studi pengenalan kampus suruh bawa bibit pohon mahoni tawa
Alaniafitri,hormon labil bosan saudara wanita bosan hahhaha
Alaniafitri,sen feb tawa
Alaniafitri,tawa alami sindrom labil
Alaniafitri,sseorang golong darah hati senang kebaji dermawan sosok keras kepala
Alaniafitri,urus
Alaniafitri,iya
Alaniafitri,kuliah cooy tawa
Alaniafitri,sembunyi tangan pangku kantong celana badan gera jujur
Alaniafitri,dilema tuhan listening erti
Alaniafitri,sayang sekolah friends baca together anymore senang gila sedih memories hati
Alaniafitri,oh iya gabung grup garis
Alaniafitri,lani jakarta
Alaniafitri,iya
Alaniafitri,senang ulang tahun teman teman fakultas teman jurus teman ajak obrolan http cowok rlp ktteq
Alaniafitri,sudaah embun
Alaniafitri,tawa pop bagus pagi deh tawa
Alaniafitri,tidur pop malam
Alaniafitri,bbm tinggal bbm berkumpul iya tinggal berkumpul bbm takut ganggu sibuk hidup
Alaniafitri,oh iya taar
Alaniafitri,iya kenal
Alaniafitri,iya
Alaniafitri,oke deh undang grup psiko
Alaniafitri,kenal dian garis
Alaniafitri,iya mahasiswa lani jakarta
Alaniafitri,iya psiko undip
Alaniafitri,haai iya
Alaniafitri,iya tinggal kos garis grup psiko
Alaniafitri,iya angkat kook lani jakarta
Alaniafitri,haai mahasiswa psiko undip
Alaniafitri,panggil lani kook
Alaniafitri,fisika warna warna cerah murah hati optimis
Alaniafitri,tanggal digantungin tawa orientasi studi pengenalan kampus oh orientasi studi pengenalan kampus
Alaniafitri,saudara wanita sedih
