username,tweet
Indomilk,jelang libur mampir ayo stan indomilk kental manis belanja carrefour lebak bulus raksasa taman yasmin yogya patih
Indomilk,keren lintang semangat
Indomilk,terima kasih sukses iya acara
Indomilk,terima kasih ismail tunggu resep hadir galeri
Indomilk,semangat
Indomilk,penuh butuh nutrisi tubuh susu indomilk ayo simak nutrisi butuh tubuh aktif iya
Indomilk,temu stan kemas kejut periksa peristiwa
Indomilk,terima kasih mampir stan kontes resep kondang indomilk carrefour raksasa yogya bandung
Indomilk,selamat menang kipas seru ulas
Indomilk,april konfirmasi pesan facebook indomilk
Indomilk,hadiah libur bal foto tampil kemas indomilk kental manis juri chef gugup lho
Indomilk,hadiah menang minggu kirim foto keluarga resep andal indomilk kental manis
Indomilk,selamat aprillia uang nila rp kirim konfirmasi kontes
Indomilk,selamat aprilia arifiyanti dessy ii windi purwo menang minggu
Indomilk,hati foto cemil kemas susu indomilk kental manis iya
Indomilk,media sosial indomilk barang dagang tarik stan indomilk carrefour cempaka putih
Indomilk,adat kemas struk pmbelian admin kaleng renteng indomilk kental manis stan indomilk carrefour cempaka putih
Indomilk,dukung sedia indomilk uht kalsium tinggi rendah lemak bantu keluarga hidup sehat
Indomilk,terap hidup sehat ayo konsumsi protein olahraga istirahat atur jaga tubuh dehidrasi
Indomilk,stan indomilk minum indomilk pisang gratis lewatin mendapati barang dagang tarik
Indomilk,menang minifigure karakter selamat iya
Indomilk,menang minifigure karakter ulang sidang hadiah goodie tas isi produk barang dagang indomilk selamat iya
Indomilk,buka ayo mampir stan indomilk
Indomilk,beli indomilk pisang paket oke mendapati gymsack pisang tunggu stan indomilk
Indomilk,ayo balai kartini samperin stan indomilk gratis sampling indomilk pisang
Indomilk,habis waktu keluarga nikmat nutrisi susu segar indomilk pekan ayo rencana
Indomilk,ayo kirim foto keluarga resep andal indomilk kental manis tunggu maret
Indomilk,kreasi pai kontes udara dingin campur adon hasil renyah iya
Indomilk,windi terima kasih partisipasi tunggu hadir galeri
Indomilk,tyuu terima kasih partisipasi tunggu mampir galeri
Indomilk,terima kasih partisipasi tri kirim ayo malu
Indomilk,lupa kemas indomilk kental manis foto iya saudara teman resep andal
Indomilk,raih hadiah juta rupiah menang minggu menang utama libur kuliner bal ayo
Indomilk,unggah foto keluarga resep andal ayo kontes resep kondang indomilk
Indomilk,butuh susu anggota keluarga penuh susu indomilk iya saudara
Indomilk,sih cokelat lindung gigi mati bakteri rahang ayo minum susu indomilk cokelat saudara
Indomilk,tanggal februari lafitri
Indomilk,asiknya lintang tunggu resep mampir galeri
Indomilk,senang lafitri malu tunggu menu galeri
Indomilk,simak tips panggang kue resep pakai indomilk kental manis ayo kontes
Indomilk,ah suka malu kirim
Indomilk,asik iik kirim malu tunggu kirim
Indomilk,mantap murti malu kirim iya
Indomilk,terima kasih azis
Indomilk,april terima kasih partisipasi kirim
Indomilk,bahasa halus puji sih sedia susu cair indomilk energi sih terap ayo
Indomilk,indomilk tips motivasi sih tanggung simak iya ajak diskus ikan contoh
Indomilk,unggah ayo foto keluarga resep andal menang utama bal bareng
Indomilk,indomilk uht ml polos gaya hidup sehat teman beraktifitas penuh butuh kalsium tubuh
Indomilk,azis terima kasih tari bekerjasama indomilk email layan konsumen
Indomilk,teknologi nutrikeep indomilk jaga nutrisi susu ayo buka indomilk
Indomilk,tunggu resep andal unggah keluarga kondang menempel
Indomilk,menang utama tampil kemas indomilk kental manis libur kuliner bal senja lho
Indomilk,kontes resep keluarga kondang indomilk ayo unggah foto keluarga resep andal
Indomilk,kontes resep keluarga kondang indomilk kental manis sebentar resep andal kenal
Indomilk,selamat pagi mimpi indah
Indomilk,jalan kualitas susu indomilk jaga sistem emas ketat nutrisi
Indomilk,keluarga jaga tubuh sehat lho ayo tips indomilk
Indomilk,indomilk selamat tahun imlek raya semoga tahun tahun keluarga
Indomilk,momen sih momen cocok tani susu indomilk
Indomilk,buka youtube indomilk inspirasi kreasi resep indomilk lho bagikan ayo resep
Indomilk,gizi nasional ayo ikan gizi imbang keluarga minum susu indomilk
Indomilk,susu indomilk penuh nutrisi olah susu sapi segar kalsium protein vit saudara
Indomilk,maaf zico indomilk sedia
Indomilk,tolong kirim indomilk pisang rumah ruguunn saudara
Indomilk,paksa pindah gelas eunha saudara
Indomilk,nikmat saudara cemil saudara
Indomilk,kirim indomilk pisang rumah achan iya moodnya saudara
Indomilk,lupa cemil atur tumpuk aktifitas indomilk uht penuh gizi praktis nikmat nutrisi
Indomilk,bagikan ayo momen seru sehat keluarga olahraga santai minum susu indomilk uht
Indomilk,selamat pagi maaf nyaman tanggap pesan terima kasih
Indomilk,kandung vitamin protein indomilk pisang bantu temu pisang persis gambar
Indomilk,hubung via pesan
Indomilk,kirim usul layan konsumen iya saudara
Indomilk,manis tingkat suasana hati lho sehat minum indomilk kental manis kotak iya
Indomilk,cocok isi pecah bentuk segi sisi lupa isi minum susu cair indomilk
Indomilk,temu ayo susu indomilk tawar cokelat rendah lemak nikmat keluarga
Indomilk,yusuf anak suka indomilk uht ml stroberi kirim saran komentar hubung
Indomilk,resep andal keluarga sebentar kontes tarik indomilk lho
Indomilk,pekan seru giat positif utama indomilk tebak beda gambar
Indomilk,selamat pagi raisa selamat nikmat pekan
Indomilk,utama indomilk ayo ayo coba susun huruf huruf minum gelas susu segar indomilk
Indomilk,semoga senang
Indomilk,maulana kirim saran via layan konsumen kunjung iya saudara
Indomilk,bagikan ayo unik kunjung bawa bekal indomilk uht ml nutrisi energi
Indomilk,keren
Indomilk,yoga kirim layan konsumen iya
Indomilk,coba susun urut angka bentuk gambar indomilk kental manis tunggu iya
Indomilk,mantap
Indomilk,sst susu segar indomilk gambar tunggu
Indomilk,terima kasih setia indomilk saudara
Indomilk,terima kasih teman indomilk lantai
Indomilk,selamat nikmat cemil
Indomilk,tebak tebak ayo kalsium gizi cocok aktif penasaran
Indomilk,tri
Indomilk,buka momen keluarga indomilk kental manis seru nikmat hidang manis favorit keluarga
Indomilk,iya
Indomilk,selagi isi energi susu indomilk uht mudah bawa pasang alat alat olahraga ayo
Indomilk,puding manis sehat ayo buka momen keluarga pekan periksa resep lengkap
Indomilk,atur pola cemil bantu keluarga hidup sehat gila buka susu segar indomilk penuh nutrisi
Indomilk,tidur cepat lelah nafsu cemil atur nyenyak minum gelas susu indomilk tidur
Indomilk,pagi buka segar susu indomilk aktifitas seru tahun
Indomilk,sabel
Indomilk,layan konsumen iya saudara
Indomilk,sebentar indomilk kasih kejut aktif penasaran kejut indomilk
Indomilk,email layan konsumen
Indomilk,tulang manusia susun udara lho minum susu
Indomilk,lantai
Indomilk,kirim layan konsumen ndomilk dot com iya saudara
Indomilk,selamat tahun buka segar nutrisi susu indomilk bagikan seru tahun
Indomilk,raya tahun epik tahun nikmat susu indomilk pisang teman teman kah
Indomilk,tahun kejut susu uht indomilk penasaran
Indomilk,coba tebak kemas susu uht stroberi kemas periksa toko supermarket
Indomilk,tahun sih resolusi tahun indomilk ayo tulis
Indomilk,resep andal coba kreasi susu kental manis indomilk kejut manis susu kental manis indomilk
Indomilk,gelas susu segar indomilk kandung vitamin protein nutrisi sumber energi minum indomilk
Indomilk,hubung via pesan
Indomilk,ajar utama indomilk ayo ayo lengkap huruf hilang bentuk
Indomilk,selamat natal keluarga raya sedia pilih susu indomilk momen keluarga spesial
Indomilk,email layan konsumen
Indomilk,gizi imbang susu segar indomilk bahan cemil nutrisi lezat damping hidang
Indomilk,terima kasih keluarga fitri tani indomilk
Indomilk,terima kasih setia indomilk
Indomilk,terima kasih dukung indomilk syukur
Indomilk,suka susu uht indomilk suka sebentar kejut susu uht indomilk lho
Indomilk,susu indomilk uht ml hadir tampil lezat nutrisi
Indomilk,harap keluarga cinta
Indomilk,cinta alas indomilk usaha nutrisi kualitas
Indomilk,tubuh energi gesit konsentrasi coba sih pisang henti susu indomilk pisang
Indomilk,sih manfaat kandung susu cair indomilk gemar susu cair indomilk sejati
Indomilk,lupa bawa susu uht indomilk sumber energi nikmat gizi libur gambar barang wajib
Indomilk,kejut manis kreasi susu kental manis indomilk penasaran kejut
Indomilk,ayo ikan saran layan konsumen malu
Indomilk,kasih
Indomilk,fussion mouse ala indomilk ayo resep
Indomilk,beda raya pilih tipe
Indomilk,terimakasih iya tantang periksa ayo karya karya epik
Indomilk,layan konsumen iya
Indomilk,fungsi jaga sehat vitamin kuat sistem kebal tubuh
Indomilk,lindung nikmat nutrisi indomilk lindung
Indomilk,lupa bawa susu indomilk libur epik pisang lezat segar tinggalkan
Indomilk,periksa website indomilk informasi inspirasi penuh nutrisi gizi keluarga
Indomilk,panas lho olahraga energi olahraga minum susu segar indomilk ayo
Indomilk,asah otak indomilk ayo butuh susu cair indomilk isi wadah kosong ukur liter
Indomilk,epik combo video video tantang eka gustiwana
Indomilk,menang utama tantang zamroni firmansyah nurhamzah selamat iya dengung dji hantu
Indomilk,selamat nikmat indomilk pisang
Indomilk,rencana tahun jalan lancar simak ayo lupa minum indomilk semangat iya
Indomilk,mudah bawa tahan simpan nutrisi susu indomilk bekal
Indomilk,susu kental manis indomilk pilih vitamin lho suka
Indomilk,syukur tumbuh kembang sih lupa sedia indomilk dukung tumbuh sih saudara
Indomilk,resep
Indomilk,nikmat susu uht indomilk nutrisi vitamin bantu sih aktif gerak lho setuju
Indomilk,libur pantai gunung desa kota negeri bagikan
Indomilk,utama kelereng pakai hembus nafas ide serah epik ketrampilan serah ayo selai private message
Indomilk,waktu serah lho ayo serah video epik ketrampilan penuh ajaib
Indomilk,nyanyi seriosa mecahin kaca panggil saudara laki bakso jarak ratus meter epik pergi pilih
Indomilk,tantang lho serah ayo dengung dji hantu
Indomilk,syukur mutan pria sempit peluang menang buru serah epik video
Indomilk,periksa deh indonesia epik ketrampilan epik ketrampilan pamerin
Indomilk,desember raya brownies kukus es krim vanila ayo periksa resep
Indomilk,komunitas ketrampilan pindah suara epik kenal komunitas lho
Indomilk,selamat agung
Indomilk,fikri dunia ketrampilan epicmu malu
Indomilk,zamroni menang bi minggu menangin hadiah
Indomilk,menang bi minggu tantang ketrampilan epik serah
Indomilk,mantap epicnya
Indomilk,pisang jenis epik kategori lho epik
Indomilk,tiara cerita runtut via email layan konsumen tindak terima kasih
Indomilk,terampil ajar sedia susu segar indomilk sumber energi
Indomilk,utama drum pakai tangan bayang ketrampilan epik serah
Indomilk,serah video epik ketrampilan agung prize dengung dji hantu desember
Indomilk,terima kasih ayo kirim kirim malu
Indomilk,terima kasih setia indomilk
Indomilk,epik tim sapi
Indomilk,epik kece kirim
Indomilk,hebat
Indomilk,ayo kunjung stan indomilk menikmati indomilk pisang epik
