username,tweet
Indomilk,sumbang darah perhati cemil minum konsumsi
Indomilk,lupa sedia susu indomilk bekal aktivitas sehat
Indomilk,bangun tenda halaman rumah acara barbeque olahraga bareng pagi
Indomilk,aktivitas seru beda sahabat ayo camping ala indomilk
Indomilk,ayo temu indomaret saudara
Indomilk,mahir masak saudara
Indomilk,dhienda terima kasih rekomendasi iya
Indomilk,bagus temu minat
Indomilk,kumpul mahir ayo
Indomilk,ayo minum indomilk melon suka saudara
Indomilk,jurus kuliah epik sesuai minat hobi ajar wuoww dilema
Indomilk,kuliah pilih jurus ayo suka
Indomilk,perihal layan bebas pulsa terima kasih
Indomilk,unduh misi
Indomilk,selesai misi seru boboiboy galaksi nikmat uht kids boboiboy ayo
Indomilk,minat sih salah utama indomilk utama seru utama bareng sih
Indomilk,tanda teman ajak wuoow indomilk melon ayo
Indomilk,indomilk melon usir mellow epik wuoww sih disuka
Indomilk,sulit pindah nyala disuka pindah sekolah tenang susu indomilk melon
Indomilk,ayo pasang olahraga
Indomilk,susu indomilk lemak tinggi calcium bantu energi olahraga lho
Indomilk,selamat olahraga nasional tubuh cepat lelah butuh nutrisi tinggi
Indomilk,ajak sih baca tulis kemas indomilk minum susu atur bantu kembang otak lho
Indomilk,selamat aksara internasional tumbuh minat baca sih ringan ayo
Indomilk,kumpul mahir unduh misi seru
Indomilk,sih bosan tantang utama online ajak sih utama seru indomilk boboiboy
Indomilk,zahra mahir boboiboy
Indomilk,usaha wuoww isi energi epik indomilk melon
Indomilk,cari perhati tonjol prestasi foto pasang curi perhati
Indomilk,uring uring foto disuka mellow
Indomilk,selamat pagi maaf nyaman tindak via pesan terima kasih
Indomilk,minum indomilk melon ubah mellow wuoww
Indomilk,mellow kuat hati bawa tahan
Indomilk,utama minum indomilk seri mahir boboiboy seru
Indomilk,paket indomilk kids milkuat seri boboiboy galaksi nila rp
Indomilk,indomilk mahir boboiboy hadir loh cfd waterpark ayo ajak sih
Indomilk,sehat ganti santan hidang susu indomilk momen keluarga seru susu indomilk
Indomilk,selamat raya idul adha keluarga raya
Indomilk,semangat
Indomilk,isi energi tubuh susu indomilk melon kalimat epik melon wuow
Indomilk,indomilk melon istimewa milik kandung vitamin sih tubuh
Indomilk,indomilk susu uht epik
Indomilk,lupa semangat sih pergi sekolah bagikan semangat favorit sih
Indomilk,semangat bekal cemil nutrisi suka botol susu cair indomilk mudah bawa
Indomilk,suka khawatir sih aktif sekolah
Indomilk,lupa iya instagram seru
Indomilk,seru asean tahun anniversary indomilk stan
Indomilk,ayo bagikan kolom komentar foto seru sih dapur
Indomilk,hasil maksimal resep lezat indomilk susu segar
Indomilk,libur keluarga libur seru ajak sih kreasi resep rahasia keluarga ayo
Indomilk,semoga semangat ajar iya
Indomilk,andien iya pisang ledak batu melon melon pindah beda pisang beda komposisi
Indomilk,ayo ajak sih nikmat indomilk uht kids tantang utama boboiboy
Indomilk,manfaat ayo bagikan lupa minum susu indomilk
Indomilk,manfaat susu tulang gigi kuat lho rajin minum susu kulit cahaya
Indomilk,bukti prestasi pacar ayo minum susu indomilk melon isi semangat wuoww
Indomilk,sedih rapuh kejut
Indomilk,resep mudah bagikan ayo
Indomilk,bawa bekal mudah penuh nutrisi resep indomilk kental manis mudah
Indomilk,sibuk padat urus sih kantor cemil siang waktu lho
Indomilk,benci monday deh
Indomilk,besok senang ayo tips indomilk tiru
Indomilk,ayo kirim saran layan konsumen
Indomilk,ayo kirim usul layan konsumen
Indomilk,tubuh sehat
Indomilk,hilang lelah istirahat bantu metabolisme tubuh tingkat daya tahan tubuh
Indomilk,sibuk pagi sakit lupa hidup sehat salah istirahat
Indomilk,epik minum susu indomilk melon kandung vitamin wuoow
Indomilk,suka mellow foto dikit suka mellow asyik
Indomilk,bagikan foto merdeka iya
Indomilk,raya merdeka indonesia tahun kumpul keluarga minum susu indomilk
Indomilk,maaf nyaman tindak via pesan
Indomilk,indomilk epik lho coba
Indomilk,ayo coba susu batu melon indonesia indomilk batu melon hadir indomaret
Indomilk,tunggu ayo unduh gameboard
Indomilk,pramuka cilik ayo mandiri karya pramuka latih tim utama seru indomilk seri boboiboy
Indomilk,kandung potassiumnya kilometer energi semangat lho pilih ide epik ala indomilk melon suka deh
Indomilk,malas gerak mellow diam rumah minum susu indomilk melon bom
Indomilk,ayo bagikan sehat
Indomilk,generasi muda aktif semangat gaya hidup sehat
Indomilk,padu susu kalsium tinggi cinta melon wajib bagikan pasang
Indomilk,buah manfaat sehat tubuh nikmat mellow
Indomilk,utama boboiboy unduh arena
Indomilk,utama peka warna bentuk koordinasi tubuh tangan
Indomilk,utama jenis games papan latih kembang sih lho
Indomilk,tebak susu indomilk strawberry
Indomilk,hayo
Indomilk,selamat pagi wira indomilk perihal terima kasih
Indomilk,batal
Indomilk,ajak teman minum susu indomilk lemak tinggi calcium kalsium rendah lemak ayo
Indomilk,canda ngobrol teman semangat cegah gila
Indomilk,fokus sosial lho
Indomilk,istirahat olahraga temu susu indomilk uht ml strawberry gambar
Indomilk,strawberry kandung nitrat lancar alir oksigen tubuh
Indomilk,konsumsi strawberry olahraga bantu daya tahan tubuh bakar kalori cepat lho
Indomilk,selamat menang cosplay indomilk
Indomilk,pilih cosplay ter epik ayo suka
Indomilk,gymsack indomilk modal teriak wuow mudah
Indomilk,gaya ter wuoww voucer maaf periksa stan indomilk
Indomilk,temu melon pria ajak wefie bumerang
Indomilk,rangkai acara epik wajib tani indomilk melon gratis
Indomilk,stan indomilk temu kejut epik aula jcc
Indomilk,ayo beli susu indomilk gambar boboiboy sih imajinasi baca informasi lengkap
Indomilk,mahir kumpul sih
Indomilk,lupa besok kejut kejut epik ayo susul aula jcc
Indomilk,epik an stan mellow wuoww
Indomilk,ayo stan indomilk tantang epik hadiah jamin wuoww
Indomilk,iya
Indomilk,bagus untung
Indomilk,bagus untung
Indomilk,hadiah jamin epik
Indomilk,libur mellow rumah ajak bff mampir stan indomilk besok
Indomilk,pakai napas kenal siang senja profesi
Indomilk,profesi epik idam butuh keras semangat pantang serah profesi epik tebak an
Indomilk,eits mellow wuoww minum indomilk melon
Indomilk,sayang sayang eh ditinggalin hati rapuh mellow
Indomilk,eits mellow wuoww minum indomilk melon
Indomilk,eits mellow woouw minum indomilk melon
Indomilk,wira tanggal kedaluarsanya data upa email telepon
Indomilk,selamat pagi wira maaf nyaman konsumsi produk bel
Indomilk,ayo cosplay kompetisi mendapati hadiah tarik informasi periksa
Indomilk,tanda nama sahabat kolom komentar susu indomilk cocok
Indomilk,rencana sahabat sahabat dunia giat bawa indomilk tani sahabat
Indomilk,bagikan alam sih utama gameboard kolom komentar
Indomilk,unduh gameboard ikan hadiah manis sih hasil selesai permainanannya
Indomilk,utama seru indomilk kids boboiboy sih superhero kemas indomilk kids
Indomilk,cari
Indomilk,saji nikmat libur keluarga rumah
Indomilk,kreasi resep susu indomilk uht singkong thailand es krim
Indomilk,penasaran epik bff sapi pantau instagram epik jalan iya
Indomilk,tanda sahabat peran model musik
Indomilk,dukung aktivitas sahabat inspirasi konsumsi gelas susu indomilk
Indomilk,epik bff senang mahir utama musik hibur kumpul
Indomilk,lupa minum susu indomilk ml cokelat segar tubuh olahraga
Indomilk,utama bulutangkis teman ayo tubuh bugar latih pikir lho
Indomilk,cari sembunyi ketemu hadiah susu cair indomilk
Indomilk,pekan produktif sih utama indomilk ayo temu instrumen musik sembunyi gambar
Indomilk,nikmat susu cair indomilk senang
Indomilk,raya anak nasional asah kreativitas rajin tangan ayo
Indomilk,iya
Indomilk,terima kasih tari bekerjasama kirim usul layan konsumen
Indomilk,bagikan kolom komentar sih lengkap karakter
Indomilk,pilih mahir beli indomilk kids label boboiboy
Indomilk,selagi libur ajak sih utama indomilk kids boboiboy unduh gameboardnya
Indomilk,maaf sosial media indomilk perihal informasi produk peristiwa terima kasih
Indomilk,lupa minum susu indomilk tanda teman ajak ajar bareng
Indomilk,tahun ajar nilai epik tips
Indomilk,ajak teman teman utama ayo coba rumah
Indomilk,unduh gameboard
Indomilk,motivasi sih semangat ajar utama jenak boboiboy indomilk kids
Indomilk,mantap jeli saudara
Indomilk,keren jeli saudara
Indomilk,ayo bagikan
Indomilk,beda waktu minum udara beda manfaat tubuh keluarga tipe minum susu segar indomilk
Indomilk,waktu tes jeli cari gelas susu sembunyi gambar
Indomilk,sst indomilk susu uht epik lho vitamin sih kebal tubuh sehat
Indomilk,penasaran tonton video tutorial utama seru
Indomilk,bantu sih superhero ayo salah utama indomilk kids boboiboy teman
Indomilk,coba
Indomilk,susu indomilk lemak tinggi calcium kandung rendah lemak konsumsi
Indomilk,konsumsi lemak ganggu sehat jantung indomilk inovasi sehat
Indomilk,umum temu warna hijau sila kolom komentar iya
Indomilk,tebak tebak ayo epik indomilk buah kandung vit sih tinggi
Indomilk,sibuk temu beda beda jaga sehat tips ayo tips
Indomilk,kalah epik indomilk lho penasaran kunci
Indomilk,selagi tahun ajar cari hobi suka ayo ekskul coba hobi unik semangat
Indomilk,tinggal susun sesuai iya gila pagi
Indomilk,cemil mudah contoh sandwich tuna bahan roti tawar lembar keju kir gram tuna margarin
Indomilk,aktivitas padat ganggu jadwal cemil teman penuh nutrisi vitamin tubuh susu indomilk uht ml cokelat
Indomilk,semoga mimpi epik lupa doa
Indomilk,terima kasih dukung indomilk
Indomilk,lupa minum susu indomilk tani seru utama
Indomilk,toko partisipasi ayo ajak utama keluarga teman teman sih
Indomilk,kumpul mahir boboiboy galaksi temu kemas indomilk uht kids arena seru
Indomilk,ajak sih aktif tualang boboiboy lawan asing kumpul kuat super galaksi
Indomilk,prj andien
Indomilk,inspirasi gila besok resep lengkap
Indomilk,senin pilih gila sehat keluarga ayo saji crecker krim susu kreasi kental manis indomilk
Indomilk,seru lupa beli indomilk kids
Indomilk,sih bosan utama indomilk kejut seru boboiboy penasaran
Indomilk,selamat senja maaf nyaman mngonsumsi produk tindak via pesan terima kasih
Indomilk,keluarga suka indomilk kental manis ikan komentar ayo
Indomilk,selamat keluarga nasional habis seru nikmat minum favorit anggota keluarga
Indomilk,bagikan cerita lebaran indomilk
Indomilk,tubuh sehat pikir segar hubung akrab beraktifitas deh
Indomilk,nutrisi sumber energi keluarga susu segar indomilk
Indomilk,momen habis keluarga suasana hati dorong lho
Indomilk,menu
Indomilk,jaga sehat tubuh olahraga minum susu indomilk lemak tinggi calcium
Indomilk,lebaran nikmat cemil lezat takut gemuk pilih cemil nutrisi imbang
Indomilk,suasana kumpul raya hangat riah hidang saji indomilk kental manis manis momen keluarga menempel
Indomilk,selamat raya idul fitri keluarga raya
Indomilk,inspirasi resep periksa ayo
Indomilk,susu indomilk uht kandung kalsium nutrisi lho
Indomilk,jelang lebaran menu menu santan ganti sehat
Indomilk,macet transportasi umum bawa indomilk uht ml penuh krim energi cadang jalan
Indomilk,selamat ulang tahun jakarta peduli kota negara indonesia cinta
Indomilk,ayo bagikan cerita ramadan lengkap kalimat tunggu cerita
Indomilk,sebentar ramadan indomilk
Indomilk,minum indomilk lemak tinggi calcium sahur bantu isi energi
Indomilk,sedia waktu jalan kaki dar stretching tubuh nutrisi
Indomilk,puasa malas malas segar puasa
Indomilk,ibadah lancar tubuh sehat
Indomilk,kalsium susu rendah lemak khawatir berat badan utama puasa cemil tengah senja
Indomilk,salah manfaat kalsium jaga berat tubuh imbang lho susu indomilk lemak tinggi calcium
Indomilk,lupa isi tenaga energi susu indomilk uht ml penuh krim buka
Indomilk,sepeda puasa menit waktu buka
Indomilk,sepeda cegah kanker usia lho
Indomilk,salur bentuk donasi buku teman semoga
Indomilk,terima kasih pilih indomilk resep pilih takjil panti asuh bamadita
Indomilk,mari saksi facebook instagram cerita yayasan yatim piatu bamadita rangkai acara resep pilih
Indomilk,iya
Indomilk,memakai over ruang baca jendela bahagia henti
Indomilk,terima kasih pilih resep momen manis buka takjil favorit
Indomilk,senang senyum penuh bahagia rangkai acara
Indomilk,terima kasih arya sedia malu
Indomilk,terima kasih arya dukung indomilk
Indomilk,nikmat lezat keluarga lebaran tunggu cerita
Indomilk,kue kering susu indomilk uht salah bahan adon
Indomilk,kirim usul layan konsumen iya
Indomilk,facebook gemar halaman indomilk pilih foto album
Indomilk,takjil memakai over ruang baca tunggu pilih pilih iya
Indomilk,anak panti asuh ayo pilih resep favorit resep terbyk menu takjil panti asuh
Indomilk,otak kanan otak kiri nutrisi epik
Indomilk,utama ajar lupa minum susu indomilk pisang ramadan
Indomilk,latih otak kanan kiri padu epik temu utama lego
Indomilk,kue favorit susu indomilk uht temu susu sembunyi gambar ayo
Indomilk,tengah puasa sih semangat ajak sih bantu takjil
Indomilk,foto
Indomilk,susu desain ubah periksa informasi terima kasih
Indomilk,momen manis
Indomilk,panti asuh al mubarokah pasar jumat raya takjil resep pilih
Indomilk,terima kasih pilih resep favorit
Indomilk,halus susu indomilk gls blueberry gls blackberry gls anggur merah pisang sdm ekstrak vanila
Indomilk,smoothies buah susu segar indomilk pilih mudah
Indomilk,sahur menu jaga tubuh segar sehat lho usaha sedia buah buah susu penuh nutrisi
Indomilk,periksa resep lengkap
Indomilk,nikmat protein vitamin susu bantu nutrisi hilang puasa
Indomilk,cari menu buka puasa keluarga klapertaart durian es teler susu indomilk uht ayo
Indomilk,periode resep takjil buka puasa anak panti asuh tanggal juni pilih
Indomilk,facebook gemar halaman indomilk pilih resep suka foto takjil album
Indomilk,pilih resep suka indomilk ramadan
Indomilk,minum susu
Indomilk,pekan susu nusantara indomilk usaha susu masyarakat indonesia
Indomilk,kuat bangsa sikap harga kuat tulang tubuh susu indomilk
Indomilk,anak panti asuh ramadan
Indomilk,mari anak anak panti asuh
Indomilk,dian maaf nyaman konsumsi produk kirim data via pesan upa email telepon terima kasih
Indomilk,pilih resep album resep suka
Indomilk,puasa besok lupa penuh bekal energi susu indomilk sahur
Indomilk,rencana buka puasa pasu reservasi restoran incar teman teman
Indomilk,resep suka indomilk ramadan
Indomilk,salah resep pilih buka keluarga
Indomilk,mudris indomilk
Indomilk,mari anak panti asuh
Indomilk,mudris data upa nama telepon email alamat lengkap
Indomilk,lengkap gila gelas susu segar indomilk momen gila pagi keluarga seru deh
Indomilk,indomilk tips inpirasi gila lucu sih sandwich bentuk lucu hias potong buah
Indomilk,bagikan cemilan sehat pilih
Indomilk,kacang almond potong buah susu indomilk lemak tinggi calcium kalsium rendah lemak
Indomilk,ngemil salah tubuh sehat berat pilih cemilan sehat ayo
Indomilk,selamat pagi mudris maaf nyaman konsumsi produk tindak via pesan terima kasih
Indomilk,kontribusi ramadhan butuh momen manis
Indomilk,ramadhan momen manis indomilk
Indomilk,hasil bagikan screenshot kolom komentar
Indomilk,santa keluarga pekan utama indomilk ayo temu susu indomilk uht
Indomilk,terima kasih indomilk susu favorit
Indomilk,tips jaga tubuh sehat bagikan ayo
Indomilk,tubuh sehat kulit cahaya susah penuh asupan gizi tubuh jaga pola cemil sehat
Indomilk,terima kasih nisa dukung indomilk saudara
Indomilk,bagikan iya energi penuh sedia susu indomilk lemak tinggi calcium
Indomilk,acara olahraga bareng seru ayo anggota keluarga olahraga pilih roda
Indomilk,rencana bareng keluarga libur
Indomilk,nutrisi jaga tubuh sehat aktifitasmu ganggu
Indomilk,susu indomilk uht ml penuh krim bekal energi
Indomilk,bagikan ayo sih tas gudang aktifitas
Indomilk,lupa indomilk uht kemas teknologi nutrikeep nutrisi tahan
Indomilk,motivasi puasa ajak sih menu buka puasa
Indomilk,sih puasa ramadan indomilk motivasi sih puasa
Indomilk,indomilk ramadhan
Indomilk,resep favorit anak anak panti asuh
Indomilk,gila sehat mudah nikmat campur indomilk kental manis potong buah gandum coba ayo
Indomilk,porsi cemil mngandung karbohidrat protein serat buah sayur gila cemil siang cemil senja
Indomilk,setuju hidup sehat konsumsi cemil
Indomilk,mona terima kasih saran ayo kirim saran layan konsumen indomilk setuju
Indomilk,pilih susu indomilk lemak tinggi calcium kalsium protein rendah lemak tubuh sehat khawatir lemak
Indomilk,olahraga imbang asupan kalsium tinggi dukung sehat tulang
Indomilk,suka sepeda olahraga gym
Indomilk,susu indomilk ml mudah bawa sih semangat tanding
Indomilk,tanding sekolah bekal cemil siang favorit sih
Indomilk,lengkap olahraga minum indomilk lemak tinggi calcium
Indomilk,daya tahan tubuh kuat lupa lengkap minum susu indomilk lemak tinggi calcium
Indomilk,ayo luang waktu menit olahraga bakar lemak tubuh bugar
Indomilk,semoga epik
Indomilk,terima kasih suka indomilk pisang
Indomilk,batal
Indomilk,pilih aktifitas epik suka lupa susu indomilk pisang ml nutrisi epik tubuh
Indomilk,pilih utama modern tradisional ayo karakter epik pilih salah
Indomilk,periksa minimarket supermarket
Indomilk,terima kasih reva semoga epik saudara
Indomilk,ayo acara haiday tanggal april parkir timur senayan buktikan epik
Indomilk,berani tantang epik indomilk hadiah oppo si voucher total rp juta lho
Indomilk,beda ayo bagikan
Indomilk,susu sapi olah inovasi indomilk kalsium susu mudah serap tulang sehat tubuh
Indomilk,kalsium susu milik efek metabolisme tinggi banding kalsium karbonat kalsium fosfat
Indomilk,beda susu indomilk lemak tinggi calcium rendah lemak kandung kalsium susu tinggi lho
Indomilk,selamat senja chacha maaf nyaman via pesan
Indomilk,hayo bangun selai saudara
Indomilk,nikmat hangat matahari pagi prbaiki suasana hati mnikmati indomilk uht ml penuh krim
Indomilk,bangun pagi ayo matahari pagi rangsang bentuk vitamin saudara tubuh lho
Indomilk,kandung vitamin kombinasi epik pisang susu semangat percaya coba
Indomilk,stretching menit minum indomilk pisang bayang seru malas gerak
Indomilk,suka malas gerak alias malas gerak sekolah rumah epik aktif
Indomilk,mecin
Indomilk,tubuh sehat aktif aktifitas seru
Indomilk,ganti buah buah susu indomilk uht ml penuh krim nutrisi vitamin
Indomilk,lambat gaya hidup sehat utama suka ngemil ngemilin mecin cemil penuh gula
Indomilk,indomilk tips epik bangun pagi segar ayo coba pergi pagi
Indomilk,serah semangat raih impi selamat kartini
Indomilk,kalsium rendah lemak
Indomilk,kandung kalsium tinggi tara gelas penuh brokoli lupa minum susu indomilk lemak tinggi calcium
Indomilk,suka cemil sayur penuh butuh kalsium tubuh minum gelas susu indomilk lho
Indomilk,bagikan pasang cocok susu indomilk
Indomilk,nutrisi lengkap lengkap asupan cemil susu indomilk uht ml penuh krim protein vitamin kalsium
Indomilk,selamat siang maaf nyaman dinfokan pesan twitter facebook indomilk
Indomilk,fosfor kandung susu peran kembang otak lho games ayo gambar persis
Indomilk,jaga gigi minum indomilk lemak tinggi calcium
Indomilk,kandung protein susu tingkat asam rahang cegah bentuk plak risiko gigi lubang
Indomilk,indomilk usaha ikan
Indomilk,ulangan harap sabar tunggu iya
Indomilk,terima kasih dukung indomilk saudara laki kalya
Indomilk,gila sehat mngndung protein vitamin mudah cerna gandum indomilk lemak tinggi cal
Indomilk,gila sehat suasana hati semangat jalan
Indomilk,layan konsumen iya
Indomilk,libur selamat istirahat kumpul keluarga bagikan ayo rencana
Indomilk,selamat jalan ibadah jumat agung puasa lupa gizi susu indomilk
Indomilk,minum susu sehat tubuh kembang tulang tulang manusia dewasa
Indomilk,terima kasih konfirmasi veni
Indomilk,veni hadiah transfer sctv alami lambat proses harap tunggu iya
Indomilk,cegah minum susu indomilk lemak tinggi cal vitamin saudara kalsium susu tulang sehat
Indomilk,kilometer derita kanker indonesia derita kanker tulang gejala badan nyeri
Indomilk,senang borong saudara
Indomilk,kulkas lindung sinar matahari
Indomilk,hobi sih hobi epik milik coba cerita susu indomilk pisang
Indomilk,hangat susu indomilk uht penuh krim sendok saudara wanita kunyit jahe madu hidang daya tahan tubuh
Indomilk,simpan kulkas hindar sinar matahari iya
Indomilk,batal
Indomilk,selamat sehat dunia sehat olahraga minum indomilk iya
Indomilk,promosi carrefour indomaret alfamart susu indomilk sila periksa iya
Indomilk,putar indomilk
Indomilk,minum indomilk lemak cal tubuh sehat khawatir lemak
Indomilk,tips ajar epik istirahat pikir menit minum susu indomilk pisang vitamin saudara
Indomilk,wisam terima kasih tari bekerjasama indomilk kirim usul layan konsumen
Indomilk,terima kasih verdy epik iya saudara
Indomilk,regang alir darah lancar lupa minum indomilk uht ml penuh krim
Indomilk,senang
Indomilk,menang utama kontes tampil kemas indomilk kental manis libur kuliner bal
Indomilk,minum indomilk
Indomilk,terima kasih verdyanza
Indomilk,verdyanza indomilk pisang ledak produksi sila temu minimarket supermarket kota iya saudara
Indomilk,pilih sayang indomilk saudara
Indomilk,terima kasih setia indomilk saudara
Indomilk,bagikan menu hidang masak keluarga cemil cepat saji iya risiko gemuk
Indomilk,suka indomilk indomilk cinta lantai
Indomilk,indomilk uht ml penuh butuh vit lho oiya temu beda gambar
Indomilk,keren terima kasih suka indomilk lantai
Indomilk,semoga cepat selesai veni
Indomilk,tipsnya cemil gizi imbang olah badan lupa minum susu indomilk lantai
Indomilk,throwback lantai
Indomilk,utama ayo coba henti gambar indomilk kental manis
Indomilk,salma temannya bella
Indomilk,senantiasa syukur aduh olahraga minum susu indomilk tips tipsnya
Indomilk,veni data selenggara
Indomilk,selamat raya nyepi raya semoga tenang damai
Indomilk,aduh imbang olahraga iya selamat pagi
Indomilk,bella terima kasih saran indomilk kirim saran layan konsumen
Indomilk,tips indomilk sehat bawa susu indomilk uht ml penuh krim iya
Indomilk,terima kasih antusias kontes umum menang utama april bagus untung
Indomilk,inspirasi kreasi resep indomilk kental manis ayo resep coba
Indomilk,momen olahraga keluarga tani indomilk
Indomilk,selamat jalan
Indomilk,indomilk hadir krl lho promosi beli bonus rp ribu beli paket harga rp ribu untung seri tarik
Indomilk,aeon bsd kota ayo jalan jalan beli indomilk iya promosi tanggal maret
Indomilk,susu indomilk uht tinggi kalsium fosfor protein vitamin saudara tubuh bebas garam
Indomilk,promosi indomilk beli bonus rp beli paket harga rp untung seri tarik
Indomilk,indomilk hadir stasiun krl bantu penuh butuh kalori nutrisi sehat pergi pulang aktivitas
Indomilk,tidur tingkat risiko ganggu sehat lho tidur nyenyak minum susu indomilk ayo
Indomilk,selamat iya menang minggu ayo menang patah semangat
Indomilk,verdian terima kasih tari bekerjasama indomilk email layan konsumen
Indomilk,besok tukar kaleng renceng indomilk kental manis media sosial indomilk kejut tarik
Indomilk,buku resep barang dagang adat kemas indomilk kental manis
Indomilk,ayo raksasa cbd bintaro griya yogya sumedang carrefour cempaka putih buar
Indomilk,tinggal demo chef stan lumayan ilmu resep
Indomilk,lupa media sosial indomilk mendapati barang dagang unik buku resep tarik iya
Indomilk,senin lho tinggal kemas indomilk unik ganti pakai foto
Indomilk,seru stan hadir griya yogya sumedang raksasa cbd bintaro carrefour buar cempaka putih
Indomilk,olah badan lho bawa indomilk uht ml penuh krim penuh butuh kalsium tubuh kuat
Indomilk,coba bagikan bahan cemil suka pasang indomilk kental manis
Indomilk,rima hobi saudara
Indomilk,olahraga keluarga lupa sedia indomilk uht iya
Indomilk,umum minggu selamat iya kontes maret ayo
Indomilk,bawa pulang barang dagang unik kemas indomilk kental manis dicustom pakai foto
Indomilk,ayo rapat raksasa margo kota transmart carrefour ambasador itc cempaka saudara laki griya yogya majalaya
Indomilk,minggu stan chef ragu andal masak kemarin
Indomilk,lho anak ayo periksa galeri
Indomilk,kombinasi cemil indomilk uht ml penuh krim kandung kalori tubuh
Indomilk,aktif tubuh kalori kalori lho indomilk imbang
Indomilk,tunggu ayo rapat stan
Indomilk,adat kemas indomilkmu lupa media sosial buku resep barang dagang tarik
Indomilk,stan raksasa margo kota transmart carrefour duta itc cempaka saudara laki griya yogya majalaya ayo
Indomilk,media sosial barang dagang unik buku resep tunggu hadir
Indomilk,foto menempel kemas indomilk lho tukar kaleng renceng indomilk kental manis
Indomilk,ayo stan raksasa margo kota carrefour duta carrefour cempaka saudara laki yogya griya majalaya
Indomilk,uht pilih bantu jaga sehat tubuh lho ayo buka
Indomilk,susu sapi segar kualitas kemas teknologi nutrikeep jaga nutrisi
Indomilk,resep andal keluarga ayo kontes hadiah utama maret
Indomilk,keluarga kondang lho ayo kunjung maret
Indomilk,umum minggu ayo kontes maret lho
Indomilk,ulfah hubung arah
Indomilk,bawa pulang buku resep barang dagang foto menempel kemas indomilk stan
Indomilk,demo masak chef ayo yogya buah batu raksasa botani kotak carrefour taman mini puri indah tawar tarik
Indomilk,buku resep media sosial indomilk iya ayo kesini
Indomilk,adat kemas indomilk kental manis barang dagang tukar struk beli kaleng renceng indomilk kental manis
Indomilk,libur kemana seru raksasa botani kotak agung yogya buah batu carrefour tamini kotak puri indah
Indomilk,simak tips olahraga fit ayo lupa minum susu indomilk uht ml penuh butuh kalsium
Indomilk,tonton seru bareng keluarga ayo film cocok tonton sih lho sedia indomilk uht kids
Indomilk,menang hadiah minggu libur spesial bal senja buka
Indomilk,umum menang minggu ayo periksa patah semangat kontes brlangsung maret
Indomilk,media sosial indomilk stan buku resep coba rumah
Indomilk,kemas indomilk dicustom barang dagang tarik tukar struk beli indomilk kental manis
Indomilk,seru stan yogya buah batu carrefour makan teman haryono pusat taman
Indomilk,terima kasih stan jadwal peristiwa ayo besok ajak tetangga iya malu
Indomilk,stan feb carrefour lebak bulus raksasa taman yasmin yogya patih ayo ajak keluarga
Indomilk,demo chef carrefour lebak bulus tawar tarik tukar struk beli media sosial indomilk samperin ayo
Indomilk,ajar jatim berhasil harum ruang limbah sapi lho bagikan inovasi ayo minum indomilk
Indomilk,terima kasih stan yogya patih raksasa taman yasmin carrefour lebak bulus
Indomilk,buku resep bukti media sosial indomilk tunggu hadir
Indomilk,kemas indomilk dicustom barang dagang tukar struk beli indomilk kental manis kaleng renceng
