username,tweet
Indomilk,utama twitter instagram ayo mekanisme iya
Indomilk,twitter instagram mekanisme iya
Indomilk,tanda tiktok video ekspresi senang nikmat indomilk unggah video tiktok tulis username instagram terang video tiktoknya iya hashtag
Indomilk,kemarin giveaway indomilk pisang tenang admin kasih kabar indomilk mengadakan giveaway kotak indomilk pisang unggah video tiktok utas iya
Indomilk,pikir seru tunggu iya
Indomilk,paket nugget tenang indomilk pisang minimarket
Indomilk,akun instagram indomilk kunjung unggah an tata ayo tantang
Indomilk,indomilk pisang cavendish indomilk java criollo tenang hadiah voucher total juta rupiah
Indomilk,aduh admin terima kasih iya
Indomilk,periksa
Indomilk,coba ayo penasaran saudara
Indomilk,senang libur coba tenang kejut instagram lho lagu iya
Indomilk,ramai coba indomaret borong indomilk pisang cavendish indomilk java criollo promosi klik
Indomilk,lupa minum dibarengin indomilk pisang terimakasih iya
Indomilk,eksperimen hasil saudara laki pais senang deh
Indomilk,jatuh hati periksa promosi indomilk pisang indomilk java criollo
Indomilk,koh jatuh hati terimakasih lho coba
Indomilk,sikat klik link saudara
Indomilk,ayo sikat klik mendapati promonya
Indomilk,sedih
Indomilk,ayo ayo
Indomilk,coba deh indomilk pisang minum bareng indomilk java criollo kekninian
Indomilk,mantap suka semangat
Indomilk,ehem
Indomilk,terima kasih reviewnya saudara
Indomilk,baca terima kasih admin colek tim kait
Indomilk,malas gerak tenang tinggal checkout klik
Indomilk,bagus coba indomilk java criollonya iya
Indomilk,lho salah server indomilk pisang indomilk java criollo
Indomilk,kilometer indomilk java criollonya
Indomilk,bagus beli indomilk java criollonya
Indomilk,mampir
Indomilk,periksa bom
Indomilk,coba beli indomilk pisang cavendish indomilk java criollo kutip balas pakai foto
Indomilk,coba klik ayo beli indomilk pisang indomilk java criollo lho
Indomilk,nanyain
Indomilk,ayo rindu klik indomilk pisang indomilk java criollo rindu
Indomilk,sih admin
Indomilk,hati hati saudara
Indomilk,cus klikindomaret
Indomilk,oke balas saudara lupa chekcoutnyah
Indomilk,dus
Indomilk,colek admin
Indomilk,rindu
Indomilk,wuadoh admin kemari bawa kabar sila klik indomilk pisang indomilk java criollo lho
Indomilk,kemarin rindu indomilk pisang
Indomilk,heyhoo rindu admin tenang admin kabar alias promosi seru indomilk pisang cavendish indomilk java criollo cus link
Indomilk,senang ulang tahun jeon jungkook
Indomilk,ayo borong tantang instagram indomilk
Indomilk,jungkook bias sayang coba indomilk pisang lho lezat diraguin deh lezat indomilk pisang minum indomilk pisang
Indomilk,oh acara coba indomilk pisang lho
Indomilk,haloo tonton acara
Indomilk,coba foto indomilk pisang
Indomilk,ayo beli produk indomilk diskon buka aplikasi website blibli produk indomilk diskon ekstra cashback gratis ongkos kirim tanggal agustus
Indomilk,eh eh omong omong admin besok sih
Indomilk,sih saudara indomilk pisang pisang strawberrynya iya
Indomilk,oke mari catat coba beli indomilk pisang
Indomilk,keranjang tokopedia checkout
Indomilk,admin ken beli indomilk pisang admin
Indomilk,admin
Indomilk,minum indomilk pisang tangan
Indomilk,pikir sih sebentar admin kasih
Indomilk,wuiih
Indomilk,admin degdegser
Indomilk,siang minum indomilk pisang
Indomilk,wi ramai ramai
Indomilk,rangka ulang tahun tahun blibli hepi upa promosi diskon produk indomilk indomilk resmi toko blibli ekstra cashback gratis ongkos kirim puas periode juli agustus
Indomilk,senang kantor dibawain susu gila teman minum siang merhatiin semangat aktivitas admin dibegitukan
Indomilk,fay terima kasih tari bekerjasama indomilk iya tunggu
Indomilk,suka kode kode
Indomilk,beli supermarket minimarket
Indomilk,coba indomilk deh nutrisi kenyang lho
Indomilk,terima kasih suka admin
Indomilk,keren indomilk melon iya semoga senang
Indomilk,terima kasih
Indomilk,iya jalan aktivitas saudara
Indomilk,mantap goers minum jamin aktivitas
Indomilk,mantap goers semoga aktivitas iya
Indomilk,mantap goers jalan iya
Indomilk,mantap goers coba advocado
Indomilk,mantap goers
Indomilk,mantap goers semangat atlet alir tubuh jadisemangat
Indomilk,goers terima kasih iya
Indomilk,kait aju surat layan konsumen iya terima kasih
Indomilk,email aktif sila kirim usul iya
Indomilk,ayo tiket february loh informasi periksa akun instagram buru
Indomilk,mudah lho unggah pakai minum tonton konser mudah
Indomilk,utas twitter tolong milik sihir tiket tonton internasional bni java jazz festival gratis iya ayo bantu
Indomilk,terima kasih
Indomilk,sila email usul layan konsumen terima kasih
Indomilk,minum fresh indomilk fresh susu via
Indomilk,fresh indomilk fresh susu via
Indomilk,pilih fresh indomilk fresh susu via
Indomilk,misi
Indomilk,lingkar cahaya tinggal iya indomilk varian susu mangga lho ayo cari supermarket
Indomilk,indomilk sumpah pemuda via
Indomilk,selamat pagi maaf ketidaknyamanan kirim nomor telepon pesan hubung tim kait terima kasih
Indomilk,sila email layan konsumen
Indomilk,periksa pesan iya tunggu responnya terima kasih
Indomilk,online produk supermarket minimarket
Indomilk,semangat asi games keluarga nutrisi indomilk
Indomilk,tubuh kondisi menangin indomilk kemas praktis teman gaya hidup sehat
Indomilk,hitung setuju asi games sempurna bugar tubuh habis olahraga susu segar indomilk olah teknologi jamin manfaat nikmat segar susu sapi
Indomilk,terima kasih tari indomilk aju kerjasama sila kirim usul email layan konsumen
Indomilk,jelang asi games sebentar mesti semangat aktif kendur iya imbang gaya hidup aktif indomilk bagus pergi minum multi real indonesia kenyang energi
Indomilk,semangat setuju asi games utama indomilk senang ar bareng dom bhin bhin atung saudara ayo ajak teman utama aduh poin tinggi juara
Indomilk,indomilk senang ar asi games via
Indomilk,indomilk senang ar asi games via
Indomilk,indomilk senang ar asi games via
Indomilk,astri tolong pesan nama alamat nomor telepon bantu kece kait
Indomilk,duet susu mangga yummy segar sih
Indomilk,informasi sila hubung nomor layan konsumen
Indomilk,tunggu iya saudara
Indomilk,lini informasi detilnya pesan nama alamat telepon informasi produk konsumsi
Indomilk,mahar indomilk milik produk susu bakar sedia ukur gram
Indomilk,amin goodluck iya
Indomilk,impi umrah keluarga ayo wujud kontes buka unggah foto sih hasil kreasi resep tajil menang voucher belanja nila rp minggu tunggu juni
Indomilk,resep tajil mantap indomilk kental manis ayo buka tahap utama umrah keluarga unggah resep foto iya kontes buka juni
Indomilk,semoga untung iya
Indomilk,terima kasih informasi semoga produk manfaat konsumen setia indomilk
Indomilk,selamat sakit tolong bantu pesan informasi nama alamat telepon lokasi beli tanggal beli susu indomilk tim kait
Indomilk,cari inspirasi kontes coba periksa resep kreasi resep tajil selamat cari inspirasi lupa kontes
Indomilk,bagus untung
Indomilk,terima kasih
Indomilk,bagus untung
Indomilk,lingkar cahaya informasi nama alamat nomor telepon pesan bantu periksa lokasi toko sedia produk skm
Indomilk,harap sih tumbuh sehat maksimal sih gerak tulang maksimal utama dukung kalsium ikan susu indomilk uht kids penuh krim bekal nutrisi utama
Indomilk,ajak sih kreasi tajil indomilk ayo unggah foto sih hasil resep kreasi tajil hadiah utama umrah keluarga voucher belanja menang minggu
Indomilk,aju sponsor kirim usul layan konsumen
Indomilk,indomilk tajil sih via
Indomilk,selamat kartini perempuan hebat serah juang impi bagikan ayo mimpi juang
Indomilk,selamat paskah semoga istimewa damai bahagia kumpul keluarga
Indomilk,video daftar putar dukung gemilang anak indonesia
Indomilk,video daftar putar nur hormat renang cilik
Indomilk,video daftar putar pasha senam cilik
Indomilk,video daftar putar video yasmin
Indomilk,video daftar putar mitos gila
Indomilk,video daftar putar nyimas skater cilik
Indomilk,video daftar putar selamat
Indomilk,video daftar putar video zulfiati
Indomilk,video daftar putar video yen mukti
Indomilk,video daftar putar video sisty
Indomilk,video daftar putar video yuliana
Indomilk,pantang serah cari solusi kreatif ahli alias ketrampilan lho ayo latih gemilang solusi gambar
Indomilk,selamat tahun imlek keluarga raya raya momen keluarga cerita gemilang penuh inspirasi
Indomilk,landa bingung pilih asupan kalsium dilema kuat minum indomilk
Indomilk,dads maaf nyaman konsumsi produk hubung via pesan
Indomilk,sih alami sulit ajar tips bantu waktu ajar senang efisien salah asupan nutrisi vitamin protein temu susu indomilk kids
Indomilk,inspirasi kontes cerita indomilk semangat gemilang lho cerita suka
Indomilk,semoga cerita inspirasi dukung sih prestasi bidang suka
Indomilk,anak gemilang indonesia sikap teliti pantang serah lho coba latih teliti temu bayang anak minum susu cair indomilk
Indomilk,resep lengkapdengan indomilk kental manis
Indomilk,sih semangat ajar kejar prestasi gemilang ikan cemilan lezat sehat ayo salah klappertaart pai durian warih suci
Indomilk,tubuh sehat pikir gila takut gemuk
Indomilk,cemil tubuh pengaruh sehat tubuh jiwa lho hindar cemil kandung lemak tinggi utama cemil siang cemil senja nikmat susu indomilk lemak tinggi calcium kalsium rendah lemak
Indomilk,ayo kanker dunia jaga daya tahan tubuh salah gaya hidup sehat lengkap asupan nutrisi saji menu penuh nutrisi piknik iya
Indomilk,periksa resep
Indomilk,aktivitas penuh sih butuh energi erik sih cemil kandung vitamin gizi resep bubur jagung susu resep kreasi indomilk
Indomilk,cerita olahraga pagi
Indomilk,gemilang tubuh sehat ayo jogging ringan keliling komplek rumah pagi tubuh giat lupa bawa susu indomilk uht ml bekal energi
Indomilk,ayo cerita alam masak sih kolom komentar
Indomilk,rencana libur ajar sih masak mudah panekuk gizi susu indomilk sih prestasi koki cilik saudara
Indomilk,kreasi gila lho
Indomilk,pekan rencana olahraga pagi lupa gila gila tubuh fit giat
Indomilk,ide ajar alat musik beda sih ajar ikan cemilan nutrisi hasil kreasi indomilk kental manis
Indomilk,prestasi sih muncul ide kreativitas cemerlang raya bantu kreatif ayo penuh kreativitas
Indomilk,sih suka nikmat indomilk iya ayo tulis kolom komentar gambar nikmat indomilk
Indomilk,sehat indomilk bagikan ayo
Indomilk,prestasi gemilang sih dukung sehat contoh cair tubuh aktivitas gelas susu indomilk sih hindar dehidrasi
Indomilk,lupa minum susu indomilk ml penuh krim energi semangat
Indomilk,hilang semangat hasil maksimal hasil prestasi pantang serah
Indomilk,harap kirim layan konsumen
Indomilk,harap kirim layan konsumen
Indomilk,konfirmasi
Indomilk,cerita inspiratif pantau sosial media indomilk informasi menang hadiah utama nila total rp
Indomilk,selamat hasil menang kontes cerita periode januari hak voucher belanja nila rp cerita inspiratif dukung gemilang anak indonesia
Indomilk,cerita inspiratif pantau sosial media indomilk informasi menang hadiah utama nila total rp
Indomilk,selamat hasil menang kontes cerita periode januari hak voucher belanja nila rp cerita inspiratif dukung gemilang anak indonesia
Indomilk,cerita inspiratif pantau sosial media indomilk informasi menang hadiah utama nila rp
Indomilk,selamat hasil menang kontes cerita periode januari hak voucher belanja nila rp cerita inspiratif dukung gemilang anak indonesia
Indomilk,tunggu
Indomilk,total hadiah nila rp indomilk cerita dukung juang anak usaha gapai cita cita gemilang klik lengkap
Indomilk,isi tenaga klub susu cair indomilk
Indomilk,sekolah cari cita cita salah coba giat klub sekolah musisi kenal klub seni sekolah
Indomilk,contoh susu indomilk lemak tinggi calcium kalsium rendah lemak ayo pola hidup imbang
Indomilk,suka olahraga suka cemil sembarang pikir iya atur pola cemil sehat tubuh sehat imbang olahraga atur cemil nutrisi
Indomilk,indomilk semangat gemilang kontes januari lho ayo cerita foto prestasi gemilang sih
Indomilk,hadiah tarik grandprize menang utama tunggu januari
Indomilk,indomilk ajak keluarga indonesia raya gemilang anak indonesia ikan cerita foto prestasi gemilang sih klik lengkap
Indomilk,teman mellow diapakan semangat seru seru gabung anti mellow melon klub indomilk melon ayo solusi epik wuoww teman dilema uang habis
Indomilk,ayo cerita inspiratif dukung anak menang total hadiah nila rp juta
Indomilk,selamat hasil menang kontes cerita periode januari hak voucher belanja nila rp cerita inspiratif dukung gemilang anak indonesia
Indomilk,pilih menang paket indomilk tahun hadiah utama nila rp buru kontes tutup saudara
Indomilk,tinggal indomilk semangat gemilang lho ayo cerita foto prestasi gemilang sih
Indomilk,buru buru lengkap sekolah sih ajar sih mudah raih sih sekolah
Indomilk,sekolah bantu prestasi gemilang lho
Indomilk,huruf braille kode tulis senja charles barbier komunikasi tentara napoleon bonaparte tahun coba baca susun huruf braille
Indomilk,setuju indomilk melon nikmat konsumsi butuh suasana hati iya kasih ekspresi wuoww nikmat indomilk melon gif kolom komentar
Indomilk,selamat hasil menang kontes cerita periode desember januari hak voucher belanja nila rp cerita inspiratif dukung gemilang anak indonesia
Indomilk,aju sponsor kirim email layan konsumen saudara
Indomilk,amin saudara
Indomilk,ayo cerita inspiratif dukung anak menang total hadiah nila rp juta
Indomilk,selamat hasil menang kontes cerita periode desember hak voucher belanja nila rp cerita inspiratif dukung gemilang anak indonesia
Indomilk,gemilang anak indonesia anak anak indonesia usaha keras pantang serah semangat raih cita cita momen harga sih lingkung dukung gemilang anak indonesia
Indomilk,selamat tahun keluarga dukung anak anak indonesia gemilang tahun nutrisi
Indomilk,sih penuh tahun dukung sih pantang serah ayo bagikan tahun sih
Indomilk,sehat keluarga
Indomilk,cerita salah kompetisi cerita gemilang anak indonesia gilir cerita menang total hadiah juta lho
Indomilk,utama piano timbul video pianis cilik indonesia serah semangat utama dukung saudara dukung susu cair indomilk suka latih
Indomilk,minggu kenal pasha nyimas nur hormat gilir cerita gemilang sih klik menang total hadiah rp juta
Indomilk,selamat natal semoga nutrisi indomilk momen keluarga hangat
Indomilk,jalan hidup sehat penuh nutrisi gizi susu indomilk penuh krim ml hidup sehat pengaruh bahagia lho
Indomilk,usaha keras pantang serah anak gemilang aktif rajin ajar raih cita cita ikan sih nutrisi semangat aktivitas padat salah nutrisi susu indomilk
Indomilk,umum menang utama selamat pahlawan mellow hasil oppo si lupa minum indomilk melon ubah mellow wuow
Indomilk,terima kasih tulus cinta kasih nutrisi sih tumbuh anak milik semangat gemilang selamat
Indomilk,peran sih dukung bantu hasil sih raih cita cita terima kasih dukung bentuk sih
Indomilk,ayo cerita dukung sih keluarga
Indomilk,sih dukung gila indomilk dukung korban waktu sih raih cita cita
Indomilk,buah pisang kandung total potassium butuh tubuh gerak aktif milik detak jantung sehat coba isi penuh gelas susu kirim screenshotnya kolom komentar
Indomilk,semangat nur hormat pantang serah dukung keluarga lho ayo tonton cerita lengkap nur hormat renang anak anak
Indomilk,usaha nyimas skater cilik semangat tinggi nutrisi indomilk kental manis dukung tua cari cerita lengkap video
Indomilk,pasha usaha raih prestasi gemilang anak indonesia prestasi usaha pantang serah nutrisi susu uht indomilk dukung tua lho ayo tonton video
Indomilk,waktu umum remake komik ter epik indomilk tahilalats periode selamat iya menang hasil mendapati voucher belanja tonton cemil nila juta tunggu data inbox
Indomilk,menang periode selamat hasil voucer senang nila rp tonton belanja cemil menang utama iya
Indomilk,semoga inspirasi generasi bangsa tumbuh indomilk
Indomilk,tua sekolah pegang peran hidup anak tua dukung program cerita website
Indomilk,indomilk kunjung sekolah kota kota inspirasi nutrisi tingkat kembang anak harap inspirasi anak indonesia capai tingkat potensi apresiasi
Indomilk,indomilk raya ulang tahun dukung anak indonesia program gemilang anak indonesia indomilk sedia sarana inspirasi sekolah dasar nasional dorong tingkat potensi anak indonesia
Indomilk,tekan konferensi gemilang anak indonesia
Indomilk,buru tulis solusi epik wuoww menang voucher belanja cemil tonton nila rp hadiah utama
Indomilk,waktu voucher belanja cemil tonton nila rp juta kasih solusi epik wuoww
Indomilk,ken menangin voucher belanja cemil tonton nila rp ikan solusi epik wuoww waktu desember loh tunggu ayo buru
Indomilk,hasil mendapati voucher belanja tonton cemil nila rp tunggu data inbox indomilk iya teman mellow ayo hibur remake komik tahilalats menangin hadiah
Indomilk,epik deh solusi solusi remake komik tahilalats periksa waktu umum remake komik ter epik indomilk tahilalats periode selamat iya menang
Indomilk,sih milik cita cita dukung semangat pantang serah anak gemilang video
Indomilk,anak indonesia hak milik cita cita usaha wujud raih prestasi gemilang anak indonesia bangga dukung sih sempurna
Indomilk,solusi epik wuoww nampang galeri anti mellow melon klub coba hasil lupa ajak teman
Indomilk,teman mellow ayo hibur remake komik tahilalats menangin hadiah
Indomilk,hibur teman wuoww anti mellow melon klub
Indomilk,latih konsentrasi sih utama tangkas indomilk fokus ikan indomilk uht kids cokelat nikmat alam sih bagikan ayo
Indomilk,sih konsentrasi kelas faktor bosan latih
Indomilk,st indomilk iya
Indomilk,susu uht indomilk pilih ikan sih kadung kalsium tinggi indomilk nyaman genggam milik tutup aman ramah sih ayo cerita kolom komentar
Indomilk,oh iya lupa hibur mellow teman anti mellow melon klub kolaborasi indomilk tahilalats
Indomilk,teman mellow kalemin epik wuoow ikan indomilk batu melon kalium manfaat kalium lancar oksigen otak tenang dingin
Indomilk,ayo video temu indomilk uht informasi lengkap periksa iya
Indomilk,indomilk uht gurih susu asli garam lho
Indomilk,kandung nutrisi fit penuh
Indomilk,duduk tubuh lesu gera bangku konsumsi indomilk lemak tinggi calcium
Indomilk,solusi epik wuoww terbang angkasa bagikan tunggu
Indomilk,tips menang anti mellow melon klub minggu menang minum indomilk melon meditasi gunung sih
Indomilk,indomilk
Indomilk,utama tebak tebak sih ayo hasil tebak hadiah sih susu indomilk cair cokelat stroberi senang
Indomilk,informasi lengkap
Indomilk,beda gurih susu garam indomilk bebas garam cicip gurih susu asli indomilk
Indomilk,bantu teman menemukan solusi wuoww tanda teman gabung mendapati hadiah tarik tunggu buru ayo
Indomilk,keren bagus untung musim iya lupa minum indomilk mahir utama bola
Indomilk,bantu teman menemukan solusi wuoww tunggu buru ayo
Indomilk,cari ayo beda susu gurih asli gurih garam beda tonton video ayo
Indomilk,parfait ala saji indomilk senang deh ide raya guru bagikan ayo
Indomilk,kasih kado beli kue raya guru tahun tahun ikan kejut beda guru
Indomilk,susu sih bagikan kolom komentar iya
Indomilk,kemas indomilk lengkap teknologi nutrikeep loh teknologi jaga susu kemas jaga sih manfaat jaga
Indomilk,olahraga ringan jalan minum susu indomilk lemak tinggi calcium nutrisi bantu rutinitas senang
Indomilk,jaga tubuh segar selai kantor
Indomilk,media sosial klik pilih tema mellow isi solusi epik bagikan media sosial tanda teman gabung mudah ayo hadiah
Indomilk,teman nang nang muka gara gara diunfol disuka ikan solusi wuoww mengikuti mendapati hadiah seru
Indomilk,selamat menang hasil mendapati voucher belanja tonton cemil nila rp teman mellow ayo hibur remake komik
Indomilk,selagi minggu senang nasional ayo cemil suka kreasi indomilk kental manis jamin momen manis keluarga kesan
Indomilk,teman mellow ayo hibur remake komik menangin hadiah
Indomilk,selamat iya menang hasil mendapati voucher belanja tonton cemil nila juta tunggu data inbox indomilk iya
Indomilk,waktu umum remake komik terepic indomilk periode
Indomilk,epik deh solusi solusi remake komik periksa
Indomilk,oh iya lupa hibur mellow teman anti mellow melon klub kolaborasi indomilk tahilalats
Indomilk,teman mellow kalemin epik wuoow ikan indomilk batu melon kalium manfaat kalium lancar oksigen otak tenang dingin
Indomilk,media sosial klik pilih tema mellow isi solusi epik bagikan media sosial tanda teman gabung mendapati hadiah tarik tunggu buru ayo
Indomilk,uang jajan habis teman mellow gara gara bantu teman menemukan solusi wuoww
Indomilk,bingung selesai sekolah coba zodiak cocok zodiak ayo tulis kolom komentar pilih
Indomilk,buka deh link ayo kirim solusi epik wuoow
Indomilk,sih menang kompetisi anti mellow melon klub mudah tips ala indomilk melon
Indomilk,batal
Indomilk,lupa bawa indomilk penuh krim ml ayo bagikan olahraga tarik coba
Indomilk,teman hobi olahraga beda coba temu alam
Indomilk,ajak keluarga minum indomilk tonton iya
Indomilk,lupa tonton film tayang bioskop sayang november
Indomilk,deh wajah wajah bahagia inspirasi film
Indomilk,seru seru gala premiere film naura genk juara paskal mall bandung
Indomilk,ketemu pantau sosial media indomilk ayo seru
Indomilk,tiket gala premiere naura genk juara lupa bawa indomilk bekal acara sakit paskal belanja mall
Indomilk,menangin hadiah handphone voucher senang
Indomilk,teman mellow ayo hibur remake komik
Indomilk,waktu umum remake komik ter epik indomilk periode selamat hasil mendapati voucher senang
Indomilk,sih semangat hadiah susu uht kids cokelat selesai selamat coba
Indomilk,sih senang lendir coba lendir mudah aman
Indomilk,mari bukti gurih susu asli
Indomilk,susu susu segar milik asli susu kandung nutrisi imbang lho
Indomilk,lho nikmat gelas susu indomilk uht asli gurih
Indomilk,ayo bagikan alas keluarga suka susu indomilk nikmat tunggu
Indomilk,kandung garam susu indomilk nikmat lho
Indomilk,rupiah bank indonesia
Indomilk,rupiah indonesia cipta ajak sih utama ajar sejarah bangsa indomilk
Indomilk,epik minum indomilk pisang pamer ayo bagikan ide seru
Indomilk,ide seru sumpah pemuda ajak teman teman pamer sejarah indonesia sekolah ayo
Indomilk,lupa bagikan media sosial tanda teman klub tunggu solusi saudara
Indomilk,mudah media sosial klik pilih tema mellow isi solusi epik
Indomilk,teman mellow diunfollow disuka solusi wuoww
Indomilk,sumber energi bantu pikir kreatif unduh misi
Indomilk,menang utama boboiboy galaksi mudah minum uht kids boboiboy utama
Indomilk,ayo video
Indomilk,lho susu gurih garam gurih susu asli
Indomilk,ubah mellow teman wuoww gabung
Indomilk,sedia indomilk momen lupa
Indomilk,luang waktu raya menang tim keranjang sih sekolah ajak keluarga cemil halaman blkg rumah ayo
Indomilk,hadiah tarik periode tunggu ayo buru
Indomilk,cerita kreatif ubah mellow wuoww periksa ayo
Indomilk,bingung teman henti kemellow annya hibur remake komik tahilalats
Indomilk,periksa inspirasi bekal sih bagikan bekal
Indomilk,khawatir cemil konsumsi sih sekolah bekal sekal coba kreasi resep nikmat sehat indomilk uht
Indomilk,kreasi indomilk kental manis ayo unggah foto balas cerita alas
Indomilk,mendapati hadiah seru indomilk melon informasi lengkap
Indomilk,utama bareng indomilk tahilalats wuoww mellow ayo remake komik anti mellow melon klub tahilalats
Indomilk,hujan hubung disuka banding awet hujan turun sedih
Indomilk,unduh sedia uht kids boboiboy sih semangat menang
Indomilk,santai sih utama boboiboy galaksi lupa coba misi seru
Indomilk,funwalk maraton nikmat indomilk penuh krim tips ayo bagikan kolom komentar
Indomilk,produktif aktivitas beda teman ayo
Indomilk,mudah nikmat indomilk melon updatenya sosial media indomilk
Indomilk,bingung usir dilema seru kolaborasi indomilk tahilalats
Indomilk,tetangga komplek cemilan kreasi susu kental manis semangat lho
Indomilk,sehat mental dunia semangat
Indomilk,hilang minum indomilk melon kolaborasi tahilalats indomilk
Indomilk,suka baca komik tahilalats nama serial episode mellow hilang
Indomilk,ayo utama bareng boboiboy galaksi lho seru
Indomilk,rajin
Indomilk,rendah lemak kalsium minum
Indomilk,minum udara olahraga atur tubuh sehat indomilk lemak tinggi calcium
Indomilk,saksi tampil bintang tamu spesial ajak teman teman keluarga seru
Indomilk,ayo tualang bareng boboiboy galaksi mode atrium kota kasablanka oktober
Indomilk,unduh misi
Indomilk,ajak sih utama boboiboy games nikmat uht kids bosan ajar sekolah
Indomilk,batal
Indomilk,oke coba minum susu cair indomilk cokelat
Indomilk,salah dulunya biji cokelat uang suku aztec
Indomilk,seru kolaborasi indomilk melon tahilalats ubah dilema mellow wuoww
Indomilk,suka suka canda receh isi bareng teman teman
Indomilk,ayo cinta indonesia pakai batik minum susu indomilk
Indomilk,batik waris budaya indonesia unesco oktober
Indomilk,terima kasih saran kirim saran layan konsumen
Indomilk,kirim usul layan konsumen
Indomilk,stan indomilk
Indomilk,paket indomilk kids milkuat seri boboiboy galaksi nila rp
Indomilk,rekreasi keluarga ajak sih ayo
Indomilk,simak fakta seru indomilk unduh
Indomilk,laila kirim usul layan konsumen hubung kait
Indomilk,dukung sehat jantung internasional
Indomilk,cipta lingkung sehat olahraga rutin konsumsi cemil minum gizi
Indomilk,epik minum indomilk melon
Indomilk,suka mellow habis tonton film sedih wuoww tebak ikon
Indomilk,saudara
Indomilk,benig ayo periksa packaging indomilk saudara
Indomilk,seru ajak teman sih saji uht kids boboiboy
Indomilk,selesai misi milik boboiboy galaksi
Indomilk,tunggu saji keluarga
Indomilk,takut susu segar buka khawatir teknologi nutrikeep packaging indomilk uht nutrisi susu jaga
Indomilk,hadiah indomilk melon menang milik kumis susu
Indomilk,teman mellow ajak nikmat indomilk melon utama utama epik kumis susu
Indomilk,ide cerita
Indomilk,lepas gila hubung sih erat lupa raya susu indomilk uht
Indomilk,selagi pulang cepat luang waktu tonton bareng sih ajak jalan jalan sakit ayo
Indomilk,lezat nutrisi kreasi susu indomilk pisang
Indomilk,susu indomilk pisang kreasi seru lho halus buah stroberi jeli kelapa epik
Indomilk,sumbang kunjung kantor pmi
Indomilk,saudara
Indomilk,cuaca mendung mellow produktif tenang kombinasi epik indomilk melon bantu moodmu wuoww
Indomilk,pilih nutrisi tinggi salah kreasi hidang indomilk kental manis
Indomilk,sumbang darah perhati cemil minum konsumsi
Indomilk,paket indomilk kids milkuat seri boboiboy galaksi nila rp
Indomilk,rekreasi keluarga ajak sih ayo
Indomilk,pilih nutrisi tinggi salah kreasi hidang kental manis indomilk
