username,tweet
Joabaldo,moral cerita kuliah ilmu luas agam bantu kenal
Joabaldo,nyala titik siswa english malu nunjuk bilang
Joabaldo,mesin cari joab freshgraduate guru fisika ajar minggu
Joabaldo,syukur nama alias
Joabaldo,tolak memakai putus tinggal cenderung pilih tawa
Joabaldo,three gaib ajaib erti pikir
Joabaldo,dasar alam semesta alam semesta batas
Joabaldo,maklum gaji penuh
Joabaldo,gaji minggu uang sisa cemil
Joabaldo,drives dikit ayo
Joabaldo,iya
Joabaldo,wondering alarm ringtone
Joabaldo,waktu harap ah
Joabaldo,paham pagi pagi milik makna beda
Joabaldo,inheren paham gila keren sih
Joabaldo,hasn become pribadi
Joabaldo,bilang dukung bawa pedul
Joabaldo,obat pasien corona sembuh corona sakit sembuh tubuh melaw
Joabaldo,three weeks passed paham relaxing nyala kutip shall lulus
Joabaldo,si mudah pikir struggling seems has milik juang has beda characters
Joabaldo,pikir through tahun wished placed nyala internasional sekolah weeks bidang experi
Joabaldo,terbaik data concerning saudara laki predicted had pergi nyala
Joabaldo,tahun tahun
Joabaldo,ide ajar penuh ajar rencana minggu
Joabaldo,dasar
Joabaldo,sih jos benernya
Joabaldo,sekian dengar gadis merespons si fine
Joabaldo,mjd partisipan riset pakai diberitahukan plajari
Joabaldo,squidward sumber memefess
Joabaldo,putar video sharescreen saudara wanita tinggal
Joabaldo,iya
Joabaldo,bablas wajar ganti senja sih admin biarkan tawa
Joabaldo,ajar online temu bagikan video pikir bagikan link tonton diba
Joabaldo,bingung senang selesai ajar gaji
Joabaldo,mikirnya kepala copot fatal
Joabaldo,istirahat
Joabaldo,minggu bicara oksa santai bilang pra
Joabaldo,stressku bilang tekan bilang sesat
Joabaldo,ah bootleg iya
Joabaldo,pikir jalan topik
Joabaldo,turun an pecah obyek bibir balsem pecah iya
Joabaldo,gave activities students ukur penggar second ukur waktu an
Joabaldo,bible verses ve baca recently miraculously his takdir circulating nyala
Joabaldo,terimakasih jos semangat jalan hidup
Joabaldo,hidup si tinggal
Joabaldo,milik informasi officially pindah bandung starting minggu tuhan si tahun
Joabaldo,pagi pagi dilema sadar habis hidup ubah
Joabaldo,pandemi presiden bicara rumah cuti
Joabaldo,senang bantu tua bilang gaji tahan beli pakai butuh
Joabaldo,asking abai tantang ask
Joabaldo,terimakasih informasi
Joabaldo,iya menang menang larut
Joabaldo,bagus saudara motivasi kenan rezeki saudara piatu
Joabaldo,iya
Joabaldo,pengaruh ketua john haggai saudara laki
Joabaldo,taruh kaki nyala milik shoes ganggu taruh ide nyala milik kepala
Joabaldo,lupa bentuk investasi rap
Joabaldo,tawa mantap
Joabaldo,john interviews months over ratus seems
Joabaldo,iya dibeginikan
Joabaldo,ilmu ateisme campur evolusi berita
Joabaldo,wanita created gambar tuhan look gambar tuhan an obyek
Joabaldo,normal hormat wanita any wanita wants disrespected pria si
Joabaldo,lanjur pikir
Joabaldo,eh bilang pelakor sih eren suami istri
Joabaldo,paham alas senyum titan bunuh eren eren pelakor
Joabaldo,juang guru iya
Joabaldo,batal
Joabaldo,budaya nyampur bingung panggil rekan tuan
Joabaldo,tawa iya
Joabaldo,salah terima program loh saudara
Joabaldo,berita sapa pergi sih asrama tanggal tawa
Joabaldo,besok loh langkah xd
Joabaldo,oiya lupa
Joabaldo,salah yayasan didik indonesia sekolah pencar indonesia larang
Joabaldo,fakultas kampus daftar ketua kabid kepala divisi ipknya
Joabaldo,februari berita pariwisata indonesia kasih insentif tingkat daya tarik
Joabaldo,sustain percaya tuhan ateisme has demonstrasi batas
Joabaldo,hayo rindu pandemi habis fn area ramai
Joabaldo,batal
Joabaldo,mari ajar cepat ambil simpul hasil capai target
Joabaldo,kekny kuliah beli baju deh kasih
Joabaldo,bakat pendam dit gara intel
Joabaldo,bilang
Joabaldo,titip utas iya saudara wanita hitung hitung bantu promosi
Joabaldo,kemarin ken ngetweet konsep
Joabaldo,layan tumpuk tengah masukkin kursi tinggal meja cemil meja
Joabaldo,basic tata krama wajib nunjukin kualitas pribadi bilang terimakasih layan
Joabaldo,asrama pakai sistem pesan cemil gratis minggu batas waktu rabu siang mesen kal
Joabaldo,nyimpan uang pindah lupa pesan cemil minggu
Joabaldo,awas maling sendal
Joabaldo,hukum bebas batas
Joabaldo,coba
Joabaldo,hahahahahhahahah
Joabaldo,setop
Joabaldo,clear bela bebas batas jelalat
Joabaldo,heran gadis pakai standart tubuh atur justifikasi pakai tukik
Joabaldo,sih utas lengkap mantap tawa
Joabaldo,ilmu konfirmasi tangkap
Joabaldo,rumah tingkat garasi pria
Joabaldo,drama lookism gank milik hati lookism adaptasi webtoon gank milik hati olahraga cowok
Joabaldo,spending minggu tonton dramas titles times baris
Joabaldo,ajar guru susah lepas jerat haluan drama
Joabaldo,attractions
Joabaldo,pikir bangun roket pamer bangun roket
Joabaldo,becoming lonewolf alam
Joabaldo,pandang paham darat minggu whatsapp
Joabaldo,saudara bas posisi colek
Joabaldo,tenang rabu siang
Joabaldo,sangkal pikir sengguk anak
Joabaldo,pisang goreng pontianak posisi
Joabaldo,bonus quotes famiiar
Joabaldo,finishing pikir arising berhenti khayal realitas looking muda tindak
Joabaldo,menyelesaikan webtoon hidup adaptation lookism wondering beruang bunga tahun
Joabaldo,oh iya iya temu facebook memenya coba dengar muncul beranda youtube
Joabaldo,eng
Joabaldo,ujian nasional fisika teman teman kelas cerita romansa alhasil nilai tinggi
Joabaldo,iya lagu dengar nyentuh kokoro gambar facebook athallah
Joabaldo,ajar kuliah ujian ujian semester ngajakin teman kelas ajar bareng
Joabaldo,teman teman sibuk temu
Joabaldo,whose hati toward tuhan produces puja characters teladan pikir considered lea
Joabaldo,subyektif mayoritas monster tc pe
Joabaldo,rintih sukmaria zendrato saudara wanita riny kepala mentors tc salah cerdas kelas
Joabaldo,assa moria evangelianto pend matematika foto habis sidang
Joabaldo,yosua yeremia pend kimia saudara nelis rintis hmps sophomo
Joabaldo,pikir yadeh
Joabaldo,lupa telepon selai
Joabaldo,izin simpan tawa canda deng
Joabaldo,batal
Joabaldo,tolong robot
Joabaldo,utama permainan teman joab loh utama permainan utama jo utama
Joabaldo,coba takut kolesterol ujung mati
Joabaldo,utas lanjutkan
Joabaldo,mengambil barang ketemu
Joabaldo,eh kontak andry
Joabaldo,struktural fungsional lompat tim organisasi saudara
Joabaldo,prinsip pimpin andry minggu si pimpin tim organisasi pimpin
Joabaldo,leaders bicara pandemi host andry panjaitan tamu bintang bupati tangerang tim komunikasi gtppc
Joabaldo,spending si activities diluar
Joabaldo,kirim
Joabaldo,tulis nama
Joabaldo,kado
Joabaldo,nama mcgurk efek saudara laki dengar gera bibir
Joabaldo,sombong ayo kemarin panggil menengok
Joabaldo,gerak assa eh assa yamaha
Joabaldo,materi kelas
Joabaldo,menn
Joabaldo,prihatin yayasan wakil bayang wakil
Joabaldo,sadar iya iya khawatir sih sekolah
Joabaldo,vidcall nyeletuk joab cinta
Joabaldo,cerita teman teman kelas vidcall kasih semangat sih bilan
Joabaldo,omong omong konteks graduated beasiswa students placed nyala schools yayasan si partnering over
Joabaldo,milik pengaruh therefore si bagus
Joabaldo,divisi sisa divisi pergi anggota
Joabaldo,kepala divisi angkut omba otomatis sambut jemput
Joabaldo,obrolan saudara tingkat bilang selamat lulus bilang jasa penjemp
Joabaldo,john sih maxwell milik pengaruh tindak
Joabaldo,pikir bagus angka interacted might influenc
Joabaldo,through tweets controlled angka nyala sosial media repetitively pikir moments
Joabaldo,meanwhile kotak schrdinger si kucing plans balas dendam
Joabaldo,thankfully bohong nila trouble
Joabaldo,everytime maaf replied si oke
Joabaldo,rumus sederhana mudah republik indonesia jv republik indonesia risiko infeksi jv virus papar imunitas
Joabaldo,terimakasih dit tawa
Joabaldo,teman kelas bilang bukanny nyemangatin nasib tangis
Joabaldo,ah tsuyoku nareru
Joabaldo,balikin buku mahasiswa habis tangis gara gara nunda nunda misi
Joabaldo,tipe mta tc pagi enrichmentnya seminar video baca materi iya enrichmentnya
Joabaldo,ketemu teman akrab hubung ngobrol tumbuh
Joabaldo,tuh
Joabaldo,iya atur bebas
Joabaldo,tuhan adam dna hawa
Joabaldo,faktor bdskn balasan nurut kalah bangga jatuh nurut bebas nyaman renggut paham
Joabaldo,takut ketidakpastian corresponds fakta assume negara an ide aski
Joabaldo,dokter jiwa niat bantu usus buntu operasi akibat fatal kadang ki
Joabaldo,tekan angkat tombol siku
Joabaldo,aliran musik sesuai oke suara anak
Joabaldo,batal
Joabaldo,yakalo libur saudara wanita
Joabaldo,terimakasih youu
Joabaldo,saudara
Joabaldo,tarik arah assa shin
Joabaldo,tahun
Joabaldo,didik anak
Joabaldo,okesip
Joabaldo,spending hebat tahun uph harfiah tinggal uph pindah bandung tahun starting
Joabaldo,niat ketemu kelas eh rapat hmps
Joabaldo,konteks mahasiswa appreciate habis waktu dengar
Joabaldo,woahh keliru mem
Joabaldo,ketemu salah
Joabaldo,paham hakim iya adil
Joabaldo,permainan expnya dokter
Joabaldo,coba periksa sa
Joabaldo,iya zai
Joabaldo,thnk adviceny wan kawan sih tawa kemarin
Joabaldo,diturunin tawa
Joabaldo,decide tonton episodes tonton seasons
Joabaldo,banding nakal nyeremin eh candid bentuk nakal
Joabaldo,batal
Joabaldo,tinggi pertanggungjawaban
Joabaldo,buah keliru
Joabaldo,ah asa bagus
Joabaldo,wid aren pergi hubung cohabitate bentuk commitment akal
Joabaldo,cenderung orientasi setuju menikah sha iya
Joabaldo,alam
Joabaldo,resonating hati
Joabaldo,iya
Joabaldo,iya loh
Joabaldo,sa rajut motif utama erti implisit saudara
Joabaldo,masalahny dikonci
Joabaldo,pacar setuju menikah orientasi cenderung setuju sih
Joabaldo,sip rujuk ditanyain loh cuman paragraf
Joabaldo,alam paham kait paham akar ilmu behind
Joabaldo,dosen unggah progres usul teliti batas serius parag
Joabaldo,iya pleasure tolong
Joabaldo,iya dit ubah cepol
Joabaldo,cc iya terimakasih retweetnya kemarin admin
Joabaldo,eh ajib tahun tulis
Joabaldo,bagus teladan melakuk
Joabaldo,iya
Joabaldo,lucu kasih tiket
Joabaldo,bilang dinamis
Joabaldo,ken praktek ajar tahun tawa baju beli kain jahit oke
Joabaldo,iya seringkali sirat
Joabaldo,santai sa ketemu kasih karunia damai sejahtera tuhan
Joabaldo,lupa materi kuliah aduh
Joabaldo,dorm kemarin udha jarang tawa
Joabaldo,eh dorm sahabat kamar untung tidur
Joabaldo,fisika kuantum mudah saudara
Joabaldo,balas obrolan bingung tinggalkan
Joabaldo,minggu paham miring
Joabaldo,pesan email saudara laki
Joabaldo,iya wawas hehehehe
Joabaldo,bolong saudara tawa caseku catat tawa
Joabaldo,pakai uang manajer
Joabaldo,gantung nyaman disiplin masukinnya sih
Joabaldo,sip
Joabaldo,yoi
Joabaldo,foto barang bel stokn
Joabaldo,isi sensor iya pribadi tawa polos warna tahun
Joabaldo,tabung rekening sih ribu rencana jangka misi
Joabaldo,mindset tua kirim exclude uang kuliah hidup beasiswa penuh keli
Joabaldo,pikir muncul teman gadis suka suka iri
Joabaldo,iya tweet kegeeran jarang hidup
Joabaldo,bright telepon layar look milik stories clearer bright
Joabaldo,nominasi pandemi kuliah beker
Joabaldo,pasien corona ren
Joabaldo,omong omong pikir tarik telaah sisi pria tawa
Joabaldo,amin buah responsif shin pergi nyala
Joabaldo,tingkat pendekatan
Joabaldo,jesus ignominious mati janji mati john baptist beheaded nyala tingkah tanda
Joabaldo,okela
Joabaldo,yedija agus nama
Joabaldo,ren tengah mantap viewnya
Joabaldo,duduk kelas dekan pulang teman kamar pulang
Joabaldo,managing ruang pas sprei spesial
Joabaldo,kilometer geser kah dit
Joabaldo,uang dipakai
Joabaldo,sekian elaborasi semoga kati terima kasih sedia waktu baca tekun
Joabaldo,mati selesai elaborasi iya tuhan hidup selesai
Joabaldo,tukang luncur jatuh perosot tawa genteng genteng kayu arah luka ringa
Joabaldo,gosip cerita waktu lempar jendela cebur kolam samping
Joabaldo,rasul paulus hidup buah percaya bah
Joabaldo,tuhan hidup hidup kristus mati
Joabaldo,damai kasih sukacita lain-lain dunia lewa
Joabaldo,nikmat tuhan kekal hidup dunia milik sembari
Joabaldo,harap gosip hidup mati sadar percaya te
Joabaldo,jamin hidup layak
Joabaldo,paid tebus budak dosa ensures pisah his cinta
Joabaldo,jesus hidup ask bagus run
Joabaldo,rusak daya ubah myself deep turun realize butuh saviour
Joabaldo,riny bilang muncul muka salah
Joabaldo,sentak pikir imageku bodoh gambar mengatur
Joabaldo,oktober waktu diskusi riny candid bilang anggap publi
Joabaldo,iya anggap anggap teladan panutan awam
Joabaldo,konseling ngeberesin tahun
Joabaldo,hidup pribadi malu hidup kacau tru
Joabaldo,harap kokoh mati bangkit kristus pria cemburu
Joabaldo,ajar ajar paham tegar ayah menghada
Joabaldo,teladan ayah ayah rindu
Joabaldo,tuhan pegang hidup ayah mati bangkit tuhan
Joabaldo,situ harap hidup ayah dasar saudara tenang
Joabaldo,hidup tears dunia apart waktu ayah bicara ringkih anak
Joabaldo,waktu tahun ayah kritis susah izin kampus
Joabaldo,tuhan jamin hidup kekal ambil kristus
Joabaldo,titik sadar jarang komunikasi keluarga keluarga inti pria
Joabaldo,paman profesor keluarga tinggal nyesal
Joabaldo,sedih pisah sakit harga waktu waktu si
Joabaldo,harap bantu tegar sukar pagi pagi nelpon tua whatsapp
Joabaldo,makna relevance christ died resurrected
Joabaldo,pikir answered thouroughly individuals themselves
Joabaldo,pikir explained oke terima true
Joabaldo,unsure elaborasi tolong thinkers percaya waktu sih
Joabaldo,simpang each individuals issues hidup percaya has affected alam beliefs
Joabaldo,penuh percaya nyala sederhana analogi saji
Joabaldo,however ive isu stretches further comes pribadi hidup individuals
Joabaldo,nomor kemarin kamera layar kanan kepala geleng geleng kamera layar joab
Joabaldo,tahun rumah kenang pergi tinggal pindah
Joabaldo,henti
Joabaldo,sindir assa sindir
Joabaldo,tolong believers pikir iman buta iman otherwise has limpah evidences
Joabaldo,tulis elaborasi teguh setuju tulis elaborasi pribadi
Joabaldo,elaborasi dasar alkitab christ lee strobel enough iman
Joabaldo,milik elaborasi nyala pusat christian iman pegang terimakasih takes waktu
Joabaldo,ravi zacharias submitted tests christian pesan uniqu
Joabaldo,tes koherensi aspek konsisten logis
Joabaldo,teori lolos tes te
Joabaldo,selesai terimakasih logicians invented uji teori
Joabaldo,tulis otoritas otoritas iya logika
Joabaldo,implikasi tulis joab konsisten percaya tulis otoritas
Joabaldo,tunggu tulis joab otoritas mengestablish alkitab tulisa
Joabaldo,mari bawa logika contoh tulis alkitab tulis joab alkit
Joabaldo,tulis otoritas otoritas otoritas baw
Joabaldo,oke coba terima alternatif tinggal pilih tulis iya
Joabaldo,alkitab firman tuhan tulis tuntut balas argumen alkitab kirim
Joabaldo,detail ditunjukkin malu maluin setuju tulis detail belaka
Joabaldo,tulis tuhan bangkit siswa sembah ragu ragu
Joabaldo,peristiwa libat siswa detail malu terrcatat tuhan enyah iblis kep
Joabaldo,oke alkitab milik salah mari telaah injil tulis
Joabaldo,jarak rentang tahun janji salin jarak tahun
Joabaldo,mindblowing fakta manuskrip kuno contoh kenal republik malu asli
Joabaldo,mampi konstruksi manuskrip asli dasar salin limpah salina
Joabaldo,manuskrip manuskrip janji bakar milik manuskri
Joabaldo,janji edar kristen kuasa
Joabaldo,alkitab fiksi saksi saksi mudah bongkar bohong alkitab
Joabaldo,alkitab fiksi argumen tuntut balas penuh diraguka
Joabaldo,scholars setuju janji tulis tahun tulis
Joabaldo,legenda alkitab tulis cepat tahun hidup tuhan asumsi tuhan
Joabaldo,sadar tuhan kunjung inisiatif tulis injil terbentu
Joabaldo,alkitab janji tulis tuhan hidup surga
Joabaldo,mari alkitab legenda tuntut balas bilang alkitab tulis generasi si
Joabaldo,pegang alkitab alkitab rujuk manuskrip salin bahasa asli alki
Joabaldo,tuhan salah manusia gaya misi
Joabaldo,latar beda raja tani dokter doktor nelayan mungut cukai imam rasul
Joabaldo,eh deskripsi pribadi alkitab alkitab wahyu tuhan kit
Joabaldo,percaya janji percaya
Joabaldo,hidup mati bangkit tuhan buah sejarah tuhan
Joabaldo,nyala vince vitale les
Joabaldo,nama kubur kosong alkitab menul
Joabaldo,kosong makam kubur tuhan kubur milik yusuf arimatea kenal cerita bohong
Joabaldo,paulus pimpin siksa kristen salah berp
Joabaldo,si skeptics konversi skeptics yakobus saudara tuhan percaya kepa
Joabaldo,sih salib tuhan mati salib historis appearances jes
Joabaldo,tulis saudara wanita riny ngeshare video kait
Joabaldo,oke mari simpan alkitab periksa sejarah setuju sejarawan fakta bangkit
Joabaldo,tanggap tunggu elaborasi ambil alkitab lagipula alkitab
Joabaldo,harap komprehensif tahan kemung
Joabaldo,peduli peduli
Joabaldo,sa
Joabaldo,berani risiko taking tindak brought capai made two times dekan
Joabaldo,malu sakit jarang anymore accepted myself made memakai mistakes
Joabaldo,challenges pikir deeper look speak corresponds pikir
Joabaldo,qna dekan malam realized laughed students dangkal
Joabaldo,risen monday tuesday every minggu filled bangkit gembira
Joabaldo,ubah mati based nyala claimed
Joabaldo,seems tarik klaim jesus resurrected mati standstrong countered hitung
Joabaldo,alkitab tulis perspektif beda mati yudas injil yudas gantung kisa
Joabaldo,siswa hidup proses salib kecuali yudas yudaslah rujuk satuny
Joabaldo,rasul percaya serah hidup dasar tipu hidup
Joabaldo,tuntut balas siswa tuhan mati mer
Joabaldo,mati tuhan siswa kubur kosong tujua tuhan
Joabaldo,samping sahih tuntut balas muncul abad tuntut balas superficially si
Joabaldo,mati tuhan abad tuntut balas salib ter
Joabaldo,alkitab konsisten tuhan bangkit tuhan tuhan cipta alam
Joabaldo,sains bantu paham bangkit umum
Joabaldo,sains bangkit tuntut balas runtut akar fil
Joabaldo,tuntut balas untung bohong diam menyebarkanny
Joabaldo,siswa gambar takut lari kemari berani
Joabaldo,jaga jobdescnya jaga kubur maling jaga sedia
Joabaldo,mayat tuhan curi rasional kronologi waktu senja
Joabaldo,kisah bangkit tuhan mahkamah agama yahudi tuhan disa
Joabaldo,pelit ragu pintar lawan
Joabaldo,salah buku baca testimoni testimoni dukung ki
Joabaldo,tuhan hidup kondisi fisik manusia tuhan sekarat
Joabaldo,bukti kuat tuhan mati tuhan
Joabaldo,percaya prajurit dokter medis ahli saudara
Joabaldo,lupa tangan kaki paku selai waktu waktu berat si
Joabaldo,salib hukum mati rancang hukum mati perlahan siksa salib teri
Joabaldo,fisik tuhan ludah olok olok hina telanjang kemu
Joabaldo,tuhan sesah cambuk desain mencengkram cabik kulit
Joabaldo,senja salib tuhan derita gila berat tulis keringat darah tuhan alami
Joabaldo,muka klaim dengar akal kondisi tuhan
Joabaldo,tuhan pingsan indikasi tuhan mati bangkit tidur
Joabaldo,sederhana salah aspek iman kristen percaya tuhan mati bangkit tebu
Joabaldo,pikir elaborasi rasul tuhan
Joabaldo,luas dunia pikir tindak apostles has pikir
Joabaldo,risen christ janji jasmani resurrected spiritually jasmani res
Joabaldo,tuhan takut lari pimpin hukum mati
Joabaldo,easters libur worlds annual christianitys pesan akar historical
Joabaldo,minggu
Joabaldo,selesain elaborasi mati bangkit kristus eh selai renang teman teman
Joabaldo,tulis paulus implisit bilang percaya rasul silah periksa
Joabaldo,halusinasi tuntut balas tarik halusinasi secar
Joabaldo,rasul janji uang pikir dorong kuasa uang mer
Joabaldo,rasul janji seks tuhan rasul kutuk cabul rasul lambat laun kont
Joabaldo,dorong rasul janji kuasa bilang kuasa bumi rasul
Joabaldo,alkitab catat ubah signifikan bangkit risen indeed
Joabaldo,lagipula paulus aniaya kristen salah pali
Joabaldo,tahun cuci otak hasil siswa mati si
Joabaldo,doktrin teroris rela mati doktrin siswa ra
Joabaldo,sedia khotbah sedih
Joabaldo,bohong pikir such weak tuntut balas rela persekusi mati abar keb
Joabaldo,counterclaims rela mati bilang rasul halusinasi dorong
Joabaldo,bangkit bawa harap harap kabar bumi segenap hidup
Joabaldo,elaborasi singkat
Joabaldo,hidup buka
Joabaldo,mati klise
Joabaldo,belas siswa rasul yudas ganti matias rasul paulus persekusi
Joabaldo,salib lari petrus belaga berani sangkal fast hidup
