username,tweet
Joabaldo,anytime fer obrolan
Joabaldo,selesai value pantau isi perut relasi masyarakat
Joabaldo,tuhan taat mati tuhan saved oke
Joabaldo,tuhan ajaib kandung maria sperma yusuf dikandu
Joabaldo,turun adam dosa adam sangsi tugas
Joabaldo,taat selamat taat selamat si
Joabaldo,iya cipta konsep selamat dasar
Joabaldo,pikir abai tolak ber
Joabaldo,fakta susah bicara creatures hasil non
Joabaldo,senang fakta makhluk nama dna dna simpan informasi informasi lucu
Joabaldo,salah wordmu mengetik garis kertas ti
Joabaldo,garis huruf simbol lain-lain cipta non existe
Joabaldo,anytime fer senang gosip
Joabaldo,coba titik salah bentuk kalimat
Joabaldo,oh batu susah gosip tuhan
Joabaldo,eksistensi tuhan gantung tuhan deh pakai manusia
Joabaldo,bagikan alam oke dasar utama bah
Joabaldo,rendah alam tingkat alam sih
Joabaldo,alam tuhan klaim sifat subjektif
Joabaldo,gratis willnya
Joabaldo,unik tuhan gratis bukti tuhan iya
Joabaldo,ekstrimnya ahli papermu
Joabaldo,omong omong contoh sederhana kirim istilah papermu oke
Joabaldo,ultimat dunia tuhan cipta dunia dunia muncul
Joabaldo,premis tuhan dunia tepa
Joabaldo,guru administrator ajar konselor dengar video editor peristiwa organizer
Joabaldo,kejut pukau kutip drama dri
Joabaldo,suasana hati senja
Joabaldo,pergi memakai myself
Joabaldo,tuhan komprehensinya tuhan
Joabaldo,gaji sisa gaji eh senja pinjam
Joabaldo,beda asumsi ambil simpul beda
Joabaldo,asumsi sih dasar usul manusia cipta binatang tuhan aduh
Joabaldo,debatin hak perempuan asumsi manusia laki perempuan hak si
Joabaldo,kadang omong menyambung asumsi
Joabaldo,asumsi alam semesta cipta tuhan
Joabaldo,asumsi cenderung susah bukti realitanya periksa logis sinambung terha
Joabaldo,asumsi percaya manusia kecuali asumsi dasar
Joabaldo,gosip gosip topik menit asumsi menyambung selai
Joabaldo,indikasi sandwich generasi rantai blunders kutuk
Joabaldo,penuh numpang pagi relativisme pikir
Joabaldo,sih newton menemukan hukum newton gara ajar rumah wabah loh
Joabaldo,bodoh inti dinotice
Joabaldo,cenderung setuju pikir tweet saudara laki sarkasme realistis sadar mantap
Joabaldo,pikir tarik
Joabaldo,tawa selagi beban
Joabaldo,iya chris kemarin menawari tinggal nyesuain waktu
Joabaldo,uhuhuhu
Joabaldo,cari jua selagi bandung sa bicara kemarin
Joabaldo,tahun pikir iya biayain kuliah
Joabaldo,eh sorryy ssan sih eheheheh nyonya lee kbbq bandung
Joabaldo,tanggalny saudara laki
Joabaldo,gaji
Joabaldo,area nomor potong pisah
Joabaldo,asyik usernamenya pakai rela pergi iya
Joabaldo,hidup ditawarin gambar oke
Joabaldo,interestingly jumat kemarin mimpi tidur bangun tidur mimpi terkait
Joabaldo,cinta cinta pdf
Joabaldo,gadis elus pipi anak kucing
Joabaldo,pengaruh mode
Joabaldo,traits unknowingly become tutup toddler
Joabaldo,anak temannya saudara nila tawa
Joabaldo,kalah ah
Joabaldo,backsoundnya
Joabaldo,asli video epik
Joabaldo,utama bareng teman mcl seru sengit battlenya solo
Joabaldo,ah iya peluk milik hati magically teleport milik tulang rusuk kandang cause saudara
Joabaldo,mindblowing fakta tarung karakter lvl max lawan lvl max lvl lawan lvl
Joabaldo,maju maju harga kembang iya bandingkan maju sinar
Joabaldo,kemarin dibicarain suar lenan silah dengar kenan
Joabaldo,googlingnya sih tunggu did least look layar
Joabaldo,salah kadang sedih students bilang tunggu goog
Joabaldo,em iya iya misused memenya
Joabaldo,turun
Joabaldo,celetuk dengar kiamat hhahaha
Joabaldo,pengirim
Joabaldo,oh iya rancu iya bicara
Joabaldo,maaf saudara laki armin bicara iya sih dikorbnka
Joabaldo,balas gaji bingung abisinnya suka flexing
Joabaldo,ditawarin teman pandemi curiga malam
Joabaldo,oh ngedate iya asyik cocok eh tua setuju alas iya
Joabaldo,trinitarian monotheist kejut dengar filosofis keren kristen
Joabaldo,iya gambar
Joabaldo,beranda ide bagus tawa
Joabaldo,dengar google apps
Joabaldo,updated rumput tetangga hijau rumput hayo pikir
Joabaldo,meanwhile kotak schrdinger si kucing plans balas dendam
Joabaldo,matkul nang tugas
Joabaldo,amin
Joabaldo,prioritize milik mental sehat nyaman untu
Joabaldo,lupa alih mati cam video temu
Joabaldo,iya openingnya kimetsu yaiba
Joabaldo,januari bangun selai tidur selai tengah meetingnya selai februar
Joabaldo,link guiyar tutup groovenya gila parah
Joabaldo,link suka kei iya
Joabaldo,tawa iya saudara wanita muternya rep
Joabaldo,serius playlistnya
Joabaldo,bersihin kamar nyetel dinamit gurenge
Joabaldo,ask pendeta john puluh principles pribadi produktifitas
Joabaldo,senja pesan hormat bukti kumpul lengkap joab
Joabaldo,alami rekrut tes
Joabaldo,pagi mendengarkan podcast john tiup seruling willing som
Joabaldo,setuju rezeki sih anak
Joabaldo,pulang mampir teman kasih payudara nelponnya
Joabaldo,ruang interchangeably ruang kelas tmi
Joabaldo,ruang ambil balkon detik diupload
Joabaldo,ken kontrak rumah eh
Joabaldo,ajar perhaps keras harap umum kesalahpahaman sebar milik
Joabaldo,traits trustworthy dependable temu representatives alumni alumni proyek comin
Joabaldo,sesal candid momen syukur momen nama hidup dinamis
Joabaldo,ayo semangat ayo tengah
Joabaldo,tinggal penuh rol coaster feelings pikir
Joabaldo,tua wanti paham anak tahun
Joabaldo,biggest decisions hidup tahun signing kontrak knew tahun later
Joabaldo,paham
Joabaldo,juang
Joabaldo,lembur oh breaknya
Joabaldo,candid tweet ajar sih menikah goal saudara
Joabaldo,receh
Joabaldo,iya loh sakit pinggang siksa parah iya wid minggu
Joabaldo,konyol waktu uang wkwwk
Joabaldo,lawan selesai edisi lelah duduk
Joabaldo,syukur panik langkah deh telepon saudara nagi
Joabaldo,eh atm bri rumah menit jalan kaki pakai lapar
Joabaldo,selasa kemarin pegang uang cemil siang jadwal padat rencana sor
Joabaldo,rajin tabung saudara kemarin pinjam laptop rusak kasih bayar
Joabaldo,rekening baca bri saldo baca habis bri limpah
Joabaldo,gaji ngetweet alam konyol
Joabaldo,tiada tolong belok milik camera nyala si students
Joabaldo,anak tiktokan walah twitter april
Joabaldo,backsoundnya
Joabaldo,cerita cenderung klop masala
Joabaldo,mari retweet joab
Joabaldo,iya semangat bahasa inggris konteks siswa jatuh bilang semangat
Joabaldo,iya
Joabaldo,gara kamera layar samping waktu interviewernya bicara awam
Joabaldo,februari wawancara jarak interviewnya rektorat kampus
Joabaldo,oh iya rata sih casenya umur anak
Joabaldo,tua maaf anak anak maa
Joabaldo,anak maaf
Joabaldo,si lurus komunikasi tua iya bilang maklum
Joabaldo,keeps getting stronger
Joabaldo,takes kuat
Joabaldo,tahun tulis tuhan mati ajaib ganti
Joabaldo,eh sources sejarah percaya waktu
Joabaldo,tuhan janji bangkit nepatin janji bangkit kuasa
Joabaldo,reka an rasul mati iya
Joabaldo,bukti bangkit tuhan kuat berani rasul
Joabaldo,tuhan mati konyol bilang bangkit bangkit dis
Joabaldo,tuhan bohong gila anak tuhan bohong susah bawa sa
Joabaldo,omong tuhan anak tuhan konteks yahudi oke
Joabaldo,bukti kebngkitan tuhan mudah didisprove fisi
Joabaldo,kutambahin gosip percaya kristen percaya dasa
Joabaldo,bias asyik eh gosip agama tawa takut bias
Joabaldo,balikin darimana tuhan tuhan ofc jwabannya qur
Joabaldo,hati ken coba papar bukti
Joabaldo,responnya nolak responnya oke coba paham posisi asums
Joabaldo,motif ngebantah alias menang paham sendi
Joabaldo,nolak kasih alas percaya tuhan tuhan inti
Joabaldo,gantung responnya komunikasi cuman sika
Joabaldo,bilang beber bukti oke
Joabaldo,terimakasih wid malu mantap pikir setel
Joabaldo,ateis tokoh alkitab kecewa tuhan kondisi bahka
Joabaldo,lagipula sih fisik vitalitynya rendah tahan cambuk mikul salib kurleb
Joabaldo,pikir tuhan fisik lemah lembut lunglai latar tumbuh
Joabaldo,selai tidur
Joabaldo,weekdays jo si obrolan tonight iya oke tonightnya
Joabaldo,pola pikir bakat pintar pintar hebat obat sembu
Joabaldo,ayo saudara laki mati mesin
Joabaldo,keras gamer
Joabaldo,ihiy
Joabaldo,pikir hubung spesial jatuh penggemar artis
Joabaldo,biasany minder gajiny omong gaji
Joabaldo,gaji workfield beda minder
Joabaldo,minder minder gantung sih minder kare
Joabaldo,mabar saudara mvp bantu
Joabaldo,syukur ilmu beda panggil
Joabaldo,bayangkan percaya tua didik anak anak manusia
Joabaldo,guru turun turun profesi mudah turns lulus ilmu
Joabaldo,iya saudara laki kadang bilang murah perspektif beli produk konten
Joabaldo,libur
Joabaldo,oh mantap
Joabaldo,santai buru hidup mandiri tahun memaksa
Joabaldo,resolusi tahun mudah gagal impi tahun konon resolusi tugas
Joabaldo,solo raja diam
Joabaldo,sengaja dibiarkan menit aman jungler menit efektif junglin
Joabaldo,ejek buta maaf
Joabaldo,resolusi ajar sabar paham fungsi jungler ejek jungler bodoh ngekill ngebuff
Joabaldo,buka rencana putar
Joabaldo,ihiy kirim sticker
Joabaldo,selamat tahun
Joabaldo,selamat haato dokter dokter suruh
Joabaldo,waktu kuliah ken praktek ajar sekolah internasional dengar senior
Joabaldo,relatif mudah
Joabaldo,kritis simpul ambil periksa validitas reliabilitas fakta ki
Joabaldo,manusia asumsi pikir asumsi dasar fakta konteks situasi si
Joabaldo,cinta revolusi adaptasi webtoon
Joabaldo,episode become sehat wasn
Joabaldo,mungkinngapain beli mobil bantu tua bayar
Joabaldo,oh iya gambar saudara persen beda pe
Joabaldo,rekening pisah rekening iya
Joabaldo,dikit gambar
Joabaldo,selamat natal jos
Joabaldo,oh dibolehin iya rumah pacar tawa
Joabaldo,setuju saudara tools inti perilaku impulsif iya
Joabaldo,semester mincot hubung freshgrad pindah kota
Joabaldo,sih putri natal rumah tawa
Joabaldo,selamat natal khalayak twitter
Joabaldo,astaga
Joabaldo,semester
Joabaldo,balas dendam informasi dasar keluarga comeback wkwwk
Joabaldo,sih gaya beli tanda tangan seksi cokelat kental manis coklat kos
Joabaldo,eh sih spoilernya bilang genjustu
Joabaldo,webtoon episodes mimpi pria
Joabaldo,beginnin tahun latih english tahun latih iya bicara ba
Joabaldo,minggu semester sadar tunda selesai hitung menit
Joabaldo,teman suka sembarang panggil dik iya hindar asa sih
Joabaldo,pindah fyuh
Joabaldo,making putus putus pudit pasif putus
Joabaldo,baca fistful pasir si pegang
Joabaldo,memakai pikir bangga bruised bakar
Joabaldo,kuasa ban kota
Joabaldo,misi
Joabaldo,utama permainan online bareng saudara rumah dengar panggil saudara hati ayo saudara
Joabaldo,okeh terimakasih saudara laki
Joabaldo,ketemu bukti saudara laki tarik bio
Joabaldo,mantap nyupirin tugas
Joabaldo,saturday harap mudah mudah panggil pakai nama menyadari panggil pakai honorific
Joabaldo,paksa erti webinar bahasa inggris sub
Joabaldo,setuju rumus fisika kuhapal
Joabaldo,uji papersnya ketemu kuantum fisika anak
Joabaldo,whew materi atom fisika eh bohong kelas semester saudara
Joabaldo,tular hiv duduk minum cemil peluk perhati
Joabaldo,teman suka iya nelpon nang selesai dimatiin
Joabaldo,traktir traktir lengkap laptop
Joabaldo,tuhan kontrol therefore terimakasih situasi
Joabaldo,gratis seks normal
Joabaldo,talking any dasar pengaruh medis ilmu lgbt gera alfred sih
Joabaldo,lgbt hukum pikir kejut pedofilia beastiality hukum
Joabaldo,sayang
Joabaldo,bumi sisi wajah luna beda sudut miring
Joabaldo,teman teman izin menang milik tubuh made menang alas
Joabaldo,senja coba hasil jatuh lompat bodoh
Joabaldo,teman teman carany terbang lucid mimpi
Joabaldo,pakai sabun sinar matahari lemon
Joabaldo,lupa pakai masker anak laki
Joabaldo,april juni sukarelawan kepala kantor rumah sakit swasta indonesia mengecek apd data
Joabaldo,ajar iya uji
Joabaldo,ajar momen materi kuliah mudeng paham cepat
Joabaldo,minggu gaji lipat baca ngutang tua
Joabaldo,harap name tulis nyala his buku
Joabaldo,telepon
Joabaldo,wahahaaha iya mantap pusing
Joabaldo,semangat saudara ajar rencana temu iya
Joabaldo,guru nama ajar rencana rencana ajar administratif rencana bagus si
Joabaldo,formal evaluasi guru ajar materi atom fisika kelas sa
Joabaldo,senja perut payudara panas sakit gila
Joabaldo,luna gila gila lunar dulunya pikir posisi gila
Joabaldo,saking jarang sentuh atom fisika kejut ajar bab mengajari kimia dasar
Joabaldo,tarik panas atom gera elektron jos
Joabaldo,kemarin dengar bicara jo cari pasang umur tolong
Joabaldo,tuhan bejat
Joabaldo,pegawai penjara
Joabaldo,terima kasih pesan senior
Joabaldo,si oke taruh did
Joabaldo,buku beliau
Joabaldo,weeknend
Joabaldo,hapus
Joabaldo,mantap profesor sambung podcastku kemarin
Joabaldo,john sih lennox iya dunia filled robot makhluk
Joabaldo,tuhan exists genocide coronavirus calamities dunia
Joabaldo,webinar beliau
Joabaldo,suka curhat waktu ken curhat
Joabaldo,diketemuin mantan guru sekolah jepang konsult
Joabaldo,guru freshgrad bingung rumah sungkan ba
Joabaldo,eh tahun ganti kurikulum
Joabaldo,susah payah ajar ib diploma program paham seluk beluk celahny
Joabaldo,beli motor iya kredit hutang ringan gonta ganti telepon iya
Joabaldo,moral storynya teman keburu hati mutualan iya
Joabaldo,pindah sakit foya selagi promosi makan foya foya gaji
Joabaldo,waktu bandung kos murah
Joabaldo,cemil gaji waktu habis makan
Joabaldo,foto dijelasin iya foya foya foto bilang gaji
Joabaldo,tweet kandung tengah
Joabaldo,iya flexing
Joabaldo,habis gaji lawan gaji
Joabaldo,pria yudisium wisuda
Joabaldo,selimut keingetan teman pikir bau selimut bau bau indrawi baca
Joabaldo,habis ngelaundry selimut bau tipikal iya memakai selimut kemarin
Joabaldo,adit asing dengn blablabla rumah iya dit
Joabaldo,earning hemat investing spending pesan ll fine
Joabaldo,sembuh sakit bangkit mati ampun dosa standar moral baca
Joabaldo,tuhan klaim tuhan senang fakta hukum mati klaim layak tuhan
Joabaldo,panas keringat acara yudisium hayo
Joabaldo,dana darurat sentuh goals nabung capai
Joabaldo,fakta kejut contoh bangun selai pagi pikir tidur
Joabaldo,joab guru salah sekolah bandung semester datengin gedung sekolah
Joabaldo,episode
Joabaldo,lagu pretender sih
Joabaldo,undang webinar keren eh harga tiket jtan iya
Joabaldo,habis hours tulis penuh halaman
Joabaldo,heran kompleks planet made debu batu seems
Joabaldo,jos tulis abstrak konkrit awang awang darat
Joabaldo,eh video youtube iya
Joabaldo,curiga tonton mastiin
Joabaldo,tips putar video zoom temu bagikan layar bagikan linknya
Joabaldo,kenang atom fisika deh dipelajarin
Joabaldo,silabus pikir mengajari atom fisika siswa kelas
Joabaldo,coba kerjain selesai menit siswa selesai waktu menit lelah
Joabaldo,prinsip ulang kerjain cepat ekpektasi waktu ulang menit tawa
Joabaldo,asyik susah mudah paham cemil waktu menit
Joabaldo,episode coba elaborasi konflik virus dunia klaim tuhan matahari
Joabaldo,dengar google apps
Joabaldo,episode
Joabaldo,kuat iya
Joabaldo,kantor lawan rumah foto handuk tetangga
Joabaldo,elaborasi tutup yuzo kalimat penuh kasih si sakit
Joabaldo,waktu hitung iya sesuai kemampua
Joabaldo,hitung iya pamrih transaksional ing
Joabaldo,yuzo adhinarta bilang hitung
Joabaldo,selamat libur libur nikmat paksa produktif iya selamat yan
Joabaldo,saudara laki paket keluarga
Joabaldo,eh kuliah tanggung loh
Joabaldo,gaji gaji potong iya potong bpjs pajak lain-lain eh bpjsku kelas
Joabaldo,tipsnya bahas podcast hehehehe
Joabaldo,tambang emas cari emas penuh lantas cuil emas pekerjaa
Joabaldo,bangga baca nyentuh angka mwehehehe iya kepala si
Joabaldo,iya wid sayang rumah kucing kostan
Joabaldo,teman nelpon jelasin nang selesai nang telepon dimatiin
Joabaldo,kantor
Joabaldo,myself two kontradiktif pesan kontradiktif isn
Joabaldo,pleasure
Joabaldo,iya torsi proporsional gaya tor
Joabaldo,ah sadar bilang lb
Joabaldo,diikutin salah iya keseluruha
Joabaldo,saudara laki minggu gosip podcast bareng teman monggo
Joabaldo,ilmu situ maklum guru tawa coba cari
Joabaldo,oalah silah tawa
Joabaldo,yanh tweet etta
Joabaldo,pikir generasi tua sih generasi buruk
Joabaldo,hidup serba atur paham tua bilang uang dompet
Joabaldo,intens pria avengers
Joabaldo,dunia nikah episode klimaks episode nunjukkim
Joabaldo,inisiasi podcast januari kemarin ketemu jakarta jalan jalanny perpusnas
Joabaldo,dengar google apps
Joabaldo,ngobrol bareng
Joabaldo,standar apresiasi tumpah
Joabaldo,em kirim pria gadis iya wkwwk beda
Joabaldo,gadis lawan pria
Joabaldo,senja moodnya ngebagiin semangat teman
Joabaldo,gelisah tingkat langit tujuh
Joabaldo,astaga iya iya nyala atom tingkat doesn sentuh each therefore contacts
Joabaldo,astaga ndin habis tweetmu mengecek tawa
Joabaldo,eh bantu masak masak jual cemil pria tular iya
Joabaldo,bandung temenin saudara tingkat pandemi
Joabaldo,rujuk turun gen biologis
Joabaldo,klaim lgbt ubah pegang bukti konkrit nan ilmiah tawa
Joabaldo,gregetnya bayar pakai debet kartu uang sisa gesek ros habis
Joabaldo,ditweet jerome lagu teman teman
Joabaldo,monggo nikmat
Joabaldo,tim eh whatsapp mode an iya
Joabaldo,hafal efektif taruh kondisi jus
Joabaldo,pikir argumen tuhan cipta manusia sah manusia berd
Joabaldo,oh temu incest diizinkn tuhan
Joabaldo,acu saudara setuju misi
Joabaldo,pakai kantor
Joabaldo,percaya tuhan dunia luka bahas podcast
Joabaldo,tuhan cipta alam semesta henti corona dunia
Joabaldo,doa tuhan cipta manusia akal budi dunia oke
Joabaldo,habis tengah warga tinggal tuhan doa manjur
Joabaldo,whatever currently percaya jesus nazareth hutang selidik thoroughly makes li
Joabaldo,anggar budgetku mentok eh dipakai diskon lain-lain
Joabaldo,iya dianggarin butuh anggar kelia
Joabaldo,bukti cemil puas hehehehehe
Joabaldo,alur terimakasih later
Joabaldo,hebat iya gaji khawatir uang puji tuhan
Joabaldo,iya korban bodoh
Joabaldo,cegah iya dokter sosialisasi masyarakat sih si
Joabaldo,ditanyain
Joabaldo,informasi
Joabaldo,selesai baca minggu sih hehehehehe buku filsafat eh jatuhn
Joabaldo,bilang contoh
Joabaldo,aah bahas podcast
Joabaldo,bungg
Joabaldo,diretweet
Joabaldo,produktif
Joabaldo,pikir kejut iya rela mati istri selamat minggu khalayak
Joabaldo,lokasi teks alkitab tuntut suami asih istri kristus asih jemaat
Joabaldo,meanwhile alkitab bilang istri tunduk suami tunduk posisi wanita
Joabaldo,told tawa
Joabaldo,eh eh eh
Joabaldo,pikir tarik
Joabaldo,dengar google apps
Joabaldo,isi senja coba ngobrolin isi buku periksa
Joabaldo,judul buku salah tulis kristen jerry bridges situ pe
Joabaldo,pandemi bawa derita sengsara luka muncul
Joabaldo,iya langkah aduh tua riwayat sakit takut
Joabaldo,terimakasih saudara
Joabaldo,eh bicara setuju setuju mudeng mudeng
Joabaldo,ngetweet admin
Joabaldo,picu kumpul ramai kemarin keluarga waktu
Joabaldo,keluarga whatsapp bicara rindu bicara tinggal
Joabaldo,utama atom sih tendencynya setuju kuantum mekanik
Joabaldo,doa
Joabaldo,susah kualitas guru tuntut lingkung tinggi iya permainan si
Joabaldo,gelisah rekan profesional sih syukur ketemu ajar
Joabaldo,rata rekan ekspat lulus negeri lulus kampus nama peng
Joabaldo,salah susah kubagiin
Joabaldo,tolong teman teman dukung
Joabaldo,gosip belaga keren gumul
Joabaldo,sebentar keren iya bicara alam tahun sekolah internasional
Joabaldo,prinsip archimedes terap gravitasi
Joabaldo,ngubah berat jenis memaksa
Joabaldo,omong omong ayo fluida aplikasi konsep archimedes kondisi
Joabaldo,penjelasanny sih gaya luas tekan
Joabaldo,beda bahasa
Joabaldo,iya hambat udara terminologi konteks gaya udara paham hambat
Joabaldo,gabung online kapel mahasiswa talking guru kontrak guru umum contr
Joabaldo,wha oke terimakasih saudara laki
Joabaldo,batal
Joabaldo,bahas acak guru fisika fisika terjun bebas
Joabaldo,asyik logika egoistic
Joabaldo,id menghancurkan gedung id sesuai tata tertit iya
Joabaldo,saudara laki lanjutkan bangung bangun minecraft heheheh
Joabaldo,semangat saudara wanita padat
Joabaldo,tulis sih si lewis baca hidup dunia sempit sesak belaka
Joabaldo,fisika ajar bentuk hadiah ulang manusia batas
Joabaldo,setor minggu tugas tua siswa ajar rencana ajar
Joabaldo,batal
Joabaldo,kejut surely senang translator milik buku nyala
Joabaldo,tidur
Joabaldo,dengar google apps
Joabaldo,rindu suara mari rapat
Joabaldo,nakut ah kemarin harap nakut
Joabaldo,detik eh balas buang detik ah harga waktu
Joabaldo,amin
Joabaldo,kapasitas tes batas hasil angka sekian sadar
Joabaldo,nyampain pikir menngunakannya
Joabaldo,pikir bohong kadang muncul dokter indonesia luas wajar ang
Joabaldo,debat saudara keluarga jakarta kepenge
Joabaldo,eh saudara laki iman dasar bukti memp
Joabaldo,maaf maaf saudara laki kasar iya tua saudara laki tinggal tular
Joabaldo,anggap sopan iya eh derajat beda
Joabaldo,materi besok
Joabaldo,berhubungan suka umpama akurat hubung
Joabaldo,baca buku bahas waktu bahas podcast bahas rumit buku buku
Joabaldo,dengar google apps
Joabaldo,baca buku aileen riady iya temu nyala podcast
Joabaldo,rumah beli meja kursi nyaman mahal pinggang kaki lantai
Joabaldo,ayo teman teman cemil
Joabaldo,laptop cerita
Joabaldo,rumah lengkap meja kursi earphone
Joabaldo,kain
Joabaldo,gali puji tuhan buah kursi iya puji tuhan
Joabaldo,lupa toko distribusi barang pabrik beli kurir yan
Joabaldo,pilih bahan bahan kursi kokoh nan nyaman bahan mentah tuhan cipta dar
Joabaldo,kursi desain hikmat tuhan ikan desain kursi
Joabaldo,gosip percaya pintar alam ketrampilan ajar lain-lain
Joabaldo,iya gaji beli gaji sekolah ypph percaya
Joabaldo,kursi meja susul responsif nyepelein
Joabaldo,henti karen aktif situ aktif
Joabaldo,sadar uang tengah gaji
Joabaldo,degdegan waktu habisin wishlist tokopedia sensasi ajib
Joabaldo,kacau adeknya keren
Joabaldo,obat sih
Joabaldo,butuh ubah
Joabaldo,paham alkitab isi firman tuhan hidup twitter firman suka keliru sempurna
Joabaldo,lupa buka ekspektasi alkitab twitter
Joabaldo,gantung posisi lawan bicara situasi kondisi
Joabaldo,merta salah karakter komunikasi tua dewasa yan
Joabaldo,komunikasi tua cenderung tekan perintah oran
Joabaldo,ajar karakter gaya digunakn komunikasi
Joabaldo,coret moret materi podcast selesai rekam
Joabaldo,buruk putus putus far hebat fail hasil
Joabaldo,habis tunggu lagu direact rev chris jolly asyik
Joabaldo,si buruk jisoo si garis pendek
Joabaldo,iya bilang es creamnya jennie
Joabaldo,debat bilang es krim tunggal blackpinkxselena gomez jennie lawan lena rencana putar jisoo bicara
Joabaldo,beli motor cuci kaki jalan kaki dis
Joabaldo,okeh
Joabaldo,uji salah
Joabaldo,lulus jurus deh fakultas
Joabaldo,kuliah pikir ajar bahasa sunda bahasa sekian teman sund
Joabaldo,lagu taylor cepat kasih known puluh seconds puluh tahun
Joabaldo,sesuai imajinasi imajinasi
Joabaldo,lucu otak suka isi celah imajinasi imajinasi ragu leb
Joabaldo,iya celah kenal kenal celah kenal
Joabaldo,iya waktu ngobrol lebar enggan isi celah kenal saudara
Joabaldo,beli bagus nyaman ofc mahal nila iya hitung hitung investasi sehat
Joabaldo,rumah lantai siksa pinggang kaki ken beli meja kursi sebentar
Joabaldo,bisnis produk cantik
Joabaldo,jo bisnis curiga tolak tarik
Joabaldo,teman teman ken melek finansial bagikan video kait jenius ngeshare kode invitasi
Joabaldo,tingkat utama prosotan motogp
Joabaldo,bosan kenyang menu uji tawa
Joabaldo,sih pagi gila roti pcs roti ribu tahan selai susu harga ribu
Joabaldo,asih asih bantu susah
Joabaldo,habis bahas pikir bahas umum luas
Joabaldo,iya dar tema podcast target kalang pribadi tawa
Joabaldo,bungkus isi gosip ldran
Joabaldo,dengar google
Joabaldo,saudara kirim uang
Joabaldo,overtinking pagi senja tidur
Joabaldo,tema podcast selesai habis iya
Joabaldo,pagi sekolah eh lulus tidur guru larang
Joabaldo,iya tweetku pikir sepi gilir tweet ala ide copas jaman bahula ramai
Joabaldo,cinta saudara rekening
Joabaldo,disinformasi pagi sekolah virtual iya saudara
Joabaldo,aspek bagus laksana dasar fondasi kuat
Joabaldo,kirim suka sembarang stiker pikir bawa
Joabaldo,aparat yayasan bagus
Joabaldo,tawa terimakasih terimakasih youu
Joabaldo,tawa sekolah negeri bolos kejer
Joabaldo,selesai briefing pagi saudara wanita wkwkwwk
Joabaldo,sekolah swasta terkait
Joabaldo,iya iya eh buka grnyaa
Joabaldo,pagi sekolah eh lulus tidur guru bangun
Joabaldo,mapel siswa paham bilang joab salah ngajat
Joabaldo,guru takut salah ajar salah ajar mapelnya si
Joabaldo,siang tunda tunda eh telepon seberang nang nang
Joabaldo,salah alas minimalisir tunda
Joabaldo,kedip iya suka tingkah konyol jisoo
Joabaldo,suka nunda parah sibuk teman ah joab nunda
Joabaldo,pandemi paksa
Joabaldo,loh jumat
Joabaldo,kejut foto masak
Joabaldo,lupa foto wokeh
Joabaldo,pindah kamar kamar asrama ramai
Joabaldo,pindah mhsw pindah kamar menemani teman habis operasi pindah
Joabaldo,pindah minor suasana diitung maret minggu hitung pindah
Joabaldo,spotify premium tenang
Joabaldo,iya tidur
Joabaldo,bayar iya
Joabaldo,pikir
Joabaldo,terlambat dikit ndapapa iya
Joabaldo,besok iya ry laptop
Joabaldo,iya kemas dengn tarik suka filsafat alias pikir pikir
Joabaldo,filsafat korelasi hidup langkah lan
Joabaldo,senja minggu isi rekam podcast hubungan jarak hubungan jarak ajak teman hubungan jarak relevan
Joabaldo,evaluation pressuring butuh berterimakasih
Joabaldo,podcast tawa putar apologetik renung pimpin misi
Joabaldo,kembang karir coba ulas pakai model alam didik eksposur buah utas
Joabaldo,praktik sadar kategori omong omong lupa buku direko
Joabaldo,baca buku direkomendasiin dekan dosen senior mendengarkan podcast tangan sibuk tugas
Joabaldo,batal
Joabaldo,newbie alam hebat alam
Joabaldo,video keren topang koreografi konsisten tanding cutsnya ajib
Joabaldo,asyik
Joabaldo,jiwa engkau tekan gelisah capai bersa
Joabaldo,dengar erti susah susah alami menang
Joabaldo,bicara idealis pikir sentuh awan bangkit jatuh
Joabaldo,dengar berlalut puruk lelah
Joabaldo,cenderung peka situasi bahan evaluasi
Joabaldo,dengar yoursef dengar isi hati bicara tegur
Joabaldo,dengar bicara
Joabaldo,pagi suram beban berat sesal muncul plong siswa ketawa
Joabaldo,dengar spotify
Joabaldo,juang syukur sih tumbuh juang obrol putar tapak dunia
Joabaldo,tolong catat tolerir butuh
Joabaldo,guru arsitek arsitek jiwa
Joabaldo,ahay
Joabaldo,iya iya tuan
Joabaldo,dikerjain selesai iya
Joabaldo,kampus asrama ngerasanya mahasiswa unapproachable dunia beda sendir
Joabaldo,gengsi kalang fakultas didik saudara laki langgar iya oke
Joabaldo,buka laptop eh batal deh matiin
Joabaldo,oh iya superficially butuh any tuhan dunia
Joabaldo,tunggu mute his iman ilmu
Joabaldo,butuh iman any tuhan alam semesta enough waktu ilmu able
Joabaldo,pesta pora
Joabaldo,oh bonus
Joabaldo,prinsip admin becomes misi
Joabaldo,flexing gelembung bungkus
Joabaldo,beli gelembung bungkus ngurangin beban rumah
