username,tweet
kepikbesar,lesgo
kepikbesar,batal
kepikbesar,beli habis gigi ngilu
kepikbesar,ayo an otter daki his perahu lari lapar orca
kepikbesar,gila hormat maaf ganggu profesionalisme manee oh oke terimakasih
kepikbesar,sambat saudara wanita iq marah barang posisi penuh pakai id brand
kepikbesar,aneh psbb alias yaudahlah
kepikbesar,bajing fine tunggal cinta seconds musim panas
kepikbesar,dimana jess instagram
kepikbesar,kucing kais ngelupas waktu sakit kais sembuh
kepikbesar,mnyt
kepikbesar,kucing says terimakasih
kepikbesar,kriwil gengs buluna
kepikbesar,bangun tidur buka instagram ngumpatnya leluasa rek suara
kepikbesar,batal
kepikbesar,sekesel kesal macet banjir cuy rindu ujung
kepikbesar,idols memakai uang copyrights royalties moonbyul wanita daftar certi
kepikbesar,say kebelet
kepikbesar,horor kuliah
kepikbesar,sos edisi
kepikbesar,yeet
kepikbesar,cemil kucing gratis mengambil cemil kucing kucing jalan temu baca
kepikbesar,texting memakai wan bicara gores kering kotor
kepikbesar,meanwhile waktu ojek online saudara wanita kemudi bawa eh iya saudara laki lupa malu anjim
kepikbesar,nombok iya
kepikbesar,tolong patahin batang leher saudara wanita
kepikbesar,konten pov najisin iya huek
kepikbesar,beritau miy
kepikbesar,iya bunda
kepikbesar,kutuk cantik
kepikbesar,tombol retweet
kepikbesar,kucing asks si indah rutin every tunggal
kepikbesar,nobody wants unless cinta
kepikbesar,beliau vaksin
kepikbesar,hore vaksin gratis
kepikbesar,yeay selamat sehat sehat alzana milik
kepikbesar,tom layar tears misi mustahil awak kapal following corona safetyprotocols
kepikbesar,salah salah usul coba maskara kantuk tolong
kepikbesar,pikir cure everytime didn played lagu
kepikbesar,apaansi gjls
kepikbesar,batal
kepikbesar,salah
kepikbesar,normalize normalize keras
kepikbesar,mental alias celamitan anjeng malu
kepikbesar,tell akun ramal tugas jessy campur
kepikbesar,an hebat tahun together jesy has made putus tinggal campur an incredibly sedih waktu
kepikbesar,tolong selesai ditolongin kesal
kepikbesar,iya tuhan cepat iya tuhan omong omong mamat ulangtaun
kepikbesar,oke
kepikbesar,pakai kiri si houses saudara wanita
kepikbesar,pikir aplikasi burung biru cari zodoh sayang tidaa haduu leluasa pakai aplikasi
kepikbesar,usul tugas arang bebas
kepikbesar,tulis tawa
kepikbesar,nang
kepikbesar,batal
kepikbesar,loh ngamok
kepikbesar,selesai bodoh natal tenang
kepikbesar,tawa logo gelandangan pengemis iya ampun
kepikbesar,rilis youtube salah film pendek teman teman dukacita anak
kepikbesar,cinta kaca bilang gila muka lucu imut najes iyuhh saudara
kepikbesar,semoga mudah tarik
kepikbesar,wanita buys tidur gantung beruang keluarga comes rumah cinta
kepikbesar,milik sanggup ngebiayain anabulnya oke turun takut terny
kepikbesar,tolong buka donasi barangkali bantu kucing kantor kantor saudara
kepikbesar,aneh vaksin gratis korupsi coba dasar negara norak
kepikbesar,nyonya pakai wetfood coba pancing pakai krimitrit adaptasi elus
kepikbesar,iya
kepikbesar,anggota dpr hormat keluarga ban ayo
kepikbesar,lepas utama rumah takut
kepikbesar,hak manusia kuasa semangkuk bakso
kepikbesar,meletnya slengki
kepikbesar,cinta terimakasih
kepikbesar,takut sih candid
kepikbesar,batal
kepikbesar,setuju
kepikbesar,bright
kepikbesar,nonik
kepikbesar,batal
kepikbesar,menyarankan biaya dokter setuju cob
kepikbesar,pengirim terbaik kayaknya kucing
kepikbesar,saran dokter waktu periksa
kepikbesar,kaum lindung
kepikbesar,nobody percaya
kepikbesar,bajing donated otak cells pagi otak energi
kepikbesar,sial negara panas gerah gerah
kepikbesar,bajing doin taking ulang woke tidur
kepikbesar,batal
kepikbesar,bekel bawa pulang ajesi indonesia sebentar bekel hensenizezezer waktu
kepikbesar,tanggal tugas comfortable santai silence baca bajing bicara
kepikbesar,bebs
kepikbesar,emas retriever grows favorit main
kepikbesar,reinkarnasi bolekah tertawa
kepikbesar,unduh aplikasi ajar bahasa inggris duolingo umum bebas rahasia tinggal coba
kepikbesar,batal
kepikbesar,astaga sabar
kepikbesar,batal
kepikbesar,senang boi getting haircut
kepikbesar,chubby pokemon wobblyshika instagram
kepikbesar,batal
kepikbesar,pria kucing cair hati
kepikbesar,foto tahun tahun kayaknya malu tawa bangga sih bilang nyan
kepikbesar,tonton konser
kepikbesar,wwkwkwk teliti tema
kepikbesar,pusink
kepikbesar,pemilihan kepala daerah hati hati habis mencoblos bodoh
kepikbesar,tolong lupa sos
kepikbesar,tawa
kepikbesar,indah syalala dunia putus sial malu
kepikbesar,tuhan kucing tawa tawa tetangga perang pintu menengok menengok rumpi ahelah
kepikbesar,batuk coba bawa dokter hewan uang konsul hallodoc
kepikbesar,tolong babu rusak
kepikbesar,hujan kayaknya bingung mencoblos paslonnya hujan ujann
kepikbesar,selai subuh zombie bangun
kepikbesar,tetiba nyanyi ramadhan ramadhan marhaban iya ramadhan ken tobat
kepikbesar,sial
kepikbesar,ayo biarawati malu
kepikbesar,batal
kepikbesar,suruh cemil daun
kepikbesar,suasana natal ngeributin selamat natal
kepikbesar,didnt pergi rencana thelandofboggs instagram
kepikbesar,batal
kepikbesar,iya pergi unggah foto kucing rumah rindu iya
kepikbesar,batal
kepikbesar,cuamat ci
kepikbesar,depok kota coban corona backfired zombie apocalypse depok
kepikbesar,ormas sono resah
kepikbesar,tolong bantu spirtus lingkar cahaya kenal sarah milik biadab nama spirtus spirtus sakit
kepikbesar,netizen disodorin galhadot tawa munafiq tugas bersih
kepikbesar,hujan ken ndu ndue uang gudang
kepikbesar,anak teknologi nama mcd ayam kasih serbet tawa
kepikbesar,edit tawa
kepikbesar,um sih aware bersihin sampah kotak sih habis pip anak anjing bersihin
kepikbesar,gadis kelompok menang dunia gemar pilih hadiah harap
kepikbesar,senang made moomoo
kepikbesar,congratulations menang puncak dunia penggemar pilih hadiah mnet asi musik hadiah
kepikbesar,informasi mamamoo menang dunia penggemar pilih selamat
kepikbesar,tren celebrate mamamoo si menang moos si tren tags kirim gadis milik cinta congratulation que
kepikbesar,pakai sih kayaknya nunjukin
kepikbesar,terima bansos anak ikan kaleng cemil pakai kerupuk
kepikbesar,nurani pade kemane sih akhlak bingung
kepikbesar,nafas beliau lega hak rakyat butuh situasi kondisi susah enta
kepikbesar,beli masker lucu slot tisu miong deh
kepikbesar,buka donasi kucing tolong bantu sembuh kucing
kepikbesar,batal
kepikbesar,hates cepat chillax
kepikbesar,kucing kahfi butuh bantu teman teman memperkenalkan kcg temu jalan kahfi jagakarta jaksel
kepikbesar,paham
kepikbesar,teh
kepikbesar,gila asli
kepikbesar,informasi jessi hwasa kolaborasi tampil lagu hujan gang besok sumber newsen
kepikbesar,iya non lipsyc performances tunggu collab tahap
kepikbesar,ampun gusti tawa
kepikbesar,did gila tuhan maaf
kepikbesar,sayang hayoo janji rusak bahagia wishing terbaik
kepikbesar,payudara selera bous
kepikbesar,megah humpback
kepikbesar,kawaii setan bunuh cosplay
kepikbesar,sumpah aneh aneh
kepikbesar,sinar bayi sinar
kepikbesar,tolong pagi menemukan anak jalan nama putih kondisi jalan
kepikbesar,rumah sadar iklan online toko iya biadab napas
kepikbesar,isi sebar semangat
kepikbesar,jakbar bantu
kepikbesar,uwa lucu lucu produk beli
kepikbesar,ah bodoh tawa
kepikbesar,hapal tawa titik salah muncul label anak gab
kepikbesar,canggung lulus used sungguh tutup
kepikbesar,beli pwesee kasih
kepikbesar,bodoh gjls sih biarawati
kepikbesar,diampunin iya
kepikbesar,someday ll capai tahap hidup
kepikbesar,beranda kilometer makes senang ibadah bahagia sendir
kepikbesar,irih bilang bos pale pale pale bertrand
kepikbesar,utas fotografi saudara
kepikbesar,gelut
kepikbesar,malu anak sih asli
kepikbesar,nurun iya anjeng nama panggil nama agus gblg tawa
kepikbesar,teman berakhlakul karimah utas
kepikbesar,terbang habis
kepikbesar,senang celebrate
kepikbesar,hua standar pria mentok nerbener si pergi keras temu sih
kepikbesar,bodoh pantat terima
kepikbesar,marah rumah cemil setrika baju beli barang pokony
kepikbesar,terimakasih
kepikbesar,salah fokus sejuk rumah
kepikbesar,sungguh pergi waktu together terimakasih
kepikbesar,nyala titik
kepikbesar,wahahanjeng
kepikbesar,yagimana say tertolaque
kepikbesar,visual saudara laki kun ckckck ndapapa deng rindu tinggal main lagu
kepikbesar,maaf tobat ehe
kepikbesar,instagram
kepikbesar,terimakasih spending minutes tahun nyala
kepikbesar,batal
kepikbesar,oalaahh oke terimakasih infonyaa
kepikbesar,underpad sih ukur kucing hamil
kepikbesar,anjing manusia
kepikbesar,sorop tamat
kepikbesar,ramah tengah pandemi tolong baca iya tolong penti
kepikbesar,jangka flutd kontrol pakai baut minum
kepikbesar,pura pura ndatau say
kepikbesar,batal
kepikbesar,gemoy andai kucing anteng gendong pakai tangan
kepikbesar,percaya cuaca ampuh suasana hati cerah angin suasana hati
kepikbesar,uwa makas jalan periksa
kepikbesar,woah semangat semoga
kepikbesar,batal
kepikbesar,pikir
kepikbesar,saran salur tutor hydroponic
kepikbesar,aduh ken hydroponic dinding kosong rumah tugas nandur oi
kepikbesar,jenis trees milik cities
kepikbesar,netizen kreatif terimakasih memenya edukatif bodoh habis canda saudara laki
kepikbesar,turun napaa
kepikbesar,kutuk keras tindak teror batas manusia sigi sulawesi tengah tindak biadab
kepikbesar,batal
kepikbesar,si sakit
kepikbesar,bayang milik
kepikbesar,muka gaikhlas
kepikbesar,lupa ronde begimana cemil
kepikbesar,sembuh
kepikbesar,jaring gusdurian duka cita peristiwa milu dusun tokelemo desa lembantongoa camat palol
kepikbesar,terimakasih hidup baca harga bayi makas habisin uang maaf iya
kepikbesar,hua andai majikan spesies
kepikbesar,warna hilang dunia
kepikbesar,bantu rt mbababu cerita salah instagram komunitas kucing surabaya periksa
kepikbesar,batal
kepikbesar,si oke least coba terimakasih si enough
kepikbesar,paham konsep romantis hujan hujan motor dingin su
kepikbesar,kelapa saudara wanita saudara laki
kepikbesar,buka donasi twitter tolong milik sihir nama ilma kucing calici
kepikbesar,gigi copot
kepikbesar,maaf sangka buka donasi hindarin opdon kucing sakit
kepikbesar,mantan majikan dudung
kepikbesar,gadis karir tinggi hasil pria pria minder deketinnya pria pria
kepikbesar,sial khusyu berak kucing ngeong bela buka pintu pakai clana eh sih
kepikbesar,gagal pendekatan disuka secondlead hidup
kepikbesar,kuping ggomo whe lucu
kepikbesar,harap terorist tangkap adil adil semoga menganggu
kepikbesar,senang
kepikbesar,gadis godain cowonya kesal gilir kesal iya iya
kepikbesar,rapat pbb pakai bahasa sunda
kepikbesar,saudara laki jalan
kepikbesar,badan atletis muka imut
kepikbesar,batal
kepikbesar,pikir edaswong instagram
kepikbesar,batal
kepikbesar,look godzilla gede otter kotaro hana instagram
kepikbesar,pura pura
kepikbesar,anak tiktok indonesian idola
kepikbesar,pergi si sakit
kepikbesar,kcg saudara wanita duduk aneh kaki ngangkang iya
kepikbesar,bohong ngejauh ndapapa yan
kepikbesar,pikir etik mudah gadis definitely salah tawa tanggap obrolan convo
kepikbesar,iya iya saudara wanita tenaga surya iya heyy
kepikbesar,minggu kecewa huray
kepikbesar,bodoamat peduli iya sial rada rada nyut
kepikbesar,pikir ajar alam sial
kepikbesar,asik utama trampoline
kepikbesar,tahun moonbyul
kepikbesar,kemarin beli varian kopi oke
kepikbesar,tungguin mati
kepikbesar,marah hooman mengganggu ngerusak barang masyaallah
kepikbesar,cemil keren anjeng anjeng tawa
kepikbesar,panggul has jual over juta units cina
kepikbesar,akumah cemil jaman jepang saudara
kepikbesar,cemil pagi
kepikbesar,lovatos gaya nyala tingkat
kepikbesar,fastest kucing hidup
kepikbesar,batal
kepikbesar,kayaknya pengirim semoga pikir wujud sih
kepikbesar,cerita sayang tahun pergi
kepikbesar,jurnal internasional ilmu direct tumpeh tumpeh cari
kepikbesar,sos accepting hadiah lagu tahun aria hadiah bangga congratulations
kepikbesar,lingkar cahaya teman teman bantu obat mendung mendung temu tambo
kepikbesar,ayo semangat gairah trabas kerjain tugas semester
kepikbesar,iya tuhan looked santa
kepikbesar,cinta butuh terimakasih
kepikbesar,an unforgettable liliyana natsir
kepikbesar,anak hogwarts cerita whatsaap iya utas
kepikbesar,grammy tahun su ks
kepikbesar,sos unfortunately did serah any musik considered grammys
kepikbesar,istirahat kecewa butuh jeda
kepikbesar,takut parah bawa kayaknya besok malam kasih udara kelapa hijau disuapin basah
kepikbesar,eh salah cinta yola
kepikbesar,cinta fajar
kepikbesar,maaf bantu bb berhenti sumbang sih coba naikin bb
kepikbesar,beranda bb an
kepikbesar,buah mengadakan
kepikbesar,blog bodoh
kepikbesar,tetangga normal terima
kepikbesar,ayo keluarga mentingin tetangga anak ahahahasu
kepikbesar,ken cemil alpukat atoga buah naga
kepikbesar,pakai daster makeupan tante tante
kepikbesar,potong nanggung panget su
kepikbesar,batal
kepikbesar,mungil anak kucing runs bushes pilih
kepikbesar,saudara wanita
kepikbesar,hitung hitungan sayang eh hitung an diam
kepikbesar,overheard iya lumayan hormat sih putri indonesia latar png
kepikbesar,kesal jijik gedek yuk silah mwah
kepikbesar,suka diunyel unyel kesal jerawat muncul habis pegang camera tembak outdoor pegang kuci
kepikbesar,sadar jakarta macet
kepikbesar,told his momma did mengomongnya tangan tawa
kepikbesar,cemil ketoprak maestro musik dominikilikili somalak somplemo uce kulek somtong
kepikbesar,tangkap kucing jalan jakarta kucing hasil tangkap kucing
kepikbesar,lupa pilih nyala website mungut suara apps si memakai mamamoo comeback terbaik oke rt
kepikbesar,iya tuhan kasih iya iya
kepikbesar,waits cuci mesin favorit blankie
kepikbesar,ketik register spasi kirim
kepikbesar,hitung hitung jajan kucing gula plz telepon meh
kepikbesar,iya sial kucing dimainin kandang dikeluarin ngana
kepikbesar,iya goblo
kepikbesar,suasana hati asli tawa
kepikbesar,iya tuhan minggu sakit rebah bom
kepikbesar,pipi halus sih mantap rawat kulit asil
kepikbesar,sakit milik daerah madebytio instagram
kepikbesar,lawan pergi grandma si rumah
kepikbesar,batal
kepikbesar,cuy keren ajar
kepikbesar,monggo ngecor cangkeme tonggone holcim hadir kemas praktis
kepikbesar,cinta bayi wheein tantrum
kepikbesar,sexiest edit ve made mamamoo
kepikbesar,tidur nikmat iya
kepikbesar,huaa prihatin efek kayaknya baca egois bua
kepikbesar,saudara wanita australian pita called seconds musim panas
kepikbesar,sih ngobrol canda canda canda ujung marah bajing
kepikbesar,kucing has hidup purrseal instagram
kepikbesar,jual jakarta ken
kepikbesar,bodoh kebrisikan anak kurung say
kepikbesar,gedung iya segar cari gedung mobil
kepikbesar,voted nyala matahari
kepikbesar,mamamoo seasons greetings concept foto moonbyul
kepikbesar,singa si
kepikbesar,hooman
kepikbesar,si suka lupa pilih moos voted nyala
kepikbesar,meowrror michel instagram
kepikbesar,bodoh ghostingin peduli tulus
kepikbesar,batal
kepikbesar,si moomoo
kepikbesar,moos pilih alir voted nyala matahari
kepikbesar,retweet percaya moos menang terimakasih moos voted nyala
kepikbesar,si tingkat views nyala resmi salur mungut suara ends global mv views hitung dunia
kepikbesar,voted nyala matahari
kepikbesar,batal
kepikbesar,performing artis tolong warm selamat mamamoo gerbang
kepikbesar,chubby senior chihuahua turns anak anjing once gets his keluarga
kepikbesar,moos lupa pilih alir voted nyala matahari
kepikbesar,cemil lebaran
kepikbesar,ken sentil kuping drama saudara hih
kepikbesar,batal
kepikbesar,salah
kepikbesar,coca cola christmas arah oscar menang direktur taika waititi istirahat tissues http
kepikbesar,moral berhenti juang second dorong each keras ambil energi int
kepikbesar,wanita watches neighbors abai senior kucing decides has
kepikbesar,voted nyala matahari
kepikbesar,moos lupa alir pilih nyala mcd whosfan voted nyala
kepikbesar,lin instagram
kepikbesar,terimakasih milik keras milik gairah milik cinta milik bahagia four queens beda generations kelompok
kepikbesar,voted nyala matahari
kepikbesar,voted nyala matahari
kepikbesar,heres resmi pilih tolong rt voted nyala matahari
kepikbesar,voted nyala matahari
kepikbesar,batal
kepikbesar,ketawa ketawa ketawa ketawa ketawa ketawa ketawa sedih sebentar
kepikbesar,nyekel nyanyi ki
kepikbesar,biadab batuk ketawa
kepikbesar,batal
kepikbesar,tawa suruh mengetik coba
kepikbesar,oomfs pilih mamamoo nyala mcountdown lebar celah balas ss voted nyala
kepikbesar,tolong perhati saudara wanita saudara laki budak cinta motor pelan iya tengah loh nyalip kagok
kepikbesar,setel lagu andal habis turun tawa
kepikbesar,iya tuhan super sedih sibuk butuh alir ambil assi
kepikbesar,tugas cemil pusing lemas cemil kantuk malas gerak
kepikbesar,memakai suara studio vers
kepikbesar,penuh lagu korea trax fm lagu korea kontraxan diramein ngobrol ngobrol bareng mamam
kepikbesar,umm kucing bawa hitam warna gelap coba ki
kepikbesar,sindir
kepikbesar,voted nyala matahari
kepikbesar,voted nyala matahari
kepikbesar,nang tulis
kepikbesar,ulang tahun ayo roti panggang
kepikbesar,milik streaming mungut suara voted nyala matahari
kepikbesar,lovato reaction pics koleksi utas
kepikbesar,kemarin tugas cemil pilus kesal tugas pilus lempar lempar ulang
kepikbesar,couldn cats spends hours feeding strays
kepikbesar,alir dinga pilih nyala mubeat voted nyala
kepikbesar,lelah pikir aneh aneh waktu tidur
kepikbesar,inti ttm hubung cerita pribadi
kepikbesar,hilang somebody shouldn hilang
kepikbesar,voted nyala matahari
kepikbesar,rumah lindung badai
kepikbesar,voted nyala matahari
kepikbesar,kasih hangat belikan susu kucing disuapin selai koreksi si
kepikbesar,goblo goblo iya ajar republik indonesia
kepikbesar,tawa awkoakwoako
kepikbesar,goblo salah ketik
kepikbesar,odeng lawson hujan hujan beginu
kepikbesar,retweet mamamoo beyonce temu voted nyala
kepikbesar,apani bagikan informasi
kepikbesar,babu habis awat habis serang buriq
kepikbesar,kcg gais tolong menemukan kucing tolong hubungin nomor tera ilangnya malam daera
kepikbesar,scrolling goldengirl xena instagram
kepikbesar,voted nyala matahari
kepikbesar,boys milik kacau timlom tim joness instagram
kepikbesar,seksi yong through milik beranda rt tweet turun milik votes voted nyala
kepikbesar,si pilih retweet ot voted nyala matahari
kepikbesar,voted nyala matahari
kepikbesar,ll unggah voted nyala
kepikbesar,gemar pilih mungut suara pesta baca doing bagus moos butuh balas milik votes retweet si
kepikbesar,every rt hitung pilih si wheein mr removed within si tema
kepikbesar,bakat
kepikbesar,dingga retak puncak nyala melon charts terkini puncak voted nyala
kepikbesar,bodoh pusing
kepikbesar,tolong rt moos voted nyala matahari
kepikbesar,ragu mamamoo si vokal
kepikbesar,memakai ownernya iya tolong bayang mengnya saudara
kepikbesar,true friends memakai upaya malu
kepikbesar,milik friends did cerita cerita
kepikbesar,kue wafer remukk paruh cemil sisa nyembur teman
kepikbesar,gila pakai olahraga bra pakai kane
kepikbesar,byul si rap truly mamamoo si favorit
kepikbesar,hyejin
kepikbesar,hype memakai tren happened maria
kepikbesar,kasih susu
kepikbesar,batal
kepikbesar,deciding makan milik gadis logeypump instagram
kepikbesar,licik
kepikbesar,moonbyul terbaik wanita rapper pergi gadis
kepikbesar,iklan salin based keren naskah brilian iklan adegan har
kepikbesar,albums nyala wrldwide itunes jalan positions cinta goes fatal cinta
kepikbesar,saudara laki brand mini album debuts nyala dunia itunes album arang
kepikbesar,hebat
kepikbesar,kuat visuals kuat vocals looking penuh paket mamamoo gadis kelompok butuh
kepikbesar,waktu standar tengah motor tawa
kepikbesar,rare jahe albino bulu segel anak anjing
kepikbesar,overtook positions titik itunes dunia itunes album grafik tangis radish
kepikbesar,informasi mv peringkat youtube dunia tren kategori musik video video tren
kepikbesar,batal
kepikbesar,mamamooid si tahun giveaway jalan lingkar cahaya lobak mantul mamamooid jalan pem
kepikbesar,nerss mamamoo comeback tittle tracknya kompleks sih coba rekomendasi mamamoo
