username,tweet
kepikbesar,afirmasi tawa gasayang mantan gara bilang
kepikbesar,magoosh macemnya toefl ajar vocab lain-lain
kepikbesar,lipat wasit sportif salah henti reli buah aksi ter
kepikbesar,umpat kuntul
kepikbesar,aduh video baca jurnal loh akses mudah teliti
kepikbesar,pasuk waktu kamar bau counterpain koyo tolak angin usia
kepikbesar,sadar serang panas area pantai wilayah industri kuliah
kepikbesar,kasih
kepikbesar,jalan kaki pulang jalan kaki ai isolasi pulang kawal
kepikbesar,sih sisa donasi oke biaya oke miing dokter hewan
kepikbesar,kawan tawa sial tawa salah fokus
kepikbesar,hormat gadis keren tawa terkait bibir profesional
kepikbesar,utama indonesia paksa wo sayang bwf lepas tangan regulasi sinkron pikir
kepikbesar,batal england profesyonel
kepikbesar,prestigious turnamen pantat
kepikbesar,pergi bos ujung telusur eventnya misi
kepikbesar,moonbyul bagus iya
kepikbesar,batal
kepikbesar,manipulative muka pegi
kepikbesar,ken heelsnya getah tugas
kepikbesar,harga
kepikbesar,pengirim sekte bilang gondrong rambut sengaja potong
kepikbesar,nang celana luntur ngumpulin uang beli iya sampah
kepikbesar,diam tawa
kepikbesar,yeay semangat
kepikbesar,sksksk subuh mandi pengirim dingin habis renang
kepikbesar,keluh dikerjain sikap profesional jalan hidup
kepikbesar,oiya lupa kah
kepikbesar,angkut pengirim
kepikbesar,according televisi olahraga si informasi danish kamp positif corona uji india thai
kepikbesar,bismillah tahun selesain skripsi lulus kuliah amin mampir profil tolong larang
kepikbesar,usaha iya sayang iya sukses beliau diam
kepikbesar,teman batak waktu beliau rumah tugas bilang anak kuliah anak
kepikbesar,kucing kentut sik
kepikbesar,revisi asked keluh kerjain lulus
kepikbesar,iya iya
kepikbesar,anjeng
kepikbesar,rumah toko buruk kota arsitektur ide mati ujung
kepikbesar,salah dunia ngerogoh saku celana eh temu uang cuci kering
kepikbesar,pagi hebat
kepikbesar,mantap mengnya makmur belikan rc desa
kepikbesar,bicara angy
kepikbesar,latih anak kos kah saudara
kepikbesar,nyala instagrams nyala twitter
kepikbesar,ah oke dicatat terimakasih informasi saudara laki lancar rezeki sehat mengnya
kepikbesar,pakai df iya suka area rumah doyan df
kepikbesar,tumpahin meng tumpahin udara omong omong saudara laki waktu jalan feeding dukuh
kepikbesar,malas gerak cemil nyuap nasi ken
kepikbesar,gemas oren
kepikbesar,sobat shopee moomoo ramein mamamoo shopee mega belanja televisi tanggal april admin giveaway
kepikbesar,meowningh
kepikbesar,indah dunia twitter
kepikbesar,dengkleng belah bahu
kepikbesar,putar laptop malas bersihin debu molor
kepikbesar,pusing suasana hati
kepikbesar,camil kos suka biscuits sih gal bijih sarri gandum cemil
kepikbesar,kebun binatang ondel ondel dukuh bawa kilogram cemil kucing kucing
kepikbesar,subhaana rabbiyal adhiimi wabihamdihi
kepikbesar,menaksir
kepikbesar,ajar malu
kepikbesar,sumpah goublok jodoh ketemu ngegoshting halah kuntul ngamok
kepikbesar,rambut gondrong sih yagimana anak gadis
kepikbesar,pantau selai kenal tangis tunggu berani titik saudara
kepikbesar,iya tuhan ken kenal
kepikbesar,batal
kepikbesar,tunggu bajing
kepikbesar,duwa anak baiq
kepikbesar,ariana grande rekam vocals collaboration lovato demis upcoming album
kepikbesar,mobil lempar sampah plastik rahang kudanil coba kuat warga twitter lemp
kepikbesar,becomes girlgroup juta total unik listeners nyala melon
kepikbesar,jual murah kucing barbar fresh alphamidiy tawa abur
kepikbesar,aduh haloo terimakasii
kepikbesar,malu cinta
kepikbesar,toilet edisi
kepikbesar,deng jia xi mahasiswa umur tahun tembak mati aparat aman myanmar temu pakai kaos ev
kepikbesar,gadis boyfriends pandemi attend sos konser
kepikbesar,hujan hujan motor
kepikbesar,penggemar puncak model akuin intp kurs seri terbaik antm
kepikbesar,diputuskan disamperin rumah pakai celana pendek hoodie rias iya
kepikbesar,pakai normal kering pipi halus kenyel lembab beli
kepikbesar,rendang sambal hijau kentang goreng bilang kurus sih cemil diam
kepikbesar,album mamamoo hilang dibeginikan
kepikbesar,funniest tolong cinta sos
kepikbesar,pukuli sih
kepikbesar,slightest ubah hubung milik tindak teduh
kepikbesar,saudara wanita candid kecewa utama utama paham
kepikbesar,sembab habis minum obat kantuk bawa kendara periksa
kepikbesar,suka hardik loh diciptain tuhan cela besok keselek tinggal
kepikbesar,selamat bayi semoga mengalir teroz
kepikbesar,batal
kepikbesar,batal
kepikbesar,tangis saudara wanita
kepikbesar,vaksinasi corona atlet nasional gelora karno pagi sehat jalan protokol
kepikbesar,fotoshot edisi horor
kepikbesar,pergi mules pergi mules berak republik indonesia
kepikbesar,twitter tolong milik sihir pagi teman kucing rumah tanggannya terpo
kepikbesar,cinta milik bagus looking indah st
kepikbesar,alex rindu
kepikbesar,butuh bantu
kepikbesar,ajar konten twt dianggep serius tawa apani sial logam
kepikbesar,bentar puasa menu buka puasa
kepikbesar,enek dengar grafis organizer
kepikbesar,figur biarkan banjir parah kasih solusi sih kapa
kepikbesar,ll ambil ll beli romantis tanggal sos merch
kepikbesar,kamar mandi sumpah risih pakai bersihin pakai pribadi
kepikbesar,niat hati cari hibur istirahat teliti ketemu pasang malas
kepikbesar,bayi sos photos use proyek
kepikbesar,warga jakarta january alhamdulillah banjir february yeh anju inimah judul geser
kepikbesar,lovato reflects nyala overdosis urus efek
kepikbesar,lovato isnt pegang premieres maret nyala youtube tonton penuh tra
kepikbesar,meong
kepikbesar,cari referensi ajar tulis strategies susah iya pikir
kepikbesar,tawa barbar iya ganti pakai kayu sangga kuat bahan foto cepat rusak pengirim
kepikbesar,raw suara indah sahabat
kepikbesar,stressed
kepikbesar,acar komplit
kepikbesar,tampan potensi bintang iklan
kepikbesar,such bagus sos stans
kepikbesar,sos lyrics beda utas
kepikbesar,bohong mampos tipu tipu
kepikbesar,daritadi diam menyimak bodoh gala bawa kao malu bodoh
kepikbesar,temenin cemil kue lapis gigit
kepikbesar,turun milik kucing tanah nyala his kaki
kepikbesar,sangka bolong daun monstera sangka sikeras daun provokasi
kepikbesar,selamat pagi kepik bom tidur tidur anjeng
kepikbesar,thinkin abt gemar told calum didn enough uang pergi sos konser his dompet
kepikbesar,tolak lupa video
kepikbesar,finds anjing renang miles offshore becomes his
kepikbesar,yogyakarta tugu yogyakarta awkoawko
kepikbesar,sos recreating old pictures terbaik
kepikbesar,ngetiknya tawa asli
kepikbesar,kucing takut tukang sampah iya tuhan angkut sampah rumah
kepikbesar,canda dimasukkin skills cv
kepikbesar,meanwhile trid saudara laki saudara wanita ramai maaf lupa unamenya
kepikbesar,butuh bagikan milik keluarga friends bagus second buka warmindo
kepikbesar,istirahat nguli
kepikbesar,obat sial meant botol
kepikbesar,pembenci tawa suasana hati
kepikbesar,mahasiswa ambil tulis pokok skripsi
kepikbesar,coba tanggal kucing milik rumit
kepikbesar,tawa suka bingung kucing gendut galak terima kejar sial lari engap
kepikbesar,kucing main terimakasih kucing mcdonald si sedot dropped nyala lantai wakil renung
kepikbesar,doing
kepikbesar,menyimpan swatches lippie beli beli alias warna cocok nada kulit
kepikbesar,batal
kepikbesar,indah laut hidup vr
kepikbesar,wii telapak tangan gatal tanda uwang nabok
kepikbesar,sentuh sosial disty
kepikbesar,otak otak
kepikbesar,lingkar cahaya salah nakes rumah sakit yogyakarta izin bagikan cerita inspirasi iya jaga rumah sakit pandemi
kepikbesar,anak cari adopter steril anak ambil ib
kepikbesar,saudara laki cerita penjara saudara laki
kepikbesar,gengsi sekolah negeri jakarta sangkal dikorbanin
kepikbesar,ah iya kumpul dasar cenderung jelek dasar lingkar iya
kepikbesar,baju mini siswa pakai baju mini geng alasan pakai baj
kepikbesar,senang kotor fakta jalan tengah lapang sorakin lempar pakai barang boto
kepikbesar,guru anak kelas kasih lantai
kepikbesar,gelap bahasa tawa
kepikbesar,bruh
kepikbesar,sholat dzuhurnya sengaja ashar wudhu kentut
kepikbesar,sahur cemil pisang menang
kepikbesar,besok puasa nang
kepikbesar,ketemu teman ngobrol si oke sebar cakap sopan te
kepikbesar,iya tuhan nang lucu
kepikbesar,budak cinta ambil uang alami penyalahgunaan dimanfaatin dijahatin racun tugas
kepikbesar,oh dimana did pergi
kepikbesar,rumah yippi imlek suka tunggu kirim kue keranjang teman alhamdulillah
kepikbesar,wheesa lari lambat instead lari moomoos gave latar musik
kepikbesar,suasana hati days
kepikbesar,twitter tolong yout sihir bantu rt jumpa tua salah nama
kepikbesar,serious tawa
kepikbesar,sends
kepikbesar,sakit biadab melarat iya otak pakai halal halal loh hidup faedah
kepikbesar,habis pikir baca twt tweet kepala pecah ringan bilang oke
kepikbesar,rahang dislebew sadar lof ayo
kepikbesar,mimpi tato wiw
kepikbesar,yuhuu seru nih
kepikbesar,pengirim tubi suka suka dimusuhin balas sih bodohie menfessnya
kepikbesar,si bicara kuasa sos owned during dunia perang gembira wisata
kepikbesar,pesan santun generasi santai
kepikbesar,tawa peluru kendali
kepikbesar,percaya isu
kepikbesar,breaking dunia pria si doubles pasang marcus fernaldi gideon kevin sanjaya sukamuljo
kepikbesar,teman teman memperkenalkan ezra henti kuliah pandemi kuliah berkat
kepikbesar,sih pastiin minum bagus kucing kucing cemil
kepikbesar,bom selingkuh selingkuh
kepikbesar,huaa keburu pulang jakarta niat cari
kepikbesar,cari kemarin waktu pulang magelang sedih cemil waktu
kepikbesar,pov
kepikbesar,neraka iya
kepikbesar,loncat sus
kepikbesar,video tawa balas tawa ditunjukin sih
kepikbesar,batal
kepikbesar,suka kesi romantisasi hidup goal senang tolong menikah
kepikbesar,balur hangat sih
kepikbesar,oke informasi balur bayi hangat akal
kepikbesar,efek hangat bawang minyak ton iya saudara
kepikbesar,aneh sih artikel bilang situ teliti bawang
kepikbesar,berani
kepikbesar,masker acne menstruasi acne
kepikbesar,ah pipnya menempel pinggir sampah kotak serok pecah eman
kepikbesar,bentar pip kucing menempel iya sampah kotak mengambil pip pakai ser
kepikbesar,becoming sempurna perfectionist gambar utas perfeksionis terkadang tekan
kepikbesar,kyot
kepikbesar,tawa kesi korban grooming
kepikbesar,pria behind indonesia si prestasi pria si doubles bangga
kepikbesar,insta cerita
kepikbesar,tty kemarin dukung menang dukung kalah iya tawa
kepikbesar,saksi atlet indonesia laga turnamen internasional minggu akh
kepikbesar,uang
kepikbesar,daddies menang hatiqu
kepikbesar,daddies menang
kepikbesar,minum susu cerdas
kepikbesar,anders antonsen loves near shuttlecock
kepikbesar,tonton seri iya tuhan tolong saudara wanita selai
kepikbesar,berhenti investing energi
kepikbesar,bodoh ketawa tinggalkan sial asli uang pakein
kepikbesar,pokok tanding otomatis pusing kolesterol tinggi
kepikbesar,hasil hendra setiawan has reached least individual each tahun gener
kepikbesar,daddies iya tuhan alhamdulillah malam oke
kepikbesar,coba pakai madu sekian jambu biji merah madu
kepikbesar,hendra ahsan pakai baju koneng
kepikbesar,ah nostalgia sih tonton tanding sesal sedegdegan cause
kepikbesar,daddies utama besok permainan lawan koriya pokok semangat utama tolong pria
kepikbesar,pegang tangan sehat bapack bapack
kepikbesar,wkwkk tuhkan benul
kepikbesar,ahsan hendra emas olympic
kepikbesar,acak ken cemil bolu ulang tahun bolu ulang tahun
kepikbesar,ngeganjel kalah negara belah bagus berita mute televisi pacar utama
kepikbesar,michael tweeting ashton tweeting sos
kepikbesar,scars milik indah
kepikbesar,pasang semangat ban lahan laki insekyur mokondo
kepikbesar,lemas tonton badminton
kepikbesar,bom rezeki
kepikbesar,ngungsi toilet iya sial tolong iya tuhan tolong
kepikbesar,tonton greyap tolong menang
kepikbesar,batal
kepikbesar,oh gave hebat memories two months senang ulang tahun seret urself turun
kepikbesar,twitter aneh tiktok bodoh tolerir bodoh gblg noo disgustinng
kepikbesar,breaking congratulations mohammad ahsan istri lahir bayi gadis barakallah semoga
kepikbesar,harap kucing sekolah meong meong
kepikbesar,curi momen
kepikbesar,cinta debm videos pakai tolong tolong mute
kepikbesar,trendingnya kait gosip iya menyebalkan
kepikbesar,tawa saudara ngalay bahagia
kepikbesar,duh
kepikbesar,ratu tty lelah kah
kepikbesar,flandy eng hian bekas raih perunggu og latih indonesia lawan malaysia wd
kepikbesar,batal
kepikbesar,layan morten embun beku
kepikbesar,cium pipi nunjukin peduli sayang manis aman beda
kepikbesar,nyawa daddies mujur ganteng waktu diaminin
kepikbesar,twitter aneh iya atur sipil agama bolehin cemil hewan ter
kepikbesar,sumpah ganyangka cita cita nanggung
kepikbesar,martabak apaka selamat tinggal saudara laki martabak langgan corona
kepikbesar,canda kucing oren aduh gambar
kepikbesar,ayo lurus permainan ayo daddies greyap hafglo
kepikbesar,salah ketik biadab bukti gemeterannya
kepikbesar,suci kotor karet titik yabg gemeteran wkwkwkk
kepikbesar,netnot
kepikbesar,mohammad hasan hendra setiawan lawan vladimir ivanov ivan sozonov
kepikbesar,coba dengar suara sintas simpang hidup mati icu sadar
kepikbesar,pengirim balas obat hasil bilang
kepikbesar,keilangan ridho bous harta hilang
kepikbesar,told lately saudara wanita
kepikbesar,batal
kepikbesar,buka media sosial ketrigger buka media sosial ketrigger
kepikbesar,kadang alam determines tanding hasil turnamen menang delap waktu po
kepikbesar,lucu sih
kepikbesar,cemil didatangi anak diliatin kcg
kepikbesar,regardless cerewet netizen bilang jakarta scbd sudirman video ob
kepikbesar,senang tahun ulang tahun multitalented
kepikbesar,gambar kelompok terbang salah fokus
kepikbesar,senang ulang tahun second memeable anggota sos sensasi bodacious calum kap
kepikbesar,tenang seconds musim panas
kepikbesar,kucing minum udara kulkas turutin eh sakit
kepikbesar,tawa panggil kucing cantik cemil cantik cemil
kepikbesar,lovato christina aguilera served ikonik collaboration
kepikbesar,kasih bantu diinjek injek tinggalkan alas roban
kepikbesar,wanita rescues kucing parking becomes obsessed husband
kepikbesar,rambak mie rengginang iya tuhan pokok
kepikbesar,waktu saudara laki foto sih anu bom tubuh sih anu mantap saudara laki tipe tipe tipe sih bagikan link
kepikbesar,oh teman rias kompetisi webinar bengkel
kepikbesar,jurus tata rias kemarin cerita teman bagikan webinar rias karakter foto
kepikbesar,bawa bahagia mie minggir
kepikbesar,sf hans kristian solberg vittinghus lawan anders antonsen super
kepikbesar,ndapapa rezeki semoga hoki bajing lucu
kepikbesar,ahsan hendra percaya
kepikbesar,stronger laddies bajing
kepikbesar,batal
kepikbesar,komentator suara gemeter duluan sksksk degdegser
kepikbesar,suara lapang TV
kepikbesar,percaya dunia peran imbang hidup paksa
kepikbesar,tenang hidup seru pedih xixi
kepikbesar,tolong kirim bosan cemil mie tahun tawa
kepikbesar,tawa iya lupa phobia huehue maaf
kepikbesar,perahu sundul tamat tawa paus nabrak
kepikbesar,ngadoin cuih terimakasih
kepikbesar,sih gantung kucing pipis anak anjing
kepikbesar,tahun mie milik
kepikbesar,ayo ayo
kepikbesar,celaka jalan tolong bingung tua kepleset kamar mandi jalan anak lompat jatu
kepikbesar,cerewet
kepikbesar,tawa sape sih
kepikbesar,bodoh hitung hitungan
kepikbesar,adil
kepikbesar,foto waktu selamat jamur belek melek kurus sisa
kepikbesar,hakim
kepikbesar,anak jakarta kasih kuat dengen
kepikbesar,batal
kepikbesar,nyaut rentennya saudara wanita lari pulang rumah bilang nyaut
kepikbesar,beli roti susu bilang aneh gerai buka sepi
kepikbesar,beli renten subuh tutup besok kasih ownernya
kepikbesar,tahun sekolah langgan gerai waktu bilang beli roti
kepikbesar,keluarga doyan jenis roti situ an beli nama roti renten semacem roti tawa
kepikbesar,suka belikan roti susu kotak rumah usaha roti rumah bia
kepikbesar,alasan jarak pergi pagi habis sholat subuh kendara umum hindarin macetn
kepikbesar,madu kehlani
kepikbesar,cerita lumayan creepy maljum asli tipu tipu wak
kepikbesar,marah tonton
kepikbesar,heran dunia doesn putar surga made doesn meant wh
kepikbesar,bentuk corona
kepikbesar,iya bunuh haraam making someones hidup sedih titik wan ambil hidup haraam
kepikbesar,batal
kepikbesar,lantai ekspektasi realita
kepikbesar,indonesia salah iblis iya salah miskin
kepikbesar,debby susanto waris cita cita ayah tangis olimpiade
kepikbesar,merpati bawa an zaitun cabang memakai damai each
kepikbesar,cocok deskrip daddies legenda
kepikbesar,buruk selamat tinggal
kepikbesar,main sublime ketrampilan mohammad ahsan ends gila rapat umum
kepikbesar,sehat otak pengirim biarkan kotoran manusia macen
kepikbesar,mesti beda jaman ulama musuh jaman
kepikbesar,gila gilee netijen komennya pedas tanding fajri pramel tawa kesal gemas
kepikbesar,kewl
kepikbesar,tahan ahsan hendra mantap legenda
kepikbesar,batal
kepikbesar,menang oscar sayang tawa
kepikbesar,banjir kalimantan jokowi akibat curah hujan tinggi tampung udara aktivis lingkung bilang
kepikbesar,internasional dagang
kepikbesar,oh kotor influencer moved twt
kepikbesar,wi ayo saudara wanita cepat bilang masup TV
kepikbesar,indonesia musibah bule bule bodoh kepala
kepikbesar,normalize buang bule laut
kepikbesar,fandom had members kelompok nominated terbaik solo artis
kepikbesar,anjing sengaja breaks his favorit batu waits patiently batu operasi
kepikbesar,used bagus simpan myself oke
kepikbesar,suhu sih jakarta
kepikbesar,harap bajing dengar gerak bal tindak
kepikbesar,tanda habis cemil kenyang
kepikbesar,bal americans indonesians nutshell
kepikbesar,americans bal murah tanah mudah pajak hindar called alas purwo lokal
kepikbesar,kucing si favorit kucing tunggu til says cinta
kepikbesar,maaf terbaik started pergi cinta
kepikbesar,indonesian twitter during bule bal konflik
kepikbesar,butuh made cause twitter made gila
kepikbesar,anyone curious deleted sembunyi bal utas
kepikbesar,tingkah sebrang aduh ngerepotin
kepikbesar,isi kepala anjak dewasa cari ajak bicara begaya
kepikbesar,periksa informasi steril akun tanda
kepikbesar,periksa informasi dom jakbar omong omong jakbar pesan
kepikbesar,beda sih harga ketemu subsidi oke kal
kepikbesar,pakai masker jerawat pindah daerah pipi dagu dahal pandemi umur umur jerawat
kepikbesar,titip pesan
kepikbesar,uwaamet ultang tahun gimbul ayo palakin babu tawa omong omong dititipin menfess
kepikbesar,kucing steril tangis asli ganti bio pokona
kepikbesar,buka pesan iya dititipin
kepikbesar,senang sportmanship shown melati
kepikbesar,steril kucing puasa tega cemil
kepikbesar,mudah memar bahaya sih utas sih angin hujan badan memar memar
kepikbesar,an auditor an ekstrim olahraga tolong
kepikbesar,kucing keeps hancur his si apartemen gets anak kucing saudara grows teror
kepikbesar,twitter tolong milik sihir putus jalan akibat bencana banjir area kalsel lumpuh total
kepikbesar,coba pakai seaweed
kepikbesar,kalsel aman nunda ngungsi sikonnya semoga cepat surut banjir
kepikbesar,santai koentji
kepikbesar,poo maria suara asli campur
kepikbesar,daddies bom rezeki ayo semangat tawa
kepikbesar,degdegan badminton
kepikbesar,ala boi tawa
kepikbesar,ramai vaksin an jelasin eficacy vaksin sinovac uji klinis fase indonesia hasil
kepikbesar,salju
kepikbesar,ngikik cerdas
kepikbesar,tersesat istiqlal
kepikbesar,pokmon macaron
kepikbesar,dukacita
kepikbesar,anjim telepon jatuh muka batang hidung sakit duka
kepikbesar,selagi bahas profesor muthalib jrg ekspos cerita dikit beliau
kepikbesar,bilang jembatan panci
kepikbesar,akademik sih pengirim rangking waras kuliah semester muda tua begimana
kepikbesar,cekit cekit napas sebentar saudara laki
kepikbesar,bajing sepi hati pedih
kepikbesar,batal
kepikbesar,tipes
kepikbesar,bahagia hubung koneksi karier amin
kepikbesar,kasih boneka nderr kemarin anak kucing sodaranya mati tinggal sisa habis rewel oke
kepikbesar,asked fajar alfian his rambut colour tonton wawancara
kepikbesar,saudara wanita
kepikbesar,anak magelang dibodo bodoin stupa isi tampung udara injek stupa tugas
kepikbesar,hampers toko oren sih isi kerudung lain-lain
kepikbesar,caught kucing studying anatomi dokter making
kepikbesar,sksksk tell em
kepikbesar,oke si pendek rambut
kepikbesar,semoga sehat iya steril lob ayo
kepikbesar,degdegan asli tanggal semoga lancar lancar doa guis
kepikbesar,rumah pindah selai rumah pikir ah rumah bi
kepikbesar,trailer nussa film bangga film anime selam
kepikbesar,bom pakai sih ss loreal hijau asli matte muka kal
kepikbesar,batal
kepikbesar,youngblood went titik nyala puncak streamed songs waktu nyala spotify lagu nyala memakai
kepikbesar,bcd kemarin
kepikbesar,every podcast
kepikbesar,lof ayo
kepikbesar,pesona memakai vokal kelompok
kepikbesar,tonton avatar korra nila tonton episode ragu
kepikbesar,yay tinggal tambahkan syal kerah bagus
kepikbesar,ingetnya iklan beng beng biadab
kepikbesar,wanita papuan wanita
kepikbesar,tonton kafe wisata latte pacar iya bubuk susu sih
kepikbesar,bentuk ubah iya warna paham anu genetika secanggi
kepikbesar,link
kepikbesar,doa belasungkawa gosip firasat cocoklogi bagikan foto foto korban bahas cerita tera
kepikbesar,faceshield masker bentuk bodoh tonton
kepikbesar,batal
kepikbesar,anak anjing meets dogs kucing bayi tunggu til keluarga foto
kepikbesar,times celaka doing any tolong digging sangka victims socials buruk releasing daftar
kepikbesar,emis kotor
kepikbesar,batal
kepikbesar,batal
kepikbesar,detik percaya aduh
kepikbesar,duka celaka sriwijaya udara semoga cepat amin foto korban tolong sebar
kepikbesar,teriak old seconds musim panas
kepikbesar,susah hidup kayaknya karma susah habis nang
kepikbesar,tetiba tlfn dek maaf iya salah memaafi bohong memaafi jahat oke
kepikbesar,ruff pergi nyala listening gupitaro instagram
kepikbesar,rules gratis letidgouw guyur guyur
kepikbesar,cinta an buka dor
kepikbesar,pagi main lagu disney rekomendasi spotify alias gemoy alias ken nyanyi
kepikbesar,ashton nyala instagram doing calum barang
kepikbesar,tawa pusing gara dubbing nemo tawa
kepikbesar,simpang anak kucing chooses pasangan nyala libur simpan his hidup
kepikbesar,informasi steril bom balesan saudara wanita disiapin uang loh
kepikbesar,sos once tinggal ain murah absolutely entirely
kepikbesar,kuasa ceban alhamdulillah hasil patungan bansos ceban disalurin salah firda
kepikbesar,selamat tinggal selamat tinggal saudara maaf babu iya maaf telaten kasih
kepikbesar,ouch
kepikbesar,mmps
kepikbesar,anak snuggles tangis anak sombong anak durhaka bakti
kepikbesar,indah
kepikbesar,simpan titik
kepikbesar,siblings tarung corgi barney heulynn thecorgi instagram
kepikbesar,batal
kepikbesar,sadja jarak
kepikbesar,hyang saudara laki hyang saudara laki alat kelamin
kepikbesar,rumah nakal diumah anak
kepikbesar,terimakasih milik keras aman badminton asosiasi thailand
kepikbesar,ngeyel pakai masker alesannya pengap ayo panutan babah ahsan
kepikbesar,twt ss tangis
kepikbesar,rantam
kepikbesar,sempolan satria apaya betah jajan huehue
kepikbesar,hujan khawatir banjir kucing nang nang suara hujan angin
kepikbesar,batal
kepikbesar,periksa alat removes darah clots
kepikbesar,batal
kepikbesar,turtle
kepikbesar,peri jalan jungraphy instagram kanagawa prefecture jepang
kepikbesar,temu kafe tertawa
kepikbesar,latar gmail ubah sih konsep pakai saudara laki buka email oke
kepikbesar,hua iya foto
kepikbesar,xixi
kepikbesar,qp qyuti pai
kepikbesar,resolusi muluk muluk tahun tahun dukung usaha dengar
kepikbesar,lepas akurat anak kasih daritadi putar cari dokter hewan tutup
kepikbesar,ou ketemu
kepikbesar,wajar sih adekku beli
kepikbesar,batal
kepikbesar,wonder leher pedih kayatheshepherd instagram
kepikbesar,camera burik heran
kepikbesar,batal
kepikbesar,tahan pacar motor jalan tengah pelan ngobrol menjenguk
kepikbesar,buka donasi kucing bora buka donasi straycat kasih nama bora kucing domestik tortie ber
kepikbesar,baca wot ngelus payudara dosa coba besok
kepikbesar,nama kode switching nama kode mixing ajar bahasa faktor mempeng
kepikbesar,tahun sponsor daddies
kepikbesar,lomari
kepikbesar,hubung ajar chances value takut
kepikbesar,pengirim emosi tahun coba ajar kualitas pe
kepikbesar,senang tahun semoga tahun berkah bawa
kepikbesar,tahun
kepikbesar,puluh puluh tahun raya kejut tugas
kepikbesar,harap raya wisuda kuliah
kepikbesar,kodrat tua kah anak salah lulus sekolah iya
kepikbesar,lebaran ulang tahun wisuda tahun bos sksksksk
kepikbesar,sih keluarga gembira keluarga iya okede
kepikbesar,jurus apas tawa
kepikbesar,batal
kepikbesar,batal
kepikbesar,ken muka tawa
kepikbesar,none tunggal soul
kepikbesar,istigfar
kepikbesar,iya tuhan yess sedih
kepikbesar,tawa gaji bilang lillahita ala tipe bilang mengajari anak sen
kepikbesar,suka pagi pagi mandi sebentar lapar cemil mules mules
kepikbesar,foto flipp bagus foto muka flipp gelandangan pengemis belah
kepikbesar,hir wi pergi egen
kepikbesar,batal
kepikbesar,miracles happened
kepikbesar,batal
kepikbesar,kelas lupa matiin mic nyanyi lagu tiktok dosen sahabat pale pale palee
kepikbesar,buka twt kesini istigfar terimakasih twt iman
kepikbesar,kabar
kepikbesar,suka tawa musim dingin cocok pakai baju hangat
kepikbesar,merah warna
kepikbesar,guru tinggi bagus kelas whenever guru tinggi buruk kelas whenever
kepikbesar,indah cakepopsicles rymondtn instagram
kepikbesar,kebun binatang catcalling sungguh
kepikbesar,sederhana bahagia
kepikbesar,tarzan wannabe
kepikbesar,teriaq
kepikbesar,benci salah hidup
kepikbesar,sepi
kepikbesar,harap memakai
kepikbesar,iya tuhan hamba kepiting mentality iya tuhan amin sanggup
kepikbesar,dospem
kepikbesar,kucing kais jalan normal sakit selang kulit iya
kepikbesar,aduh kucing dititipin pulang desa sakit batuk ngerawat malika
kepikbesar,dih
kepikbesar,bawa kantuk pulang arah jakarta sakit pakai mascara hapus pintar
kepikbesar,rendah iya pintar manis hebat istirahat iya
kepikbesar,memakai senyum
kepikbesar,oh omong omong panggil ayo panggil ayo happ
kepikbesar,dih gagal pindah nyala iya tulus iya bodoh
kepikbesar,iya maaf
kepikbesar,minus libur lelah kuota boros iya anjenk
kepikbesar,matters alam semesta milik rick
kepikbesar,selamat natal raya bahagia
kepikbesar,manusia kerangka kepala bentuk jajargenjang iya
kepikbesar,emas retriever gets an ganggu saudara whos duduk nyala kepala
kepikbesar,bodoh
kepikbesar,batal
kepikbesar,libur bawa detlen siang utama senank senank malam nguli rodi ledakin kepala
kepikbesar,warna officially nenek
