username,tweet
Nysmonworld,bagus berita goodnews
Nysmonworld,harap media jaman tolong rangin clickbait bagikan informasi hidup artis bagikan konten edukasi wawas baca
Nysmonworld,emas emas oke emas oke saudara laki
Nysmonworld,kilometer tonton goldd
Nysmonworld,drama judul navillera episode sukses nang dikit tawa salah karakter teman haraboeji bicara almarhum embah
Nysmonworld,bismillah bismillah harap
Nysmonworld,aduh pura galiat
Nysmonworld,tawa sah sekaramg selesai buku
Nysmonworld,yunji saudara laki otot iya kimbab keluarga perbarui
Nysmonworld,saudara tawa nyisir suka biarkan lantai
Nysmonworld,kamar
Nysmonworld,nyapu rumah isi rambut rontok
Nysmonworld,dopamine
Nysmonworld,fokus siang sungguh aneh ken kantuk tidur
Nysmonworld,coba coba
Nysmonworld,ruang sepi gelap ju
Nysmonworld,iya tuhan thi si meeh
Nysmonworld,realized super bakat teman tampar keras
Nysmonworld,senang
Nysmonworld,batal
Nysmonworld,lucu
Nysmonworld,sumpah sih favorito numero uno
Nysmonworld,ngeshare grup kelas gugup gugup
Nysmonworld,iya tuhan asa kimbab keluarga ketemu shinee
Nysmonworld,akhlak kilometer waktu pkm
Nysmonworld,hidup kadang penuh kejut
Nysmonworld,waktu ask si milik hidup
Nysmonworld,keren joan halmoni
Nysmonworld,fandom
Nysmonworld,malu sesuai prediksi pricenya
Nysmonworld,bismillah
Nysmonworld,batal
Nysmonworld,tawa tawa fanwar
Nysmonworld,mimpi kamar
Nysmonworld,menit saudara laki matang tambahkan menit pakai keju parah saudara
Nysmonworld,hujan hujan cemil telur kukus super cepat menit masak
Nysmonworld,hapus sih giga bats
Nysmonworld,cinta hidup
Nysmonworld,lemas flu kombinasi rebah
Nysmonworld,mati lampu saudara utama kereta tanah unduh tulis pakai suara nyarinya main toko historynya telepon bts
Nysmonworld,cerita guru smk waktu sakit temenya guru lantai habis guru muka pucet ditny teman guru crta guru situ bilang lantai plng lupa critana
Nysmonworld,gagal klik coba
Nysmonworld,ll missed mbah
Nysmonworld,tawa ambigu
Nysmonworld,dukung iya
Nysmonworld,tahun bismillah tarung profesional
Nysmonworld,batal
Nysmonworld,semangat saudara laki semoga kalimat ajar kilometer pakai waktu ketemu indonesians
Nysmonworld,sungguh inovation
Nysmonworld,favorit makan favorit lantai
Nysmonworld,favorit webtoon hardest baca baca semangat carol nathan
Nysmonworld,gila gadis gila tonton
Nysmonworld,hilang raih rela tmtets
Nysmonworld,terimakasih harap senang sehat maaf rude kadang sayang lantai
Nysmonworld,malas xl mati lampu snyl jelek
Nysmonworld,praktek
Nysmonworld,percaya sebentar kaki
Nysmonworld,kejut kejut perbarui status whatsapp
Nysmonworld,rebah habis keras mantap
Nysmonworld,atlet beda iya hamil olahraga bada sakit
Nysmonworld,saudara bgn tidur tugas olahraga tatap tugas gelisah bats minggu
Nysmonworld,pakabar tgs video iklan teliti
Nysmonworld,yaallah hamba anggota kelompok aktif ide aktif ajak diskusi utama tugas selesai beban pikir
Nysmonworld,cepat cepat lewatin mingdep
Nysmonworld,rindu jajan kampus
Nysmonworld,lumayan nad
Nysmonworld,empati ubah emoticon
Nysmonworld,jay anak anak anak anak utuh salah pilih peran model parents digital parenting
Nysmonworld,moodbooster sakit panas kepala matkul riset terimakasih webtoon
Nysmonworld,cerita mudah scenario monang
Nysmonworld,cha eunwo
Nysmonworld,cemil sate bapake tidur
Nysmonworld,suka pasang saudara tutin insightku dunia perskincarean
Nysmonworld,obrolan suka ketik tawa ubah lumayan aneh baca tawa
Nysmonworld,tawa lucu foto belah belah gaya support
Nysmonworld,maaf iya teman pikir tugas besok
Nysmonworld,saudara laki aneh pakai kerudung olahraga bulat huftt
Nysmonworld,nyate nyantai
Nysmonworld,acak mimpi ulang mtk nyonteknya
Nysmonworld,whatsapp garis whatsapp isi dilupain garis coolyeah
Nysmonworld,seru gugup gugup allahuakbar
Nysmonworld,omoo nulisnya tulis baris gel puyengg tawa
Nysmonworld,oke pengirim maaf menggangu waktu ilangin lampir tugas didik agama islam perhati terima kasih
Nysmonworld,quotes
Nysmonworld,niat cari iya cari alas
Nysmonworld,bktikan
Nysmonworld,bb berat nyala hidup
Nysmonworld,bodoh ngegopud cemilan lokasi belah rumah dasar malas
Nysmonworld,gemas latih online taekwond anak bicara nendang didpn dinding
Nysmonworld,omaigat cari cari netplix lucu telepon waitt watchh
Nysmonworld,notedd terimakasih pengirim
Nysmonworld,cerita
Nysmonworld,balas versi cina rumit
Nysmonworld,yoi boend hidup alam iya
Nysmonworld,ramai iya tonton malas
Nysmonworld,dilema pakai windows pengirim laptop santai mariyuyy
Nysmonworld,iya huhuw
Nysmonworld,wuah oke terimakasih esti ccakanim comeback jingga senja dilanjutin iya wkwkwkk
Nysmonworld,baca ganjil genap undur pilih undur tawa cerita tigran bangkai bats omong omong buku esti kinasih buku kah
Nysmonworld,renung senja
Nysmonworld,selamat ulang tahun bapake sehat beban pikir ringan semoga lucu
Nysmonworld,kindly periksa milik pesan iya
Nysmonworld,yaduu ottoke trf barang kirim habis dibatalin shopeenya
Nysmonworld,baca berita kpop muncul berita guan lin hujat celah rokok spitting wow uri byeongari gedee
Nysmonworld,terkadang benci algoritma internet
Nysmonworld,milik senang ulang tahun chagiya
Nysmonworld,panitia webinar ngundang bicara trf padehal acara tengah jalan ayah salah bicara support
Nysmonworld,tim zoom menit pusing cocok multitasking
Nysmonworld,iya kaku canda tawa gara gara efek rumah
Nysmonworld,fitur tweet cerita
Nysmonworld,bayang kilometer mma fighther jerawat muka bogem muka bug pusing nyeri perih
Nysmonworld,saudara laki kento sehat omong omong terbaik sukses tawa bingung bingung iya film jepang comedynya
Nysmonworld,favorit
Nysmonworld,gila rencana putar
Nysmonworld,seru covernya cinta wan yohan si penggemar klub
Nysmonworld,pasuk waktu pikir hidup saudara astrid hbu
Nysmonworld,holaa
Nysmonworld,wibmh waktu indonesia pikir hidup
Nysmonworld,makasiy iya
Nysmonworld,linknya saudara
Nysmonworld,iya saudara
Nysmonworld,bantu iya isi kuesioner waktu menit terimakasih link kuesioner
Nysmonworld,terimakasih iya isi
Nysmonworld,terimakasih
Nysmonworld,whatsapp bantu iya isi kuesioner waktu menit makasihh nonk link kuesioner
Nysmonworld,oke menyadari henti ikuti colle
Nysmonworld,niat mandi
Nysmonworld,sih malu teliti dosen omong omong teman teman bantu isi kuisioner teliti bidang komunikasi proses difusi berita pulang habib rizieq shihab
Nysmonworld,kaku bats hidup cocok admin
Nysmonworld,dengar ketawa tawa hati mcnya bicara izin terlambat grup baca kilas acara perhatikan eh mutee
Nysmonworld,pasang muka datar belaga ide nelpon padehal bicara pakai bahasa korea yeobosyo lupa bicara acara mcnya bicara acara latih les korea tunda iya
Nysmonworld,kulon acara games fakultas kampus jujur niat niat mandi kemarin ganti baju ganti baju bicara ahay untung acara online deh mandi kemarin habis ddk didpn lepi
Nysmonworld,kuliah dimana untar oh isi koko cici iya situ
Nysmonworld,belok kanan arah kiri motor lucu bats lurus iya tawa saudara laki masker
Nysmonworld,ujung tawa belaga ide mengikuti bapack bapack didpn jalan buntu eh alhamdullilah bapack bapack ngaso bilang belok kiri saudara laki coba topi cis cus
Nysmonworld,pade wejang taruh kilometer jalan tikus takut tersesat jalan jalan hubung posisi senjata berani ambil jalan tikus
Nysmonworld,sih coba jalan pintas telusur hajat aji jalan tutup coba mantap
Nysmonworld,youtuber favorit
Nysmonworld,saudara wanita bicara
Nysmonworld,rindu obrol konyol bareng teman smk untung video gila iya kemana
Nysmonworld,kreatif bats tawa
Nysmonworld,woho
Nysmonworld,senang ulang tahun saudara muhammad siraaj pratama putra saudara wanita al fatihah saudara
Nysmonworld,saudara wanita ju
Nysmonworld,hormat mudah main sunglap dgn bola tugas hormat kuliah teman anak bem anak ukm ipknya tinggi bats
Nysmonworld,teman percaya ilang
Nysmonworld,sesal tonton film padehal huhuww al fatihah verrys mahar
Nysmonworld,waitt episode
Nysmonworld,twitter retweet
Nysmonworld,ajar taekwondo buruk iya junbi ciat ciatt
Nysmonworld,lepas bicara kilometer temenmu celah tahun setuju bats omong bilang bengong iya pengirim ambil celah tahun mental uji
Nysmonworld,tenang tidur gelisah bats
Nysmonworld,instagram cerita saudara wanita nana motivasi hidup
Nysmonworld,kaepci versi arab bats ayam monag
Nysmonworld,pusing bats rundown acara
Nysmonworld,tonton dokumenter blackpink merinding keren
Nysmonworld,hidup datar
Nysmonworld,online buru buru mandi skincarean baca webtun kelas tugas gugup gugup offline kadang malas kampus tawa
Nysmonworld,kirim pengirim disubmit
Nysmonworld,nila tambahkan bantal pengirim empuk posisi nyaman hihiww
Nysmonworld,padehal proyek tugas presentasi pdnya ayo presentasi ppt dippt tugas kelompok fucek
Nysmonworld,fase kelompok kating umur gerak least bagikan aju dikerjain dilanjutin muncul dimultichat nama salah usul
Nysmonworld,mandi staterpack sambut libur
Nysmonworld,buenos dias
Nysmonworld,lucu sih ar santai bats nontonin kipas
Nysmonworld,buenos tardes
Nysmonworld,tetiba ken webtun
Nysmonworld,salah webinar tema ngebahas komunikasi politik dikit sesi oncam angkat tangan aju kritik gubris acara
Nysmonworld,semangat nderr mental oke
Nysmonworld,celah tahun buruk kilometer rencana seru bohong sih bilang seru downya pressurenya lingkung
Nysmonworld,timbang cari cari praktek
Nysmonworld,saudara wanita teuu ngarti
Nysmonworld,semester gembira mabuk jurnal tim riset ukm teman alam
Nysmonworld,aneh banget gabung grup nim diskusi baca baca dosa
Nysmonworld,proyek niyy
Nysmonworld,bagus oi
Nysmonworld,semester dijejelin teliti rumit
Nysmonworld,october
Nysmonworld,tidur nelpon iya taruh habis buka camera iya saudara efek kulon sial tawa menyadari menit bicara
Nysmonworld,senang ulang tahun senang ulang tahun senang ulang tahun cagiyaa semangat si sayang sayang
Nysmonworld,terimakasih admin
Nysmonworld,coba oktober gembira
Nysmonworld,admin bersih kit warna hitam iya
Nysmonworld,bangun gara gara dibangunin bangun kucing berantem
Nysmonworld,tahun teliti wol tragedi merinding baca ulang
Nysmonworld,oke si getting serious
Nysmonworld,barang barang unik pikir barang dunia cina weoo
Nysmonworld,sih acel iya saudara laki
Nysmonworld,minoritas agama
Nysmonworld,alhamdullilah
Nysmonworld,oke oke kuat baca serial
Nysmonworld,malas baca berita
Nysmonworld,niat
Nysmonworld,kiyowo lantai
Nysmonworld,retonol pakai senja sok knpe tengkuk kulit
Nysmonworld,bolehh pengirim
Nysmonworld,buka webtoon dilepi settings english huhuw
Nysmonworld,produktif tugas gass kerjain lepi waktu keluarga beda celah tahun tawa
Nysmonworld,serius teriak momm selesai
Nysmonworld,iya
Nysmonworld,bantu klik titik klik tulis together preview harap helps
Nysmonworld,indonesia
Nysmonworld,kejut eneng saudara yunji saudara jiow iya alas wonder sepinter peduli
Nysmonworld,tonton setia kimbab keluarga jaman dibdg dikorea ajak diskusi ngunjungin habis bebas pidato kimbab keluarga
Nysmonworld,seru kah utama permainan tawa
Nysmonworld,benci nyamuk banget banget ngett
Nysmonworld,konsep pakai kemudi cegah celaka parah
Nysmonworld,tawa dasar panggil pengirim pengirim
Nysmonworld,smk berat kuliah malu mundur
Nysmonworld,yuk nderr
Nysmonworld,awas
Nysmonworld,ulas jurnal isi inggris ditranslate butuh menit ngecerna bahasa berat alhamdullilah selesai
Nysmonworld,cahaya rajin skincarean cahaya sifat sikap
Nysmonworld,berhenti tonton lcdf chinese drama relateable
Nysmonworld,iya kirim saudara wanita buka lepi iya tawa
Nysmonworld,asa aneh gugup gugup gembira campur alas
Nysmonworld,ruang hidup
Nysmonworld,oke dicatat daftar malu
Nysmonworld,tugas matkul suruh tonton program televisi pilih tonton sinema elektronik sumpah kuat suara efek jeng jeng zoom backsound menang
Nysmonworld,sah baca pengirim
Nysmonworld,tunggu si
Nysmonworld,tonton film film tonton drama
Nysmonworld,tonton saudara laki
Nysmonworld,semester mabuk jurnal
Nysmonworld,tunggu tunggu
Nysmonworld,sayang usia tahun jerawat dunia beda normal
Nysmonworld,sedia sabar
Nysmonworld,lelucon ngechat notif buka pesan unsent
Nysmonworld,minjem buku nanah dibalikin buku kartu nanah tawa corona denda
Nysmonworld,pagi pagi nyapu
Nysmonworld,malas webinar
Nysmonworld,kalimat ngiang ngiang tonton jumanji tingkat agresif agresif
Nysmonworld,anjayy lagu akmu favoritokuu
Nysmonworld,oke tunggu drama
Nysmonworld,iya iya
Nysmonworld,lucu masker selubung tunggu hua suka desain ci gwyn sengaja pilih deco ver properti balas mudah moments aigo kim sajang terimakasih
Nysmonworld,ntu malu nyala laptop coba iya pengirim nyala laptop tangis
Nysmonworld,waa tekan tombol powernya detik mati laptop sebentar pencel kuasa pengirim ayo coba
Nysmonworld,sticker yrs
Nysmonworld,bengong bengong baca buku
Nysmonworld,suka waktu tunda sekolah mantan rebah tawa deng ngeasah ketrampilan ketemu ajar duka asa sepi
Nysmonworld,masak coto pasang dasa
Nysmonworld,gunhoo waitt
Nysmonworld,omo satisfying
Nysmonworld,marathon drama
Nysmonworld,baca dengar lupa inti anak akun sosial media such instagram akun email pribadi kemudi buka sih anak usia tahun isi foto foto tua
Nysmonworld,uji cakap mandarin
Nysmonworld,korea saudara etika kirim profesor
Nysmonworld,es breaking anak tawa
Nysmonworld,semangat chingu jalan setuju romaa
Nysmonworld,azik cahaya nih
Nysmonworld,cepat lambat anak anak jaman paham usia muda
Nysmonworld,omo omo keren
Nysmonworld,melow bangun bangun ulang tahun udara menetes
Nysmonworld,direstart normal admin terimakasih admin
Nysmonworld,iya turun servernya
Nysmonworld,cakeupp webinar tinggal gara gara wifi salah
Nysmonworld,film pengirim
Nysmonworld,hadiah ngira hhihi
Nysmonworld,durasi video detik
Nysmonworld,nama saudara edit sih hehehee
Nysmonworld,omong omong seminar online kah sertif kirim email nama coba kabarin panitia
Nysmonworld,bangkrut
Nysmonworld,oke
Nysmonworld,sah tawa
Nysmonworld,tawa semangat kkn
Nysmonworld,tawa selai sih urusanya
Nysmonworld,tonton televisi binggung tonton untung webnya huaa tonton keluarga sayang
Nysmonworld,waa pikir bayar saudara laki unggah dichannel televisi
Nysmonworld,moodbooster tonton
Nysmonworld,kimbab keluarga bersih aigo favorit familyy
Nysmonworld,tidur nang sedih
Nysmonworld,minggu rewatch raja mantap
Nysmonworld,nangkepnya sih kelinci takut iya sombong manusia situ renti sih berisik diam kura kura selesai
Nysmonworld,kaum rebah anak rumah bosan rumah tuh darurat sih ottoke
Nysmonworld,serial ter epik sabar tunggu si
Nysmonworld,batal
Nysmonworld,tonton drama raja siang tonton film hidup kejut insting tahan hidup
Nysmonworld,gera sampah plastik rumah tupperware plastik reusable
Nysmonworld,iya teman
Nysmonworld,iya
Nysmonworld,chouxnya favorit coklat manis mantul
Nysmonworld,hidup kemarin
Nysmonworld,omaigott temu cuci mulut kotak isi coklat semuwaa isi semangka strawberry saudara laki air segar rumah jalan langgan
Nysmonworld,milik selamat
Nysmonworld,reaction tanggap
Nysmonworld,notedd deh saudara nung
Nysmonworld,saudara dilakuin materi webinar isi nama email profesi
Nysmonworld,bantu
Nysmonworld,uang heist seru kah saudara
Nysmonworld,kopi tahun
Nysmonworld,kaca kaca video
Nysmonworld,eh kaca wow terkejoed bengkak bak hutang negara
Nysmonworld,selai pagi webinar tidur bangun banguj subuh telepon tonton alias tawa padehal selesai webinarnya
Nysmonworld,tumbuh lingkung mostly agama kuliah lingkung luas diucapin
Nysmonworld,alhamdullilah bapake pulang ketemu
Nysmonworld,menyadari selai pagi saudara laki
Nysmonworld,salah dikit pikir bicara
Nysmonworld,duri ikan nyangkut tenggorok
Nysmonworld,swoonies kasih syj ojs
Nysmonworld,kampanye vank sukarela agen jaring korea corona
Nysmonworld,oke talks manfaat tuan ngejelasinya seru super semangat jalan poin sosmednyaa
Nysmonworld,pikir webinar dinotice nyala kamera nunjuk tangan komenmya kolom obrolan rada negatif
Nysmonworld,nyetak begimane pengirim
Nysmonworld,dipolbek dasar total dikit alias
Nysmonworld,kebun dishare akun kampus temu kumpulin informasi pilih pilih
Nysmonworld,film tonton nontonnya ramean kejut banget banget otomatis kecut habis tonton film
Nysmonworld,tinggal tanggung pikir selai selai putus selai habis selesai apresiasi keren
Nysmonworld,lebar jelasin vegan tanam based sayup sayup tidur nyeletuk coba seblak situ ah luk guling
Nysmonworld,direstart coba pengirim wifinya habis direset
Nysmonworld,rumah myself waras
Nysmonworld,psikolog ips gantung universitas ambil pengirim psikolog saintek bau bau dokter ips
Nysmonworld,saudara laki kim perbarui
Nysmonworld,tunggu tonight
Nysmonworld,kimbab keluarga goes juta subss iya tuhan ve following keluarga keluarga online banyakk hua senang
Nysmonworld,tawa foto instagram kim soo hyun
Nysmonworld,oke pakcoy kering semuwa nutrisi simat
Nysmonworld,selai nontonin yutupp internet akses
Nysmonworld,imut sawi salah eksperimen pakai cangkang telur
Nysmonworld,oke alhamdullilah sehat ji
Nysmonworld,tawa kesan
Nysmonworld,nang mahir
Nysmonworld,benetan mati lampu
Nysmonworld,jijik jojo nama sih jojo busuk taro dapur tawa
Nysmonworld,xl sinyal jelek mati lampu
Nysmonworld,parah cantik potato bintang lucu tawa kayang
Nysmonworld,jijik kemarin saudara wanita hidroponik dipindahin bak jumat
Nysmonworld,tonton drama comebacknya kim soo hyun sekian episode kejut suka transisi scenenya drama
Nysmonworld,sial
Nysmonworld,kuliah pakai garis tertawa whatsapp keluarga teman sih kuliah proyek ramenya
Nysmonworld,salon waktu
Nysmonworld,sih jijik pakai udara saudara wanita pakai nutrisi nutrisi tawa
Nysmonworld,menyiram tanamansopi pikir fitur ambil udara
Nysmonworld,jijik tunas
Nysmonworld,sial habis tonton film tahan hidup keluarga cari
Nysmonworld,tunggu
Nysmonworld,saturday june
Nysmonworld,friday june udara menetes merah muka bengep hidung meler kejut muka tawa sukses nang film
Nysmonworld,senja tonton sedih sedih pakai adegan nang teriak teriak tetangga film ngedenger saudara kamar sangka tonton jurnalrisa adegan rasuk
Nysmonworld,thursday juni siang tonton pikir film
Nysmonworld,sakit tonton film
Nysmonworld,wednesday juni pagi tonton film
Nysmonworld,hidroponik
Nysmonworld,tuesday juni
Nysmonworld,lucu mari teman
Nysmonworld,monday juni
Nysmonworld,batal
Nysmonworld,lucu beli lamun nyapa nama tanam zainudin putri
Nysmonworld,suka film drama korea rencana tarik memakai upnya natural merhatiin detail properti cerita bagus
Nysmonworld,ii posisi nyaman ngadem
Nysmonworld,ayo tumbuh ayo
Nysmonworld,mudah log uninstall
Nysmonworld,sepakat air en fresh
Nysmonworld,tumbuh minggu
Nysmonworld,anti racist resource pandu
Nysmonworld,andai laut cerita dijadikan film
Nysmonworld,lupa kuliah celah tahun
Nysmonworld,telepon mati disamperin anak tetangga nyala telepon yaallah menyusahkan
Nysmonworld,chingu episode
Nysmonworld,bantu dishopee kurekomendasiin toko asli pengirim murah
Nysmonworld,become zombie hidup walkin
Nysmonworld,cantik luka keras tutup iya
Nysmonworld,giat cocok mati lampu wifi mati paket
Nysmonworld,demotivasi minggu untung gila
Nysmonworld,quw
Nysmonworld,semoga ingetan kuat tunggu tahun buku terbit
Nysmonworld,pagi langit bagus warna
Nysmonworld,sikap berhenti tonton tiktok selai
Nysmonworld,lelah bayar cireng sambal rujak
Nysmonworld,tanam cocok ruang iya
Nysmonworld,asa produktif lelah
Nysmonworld,selai sepupu nontonin upin ipin protes episode ditayangkan TV upin ipin pergi tidur yeoo
Nysmonworld,gemas klan nebula
Nysmonworld,woho buruk waktu
Nysmonworld,cimol saudara pilus monster
Nysmonworld,iya gara gara sih sipa mengomongnya lucu saudara wanita tawa khawatir beban pikir pikir kiamat randomnya vicky prasetyo menikah
Nysmonworld,qkwwkwkwk baju legenda mahal layang omong omong inap baju bawa ngepres gara gara lockdown memakai baju
Nysmonworld,kupas seru saudara
Nysmonworld,misi jomblo
Nysmonworld,belaga ide cemil sahur pakai mie pedas
Nysmonworld,mental rumah
Nysmonworld,antum sabar
Nysmonworld,gaya pengirim toilet kampus tawa
Nysmonworld,pengirim dreams hasil ngebuat ajar kamar divlog vlog koreyahh
Nysmonworld,iya temu titik terang
Nysmonworld,senang kimbab keluarga
Nysmonworld,selai pagi bangun suara gemuruh tegun yaallah kiamat bengong gugup gugup tidur lupa sahur dengar panggil ibadah alhamdullilah hamba hidup yaallah
Nysmonworld,indah pagi
Nysmonworld,pikir sih bos
Nysmonworld,chatan old teman obrolan
Nysmonworld,tonton tawa
Nysmonworld,alias hantu tawa
Nysmonworld,batal
Nysmonworld,kejut suka rencana putar
Nysmonworld,ujian semester makalah alias nilai
Nysmonworld,kisah budak cinta gila budak cinta dimenangkam eva braun rela coba bunuh simpati tuan adolfnya mati together sial
Nysmonworld,sumpah benci xl suka potong pulsa
Nysmonworld,favorit webtunn
Nysmonworld,oke pagi putus kompetisi malu wml
Nysmonworld,film novel iya pengirim beda
Nysmonworld,hubung novel aroma karsa pengirim tonton film selesai malu
Nysmonworld,temu komentar salur edu tawa wildan bayar hutang
Nysmonworld,ayo mangat yuk kuliah tahun
Nysmonworld,ngetag iya dosa mudah sih tawa ngejar guru kenal gapeka ajar
Nysmonworld,alhamdullilah lupa tulis saking mengetik lepi
Nysmonworld,tahun sedih hilang banding hilang barang hidup nama siraaj spesial hidup al fatihah saudara milik senang anak laki
Nysmonworld,ujian semester agama yaallah istigfar soalna
Nysmonworld,rsud daftar putar episode
Nysmonworld,rindu bapake semoga sehat
Nysmonworld,iya wkwkwkkwkw bapaknya ppt garing dichat teman takut
Nysmonworld,humor tawa jempol tangan getar
Nysmonworld,ngedrama yehh
Nysmonworld,wkwkwkwkwwk si meh keliling gramed tandain judul buku baca sinopsis menarique
Nysmonworld,pagi korea universitas pakai googleearth tawa
Nysmonworld,hilang semangat mahasiswa oh tel malas
Nysmonworld,teman tugas serah duka kirim tawa
Nysmonworld,waktu beli koin webtoon favorit kuhh
Nysmonworld,iya kasih pengirim coba pikir susah iya susah tolong pengirim nderr
Nysmonworld,omong omong nderr susah iya tuhan tolong nada susah gurat bstruktur kalimat puyengg omong omong mistakes dou partical kalimat ditaro tengah kalimat
Nysmonworld,wonder anak ajar mandarin pengirim hubung internasional nama iya erat hubung negara anak ilmu komunikasi ajar mandarin nichh yuk ayo
Nysmonworld,kindly periksa milik pesan
Nysmonworld,wifi kelogin lepi malas gerak tugas
Nysmonworld,batal
Nysmonworld,pagi pagi tugas
Nysmonworld,iya pisah kelas teman lumayan akrab teman bonding hihix
Nysmonworld,ulang mandarin maju padehal sahabat setia dikenal mbah gogtrans
Nysmonworld,iya tuhan novel teenlit jalan ninjaku smk wkwkwkkwk fairish kesan rish rish nama iris bawang iris tomat
Nysmonworld,anggur hasil karya
Nysmonworld,cha enwo iya gabteng
Nysmonworld,mangats nderr ujian semester
Nysmonworld,pakai jaket hitam kemeja celana kulot hitam kerudung hitam sepatu hitam bicara ganti kemeja kerudung pengirim wkwkkwwk
Nysmonworld,susah mudah susah pengirim deadline
Nysmonworld,hadir hadir hitung kulon kilometer obrolan dosen struktur kalimat sopan santun akhlak alas candid
Nysmonworld,deh salah diselingin tugas kuliah efek readingnya muncul kepala baca novel favorit book cepatan baca
Nysmonworld,pusing tweet singkat
Nysmonworld,waktu ngekpop beli album poster lain-lain tawa beli buku imitasi tere liye ribu buku buku coolyeah imitasi beli kelas murah kualitas jelek
Nysmonworld,didlm teori komunikasi nama teori penetrasi sosial teori bawang saudara laki teori dijelasin hubung analogi bawang bawang lapis manusia
Nysmonworld,suka terkait komunikasi sesimple bicara duka teori favorit teori bawang
Nysmonworld,claustrophobia sebentar duluan
Nysmonworld,dosen
Nysmonworld,setuju gue
Nysmonworld,buku ringan pengirim konflik lucu parah ketawa baca buku nila
Nysmonworld,tawa kelompok kelompok
Nysmonworld,gila tinggal cemil sebentar ulang payudara kasih waktu menit ayam kaepci cemil
Nysmonworld,baca materi ppt staterpack coolyeah
Nysmonworld,bangun bangun lelah mimpi ulang mandarin malu terima kasih saudara wanita google
Nysmonworld,jurus pura pura
Nysmonworld,bodoh kuliah online menyadari audio nyala bicara
Nysmonworld,bincang nyaman senang ketimbang
Nysmonworld,curenttly baca pengirim parah sih ajar sejarah indonesia baca buku merinding bicara ciduk bantu tani tanam jagung
Nysmonworld,iya muncul sengaja tekan oke sedot pulsa
Nysmonworld,mabuk teori
Nysmonworld,ayo ayo
Nysmonworld,indihome blok netflix tonton drama
Nysmonworld,buku tonton drama
Nysmonworld,puncak gratis pengirim book gratis aliran campur iya
Nysmonworld,kuliah libur waktu baca buku yuhuww
Nysmonworld,rindu toko buku
Nysmonworld,kuli online
Nysmonworld,giat pagi tantang tatap hewan terbang arah tringg ilang
Nysmonworld,sumpah mengepoi rizki nazar syifa hadju
Nysmonworld,beda pengirim dunia anna cerna dunia shopi yr kembang
Nysmonworld,buka instagram teman ngetag buka instagram penasaran hehehhe
Nysmonworld,buka milik pesan saudara laki
Nysmonworld,baca nila pengirim omong omong dititipin bajing
Nysmonworld,buku
Nysmonworld,tingkat banggan nomor halaman kertas pusing tinggal
Nysmonworld,bening si en nawank wulan novel baca sedih emosi dimainin budak cinta buku
Nysmonworld,malu waktu beranda saudara
Nysmonworld,tugas kelompok fucek
Nysmonworld,lapar cemil bareng nyaman tahan
Nysmonworld,saudara laki cari imitasi
Nysmonworld,iya buku buku kuliah dionline imitasi
Nysmonworld,iya tuhan kadang pengirim
Nysmonworld,buka pesan saudara laki
Nysmonworld,coba menggambil hikmah beli buku po
Nysmonworld,wishlist pengirim
Nysmonworld,domisil saudara laki si
Nysmonworld,whatsapp beli john dimana pengirim toko online jual asli
Nysmonworld,batal
Nysmonworld,pengirim sampul plastik dimasuki plastik lumayan plastik bekas beli seprei wkakwkwk
Nysmonworld,betewe drama saudara wanita
Nysmonworld,saudara wanita old keluarga
Nysmonworld,kejut kejut baca padehal diumumin kelas online
Nysmonworld,heheheh
Nysmonworld,nebula judul lumpu iya saudara
Nysmonworld,astaga naga kirim menfess muncul muncul
Nysmonworld,bumi matahari bintang ceroz batozar komet komet minor lena nebula judul buku lumpu pengirim
Nysmonworld,tidakk buku ngebahas detail dunia paralel iya dompet
Nysmonworld,cari tere liye buku bilang mudah imajinasi buku buku nebula lanjutany buku pisah bahas detail dunia paralel ns
Nysmonworld,ns
Nysmonworld,malu betewe serial anak anak sih buku sianak pelangi kuat spesial
