username,tweet
Ociirosiana,warga korea selatan korea selatan pekanbaru duga sangka virus corona corona rumah sakit arifin achma
Ociirosiana,iya singapura tiru tekat jalur transportasi
Ociirosiana,singapura lawan virus corona video nasdaily terjemah kibas
Ociirosiana,singapura lawan virus corona
Ociirosiana,corona banding virus iya banding simak ringkas infografik perhati
Ociirosiana,rumah sakit umum area rumah sakit arifin achmad pekanbaru ambil langkah cepat ruang isolasi
Ociirosiana,perintah umum indonesia positif milik pasien infeksi virus corona sus
Ociirosiana,sakit tengah konferensi pers kait perbarui situasi indonesia menteri sehat ter
Ociirosiana,via daftar area buruk indonesia pagi minggu bala
Ociirosiana,ask bawain cemil id ask cemil bawain
Ociirosiana,parah usaha kasih bonus periksa mundur buruh setuju ayah deh mundur usaha
Ociirosiana,solok si pregnant wants usaha kondisi bette
Ociirosiana,harga murah cekik buruh
Ociirosiana,kirim buruh sakit pakai skd gaji potong salah pasal pasal
Ociirosiana,boikot aice usaha has replaced workers tarung kondisi
Ociirosiana,menikah tim suruh dikerjain iya diker
Ociirosiana,maret musim
Ociirosiana,iyes coba ceki saudara maret sih saudara periksa turun harga jaman
Ociirosiana,tawa pulang dibawain cemil cemil iya ngo
Ociirosiana,pergi tidur marah lapar
Ociirosiana,diam sih saudara wanita curhat urus lapar dibi
Ociirosiana,sah saudara laki gantung prioritas tolak istilah banding topi
Ociirosiana,hasil habis tanggung hutang tua jabat bagus pulang rumah
Ociirosiana,coba iya ubah pribadi tunggu salah nikmat pergi tobat
Ociirosiana,tahap sosialisasi tega tunggu kabar
Ociirosiana,tegak atur admin lapor langgar
Ociirosiana,encik puan dasar perwako nomor tahun sanksi administratif pel
Ociirosiana,sih saudara aplikas burung biru bunderan kuning
Ociirosiana,harga murah coba periksa coba periksa
Ociirosiana,saran korea resmi cdc tingkat hindar nonessential jalan
Ociirosiana,korea selatan tinggal teman rencana korea selatan
Ociirosiana,obat alergi kantuk
Ociirosiana,minum ctm gih
Ociirosiana,kejut citilink kejut
Ociirosiana,anak keluh usut usut diagnosa
Ociirosiana,latih sudut pandang jernih
Ociirosiana,nussa juara visinema pictures giantz animasi studios bangga bahagia
Ociirosiana,tuhan lapang rezeki hamba hamba sempit ses
Ociirosiana,joko prianto tani rembang tolak pt air mani indonesia kriminalisasi pamer tanam cabai
Ociirosiana,teknik kunci kaki hindar cegah culi anak ajar latih
Ociirosiana,mengantri apotek aji waras kerepot memegang anak jalan tahun cerebr
Ociirosiana,gigi susu tahan sehat
Ociirosiana,pagi hangat ayo baca bentar sebar
Ociirosiana,ajar buku panas mekanisme alami tubuh bertarun
Ociirosiana,suami heboh benr sikit kasih obat untung bini keren anak anteng ti
Ociirosiana,uji anak suami orangtuanya mertua saudara saudara saudara laki
Ociirosiana,putus beli sate malam malam nimbag berat badan turun ons kemarin ayo beli
Ociirosiana,tuhan maha haid jadwal uji bayang rumit
Ociirosiana,tahan tahanin ngedrakor uji ajar gulir gaduh twitter
Ociirosiana,gemas
Ociirosiana,ganggu sholat
Ociirosiana,curiga bayi kistik fibrosis infeksi bolak berat susah malabsorbsi lemak
Ociirosiana,ruu cilaka berat sanksi usaha media
Ociirosiana,wacana hapus imb amdal solusi perintah mudah izin lantar keluh
Ociirosiana,janji jokowi rakyat lingkung hidup bual
Ociirosiana,hancur sombong bodoh
Ociirosiana,produk dunia karya putra indonesia perak ratu milik keluarga chuang jawa barat garu
Ociirosiana,pemerintahjepangmenyatakan penumpangkapal pesiardiamond putri terinfeksivirus corona
Ociirosiana,menstruasi cangkir catwomanizer wajar rachel
Ociirosiana,tips tips usia hindar tiup pasu cemil anak ngunyahin mie
Ociirosiana,selagi tunggu cemil rawat gigi anak usia bareng
Ociirosiana,uji baca profesor baca baca doa profesor
Ociirosiana,pamer iri
Ociirosiana,percaya tuhan rencana hamba beban hilang payudara
Ociirosiana,tolong iya iya iya iya
Ociirosiana,kumpar kasih samsung galaksi si gratis coba admin kasih samsung
Ociirosiana,lingkar cahaya teman teman sadar hantu permisi numpang iklan iya
Ociirosiana,toko emas nunjuk cincin berlian saudara iya berlian
Ociirosiana,ganti iya bismillah samsung galaksi si
Ociirosiana,tangis cantik samsung galaksi si ken
Ociirosiana,lingkung teman racun evakuasi temenmu tinggal evaluasi
Ociirosiana,butuh staycation
Ociirosiana,panggil desainer sayembara asrama detail denah turun
Ociirosiana,perbarui tinggal landai
Ociirosiana,suka halusinasi bingung
Ociirosiana,makan fresh fruits oranges vitamin sih milik tubuh doesnt butuh moga vitamin sih saudara
Ociirosiana,suami cinta anak anak pasang tumbuh dekade
Ociirosiana,perempuan perempuan sulit kembang habis tenaga mengurus domestik pria pria paham
Ociirosiana,bantu biaya istri awat operasi pulih bantu donasi klik
Ociirosiana,maaf
Ociirosiana,lidah sanggup lidah sanggup mngucapkan
Ociirosiana,kawan bicara
Ociirosiana,tidur
Ociirosiana,hapus mekap kapas bolak selesai kapas tetiba seru beranda scrol sadar saudara
Ociirosiana,iya
Ociirosiana,semangka
Ociirosiana,ilustrasi
Ociirosiana,pakai alas ah gigi ganti copot waktu gigi tetapn
Ociirosiana,gigi susu anak butuh tahan rahang iya cepat ganti umur tahun gigi seri geraham
Ociirosiana,serius nyamuk mobil pakai wangi oh iya buka plastik aroma kua
Ociirosiana,kartu identitas anak kia anggap upaya penuh hak anak
Ociirosiana,anak kunjung rumah manusia bawa buah tangan tuan rumah gembira sambut bi
Ociirosiana,islam wajib istri serah suami layan suami sih saudara
Ociirosiana,selamat nad semoga lancar iya
Ociirosiana,pagi warga negara indonesia jemput wuhan rrt bandara gantung nadim batam
Ociirosiana,valuenya ilmu didik anak uang anak mbantu suami ibadah
Ociirosiana,hadir tua kualitas abai kuantitas anak butuh hadir tua
Ociirosiana,yeay anak dokter sombong
Ociirosiana,sila unduh butuh rumah sakit puskesmas tenaga sehat deh kesiapsiagaan inf
Ociirosiana,batal
Ociirosiana,tanyarl paham jelasin
Ociirosiana,kejut sekian cemil micin cemil pedas asam chickenya kfc lidah kelu mangstap oke
Ociirosiana,buk sepele iya anak malas kunyah cemil saudara saudara remaja malas pria
Ociirosiana,malas ngunyah saudara wanita ngemut cemil daerah rahang ph imbang gigi cenderung lunak saudara
Ociirosiana,bahas gigi bungsu curhat dikit iya sambung prahara kunyah kunyah kelen kelen bantal
Ociirosiana,sweetheartkittens
Ociirosiana,layan gerai sim mal suka pindah mpp pekanbaru
Ociirosiana,tus perut bayi imune dorong termometer selamat
Ociirosiana,lapor blok kucing
Ociirosiana,hindar dampak buruk tips ayo teman teman aware teman teman
Ociirosiana,salah darimana kirim sms nama sih terima kenal sekalipu
Ociirosiana,sms kalimat waspada teman teman utas
Ociirosiana,tunggu utas dokter
Ociirosiana,libur libur tahun
Ociirosiana,batuk sakit demam parah bawa jalan libur sembuh
Ociirosiana,ken ngetwit korelasi anak malas ngunyah sempit rahang dewasa akibat gigi tumpuk
Ociirosiana,cuci tangan use topeng properly suhu periksa regularly hindar crowds
Ociirosiana,tanggal november medan
Ociirosiana,pandu praktik klinik ppk pneumonia coronavirus ncov
Ociirosiana,lupa poin logis cemil uang misi
Ociirosiana,simpul uang beranta urus cashflow old bijaksana pasak tiang
Ociirosiana,bolu meranti capucino sungguh
Ociirosiana,usia sekian sadar spesial si
Ociirosiana,nasihat sentuh hati coba
Ociirosiana,bahagia mudah sepele membesa
Ociirosiana,pria islam pakai peci hormat muka clueless iya tuhan planga plongo
Ociirosiana,sadar sehat utama peran iya perempuan salah
Ociirosiana,musuh
Ociirosiana,solatlah tepi
Ociirosiana,sih edukasi seks edukasi seks bersenggama edukasi seks liput kenal
Ociirosiana,suka tus bau nyiksa tertawa
