username,tweet
Ociirosiana,tolong media youtuber influencer peron amplifikasi informasi olahraga te
Ociirosiana,tahan corona pekanbaru nihil
Ociirosiana,dermawan kota pekanbaru riau inisiatif warung unjung cemil puas
Ociirosiana,daesang film daesang drama selamat
Ociirosiana,jaman tinggal sayang sayang jaman sayang sayang
Ociirosiana,pandemi ajar tunda dijalanin mati alham
Ociirosiana,pasien positif virus corona kota pekanbaru sembuh senin kemarin pasien pos
Ociirosiana,otak batu
Ociirosiana,dokter januari cuci ac kemarin menetes oke bochor
Ociirosiana,pasien positif corona pekanbaru sembuh riau nihilpenambahan
Ociirosiana,efektif hisapan bayi hisapan breastpump bayi hisapan bayi mantap rangsang
Ociirosiana,ngemc narasumber ceo usaha muka cemil ramai telepon taroh meja hpnya telepon
Ociirosiana,cuy
Ociirosiana,tahun salah cita cita ken kos
Ociirosiana,renov kamar kos meter pasang muda utas
Ociirosiana,cemil tolak
Ociirosiana,iya suka martabak kacang
Ociirosiana,keren
Ociirosiana,dipan minat
Ociirosiana,simak anjur ikat dokter anak indonesia giat ajar ajar pandemi corona baca lengkap
Ociirosiana,mari tepi ruang bumi nafas sabar duduk meja saudara wanita lemon hangat deng
Ociirosiana,syarat wilayah riau tengah pandemicovid
Ociirosiana,cantik suka
Ociirosiana,sih puting lecet nyusuin kunci pelekat bayi payudara sih payudara
Ociirosiana,anak tunda ajar sekolah fisik situasi terke
Ociirosiana,uwais al qorni doa syurga cari ridha uwais ternyat
Ociirosiana,dingin sikap ac servis saudara laki gede
Ociirosiana,dewasa hindar keribetan ribut penuh bising nikmat ketena
Ociirosiana,tonton twom suka serial suasana hati ayun kesal ujung marah marah
Ociirosiana,via prosedur laksana normal hidup jaga protokol sehat
Ociirosiana,saudara encik puan riau panas
Ociirosiana,strategi pemrentah wabah
Ociirosiana,batal
Ociirosiana,tjie tjie tjie
Ociirosiana,paha debat
Ociirosiana,klairs myluv
Ociirosiana,hasil kepel pdp tinggal dunia pekanbaru terima hasil
Ociirosiana,catat saudara laki pikir normal persis
Ociirosiana,ken corona selesai wisata wisata wisata wisata wisata wisata wisata pokok wi
Ociirosiana,kelen peratiin pakai kawan kebal gambar situasi
Ociirosiana,corona mimpi buruk
Ociirosiana,teliti masker kain efektif cegah tular lepas ganti
Ociirosiana,saudara wanita tahun persis januari rantau
Ociirosiana,semangka tekstur
Ociirosiana,rumah hobi cocok tanam aktivitas jenguk anak
Ociirosiana,giveaway waktu kemarin coba cucoknya pakai ken total
Ociirosiana,tekan tweetnya copied clipboard pasta delete captionnya saudara menyisakan linknya
Ociirosiana,coba
Ociirosiana,roti jalan donat roti goreng pau tongkat royco kripik malaysia kue bawang bakwan risol martabak
Ociirosiana,photoshop tingkat iya
Ociirosiana,indonesia sepele corona anak situasi indonesia beda negara nihil
Ociirosiana,malaysia khotbah tongkat utas lucu
Ociirosiana,pandemi umat muslim pria ajar solat jad
Ociirosiana,eid pakpresiden umum ibadah masjid buka jamaah masjid pegang sambal goreng sambo
Ociirosiana,badan otomatis tolak koh suami bilang alarm heboh bolong meja telepon sadar
Ociirosiana,situasi saran saudara saudara umat muslim indonesia sholat ied
Ociirosiana,iya vi maaf lahir batin
Ociirosiana,peluk
Ociirosiana,mall buka bebas atur publik angkut isi setangah
Ociirosiana,thailand mall buka minggu loh normal angka
Ociirosiana,gadis pikir ubah laki alas fokus misi
Ociirosiana,laki cinta perempuan saudara
Ociirosiana,nyapu ngepel rumah wangi
Ociirosiana,alhamdulillah tahun pakai baju tahun saudara wanita sesak longgar masyaallaah
Ociirosiana,cinta korban jaga jarak ibadah rumah lebaran
Ociirosiana,iri hidup uang iri hidup hutang
Ociirosiana,video ramai ramai nyerbu mal pikir indonesia duite ayo
Ociirosiana,keras nyala milik weigher tahun
Ociirosiana,berhenti
Ociirosiana,lapor kasih panggung sayang ah manfaat lumayan retweet
Ociirosiana,isi pulsa pakai ovo ambil potong gengs cuss
Ociirosiana,ani ani pakai masker ciprat rahang bicara
Ociirosiana,cerita syahdu gambar
Ociirosiana,jokes lelucon candid malu perempuan rendah
Ociirosiana,tongseng sapi dokter
Ociirosiana,rekomendasi online shop brand sprei domestik kualitas hotel estetik harga oke super murah bahan sejuk motif
Ociirosiana,perintah atur dihimbau atur suka langgar dihimbau
Ociirosiana,indonesia pilih jalan kondisi masyarakat cenderung abai perintah ekonomi pulih
Ociirosiana,okeh mari utas becocok tanam ala alam pribadi candid murni
Ociirosiana,perbarui blog butuh asuransi didik http cowok txrjrjx
Ociirosiana,tweet has withheld indonesia
Ociirosiana,indonesia lawa komedian anggap serius politis serius melawak muka serius
Ociirosiana,uang jajan baju mall pasar ih gimane sih
Ociirosiana,juru bicara juru bicara corona riau indra yovi persen positif provinsi riau saudara laki
Ociirosiana,ngumpulin ngira anjir
Ociirosiana,bicara ah deddy corbu salah pakai masker hak
Ociirosiana,siyap
Ociirosiana,saudara laki
Ociirosiana,ken ngumpulin kurus patah hati
Ociirosiana,gelombang second gelombang angka positif turun rebak contoh wuhan
Ociirosiana,ulang tweet sooner later hidup adaptasi masalahnye saudara
Ociirosiana,hindar luas wali kota pekanbaru firdaus imbau masyarakat gelar salat ied ruma
Ociirosiana,mengeluarkan uang jajan waspada pola gaya hidup geser konsumtif
Ociirosiana,suka asyik tumbuh dewasa lupa orangtua tua
Ociirosiana,nanyain pot kolom balas pesan deh ayo pesan iya
Ociirosiana,nikmat sabtu
Ociirosiana,iyeeh paham beli taneman kota tawa
Ociirosiana,bahas sehat hubung stories saudara curhatnya saudara
Ociirosiana,kemarin pesan anak asih tua rawat wisma atlet kabar
Ociirosiana,iya bunga mati serang ulet hih ulet embuh pot saudara
Ociirosiana,sangking psbb iya nyemai cabai rawit buah matoa nangka pokat mentega matoa
Ociirosiana,bayang milik loved
Ociirosiana,kesal bicara didengarkan bicara dinding
Ociirosiana,servis ac takut
Ociirosiana,bohong
Ociirosiana,kesal malas lambat
Ociirosiana,dewasa kesal marah pilih diam menjauhk
Ociirosiana,nganu iya mbok ekonomi mengaku miskin bantu kasihan sa
Ociirosiana,ika gelimang harta mewah raih takhta duduk jabat gengsi bur
Ociirosiana,daya kesal
Ociirosiana,jalan tokyo hong kong normally takes five hours hours kiri narita airpo
Ociirosiana,cosplay rasul ibrahim hancur berhala
Ociirosiana,iya eksekusi buah bohong iya ngenakin percaya barang utama
Ociirosiana,tolong walikota solo menghimbau paksa beli tiket bonbin jurug harga lembar ribu kap
Ociirosiana,batal judul sinema elektronik indosiar
Ociirosiana,saudara wanita doa ridha tua doa tua
Ociirosiana,indonesia amerika serikat tim divisi antisipasi epidemi pimpin
Ociirosiana,indonesia tahun tahun latih skenario epidemi laksana flu burung ambyar
Ociirosiana,tumbuh subur kongkalikong izin pulang desa otoritas sehat hubung tanda risiko mitigasi pem
Ociirosiana,perempuan pilih rumah tangga iya dukung perempuan pilih berkarir
Ociirosiana,pariwisata pulih realistis pakar simpul wabah tahun rusak
Ociirosiana,adhiguna safarah sabrina gosip lika liku
Ociirosiana,ajar masak youtube media sosial tutorial mudah mewah
Ociirosiana,saudara wanita saudara wanita suka masak masak iya santai
Ociirosiana,suka perempuan masak iya cari masak iya sih situ iya
Ociirosiana,usul saudara laki saudara laki paksa paksa perempuan suruh masak paksa
Ociirosiana,encik puan bosan rindu anak jalan jalan siasat keb
Ociirosiana,candid iya kesal orgtua bilang kasih dokter disurug sikat gigi anak suka nang anaknya
Ociirosiana,gigi anak sehat tanggungjawab orangtua loh teman teman ayo mari cipta generasi muda bebas gigi lubang
Ociirosiana,pasuk fase umur dikecewain diam inti cukstaw cerewet
Ociirosiana,online toko instagram cantumin harga
Ociirosiana,warga wuhan tes lockdown muncul positif corona
Ociirosiana,saudara kenan kesini
Ociirosiana,tiati
Ociirosiana,teman teman lebaran dokter umum daftar periode tugas tanggal mei
Ociirosiana,saudara wanita tertawa nyemai buah matoa nangka pokat mentega rawit iblis
Ociirosiana,alam jalan sembuh isolasi pdp corona utas
Ociirosiana,pacar tampan ajak jenjang serius
Ociirosiana,nabung seringkali hasil misi
Ociirosiana,pikir tidur
Ociirosiana,maaf iya keranjang shopee beli tokopedia susah bany
Ociirosiana,kawan kebal vaksin buah leceh frase mulia sih
Ociirosiana,tawakal syarat misi
Ociirosiana,si rumah rata lengkung weeks later enough data lengkung oke si buka
Ociirosiana,nama bong tahun tan penuh hidup buka
Ociirosiana,lucu
Ociirosiana,baca lancar
Ociirosiana,phk sangon cicil bangkrut gaji potong thr mudik rindu keluarga
Ociirosiana,nyawa rakyat harga jaga keluarga teman teman hindar kendara umum
Ociirosiana,negara serba nanggung pusat federal harap pusat lempar detail
Ociirosiana,ngebahagia tua batas kasih pergi
Ociirosiana,kadang malas balas obrolan teman wasap malas balesnya penasaran isi chatnya
Ociirosiana,bantu teman anak usia sekolah paud isi kuesioner aktivitas ajar rumah pandemi covi
Ociirosiana,gudmorning senin ayo mari beraktifitas semangat kulwap menunggu berbuka puasa difa besok
Ociirosiana,kambing coba sate oh coba sate kambing cemil beda iya huks oke
Ociirosiana,juru bicara juru bicara corona provinsi riau indra yovi angka sembuh pasien positif corona provin
Ociirosiana,selesai corona libur pokok gila
Ociirosiana,ekspektasi realita
Ociirosiana,sayang bunda bunda tips suami peka bantu bunda rumah suruh kadang
Ociirosiana,sayang kawan kisah terima kasih
Ociirosiana,takdir pakai sopir amin
Ociirosiana,pengaruh tipu daya jual beli pandemi efek
Ociirosiana,tg april umum tutup bandara tg juni tg mei buka ken rapa
Ociirosiana,kamar kos estetika anggar utas kamar kamar langgan serenade daftar barang pakai
Ociirosiana,sekian pantau beranda paru balado
Ociirosiana,perempuan kahwin rencana anak bayi pregnant breastfeeding menjenguk menjenguk rawat kulit
Ociirosiana,mothers nyala kamar times
Ociirosiana,titip jual iya saudara ayo batam kue buka puasa roti kirai kuah kari risol
Ociirosiana,gelisah iya sedih
Ociirosiana,gratis ongkos kirim shopee reguler pakai shopee bayar malesin
Ociirosiana,sumprit bawa tawa
Ociirosiana,menang ratap efektif efisien otak banjir endorphin cannabinoid
Ociirosiana,repost tinggal senja stok asi sih bayi tip
Ociirosiana,pagi ambyar dengar kabar tinggal didi kempot didi kempot karya sungguh istimewa
Ociirosiana,pandemi ratus masker jahit butuh liput
Ociirosiana,selamat pagi senin besok difa kulwap seru loh ayo mendengarkan tips jaga sehat gigi anak dar
Ociirosiana,projek tahan pangan keluarga inspiratif budidaya ikan sayur ember
Ociirosiana,dinas dagang industri dpp kota pekanbaru bulog operasi pasar jaga stabilitas tawa
Ociirosiana,jual titip iya saudara laki daerah batam
Ociirosiana,pegawai phk cair tunjang bpjs iya lumayan bis
Ociirosiana,marah sedih suka mendem bertumpuk bom waktu meled
Ociirosiana,produk menteri koordinator bidang utama jorok republik indonesia
Ociirosiana,misoa krispi pempek kakdel
Ociirosiana,pekanbaru tegak atur psbb selamat warga bahaya corona masjid gelar tarawih pengu
Ociirosiana,agustinus edy kristianto jurnalis investigasi jempol coba beliau lulus jurnalis
Ociirosiana,repost gambar instagram jemari angah
Ociirosiana,batam daerah jual mamay kue takjil buka puasa spesial roti kirai alias roti jalan kuah kari ayam
Ociirosiana,batam daerah jual mamay kue takjil buka puasa spesial roti kirai alias roti jalan kuah kar
Ociirosiana,lampau batas waras buah saksi program kartu pra presiden mengh
Ociirosiana,langgar psbb pekanbaru vonis penjara denda
Ociirosiana,gilir ancam krisis pangan pikir sawah kemarin kemarin mentingin jalan tol total
Ociirosiana,via bantu butuh kantong darah gol ab senja an tuminah lokasi eka rsud kota pe
Ociirosiana,waktu isya rakaat tawa iya isya tarawih witir saudara laki lelah saudara laki sanggup
Ociirosiana,pemko pekanbaru batas sosial skala psbb perpanjanga
Ociirosiana,teror acin puasa acin solat anak laki pinggang cenut cenut tolong
Ociirosiana,masjidil haram penuh darah akibat serang imam mahdi palsu november desember kelompok gera
Ociirosiana,video populer ahli ventilator tingkat mati pasien corona capai lembaga
Ociirosiana,batal
Ociirosiana,polresta pekanbaru ketat awas titik batas cegah mudik kendara
Ociirosiana,hubung sebar caring bagikan luncur materi kulwap sesi kemarin ilmu dikenal
Ociirosiana,kulwap materi kecuali komunitas ngundang
Ociirosiana,malu ngakuin hasil hebat iya ajar cari celah oke
Ociirosiana,dampak waktu kirim ekspresi kirim pulau provinsi
Ociirosiana,jnt friends informasi hubung bijak direktur jenderal hubung udara
Ociirosiana,pandu cemil bayi anak kondisi darurat susu rumus grat
Ociirosiana,representasi kemensos
Ociirosiana,massa distribusi sehat foods children hati targeted selimut distri
Ociirosiana,staycation takut
Ociirosiana,bubur kacang hijau pakai teori rebus udara kacang hijau didih matiin kompor panci teta
Ociirosiana,tim buka puasa pakai kue goreng camil cemil nasi
Ociirosiana,desember bukittinggi selai damin balap bohong keber an knalpot bik
Ociirosiana,jnt pemberitahuan akun twitternya tanggal jne iya henti
Ociirosiana,muat angkut muat krusial alat sehat belanja online muat
Ociirosiana,amal terima shalatnya puasa ah tidur sebentar
Ociirosiana,menit detik guru kait fatwa shalat jumat tarawih jamaah saudara laki
Ociirosiana,akses jalur darat laut udara kota pekanbaru jumat resmi tutup mei data
Ociirosiana,setuju tugas utama dokter ngeresepin obat mengajari
Ociirosiana,bandara internasional sultan syarif kasim ssk iipekanbaru riau tutup pelayananpenerbanganpenumpang komersil bes
Ociirosiana,jual kirai jagat raya batam daerah iya teman teman bakwan sambal merah rona nagih
Ociirosiana,pee waktu tengah selai selesai tidor
Ociirosiana,sepakat
Ociirosiana,minggu rumah hahe hahe tanggap curhatan teman
Ociirosiana,ngojol sepi pesan psbb butuh buka jasa lokasi pekanbaru
Ociirosiana,saudara selai sidang online bareng teman yogyakarta bangga auntie bangkit keterpu
Ociirosiana,dpo unsent
Ociirosiana,batal
Ociirosiana,martabak sayur tempe grg dokter beli goreng
Ociirosiana,ken beli kulkas
Ociirosiana,jado saudara laki cukur tan
Ociirosiana,omong omong dbs dasar buka daftar sosial usaha hibah alias dana hibah tahun
Ociirosiana,jaga jarak
Ociirosiana,bubur bayi kaldu soto semur sop tongseng doc
Ociirosiana,iya
Ociirosiana,iya cinta
Ociirosiana,pasien positif corona riau pasien milik riwayat jalan india tanggal januari si
Ociirosiana,pasien positif corona jb milik riwayat jalan area jangkit keda
Ociirosiana,pasien positif pasien positif corona riau salah pdp tinggal dunia
Ociirosiana,hidup ketrampilan istri
Ociirosiana,iya kepala copot cecer kakyass
Ociirosiana,suami kesal kunci taroknya suka serampang
Ociirosiana,cemil gembrot
Ociirosiana,rajin doa ibadah kati hebat
Ociirosiana,nyonya listrik olehpt pln persero pekanbaru april
Ociirosiana,negara suara isi hati dokter bahas suami gila
Ociirosiana,punc hilang sinyal
Ociirosiana,malas tular henti gaul malas tular
Ociirosiana,senja coba ngupi kembung kakyas
Ociirosiana,sambal terasi ayam bakar lalap
Ociirosiana,iri singapura atur benderang mudah paham arah baca
Ociirosiana,vitamin sih asam ascorbat didlm badan butuh moga buang ginjal urin dampak
Ociirosiana,utama buku anak
Ociirosiana,admin kenal oci admin puan resmi lembaga susu riau kir
Ociirosiana,kunjung fanpage inisiatif zakat instagram tweet
Ociirosiana,mari gotong royong zakat corona bantu tahan pangan keluarga dhuafa corona sege
Ociirosiana,puan izi wakil riau galang donasi bantu keluarga dampak cov
Ociirosiana,sahabat terfikirkah saudara ekonomi rendah andal hasil
Ociirosiana,situasi wabah corona landa negara dunia indonesia diberl
Ociirosiana,inisiatif zakat indonesia izi wakil riau puan gotong royong zakat corona
Ociirosiana,kenal terima kasih
Ociirosiana,memaksa menikah menikah suami curhat cermin
Ociirosiana,cyiin
Ociirosiana,sumpah tawa
Ociirosiana,salah alas rumah pajang dinding pajang meja malas ngebersihinnya ra
Ociirosiana,disinfektan dekontaminasi benda mati manusia semprot disinfektan manusia
Ociirosiana,sadar langkah cegah wabah corona sungguh kaum hak istimewa
Ociirosiana,ngumpulin dalgona kopi
Ociirosiana,daftar layak percaya pandemi corona brdasarkan urut imbau twitter dokter instastories tim med
Ociirosiana,kebun santai bosan badmood pergi kebun melihati bunga ngecekin daun yan
Ociirosiana,buku digital resmi akses google main tani rumah mediakita seda
Ociirosiana,italia perintah lockdown rakyat bandel indonesia rakyat lockdown perintah bandel
Ociirosiana,pesan masyarakat cheko dunia indonesia mari
Ociirosiana,salah kaprah cair desinfektan semprot tubuh manusia dar saudara
Ociirosiana,rebu saudara beli
Ociirosiana,lockdown trdengar keri sila pakai istilah paham economic political biaya misi
Ociirosiana,iya corona aib sakit akibat perilaku salah takut tular oke
Ociirosiana,saudara wanita
Ociirosiana,teman twitterland coba tips simpan sayur bahan cemil
Ociirosiana,breaking berita dokter identifies salah frontliners doing handling rumah
Ociirosiana,akuin drama korea tema rumah sakit alat prosedur medis masyarakat indonesia pria
Ociirosiana,selai minnesota rumah pesan shutdown lockdown alus tenga
Ociirosiana,dewan guru fkui desak perintah terap lockdown usul lengkap hitung an biaya butuh unt
Ociirosiana,baca pergi gila under lockdown asa ve beijing two months housemate
Ociirosiana,semangat dokter
Ociirosiana,anak susah tidur siang utama rules geser longgar
Ociirosiana,asi bukti virus tular asi proses susu kontak
Ociirosiana,indah bunga tabebuya mekar
Ociirosiana,ngoplos cc saudara wanita
Ociirosiana,iya ngefens pacar mendengarkan deh sen
Ociirosiana,hubung grup penuh grup gabung
Ociirosiana,tweet waktu undang undang isi podcast unda
Ociirosiana,panggil ibadah hayya alas sholah ganti sholluu fii buyutikum sholatlah rumah
Ociirosiana,shollu rihaalikum shollu buyuutikum shahih muslim
Ociirosiana,hujan deras shalat jamaah rumah situasi cegah sebar waba
Ociirosiana,hadis rasul wilayah jangkit wabah
Ociirosiana,mati mati sakit sedih mati kendi
Ociirosiana,jaga jarak dokter awat corona bunuh
Ociirosiana,corona bunuh kota jaga jarak kota corona memb
Ociirosiana,era wabah iya waktu bijak pergi dokter periksa spesialisasi gambar
Ociirosiana,gofood kaefsi habis cemil gegoleran kejut mantap
Ociirosiana,anak luk sakit olahraga cemil minum lupa buah keluarga cemil salak jeruk
Ociirosiana,viral sungguh nama diumumin masjid
Ociirosiana,daftar nomor telepon rumah sakit pekanbaru
Ociirosiana,rumah tolong tangan sanitizer sih susah mencuc
Ociirosiana,coba menteri menteri becandain virus corona publik maaf buka habis undur
Ociirosiana,data sebar corona kota pekanbaru akses
Ociirosiana,perbarui situasi kembang indonesia buah utas
Ociirosiana,anime sederhana rumah semoga manfaat
Ociirosiana,kota payakumbuh tutup wisata terima wisatawan waktu kait corona waktu iya
Ociirosiana,kota bukittinggi tutup wisata maret libur sekolah saudara
Ociirosiana,mengajari anak cuci tangan coba pakai lagu
Ociirosiana,karantina isolasi jaga jarak isolasi
Ociirosiana,situasi hindar kemudi penuh pakai ganti kemudi model
Ociirosiana,berita kabar
Ociirosiana,ikhtiar wajib tawakal takabur dosa ulama indonesia kasih fatwa
Ociirosiana,putus imam masjid ulama minnesota atur gubernur minnesota kumpul
Ociirosiana,informasi wabah corona indonesia april patuh
Ociirosiana,kirim video bbc pisah suruh pisah gejala ringan ranj
Ociirosiana,data statistik corona indonesia area milik
Ociirosiana,muslim american masyarakat tiada giat masjid waktu berdasark
Ociirosiana,lockdown sunnah rasulullah saw larang
Ociirosiana,teman teman diam rumah longgar rezeki bantu donasi kelihatann
Ociirosiana,habis restok belanja lupa mobil cuci tangan pakai sabun mobil bawa sabun suami wajib
Ociirosiana,suami beli sayur wangi durian mobil
Ociirosiana,mobil parkir maju nubruk pot taneman drum besi gigi saudara duduk bangku penump
Ociirosiana,restok buah sayur anak bujang durian beli biji rebu jeruk saudara laki kilogram salak pondoh
Ociirosiana,lambe perintah pakai istilah rumit komunikasi masyarakat sosial jarak rumah lockdown covi
Ociirosiana,butuh milik tolong bagikan buku pegang hospitals doctors nurses anyone needs dunia
Ociirosiana,betapa susah cikgu arah duduk
Ociirosiana,sebar corona indonesia maret jakarta jabar banten jateng kal
Ociirosiana,sebar pasien corona indonesia tinggal dunia maret jakarta jateng bal bantai
Ociirosiana,kepala dinas sehat provinsi riau mimi yuliani nazir pasien positif corona riau pasien pendek
Ociirosiana,pelampung bebek flaminggo tengger kasur cosplay renang
Ociirosiana,anak utama bola rumah pegang bola iya bola mantul kesana
Ociirosiana,suami libur
Ociirosiana,fk unri batu produksi racik tangan sanitizer mungut biaya syarat bawa bahan
Ociirosiana,rachel vennya hasil galang dana rp miliar cegah virus corona
Ociirosiana,tua tani anak rumah ajar rumah ajak sih anak ajar gambar hewan lucu nant
Ociirosiana,lingkar cahaya kece deh akses kelas online gratis kelas batas upaya tempo
Ociirosiana,mui fatwa hukum salat jumat umat islam tengah rebak virus corona corona fatwa uma
Ociirosiana,nabi muhammad saran quarantining contain mati pecah dengar an pecah wabah lan
Ociirosiana,catat curhatan swa karantina ikhtiar wajib tawakal
Ociirosiana,pemko pekanbaru perintah provinsi pemerintah provinsi riau rumah sakit rumah sakit rujuk warga
Ociirosiana,lupa periksa dokter iya tujuh rumah sakit bantu tangan gratis
Ociirosiana,bicara bolak kibas wartawan irl kantor salah faktor korea selatan sigap pecah
Ociirosiana,pintar cari nafkah sosial jarak tanggung
Ociirosiana,tukang sayur whatsapp grup isi rw tulis pesan beli teras rum
Ociirosiana,sayang acin malu ganti jaman baheula
Ociirosiana,bucinnya
Ociirosiana,umum ruangguru telkomsel gb gratis siswa ajar online tekan
Ociirosiana,area tampil data jakarta jawa barat
Ociirosiana,tinggal italia akibat corona negara minggu santai
Ociirosiana,urus masjid raya annur provinsi riau tiada aktivitas olahraga kawasan masjid waktu bijak
Ociirosiana,tutup filmmaker wuhan has rekam video buku hidup tinggal epicentre sih
Ociirosiana,kadisdik pekanbaru abdul jamal jamal harap didik
Ociirosiana,wilayah sebar corona pagi jakarta tangerang bandung solo yogyakarta bal manado
Ociirosiana,ayo sultan utama artis youtube seleb konglomerat bantu perintah korea selatan artis
Ociirosiana,dinas sehat diskes provinsi riau konfirmasi tujuh pasien sangka duga vi
Ociirosiana,lafaz panggil ibadan hayya alasshalah mari salat shollu rihaalikum sholatlah rumah
Ociirosiana,jaga lindung warga jakarta potensi risiko tular corona minggu pemerintah provinsi dki
Ociirosiana,kejut niat beli
Ociirosiana,gubernur dki jakarta anies baswedan pemerintah provinsi tutup wisata dki jakarta pekan depa
Ociirosiana,teman kantor kampanye sederhana sumbangsih tahan laju corona tidur
Ociirosiana,infeksi rahasia wilayah peta risiko wilayah tolon
Ociirosiana,loh saudara wanita kepala bayi
Ociirosiana,sungguh paham bawa sebar sesuai wilayah rad
Ociirosiana,umur bayar bpjs pakai bpjs obat malas ngantre harga dengar cerita selam
Ociirosiana,otomatis istighfar saudara wanita khilaf iya
Ociirosiana,baca mengambil udara minum teguk sadar hamba puasa iya rabb
Ociirosiana,dengar doctors lambat
Ociirosiana,saudara laki pagi mencak bungkuskan nasi uduk emaknya masakin nasi goreng kepalang
Ociirosiana,informasi selasa mtc raksasa panam
Ociirosiana,posisi wewenang doing hindar butuh groups
Ociirosiana,dampak clear italy days fine si medis tents
Ociirosiana,gigi anak bagus karies tuanya rutin mengecek gigi anak bintik misi
Ociirosiana,rumah ajar anak sikat gigi supervisi seb
Ociirosiana,dokter gigi anak lanjur rampan karies kunjung saudara
Ociirosiana,awat tambal gigi tambal awat salur akar gigi
Ociirosiana,dental sehat didik tua anak ajar sikat gigi dihin
Ociirosiana,gigi anak karies anak alami nyeri fungsi kunyah ganggu sulit
Ociirosiana,aduh biarkan sih dokter gigi susu sebentar penggantinyaa repot urus ngebersihin gigi susu
Ociirosiana,rampan karies temu anak usia tahun balita sebar tinggi anak usia tahun
Ociirosiana,buka iya karies sakit serang jaring keras gigi rampan karies
Ociirosiana,semangka
Ociirosiana,hidup toddler jilid utama ayam tidur kejut metok hidung
Ociirosiana,bosan tengah senja informasi corona
Ociirosiana,eksponensial tumbuh talking
Ociirosiana,breaking indonesia wni pulang negeri travelling
Ociirosiana,giur tiket murah iya
Ociirosiana,sih perintah cuti cari
Ociirosiana,video tahun ngobrol
Ociirosiana,tweet bagikan liha
Ociirosiana,feeding rules children hindar makan problems later nyala three basic rules jadwal kepung
Ociirosiana,jalan kota pekanbaru capai kilometer jalan kondisi rusak berat capai ratus kilometer
Ociirosiana,laki laki perempuan dunia sukses butuh support sistem
Ociirosiana,mencolong uang koleksi mesum
Ociirosiana,remeh richard hatchett pimpin vaksin
Ociirosiana,perbarui situasi kembang indonesia buah utas
Ociirosiana,hasil kendali sakit putus rantai tular isolasi terha
Ociirosiana,laki laki tahun imported
Ociirosiana,bantu tekan sebar cuci tangan udara sabun sentuh muka
Ociirosiana,lipat lipat eksponensial tumbuh scary mari tekan
Ociirosiana,tes anak alami senin maret pagi dokter periksa batuk batuk dokter
Ociirosiana,populasi italia parah tinggi cina juta deaths juta
Ociirosiana,does sabun mandi nyala sars cov coronavirus indeed viruses si
Ociirosiana,negara dunia positif
Ociirosiana,cuci tangan udara alir sabun cuci tangan udara alir sabun cuci tangan udara alir saudara
Ociirosiana,minggu ubah drastis serius agresif tekan sebar saudara laki
Ociirosiana,struggling berat badan anak grafik tumbuh anak
Ociirosiana,wanita cahaya beda senang
Ociirosiana,golong travelling suka beli beli disem
Ociirosiana,lingkar cahaya tolong informasi keluarga tetangga teman kenal biaya kait corona
Ociirosiana,perbarui kembang corona lindung wni tanggal maret pkl wib
Ociirosiana,pasien positif corona negeri sukarela periksa alami apre
Ociirosiana,andrea topik simak suka bicara
Ociirosiana,anti coronavirus protokol cuci tangan gelang tangan ambil air milik tangan bawa hidung breathe air clea
Ociirosiana,batal
Ociirosiana,tangan ruang lokasi isolasi milik lokasi isolasi yan
