username,tweet
Ociirosiana,teman vaksin
Ociirosiana,pasang uang jabat bahagia bahagia hati syukur
Ociirosiana,suasana hati turun moodswing kerna haid lelah harap untung
Ociirosiana,giveaway payudara serum niacinamide menang syarat mudah tau
Ociirosiana,ibadah susah bahagia
Ociirosiana,hancur percaya rugi hilang reputasi
Ociirosiana,hack whatsapp canggih bantu teman wanya bajak malam hacker attacker whatsapp
Ociirosiana,batal
Ociirosiana,menit ketawa gara gara
Ociirosiana,suka standar cemil ajak cemil saudara wanita
Ociirosiana,nikmat bakwan dusta
Ociirosiana,tolak vaksin fokus habis tenaga sarat debat juntrung
Ociirosiana,an saran gaya hidup kopi mahal beli barang branded kumpul-kumpul saudara
Ociirosiana,harga sih iya uang beranta bingu
Ociirosiana,ktp elektronik scam fotokopi ektp keran saudara
Ociirosiana,normalize foto wajah jenazah waktu ngelayat unggah sosial media
Ociirosiana,demam anak muncul ruam merah tubuh campak roseola
Ociirosiana,kuat butuh hidup gimanapun butuh larang
Ociirosiana,mandiri butuh butuh bantu
Ociirosiana,tips bebas cicil beli
Ociirosiana,disisirin iya
Ociirosiana,prinsip gadis tampan wangi
Ociirosiana,tips hidup waras
Ociirosiana,iya
Ociirosiana,masker beli tes kepel bayar cemil cari rp triliun habis tangan cowok
Ociirosiana,rumah urus kalap belanja suami juara
Ociirosiana,suami bawa anak pes lawan beli
Ociirosiana,coba suruh bakar mabuk bolu gagal ros
Ociirosiana,yaampun masakan hahahahahaha habis
Ociirosiana,pikir seks si seks si intim sentuh looked admired
Ociirosiana,sewa waktu umur an cicil umur an lampu merah an rumah usia pensiun hasil
Ociirosiana,tips belanja mini supermarket
Ociirosiana,kadang sih suka bajak mimpi cita pikir ragu percaya
Ociirosiana,anak panggil acin saudara panggil dengar melotot anak kura
Ociirosiana,alhamdulillah terimakasih tuhan kasih suami
Ociirosiana,husband
Ociirosiana,harga anak nyaman buka daerah kelamin
Ociirosiana,salah sih tawa
Ociirosiana,pagi cinta rem scooter remaja tekan panas hati kejut
Ociirosiana,tahun hidup habis betapa jahat dunia
Ociirosiana,pemerintah provinsi riau
Ociirosiana,bencana indonesia pandemi banjir bencana gempa ujung hilir bencana
Ociirosiana,pikir pikir pagar
Ociirosiana,dokter berani vaksin sinovac berani sedia pilih vaksin dokter
Ociirosiana,bahas vaksin sinovac iya bpom umum hasil uji klinis fase vaksin sinovac
Ociirosiana,batal
Ociirosiana,anak kicik syopi cinta ondemande
Ociirosiana,guru saudara laki cukur rambut saudara laki masak drama korea tonton antm intm masterchef ohya
Ociirosiana,diramein sih resah konten yucub
Ociirosiana,meant every hati hati iya jalan kabarin
Ociirosiana,analogi kepel antigen cepat alat tes hamil pakai masker jaga jarak vaksin jalan kondom covi
Ociirosiana,konon proses cemil pokok beras
Ociirosiana,percaya miskin takdir pilih serah riset anak miskin bak
Ociirosiana,mabhuq hydrococo beruang brand resep saudara wanita bangun pagi esok segher
Ociirosiana,tawa anak gadis malakin bapake kinder gembira rase
Ociirosiana,tahun nikmat momen hidup pikir khawatir
Ociirosiana,usul sekolah tatap muka tunda wajib varian corona angka positivity
Ociirosiana,habis kota tes corona negatif habis pergi isolasi selam
Ociirosiana,suka antem strangers sosial media uang menang damai milik
Ociirosiana,batal
Ociirosiana,cerita imunisasi iya teman teman hubung ida tabel jadwal imunisasi
Ociirosiana,kriuk tawa
Ociirosiana,teman sosial makan cerah kilat
Ociirosiana,mamisoka malu miskin belaga tawa terkait
Ociirosiana,rawat tunggu mati rawat sembari harap hidup kebahagiaa
Ociirosiana,sih cemil gendut gendut iri
Ociirosiana,batal
Ociirosiana,dibolehin sik sholat ied loh idul fitri diadain jakarta cowok
Ociirosiana,tinggal perang badar
Ociirosiana,suji yunji jio anteng iya waktu konten anak anak whatsapp tuanya
Ociirosiana,klavuu bersih busa saudara iman
Ociirosiana,periksa hamil periksa darah lengkap konseling gizi imunisasi dasar lengkap gigi tambal scaling
Ociirosiana,konseling obat ganggu jiwa konseling kb konseling vaksin tetanus calon pengantin obat peny
Ociirosiana,layan gratis murah puskesmas periksa vaksin rabies periksa dahak obat tbc periksa
Ociirosiana,luncur
Ociirosiana,walahh
Ociirosiana,lupa minggu webinar picky eater hayo anak suka pilih cemil
Ociirosiana,koordinat tolong dokter
Ociirosiana,visioner iya
Ociirosiana,loh
Ociirosiana,tipu lumayan loh dokter mibta tolong dewasa kain tinggal adeknya
Ociirosiana,warna merah muda malu teman pakai biru sih coba malu
Ociirosiana,babe sabun losion malu
Ociirosiana,imunisasi vaksin atur atur tri sehat republik indonesia tahun program imunisasi rutin
Ociirosiana,nyetir mobil
Ociirosiana,riau pantai cermin pantai
Ociirosiana,suka kesal periksa suhu tangan eksperimen sederhana diu
Ociirosiana,saudara kulit tekstur kulit gradakan sca
Ociirosiana,checkout checkout available iya syarat twitter wajib instagram pilih
Ociirosiana,tuhan santai sibuk repot
Ociirosiana,desember repot tydac habis waktu leha iya
Ociirosiana,sabar
Ociirosiana,henponnya canggih sih pilih nyaring sayang kamera canggih
Ociirosiana,ahli terimakasih
Ociirosiana,ngalor ngidul
Ociirosiana,saudara wanita gosip tahun libur iya tabung anak tahun iya eh antam ki
Ociirosiana,heboh brand beli jeli coba deh hitung
Ociirosiana,teman gosip barang branded iya iya paham tawa iya bicara iya
Ociirosiana,heboh gaya sih saudara biaya legowo selow
Ociirosiana,sombong biaya sekolah zayan tamat kemarin ngenyek pil
Ociirosiana,status jabat instansi suami iya bilang rencana pe
Ociirosiana,selagi jalan mudah anak tumbuh berkembanh sesuai cita cita
Ociirosiana,iya beli barang deh harga kualitas sih mudah iya
Ociirosiana,komentar kejut takut situ mahal loh iya iya ngesok
Ociirosiana,pasang cerewet pilih sekolah saudara laki komentar tuhan rumit
Ociirosiana,true
Ociirosiana,kereta tanah beli waktu jalan jalan negeri kereta tanah drama korea http
Ociirosiana,sih ken hemat dipengenin barang dibutuhin ti
Ociirosiana,ajar lelah lelah bodoh lelah lelah tinggal
Ociirosiana,masak beberes rumah cuci nyapu nyetrika coba lulus pandemi ketrampilan
Ociirosiana,pandemi beli online rawat kulit utama anak baju kerudung
Ociirosiana,jaman umur teman andal senang susah oke
Ociirosiana,hidup coba hidup minoritas rantau titik ubah
Ociirosiana,batal
Ociirosiana,heboh belanja pikir beli iya pinginnya libur
Ociirosiana,susu lancar pasca salin mudah ajar susu
Ociirosiana,saudara
Ociirosiana,kasih dukung proses sapih
Ociirosiana,batal
Ociirosiana,teman akrab sibuk hubung ket
Ociirosiana,lelah
Ociirosiana,gabung twitter
Ociirosiana,jual twitter beli jual pesan saudara beli
Ociirosiana,hidup sebecanda ajak cerita ngobrolin tawa
Ociirosiana,selamat kakdel ayo bareng kilogram
Ociirosiana,batal
Ociirosiana,mudah sih stunting tinggi badan pendek banding tinggi badan umum umur saudara
Ociirosiana,ayo harga putus hubung harga
Ociirosiana,oh ruam muka henti beli kacamata sabar iya ci salah dewe
Ociirosiana,manajer rumah tangga tan
Ociirosiana,buru hotel tiket pesawat saudara laki
Ociirosiana,bakso sate lotek
Ociirosiana,hdi cewek
Ociirosiana,indonesia
Ociirosiana,cuy sih
Ociirosiana,manusia adam manusia malam saudara hasil incest
Ociirosiana,simpan kulkas
Ociirosiana,menikah gaul hormat uji komitmen lelaki menikah
Ociirosiana,doyan udara putih ayo pelan pelan bangun tidur minum gelas cemil
Ociirosiana,jajan mentai mentai apose apose ramashok sen beda
Ociirosiana,baca iya
Ociirosiana,mesen kentang goreng selai bom bangun saudara laki
Ociirosiana,ganti harap semoga oktober bawa kabar
Ociirosiana,darah sumbat kondisi ancam mati insideourbrain dokdes ryu
Ociirosiana,pendam beban keluh takut bilang syukur tua bebas cerita
Ociirosiana,semoga anak anak indonesia kenyam didik tinggi
Ociirosiana,tahan sabar pergi corona
Ociirosiana,kecewa ekspektasimu
Ociirosiana,candid suka sedih sensitif berita buruk negatif suasana kejad
Ociirosiana,kadang malas balas obrolan teman wasap malas balesnya penasaran isi chatnya
Ociirosiana,giat cuci tangan atur masker cegah tular corona bersih
Ociirosiana,catat virus cultured surfaces fomites rsud atur pointing against
Ociirosiana,berita data virus kultur muka pasien rumah sakit menunjukk
Ociirosiana,pergi periksa nyala milik friends might seem oke nyala sosial media seri perhati
Ociirosiana,demam lantai selai kegawatdaruratan rumah sakit sesak napas dehidrasi
Ociirosiana,infografis demam gejala diagnosa gawat rumah sakit sa
Ociirosiana,demam bawa dokter demam curiga sakit serius
Ociirosiana,pandemi khawatir bawa anak dokter sa
Ociirosiana,awan maha payah sikap jokowi tahan menkes becus tangan pandemi
Ociirosiana,ayo
Ociirosiana,luhut kemarin awan malam nunjukin jabat publik bijak poles
Ociirosiana,menkes awan angkat detik tahan anggap
Ociirosiana,kompeten percaya bidang tenang perintah percaya
Ociirosiana,jlebnya tawa goks saudara wanita nana
Ociirosiana,undang awan sila tonton link youtube
Ociirosiana,gila ide monolog olah wawancara menteri awan tampar keras
Ociirosiana,hidup imbang dipendem
Ociirosiana,omong omong sebar deh alam konsumsi boba utas
Ociirosiana,gantung bahan cemil area negara gantung bah
Ociirosiana,menu cemil siang beta pisang luang ubi jalar rebus salada udara bunga galagala tebus telur tomat ceri
Ociirosiana,bagus dokter malu ayo dokter
Ociirosiana,tolong teman teman pancing emosi kerabat beliau lanjur maja pilk
Ociirosiana,abai
Ociirosiana,giveaway giveaway giveaway menang rt ayo oke
Ociirosiana,tan pekanbaru pandemi giat damping anak sekolah ruma
Ociirosiana,rencana admin pandemi selesai minggu
Ociirosiana,waspada takut beda hemat pelit beda sopan serba beda
Ociirosiana,upaya minum susu susu sapi oke susu kedele oke udara sasar menc
Ociirosiana,utas kapasitas sehat batas menteri airlangga hartanto
Ociirosiana,salah hubung manusia teman pacar keluarga nyaman mal
Ociirosiana,pasang saudara laki
Ociirosiana,ikan anak tumbuh asupan gizi menu masakan bera
Ociirosiana,rules hidup pola sial
Ociirosiana,perintah suka kunci turun indonesia locked turun negara an ironi
Ociirosiana,nyaman
Ociirosiana,resep umum dingin alias selesma obat umum obat sabar gendong malu gendo
Ociirosiana,selai bagikan instagram ribu suka rindu iya nam
Ociirosiana,perspektif manusia penuh manusia
Ociirosiana,pln saing rugi rakyat bayar rugi diam diam
Ociirosiana,apaqa jejak
Ociirosiana,erti adab sakit
Ociirosiana,lado kutu
Ociirosiana,positif kepel telusur
Ociirosiana,instagram omong omong saudara kantor kemarin positif suruh kepel karyawan
Ociirosiana,informasi mertua keluarga bukittinggi tes kepel pagi malam hasil maksimal besok
Ociirosiana,sumber daya utama kapabel sumbar untung andan hebat laboratorium andalas kapasitas
Ociirosiana,tarik sumatera barat apbdnya batas tes pacar lampau jawa tengah jawa barat jawa timur
Ociirosiana,sumbar bukti perintah swasta kolaborasi kendali pandemi kepel gratis hebat
Ociirosiana,saudara pekanbaru
Ociirosiana,suka parfum zara giveaway parfum zara beli suka wangi retwe
Ociirosiana,ruang alat sedia cepat nakes terampil
Ociirosiana,tidur sih chit nakesnya nakes rumah sakit positif pulih otg isolasi mandiri kat
Ociirosiana,mahasiswa universitas riau periksa universitas riau hijau kampus setuju masyarakat ber
Ociirosiana,indonesia alfa saudara ganti ayo ambil karet awet saudara pakai drama
Ociirosiana,matahari
Ociirosiana,karak kaliang dwong
Ociirosiana,pedoman hamil ngobrol konselor susu usia hamil minggu
Ociirosiana,rezeki susah uang usaha sepi tuhan lunak
Ociirosiana,setuju reza arap hidup orangtua uang orangtua cemil orangtua iya nurut
Ociirosiana,oppa
Ociirosiana,merdeka pikir
Ociirosiana,merdeka tenaga sehat bebas sponsor usaha rumus bayi
Ociirosiana,besok iya selai wib fanpage asosiasi susu indonesia aimi salur youtube cemil
Ociirosiana,semprot dus buang retweet
Ociirosiana,cemil nasi padang bungkus
Ociirosiana,cinta rendang
Ociirosiana,wilayah manfaat kota provinsi sumatera aceh sumatera utara riau sumatera
Ociirosiana,paket spesial umb kuota internet gb menit telepon sms nomor
Ociirosiana,lanjutkan masak bentar kamar eh pacar tidur monmaap motif suami pulang cepat pacar tidur siang
Ociirosiana,suami grusuk dapur ambil piring sendok jeniper madu kamar iya cemil piring
Ociirosiana,suami pulang cepat responnya bawa obat iya kamar
Ociirosiana,siang dadak pitam tungkai kaki lemas tenaga hilang nyawa badan buru
Ociirosiana,ajar jarak teknologi pedagogi teknologi lawan pedagogi
Ociirosiana,manfaat pjj komunikasi aktif guru walimurid guru hany
Ociirosiana,tomyam
Ociirosiana,selesai modul kelas ayahasi modul kembang responsif bencana gempa palu
Ociirosiana,burung teman teman
Ociirosiana,gelombang bunga emaknya gelombang ikan anak gelombang kelinci gelombang burung
Ociirosiana,vaksin corona
Ociirosiana,habis iya lawa negara
Ociirosiana,kulwapdifa bareng sariawan ayo link
Ociirosiana,waktu habis anak harga buibu santai dikit tinggal anak
Ociirosiana,tunda tahun luncur modul latih kelas ayahasi tun
Ociirosiana,asi eksklusif tahun mpasi lindung anak an
Ociirosiana,raya agustus raya dunia simak vi
Ociirosiana,pilih diam ribut rumit
Ociirosiana,senang dunia breastfeeding minggu
Ociirosiana,selamat libur tarik tulis sih
Ociirosiana,ajar pria pekanbaruyafi amrimenjadi runnerup internasional hadiah astonomy astrophysics kompetisi iaac
Ociirosiana,asi cair hidup komposisi merespon reaksi udara liur bayi bayi sakit faktor imun asi tingkat sesuai
Ociirosiana,malu sih jahat
Ociirosiana,teman teman barang dipakai malas memfoto heran giveaway dapetnya rias baju selim
Ociirosiana,waspada curi tanam hias
Ociirosiana,sih gigi bungsu sih gigi bungsu pergi kondisi gigi bungsu tahan
Ociirosiana,tenang lakban bening iya mari besok lapis kacamata aestetik impi lakban bening tyd
Ociirosiana,tahan patah tawa iya paksa optik acemana
Ociirosiana,sadar gagang daerah kuping ruam gatal nyeri lecet
Ociirosiana,pakai kulit lgsh reaksi telinga gatal dikit minggu ila
Ociirosiana,kemarin waktu camata lupa lupa anak muda pamer tawa
Ociirosiana,senang pakai kacamata saudara wanita model cocok ruam iya sadar beli gaga
Ociirosiana,sulit bahagia tolak ukur nikmat
Ociirosiana,meliara taneman diopenin dokter mamerin taneman bini videocallan
Ociirosiana,salah sayur dedaunan tanam selada budi daya pestisida kimia sintetis
Ociirosiana,corona musuh juang sikap pikir kar
Ociirosiana,teman teman corona jual deodoran turun iring
Ociirosiana,ealah ramai dipromoin nyumbang telepon bekas anak tinggal
Ociirosiana,semoga besok kabar
Ociirosiana,cepat uji antibodi mudah beli kulak supplier tolak negara negara
Ociirosiana,tingkat ilmul yaqin tunggu ainul yaqin semoga haqqul yaqin ilmul yaqin
Ociirosiana,inti kontrol biasain bilang hak pikir iya
Ociirosiana,kasih sakit manipulasi pintar bahas jurus
Ociirosiana,utas guru jatuh sakit materi ajar ajar berani cerita tem
Ociirosiana,setuju dukung ojk satgas waspada investasi admin hati hati cermat
Ociirosiana,tips iya baca baca ulas ulas cemil
Ociirosiana,isi waktu luang isi dompet kosong pandemi tulis novel bunuh danau beku
Ociirosiana,tidur siang anak tahun wajib doc
Ociirosiana,genks numpang jual jual maenan adek balita merk domestik labeille menggemaskan range harga an iya
Ociirosiana,jepit iya buka operasi bayang pedih risiko operasi teluk
Ociirosiana,anak tahun anak haid mal efektif
Ociirosiana,hilang keluarga akibat corona percaya corona kit
Ociirosiana,jurnal ilmiah milik dampak tingkat tinggi tingkat internasional negara lancet nejm jama
Ociirosiana,gejala ringan berat gagal napas ambil risiko
Ociirosiana,iya langka ambil risiko milik bayi
Ociirosiana,iya bahaya madu kandung bakteri clostridium produksi botulinum toksin
Ociirosiana,ngelus payudara kasih madu anak tahun iya klaim rumah
Ociirosiana,ilmu kembang teliti generasi
Ociirosiana,orangtua jaman cemil mp asi pisang turned fine iya
Ociirosiana,kasih bubur buah penuh butuh nutrisi iya bambang
Ociirosiana,protein lemak bangun blok otak anak lantai tahun pesat pesatny
Ociirosiana,ive menu tunggal rekomendasi penuh butuh nu
Ociirosiana,mp asi indikasi iya ganggu asi eksklusif kapasitas teliti
Ociirosiana,anak status gizi tingkat berat badan sesuai target buru buru kasih mp asi
Ociirosiana,iya kasihan anak menampak ken cemil does kasihan anak dada
Ociirosiana,sedih baca artikel iya sedak tahan kepala
Ociirosiana,iya sederhana mp asi risiko ecek ecek obesitas
Ociirosiana,anak penuh syarat mp asi kesiap motorik samp
Ociirosiana,mp asi rekomendasi usia indikasi gagal tumbuh
Ociirosiana,iya tuhan lindung sedih duka cita lemah malas kecut kikir lilit hutang
Ociirosiana,admin asi perah jemur matahari darah
Ociirosiana,iya berat tahan ayo
Ociirosiana,marah sih nasi tiris siram putih kacau makan tawa dengar aksen
Ociirosiana,lingkar cahaya anak lahir kondisi super langka moebius syndrome mutu
Ociirosiana,dipikirkan keluarga habis saudara habis tetangga habis gang belah
Ociirosiana,percaya rumors masks affect milik oksigen levels
Ociirosiana,bahas kb pergi lapang hamil pandemi salah satun
Ociirosiana,utas perbarui barang cancelan hotel juli baca terang gambar pengirima
Ociirosiana,dipikirkan menikah ngetek tuanya putus
Ociirosiana,cina mentest juta positif ribu indonesia juta spesimen konfirmasi positif ribu
Ociirosiana,sih teman
Ociirosiana,bosan isolasi alam salah positif corona baca amb
Ociirosiana,bodoh
Ociirosiana,kondangan yess indomaret pakai lipstik
Ociirosiana,lho al qur an iya hutang piutang catat saudara sendir
Ociirosiana,pandemi lucu iya
Ociirosiana,sandiwara selesai sesuai skenario titik ajar indonesia bahaya berantas
Ociirosiana,ahsantum ahsantum li anfusikum whatsapp tum falaha engkau engkau
Ociirosiana,lockdown saudara tinggal
Ociirosiana,hati penuh iri dengki hidup sulit penuh prasangka bawa cerewet hidup
Ociirosiana,cari pasang anak sahabat karyawan usaha lain-lain misi
Ociirosiana,uw maknyus mantap saudara wanita tey
Ociirosiana,giveaway cepat rt
Ociirosiana,senin dengar difa buka senin loh pantau iya media sosial difa difa
Ociirosiana,besok sabtu teman teman difa periksa gigi ayo telepon admin difa lupa tata tertib difa sup
Ociirosiana,superluv masyaallah dokter materi belalak sehat murah rezeki dokter
Ociirosiana,lingkar cahaya picek kah kemarin jiwasraya bp
Ociirosiana,asuransi jenis asuransi umum mobil lain-lain asuransi sehat asuransi sakit kiri
Ociirosiana,prioritas pasang cari pasang prioritas kare
Ociirosiana,kuat hancur kuman asam malas sikat gigi
Ociirosiana,iya intervensi setuju bersangkutan
Ociirosiana,akibat kondisi atmosfer intrusi udara kering bahan bumi utara bbu lintas wilayah samudera pasif
Ociirosiana,badan meteorologi klimatologi geofisika bmkg prediksi potensi cuaca ekstrem upa hujan lebat
Ociirosiana,tulis resep cookpad saudara wanita resep pakenya jengkol senja pete saudara
Ociirosiana,mantap malu
Ociirosiana,malu selamat coba semoga cocok lidah iya saudara wanita asam kandis juru kunci
Ociirosiana,ealah salah ketik telur puyuh rebus
Ociirosiana,contoh komunikasi krisis buruk perintah narasi kabar rekor saudara
Ociirosiana,masakan lintas pulau iya saudara wanita suka suami saudara wanita tey sambalado tanak isi teri pete
Ociirosiana,steril pakai uvc lampu bandrol juta loh jual ongkos jasa titip iya yan
Ociirosiana,selamat pagi saudara saudara tanah udara selamat beraktifitas iya lupa jaga jarak jaga sehat masker
Ociirosiana,hakasimanya hakasima merk lipat panci dokter panci uji bagus
Ociirosiana,grup tua sekolah anak waktu flies
Ociirosiana,kreativitas batas
Ociirosiana,turun jurus ken lawan realitanya ilmu gizi realita didik kimia
Ociirosiana,prancis negara hadir anak pulang indonesia lepas hutan belan
Ociirosiana,rela bibit lobster ekspor rakyat rela bibit ekspor
Ociirosiana,wisuda diikhlasin pasang menikah diikhlasin anak
Ociirosiana,menganggu proses susu bayi eksternal iya beril berkoment
Ociirosiana,susu pakai nursing tutup intimidasi susu umum beli pompa asi
Ociirosiana,ajak anak taman safari
Ociirosiana,treating prioritizing keren prioritize othe
Ociirosiana,kawan sus pudjiastuti kapal ikan
Ociirosiana,candid pikir pandemi gila pikir
Ociirosiana,tan habis pikir laki istri rumah kasih kepast
Ociirosiana,menikah dasar butuh tanggung sih laki perempuan
Ociirosiana,mudah hidup bicara rezeki atur cari rezeki susah suami
Ociirosiana,pasang mudah menikah bilang menjalani rezeki mengatur hati
Ociirosiana,sabar iya saudara laki tangis pokok corona terbang remaja sabar iya anak
Ociirosiana,deh berangan pesawat remaja pesawat cinta turun oke
Ociirosiana,pesawat tangis jelasin pesawat barang pesawat dokter
Ociirosiana,bandara layan terbang normal pesawat darat
Ociirosiana,titik jalur landas bandara pakai duduk pesawat darat pelanta
Ociirosiana,ekting saudara wanita bicara bandara perhati perhati tumpang pesawat citilink
Ociirosiana,kemarin cosplay bos bapake bicara libur bawa saudara laki jalan
Ociirosiana,setuju batam nenek sederhana daya tangis emaknya iya balek kampong
Ociirosiana,anak halusinasi pesawat cosplaynya
Ociirosiana,batal
Ociirosiana,batal
Ociirosiana,budok
Ociirosiana,nfo gempa maag jun wib lok ls bosan kilometer timurlaut padangpanjang sumbar kedlmn kilometer bmkg
Ociirosiana,prinsip dasar pimpin puji buka hasil anak buah parah anak buah tutup tanggung
Ociirosiana,lumayan iya grendel lupa buang kulit ikan patin merah wortel malu
Ociirosiana,adon ngetem sebentar difreezer mudah an sukses dibulet cantik heran bagus larang
Ociirosiana,iya pakai blender tangis makan processor ngambek layan pusat mudah an sanggup yhaa
Ociirosiana,anak bujang rikues bakso hubung daging sapi stok habis mari coba bakso ikan patin
Ociirosiana,berita presiden marah juni dengar marah juni jarak marah dengar terj
Ociirosiana,salah cerewet ngawur benci kondisi
Ociirosiana,chef william wongso an indonesian legenda has mastered over varieties rendang
Ociirosiana,masterchef dunia gordon ramsay unjung sumatera barat ajar budaya kuliner sumbar utama rendang
Ociirosiana,masyaallah difollow seleb pis
Ociirosiana,bakwan
Ociirosiana,jalan kilo gegayaan gila soto medan
Ociirosiana,umum website cdc tanggal juni grup alumni sebula
Ociirosiana,jamur enoki kandung bakteri listeria iya temu cdc amerika serikat merk temu meng
Ociirosiana,bahas kibas bahaya bakteri listeria jamur enoki urus seberang kontaminasi sel
Ociirosiana,iri zealand sih
Ociirosiana,iri igstory kumpul-kumpul tertawa malu jaga jarak pakai masker oke
Ociirosiana,jamur enoki tarik edar kandung bakteri listeria bakteri mati dipanask
Ociirosiana,sari roti roti indonesia nyamperin rumah beli deh marketing
Ociirosiana,sih hidup hidup tenang hutang
Ociirosiana,besok kulwap loohh bareng gabung klik
Ociirosiana,pacar pria watak buru buru macet mempe
Ociirosiana,klean nyebutnya
Ociirosiana,hebat suami sahabat getar nama cibir
Ociirosiana,teman langgeng awet iring jatuh lesat mera
Ociirosiana,sahabat tinggi super suami bangga
Ociirosiana,waktu saran eureka data ukur sinar uvb
Ociirosiana,efek negatif hamil preeklampsia diabetes mellitus hamil lahir misi
Ociirosiana,bahas hasil laboratorium bahas vitamin saudara sih mudah untu
Ociirosiana,kelas online gapura digital gratis ayo ajar optimal google rangkai muda
Ociirosiana,dapur iya bakso bagus
Ociirosiana,bicara politik lucu bau bawang paham
Ociirosiana,mispersepsi kalang masyarakat tanda transparansi bijak ambil
Ociirosiana,riau gelombang
Ociirosiana,jarang hutang ngomentari politik gerah deh manusia awam an
Ociirosiana,iya ngab pemerintah daerah butuh dana dana pengawasa
Ociirosiana,gagal skala prioritas hidup salah gali kubur
Ociirosiana,saudara saudari hormat normal hidup normal damping corona
Ociirosiana,aspek hidup kompetisi salah teman dikit tulus
Ociirosiana,iya
Ociirosiana,hati impor vietnam pakai mutih cair putar beli ikan tengiri tongkol mujair
Ociirosiana,keras iya si indah gaib senang
Ociirosiana,tahun tahan waras bagus
Ociirosiana,batal
Ociirosiana,feminin feminim pasang maskulin maskulim saudara laki saudara laki
Ociirosiana,talua barendo baluik dendeng kariang
Ociirosiana,ditegor sikap sifat buruk bilang sadar
Ociirosiana,coba deh iya jaman omong bumi planner ajar reprior
Ociirosiana,biaya hamil salin juta biaya sekolah puluh ratus juta tahun omong bilan
Ociirosiana,biaya lahir konten anak
Ociirosiana,serang udara keras maaf proses hukum jalan mesti terjdi
Ociirosiana,elang payudara jatuh rumah warga camat siak hulu kabupaten kampar senin pagi pilot lettu pnb apr
Ociirosiana,anggur madu kasih
Ociirosiana,paket salin lahir dokter
Ociirosiana,tanggung mengambil untung manusia
Ociirosiana,sedih
Ociirosiana,kirim via jnt monmaap pesan via shopee
Ociirosiana,anak hutang dibeliin utama mancing orderin iya selesai pesan kirim
Ociirosiana,ganti menampak ganti kondisi
Ociirosiana,kisah sedih selasa
Ociirosiana,iya lahir indonesia
Ociirosiana,untung henti situ berat saudara iya
Ociirosiana,dara tahun saudara bunda otan otan utan saudara saudara utan monyet
Ociirosiana,informasi waktu akun instagram ambil alih admin akses instagram
Ociirosiana,ciri aman bahagia usik bahagia mengaku
Ociirosiana,makan bersih nggodog kangkung bayem buncis cang labu cemil pakai sambal plecing brambang asam sambal
Ociirosiana,lagu iwan fals keren anak bawa
Ociirosiana,situasi lapor indonesia temu kasih saran perintah laksana
Ociirosiana,prinsip iya protes suka kilometer
Ociirosiana,sengaja niat bangun subuh sengaja udara keras subuh udara keras bawa udara wu
Ociirosiana,kdm mone
Ociirosiana,menyiram udara keras sengaja sengaja menaksir eh sengaja
Ociirosiana,foto wallpapernya
Ociirosiana,wanita usia an tahun kondisi precondition comorbid sehat muda paru
Ociirosiana,jay iya sengaja
Ociirosiana,asi nge refill penuh sedih deh penuh asi
Ociirosiana,sidang serang formalitas bukti persepsi bentuk
Ociirosiana,antre toilet
Ociirosiana,iya mahir gambar
Ociirosiana,provinsi riau rabu kemarin urut tingkat sembuh positif corona indonesia
Ociirosiana,jepang korea selatan gelombang pasien corona utama jepang
Ociirosiana,baca komentar merinding
Ociirosiana,setuju normal adaptasj kecuali anak anak sekolah rumah
Ociirosiana,saran tua sadar dampak sikap marah marah tengkar pasang anak
Ociirosiana,rindu
Ociirosiana,laki repot urus
Ociirosiana,abai sedih kecewa terima te
