username,tweet
rarraayu,syukur tlj jalan
rarraayu,banjir kota renang motor
rarraayu,depok pohon natal tadz tebang tadz
rarraayu,lelucon
rarraayu,wakil juve timnas itali euro dipaksain utama
rarraayu,dimana vid tinggi sekolah
rarraayu,ojek online mudah tinggal menarik ayo ngojol
rarraayu,oph tawa
rarraayu,agama era gelap malas campur aduh agama politik
rarraayu,inti motor intai rumah cepat ngobrol malu
rarraayu,putus asa depok
rarraayu,sumpah sial transfer kemarin bilang
rarraayu,siang lupa pasang alarm
rarraayu,reuni monas acara kumpul donasi bayar denda overstaynya riziq saudi malu
rarraayu,halusinasi pacar singa singa takut panggil polisi
rarraayu,ag rada khawatir gara gara lukis dinding lukis dinding spanduk ag pasang serampang pinggir jalan
rarraayu,bohong depok kue kue tar holland toko roti gantung
rarraayu,iya jilbab mode
rarraayu,batal
rarraayu,batal
rarraayu,karyawan breadtalk ban langgan tlj malu
rarraayu,bodoh miskin tinggal salah yahudi
rarraayu,batal
rarraayu,terap strategi unggul gol
rarraayu,jebak betmen
rarraayu,batal
rarraayu,pancing ular sarang tertawa
rarraayu,mancing mania ikan
rarraayu,zebra seberang gramed ringan coba nyebrang zebra seberang saudara
rarraayu,nyebrang margonda nyebrang jalan indonesia mudah tawa
rarraayu,senang je anak seni latte
rarraayu,bingung memelihara kucing monyet iya
rarraayu,gubernur bodoh iman ambil bir
rarraayu,batal
rarraayu,gubernur spesialis bongkar pasang jpo trotoar mantap
rarraayu,batal
rarraayu,maling suruh tata krama bodoh
rarraayu,christ enough natasha midori
rarraayu,rencana jahat hati tunggu tingkat
rarraayu,gojek pilih ngumpetin metode bayar cs aplikasi sopir terima pesan
rarraayu,beli aibon milyar tahun rasional iya ups
rarraayu,dikit
rarraayu,maju gentar bela aibon baswedan
rarraayu,jual lolipop permen natal
rarraayu,untung psi jakarta ngarepin partai sih mustahil
rarraayu,ikan mati lawan
rarraayu,dubbing ekspresi
rarraayu,klausa almaidah
rarraayu,sumbang konfirmasi uang tawa bahlul
rarraayu,promosi tahun mendikbud siswa smu lulus lgsng otomatis terima ojek online
rarraayu,tinggal flash menang tawa
rarraayu,buffon
rarraayu,putih induk lawan arab parents
rarraayu,alvaro soler sofia enrique iglesias bailando
rarraayu,nyaman sengaja menginjak kotoran ayam
rarraayu,yelah saudara wanita jembut numbuh budiman lawan soeharto penjara
rarraayu,teman teman iklan greentea
rarraayu,teuku wisnu singgung
rarraayu,serambi neraka
rarraayu,wan shithole countries
rarraayu,baca klausa tulis nama yudas rasul
rarraayu,indonesia jajah belanda jepang jajah arab
rarraayu,across waktu favourite video nyala internet
rarraayu,deddy pindah agama cari bahan konten tawa
rarraayu,selamat nkri khilafah
rarraayu,batal
rarraayu,nasi cooker merk philips boros beli nasi warung tegal
rarraayu,menteri jokowi rusak awet iya
rarraayu,negara fokus urus rakyat cemil didik layak sorga
rarraayu,gol bal serikat lawan persija andritany gawang nepis bola
rarraayu,brand lamborghini dosa telepon
rarraayu,senja menang lusa hehee
rarraayu,ketawa
rarraayu,heran persepsi simpan benci minoritas khususny
rarraayu,nama zina syariah
rarraayu,sepi cinta enough
rarraayu,jual dagang dosa dzalim biaya distribusi logisti
rarraayu,omong kosong dijadikan bahan berita
rarraayu,anak rocky might cutest ve
rarraayu,bakar
rarraayu,oh oh hows managed
rarraayu,pagi pagi emosi
rarraayu,hibur jaya tertawa
rarraayu,batal
rarraayu,tuhan mahayoritas
rarraayu,khotbah gereja sih umat islam saudara seberang saudara si
rarraayu,ulama prinsip senggol bacok usik deh
rarraayu,coba bicara ngebakar wihara gara gara liana
rarraayu,fansnya barbar berani polisi ambil risiko membela minoritas
rarraayu,pasar abdul somad pikir
rarraayu,ronaldo joget shopee
rarraayu,ketemu nama theresia wagiyem
rarraayu,ojek online saudara laki ojek online receh zholimi saudara
rarraayu,semarang sapi salah restoran unjung kejut
rarraayu,pasang cctv cafenya saudara laki
rarraayu,sayang rugani dipinjem
rarraayu,efek beli mahal saudara ligt
rarraayu,rizik doa pulang indonesia dikabulin tuhan
rarraayu,syukur tonton ulang burung ketangkep
rarraayu,saintis kejut teliti hiu hiu bluntnose sixgill hexanchus grise
rarraayu,ngalamin saldo ovo potong dibalikin
rarraayu,tawa
rarraayu,juve butuh imbang neraca iya
rarraayu,paket rumah saudara laki paket whatsapp kucing kepoan jend
rarraayu,happened
rarraayu,gara gara sobat gurun paskibraka rumit
rarraayu,agama indonesia dogma pribadi cipta kuasa alam sem
rarraayu,pikir indonesia sembah pribadi tuhan sembah
rarraayu,senja doa besok menang tertawa
rarraayu,dinding tulis rezeki cari jebak
rarraayu,budaya timur tengah
rarraayu,bahagia beli murah produk cina produk cina kuasa pasar marah marah logika kadal gurun
rarraayu,mari pulsa ayo menang ribu rt iya besok sakit umum
rarraayu,utama hancur pola utama kawan
rarraayu,batal
rarraayu,indah during kemarin si permainan
rarraayu,promonya dibanyakin citra melawan ambil pakai citra
rarraayu,harddisk intern sata barat digital hijau kondisi jaga sehat tb fol
rarraayu,pria selingkuh salah pria gadis selingkuh salah pria pokokn
rarraayu,akun online shop racun deh
rarraayu,paham logika kadal gurun salah busana pakai wanita asusila
rarraayu,tuhan hukum daud hukum wanita bukti tuhan pria kontrol nafs
rarraayu,iya pikir pikir instagram akun seni
rarraayu,pajak hadiah tanggung netizen
rarraayu,tweet gera rt keong jalan
rarraayu,ruang lahan parkir gedung untung
rarraayu,penggemar belah anggap edit
rarraayu,lawan sih rizik lari lari padang pasir pulang ciyan
rarraayu,karya seni bambu detail biaya juta paksa percaya tumpu bambu jakarta harga
rarraayu,habis ferari turun metromini
rarraayu,frenkie saudara jong matthijs saudara ligt gabung bursa transfer musim panas pilih jalan
rarraayu,lagu warga malu
rarraayu,batal
rarraayu,titit cambuk
rarraayu,artis mualaf apresiasi artis murtad intimidasi
rarraayu,tingkat urbanisasi tinggi solusi setel musik lampu merah pekaes
rarraayu,edit foto batas wajar
rarraayu,pimpin visi govlok
rarraayu,tidur rahang tutup micropore bangun rumah duka
rarraayu,jual sate ayam belah jual bensin ecer bakar
rarraayu,iya kampanye hitung hitungan dp
rarraayu,sih autopulang resepsi doktrin gurun rumit
rarraayu,onta pakai baju tradisional indonesia
rarraayu,batal
rarraayu,selamat menang hadiah potong pajak
rarraayu,cafenya rusak cari kafe restoran sih gaji koki kafe gaji sahabat
rarraayu,sumpah tonton ulang ulang tawa via lucu bangkai tipe senggol ba
rarraayu,dar maling jaman pintar mahir gila kedengaran ngerusak pagernya
rarraayu,testimoni sopir ambil
rarraayu,bunuh gara gara klausa kitab suci
rarraayu,pilpres selesai kampanye monyet
rarraayu,batas susu
rarraayu,saudara ligt brewok iya
rarraayu,divisi grabfood maki maki bos ambil sih
rarraayu,program bulshit pajak stnk gratis suara lipat
rarraayu,diskak tikar
rarraayu,third waktu pesona gaemungchi instagram
rarraayu,jonru ganteng gratis transfer
rarraayu,berita palsu model ngiahaha
rarraayu,felix siauw cantum
rarraayu,jalan bolong komplek walikota tambal tambal harap depok
rarraayu,lucu
rarraayu,biningging
rarraayu,ekspetasi pep realita sarri
rarraayu,agama sih mengajari setuju unt surga dosa
rarraayu,saudara laki tawa
rarraayu,dibukain pintu
rarraayu,kejut
rarraayu,pilpres kampanye tawa bodoh
rarraayu,gunadarma depok parkir ufo
rarraayu,keran agama domestik buka lebar jamin turun drastis populasi anut agama gelisah timur tengah
rarraayu,ojek online tarif murah jebak sepi minat model model
rarraayu,promosi diskon gojek kalah ambil gojek mengadu perintah tawa
rarraayu,gudang senjata si mesut zil gets nikah turkish presiden terbaik pria
rarraayu,budaya abad bawa abad tawa
rarraayu,tahun pulang republik indonesia lapor kbri saudi kewarganegaraannya otomatis hilang iya
rarraayu,indonesia damai prabowo
rarraayu,sopan presiden
rarraayu,thierry henry edgar davids zinedine zidane three aces juventus serie musim
rarraayu,ekspresi lengkap surabaya kamera metrotv
rarraayu,pilpres selesai kampanye sih wowo
rarraayu,tidur situ
rarraayu,cemil kesana reservasi lgsng jamin
rarraayu,sengaja istri buang tawa
rarraayu,harap had messi
rarraayu,prabowo sakit jiwa jokowi suruh mundur bodoh
rarraayu,curang curang curang bukti curang curang curang sila pleno provinsi pusat
rarraayu,suara hewan bebek kwek kwek kwekk kucing meong meong meongg kambing mbek mbek mbekk saudara
rarraayu,waktu selang video cloudburst hujan domestik cloudburst hujan domestik deras
rarraayu,maaf salah lucu
rarraayu,ditangkep ditangkep
rarraayu,aduh pikir
rarraayu,emaknya peter parker komuter garis
rarraayu,logika pura warga bondong bondong pindah agama hindu
rarraayu,angin topan udara waterspout gerak setuju pantai nang malaysia april waterspout monster kehila
rarraayu,pria satria pria bawa avanza
rarraayu,pilih hidup konsekuensi mamam deh rumit
rarraayu,hitung kpu jokowi mimpin juta suara mimpi tawa
rarraayu,iya sih pikir perintah ajar cegah terorisme nega
rarraayu,utas bagus buka menikah selingkuh ide buka menikah bagus
rarraayu,bajing kejut
rarraayu,udara ajak dialog pindah laut sukarela
rarraayu,gera boikot restoran padang pelit kuah rendang
rarraayu,hebat
rarraayu,parlemen pimpin pdip model zon lega
rarraayu,gila
rarraayu,milu ulang lolos parlemen tofa
rarraayu,prabowo sujud syukur lumayan bahan canda
rarraayu,gila hitung tawa
rarraayu,prabowo pintar dukung halusinasi
rarraayu,hibur iya
rarraayu,parlemen rusuh
rarraayu,khotbah nang parah
rarraayu,kursus mengetik sih yaelah
rarraayu,tsunami sulteng gempa maag apr wib lok ls bosan kdlmn kilometer bmkg
rarraayu,umur tahun uang beli batagor
rarraayu,gambar hitam lubang revealed tekan konferensi direktur shep doeleman taking
rarraayu,ambil ojek online ambil pesan grabfood pajak ojek online
rarraayu,bawa anak kereta tolong anak suruh duduk manis dibiarkan lompat gelantung kera
rarraayu,jaman sms gsm dibalesnya pakai esia hemat
rarraayu,lancar baca al quran ajak kos
rarraayu,sen bantal
rarraayu,tongseng kambing
rarraayu,tutup salah
rarraayu,isis kalah sesal isis menang jingkrak jingkrak senang basi
rarraayu,paman menawari shabu paket hemat paman butuh minat pesan iya paman
rarraayu,tahun panggil jakarta google maps jalan
rarraayu,maju kota tipu warga tertawa
rarraayu,paranormeow aktivitas
rarraayu,genoa penggemar had jual todays permainan lawan juventus marassi temu ronaldo rested juve
rarraayu,semoga hukum uefa malas iwobi utama tertawa
rarraayu,pesawat ethiopian airlines jatuh tumpang hasil selamat tuhan selamat baca lengkap
rarraayu,behind johnny depp cerita ajar lengkung assume pria
rarraayu,tonton detik ngebosenin tertawa
rarraayu,terbang darurat terbang sv jeddah kuala lampur turned saudi mothertold kabin awak kapal had fo
rarraayu,tinggal dikupasin potong saudara laki jual wkowkowko
rarraayu,nerobos lintas saran mobil jenazah mobil ambul maaf
rarraayu,ibadah pdt surg
rarraayu,selai senja sms isi saudara laki rindu sandar bahu dibangunin
rarraayu,tampol cs ngordernya
rarraayu,an bantu
rarraayu,anak kos pindah uang uang tertawa
rarraayu,silah putar
rarraayu,saudara laki vaksinasi hak anak anak indonesia
rarraayu,bodoh kasih internet iya bodoh sebar
rarraayu,turun gila tonton video ulang ulang
rarraayu,paulo dybala golazo del diez
rarraayu,sial ss tuit jual
rarraayu,bodoh
rarraayu,indonesia arab cabang asia tenggara wkoawkowkowko
rarraayu,menang wo taat regulasi rt setuju
rarraayu,anak buah suruh maju perang lari tunggang langgang huahaha
rarraayu,indonesia cemil restoran chinese alas cemil babi
rarraayu,sandi tugas keluarga almarhum gali kubur wajar pakai sporty
rarraayu,lynne mactavish menang mayat badak lindung colong badak bunuh
rarraayu,teman disputing nyala ayam goreng mcd kfc kfc rt ayam goreng mcd hel
rarraayu,sekolah hahahihi teman teman bimbel serius ajar
rarraayu,pagi pagi ngehubungi pompa udara sih sialan
rarraayu,batal
rarraayu,komen tunggu tunggu
rarraayu,krl pergi lawan pulang bekas bekas
rarraayu,ketemu sopir tangan area kelapa bengong kondisi
rarraayu,meilana jeblos penjara gara gara
rarraayu,berekspektasi tinggi sadar ruang gerak ahok bebas penuh selesai pilpres
rarraayu,tolak ratus tawar jasa edit foto buka jasa
rarraayu,gedung dpr tolong fadli zon
rarraayu,batal
rarraayu,klien wants minggu minggu video selim seni
rarraayu,tidur anak sebentar marah main teross
rarraayu,takut hilang dukung sobat sobat gurun iya
rarraayu,mantap semoga bangladesh kereta atap gerbong
rarraayu,dukung erdogan
rarraayu,artis turns starbucks culun cartoons fseo
rarraayu,chelsea penggemar harap realitas
rarraayu,oh kalimat tipu pakai almaidah ahok salah
rarraayu,saudi beli klausa barangsiapa kaum bla bla bla
rarraayu,batal
rarraayu,prabowo mute twitter tawa
rarraayu,limbad
rarraayu,kenal nukman ninggal kasih simpati mati ninggal rata rata
rarraayu,waktu jokowi urut cebongers deh
rarraayu,ongkos tera aplikasi dasar jarak tempuh restoran mes biaya parkir
rarraayu,iya ayo giveaway syarat retweet besok seri iya pakai
rarraayu,hadiah voucher pulsa oke menang syarat mudah silah unggah foto tema jalan fotografi
rarraayu,giveaway ayo retweet cari juara besok oke periksa hooper hoopersho
rarraayu,giveaway ayo retweet besok ngedraw
rarraayu,mahir menari
rarraayu,prabowo presiden saudara sih hasyim angkat menteri agama
rarraayu,haram selamat natal umat hindu galungan lantai tulis admin
rarraayu,batal
rarraayu,letus krakatau tahun silam kuat tara ribu bom atom letus lapor dengar
rarraayu,foto disebarluaskan media sosial media sosial hasil budaya kafir bodoh tawa
rarraayu,batal
rarraayu,televisi matiin
rarraayu,rekam diupload bodoh pangkat
rarraayu,sakit obat
rarraayu,iya saudara laki takut salib makam umum arwah
rarraayu,hormat wafat mengklaim agama damai
rarraayu,duka cita ayah nobita
rarraayu,mahir mahir nyanyi gerincing bells
rarraayu,sistem aplikator rubah karyawan malas utama suspen konfirmasi saudara laki
rarraayu,curang tolong undi ulang ulang lapor saudara seto
rarraayu,tahun poster kampanye cantum akun instagram facebook twitter giat caleg
rarraayu,dik tinggal cemil
rarraayu,nahkoda kapal nahkoda kapal payah prabowo
rarraayu,mesum
rarraayu,jenderal kardus guru kardus
rarraayu,partai menang warna warni sikap abu abu
rarraayu,bos gerindra saudara prabowo sih hasyim djoyohadi jemaat tibe
rarraayu,reputasi anies gubernur kuasa diskriminasi agama saudara
rarraayu,natal tibe gbk tahun paman dirayain gbk
rarraayu,tiberias tahun natal gbk nata
rarraayu,ambil pakai autobid kasih pesan beda
rarraayu,giveaway retweet lusa seri
rarraayu,kucing logika lawan anjing logika
rarraayu,burung konon tookunangkuruvi baya weaver burung yelagiri tamil naidu india
rarraayu,umur moen ehehehe
rarraayu,sistem prioritas ambil tombol prioritas nyala kasih
rarraayu,reuni murni bela agama bela prabowo bela agama bela retweet
rarraayu,waktu katekis larang keras kharismatik kharismatik kara
rarraayu,sederhana saudara wanita beda pasu sopir
rarraayu,saudara bayarin ribu
rarraayu,korban uang sial periksa uang diuntel bom kantong iya teman teman
rarraayu,kasih susu gratis minggu hebat sih efek otak
rarraayu,bagus rumah akses angkutan umum wanita
rarraayu,ngemisnya ramai ramai bawa rombong bombastis tawa
rarraayu,produk hukum universal parsial dasar agama
rarraayu,kaum mabuk agama dibilangin ngebantah pakai cerita azab sodom gomora
rarraayu,kutub
rarraayu,giveaway ayo retweet mendapati bicara pakai suara ehehe oke sih ayo mol
rarraayu,ribu
rarraayu,kucing lawan anjing
rarraayu,astagfirllah mesum umum
rarraayu,giveaway ayo retweet oke retweet seri
rarraayu,kartu kartu yaelah
rarraayu,lucu admin
rarraayu,goodnight
rarraayu,hidup jaman bodoh kasih kuota internet bodoh sebar
rarraayu,demo habis sholat jumat longmarch masjid istiqlal mek tuntut bebas
rarraayu,tahi
rarraayu,buah film biopik cerita jalan hidup karir basuki tjahaja purnama kenal
rarraayu,barbar saudi iya
rarraayu,tinggal cech suka melawak
rarraayu,hidung aerodinamis iya
rarraayu,ayam geprek nama
rarraayu,ngamuk pahala
rarraayu,israel kaum yahudi garis keras agama nomor negara nomor least arrested ult
rarraayu,huahaha
rarraayu,lupa minjem tertanda sepakat materai debat pakai dalil agama
rarraayu,oke
rarraayu,batal
rarraayu,two motivate voters takut alas
rarraayu,bendera tauhid maling motor astagfirullah
rarraayu,kelompok bodoh lahir kristen bawa bawa
rarraayu,humor harga ketawa renti renti
rarraayu,anak soleh
rarraayu,alhamdulillah contoh uang beli rokok selipin tabung
rarraayu,kasih asupan gizi sekolah senja doa anak
rarraayu,indonesia negara majemuk pindah agama wajar doktrin padang pasir rumit
rarraayu,jaman jokowi ahok walkot bekas undang tahun balkot kompens
rarraayu,anak australia umur tahun ngambek habis diomelin emaknya mencolong kredit kartu keluarga coba beli tiket ba
rarraayu,khabib si kucing
rarraayu,cemil warung tegal demo hokben bhihihik
rarraayu,iya tuhan takut
rarraayu,dengar unai emery bicara inggris sadar fasih
rarraayu,salah faham
rarraayu,mie deleted ethan buru hindar bukti pelanggaran
rarraayu,kualitas konsep ekonomi kandidat presiden orasi permainan thrones lawan memakai alkohol
rarraayu,minggu viral instagram
rarraayu,khilafah mancing baca koran
rarraayu,sayang slotnya atlet peluang raih medali lenyap egoisme
rarraayu,nadi ayo thrusters nyala falcon roket si dorong tahap guides itself iya
rarraayu,asa jalan overhear rintik pikir terimakasih bajing mates
rarraayu,persib maaf panpel
rarraayu,suruh pakai baju adat suruh pakai baju batik
rarraayu,adil isi kardus makmur elite elite partai
rarraayu,estadio saudara mestalla
rarraayu,antek vivo tawa
rarraayu,kucing curi stuffed hewan tetangga si rumah does
rarraayu,senang tahun ulang tahun anu reeves
rarraayu,realize smalling jones serang dybala mandzukic douglas costa
rarraayu,aset sita minus ngebalikin uang nasabah umroh tipu
rarraayu,gera ganti presiden gera hizbut tahrir kudeta cipta kacau pria
rarraayu,iya loker kirim biodata whatsapp tipu ujung
rarraayu,perang aduh batal pesan efek bijak operator pelit insentif
rarraayu,loker tipu dishare
rarraayu,bakti rumah tangga jemaat jatah tahun rumah
rarraayu,salah panggil ibadan volume toanya paham
rarraayu,biarkan sebar dunia dunia betapa barbar hukum indonesia saudara
rarraayu,monyet jantan habitat asli doyan kawin keliling monyet betina persis saudara
rarraayu,batal
rarraayu,ngeributin anak cadar bawa replika senjata bilang islamophobia kagum kedongoannya
rarraayu,biasain googling bodoh dipamerin
rarraayu,bodoh cari panggung huahaha
rarraayu,indonesia jajah portugis belanda jepang bangsa jajah arab ambil bir
rarraayu,saudi
rarraayu,calon menang puskas hadiah
rarraayu,coba polling akun buka saudara laki banding hasil
rarraayu,sop alumni monas jokowi gandeng ulama jokowi anti ulama jokowi gandeng ulama jokowi alat ulama misi
rarraayu,batal
rarraayu,rumah selesai bicara mayoritas minoritas
rarraayu,tahan pjanic dybala transfer putus
rarraayu,tengah imut bajing
rarraayu,intruksi pemerintah kota usaha organisasi spanduk spe
rarraayu,spanduk tulis sukses asi games pasang sampah visual
rarraayu,tipu
rarraayu,fanatisme sempit banding lurus bodoh
rarraayu,operator rekrut sopir asyik jual jaket kemudi pikir efek
rarraayu,kasablanka pagi tawa
rarraayu,selamat boys rodrigo bentancur
rarraayu,uang
rarraayu,provokator bela provokator dunia gerombol khilafah mewek utama playing victym cih
rarraayu,hitam keruk endap lumpur kontinyu pasang kelambu bodoh
rarraayu,gambar salib lgsng otomatis kapir pakai jersey
rarraayu,waringnya pasang lampu warna warni riah saudara laki idiot tawa
rarraayu,spesies banya pria pilih jalan bareng pria
rarraayu,sopir muncul aplikasi sopir nganter
rarraayu,tumpang pesan muncul sopir pilih nganter sopir
rarraayu,murah selai sibuk lemah kondisi pakai sistem lelang drivernya
rarraayu,keren
rarraayu,gerindra gabung pks jamin susah logistik mampos
rarraayu,trotoar kucing pinggir warna hitam putih huahaha
rarraayu,jersey kiper iya
rarraayu,anak kembar usia alami pertusis batuk nafas saudara
rarraayu,raul los senang kylian mbappe
rarraayu,lempar milik kemeja madrid penggemar
rarraayu,netijen ahli analisa
rarraayu,dukung kroasia
rarraayu,giveaway xiaomi redmi catat kroasia menang rt tweet hapenya
rarraayu,jokowi resmi pusat bangkit listrik kalah anies resmi gardu listrik
rarraayu,sih sibuk mengurus anak tawa
rarraayu,trnsfer utama pakai drama drama
rarraayu,semifinalis senang
rarraayu,teladan rasul tawa
rarraayu,tawa video dagel
rarraayu,tahan pilih sebar bodoh
rarraayu,bangsa ribut monyet geng menang
rarraayu,goal luciano moggi cristiano ronaldo sepakat kontrak lolos tes medis juventus
rarraayu,ronaldo higuain jual duet
rarraayu,hati hati teman teman kenal minjem uang si
rarraayu,situ ketemu basarnas perintah berani cerewet media sosial
rarraayu,butuh budak bantu
rarraayu,jaman jajah indonesia dukun dukun hebat santet hasil usir belanda
rarraayu,tenggelam laut disamain tenggelam danau otak udang
rarraayu,ahoker hasil kirim hti kubur rizik hidup hina lari mudah
rarraayu,tabiat mahkluk pks jijik
rarraayu,ahok buram kontra sikap beda ente buram utama
rarraayu,politik indonesia didik kes rumit gaduh tingkah elite gerindra pks merek
rarraayu,borok mesti tutup rapat rapat borok cari cari temu cari
rarraayu,waktu jakarta harap jakarta atur disiplin indah semangat iya
rarraayu,ribu tawa
rarraayu,batal
rarraayu,diajari marc marques paman
rarraayu,ayam
rarraayu,batal
rarraayu,kiper tawa
rarraayu,jerman lolos sungguh tawa
rarraayu,jenis kalah
