username,tweet
rarraayu,kepel antigen rumah sakit harap depok murah
rarraayu,batal
rarraayu,klaim peyempurna benteng isi kitab kritik
rarraayu,demo lelah lelah pakai kostum padang pasir mamam
rarraayu,risiko
rarraayu,susah untung
rarraayu,teman aceh bangun usaha aceh bangun usaha pekanbaru bandar lampung
rarraayu,survei korps juang
rarraayu,sungai yogyakarta ikan
rarraayu,manusia literasi
rarraayu,niat
rarraayu,skb
rarraayu,salah salah salah paksa siswa kristen pakai kerudung cari pembe
rarraayu,roti michelle pasar baca roti mikail
rarraayu,hukum barbar abad bawa abad konyol
rarraayu,waktu gramed nangkap maling buku orgnya target operasi manajemen dic
rarraayu,salah fatal paksa kristen pakai jilbab cari benara
rarraayu,jilbab identitas muslimah indonesia paksa anut agama pakai
rarraayu,cari cari tindak diskriminasi kutip ngutip klausa alkita
rarraayu,tangkap chickens
rarraayu,widih cari diskriminasi bos
rarraayu,oh kristen berani speak diskriminasi tahun tugas
rarraayu,selesai cari sumbar iya
rarraayu,paksa kristen pakai jilbab salah salah berkilah
rarraayu,biarawati rohani gereja katolik pakai standar saudara
rarraayu,keras hati pandemi selesai selesai
rarraayu,balas hak tuhan ampun wajib manusia
rarraayu,uud rinci monyet
rarraayu,sekolah negeri netral larang paksa jilba
rarraayu,tugas umat muslim speak larang jilbab bal manado papua
rarraayu,jilbab indonesia identitas rohani muslimah paksa siswa kristen pakai jilbab
rarraayu,sekolah negeri indonesia larang paksa pakai jilbab
rarraayu,berita sanding berita nalar sih
rarraayu,semoga
rarraayu,sepele paksa siswa kristen pakai pakai identitas muslimah mendapa
rarraayu,jilbab identitas muslimah indonesia paksa siswa kristen pakai jilbab pendi
rarraayu,bodoh iya beda sekolah negeri
rarraayu,atur sekolah atur
rarraayu,lancang ngutip ngutip kitab suci agama iman pe
rarraayu,atur sekolah negeri acu atur tinggi peraturan daerah
rarraayu,paksa siswa kristen pakai jilbab nista
rarraayu,derita sambut tindak gercep spanduk donasi vaksin palestina
rarraayu,rakyat keluh gentrifikasi perintah pakai alas lgbtq deportasi oia lupa menkumhamnya yasona laoly
rarraayu,kristen abu buru buru pindah depok aman serang netijen
rarraayu,hitam american kritik ras kartu dilindes pakai motor
rarraayu,pacar beda frekuensi berat
rarraayu,margonda mall cere kilometer tawa sial nganter
rarraayu,puncak ujung langit anak
rarraayu,inti mui bilang jokowi pilih kapolri iman kalimat putar putar
rarraayu,masyarakat luas kalimat putar putar sirat dim
rarraayu,mil melawak utama santai
rarraayu,jalan perum depok indah samping kartu as perangkat keras toko fotokopi
rarraayu,jonathan marco rebbeca
rarraayu,milik hewan fanatik agama saudara wanita malu
rarraayu,hukum haram cemil babi haram pegang babi ngada ngada
rarraayu,kristen minoritas domisili umat sebar bangun gereja pilih tem
rarraayu,anak nyanyi suara jelek dengar rt
rarraayu,depok agensi layang layang segel satpol pulang pergi saking ramenya psbb
rarraayu,pikir ideologi khilafah usung fpi damping pancasila
rarraayu,hastag iya
rarraayu,tahun sakit
rarraayu,bangkee
rarraayu,kaos tipikal depok gambar iya admin gambar belimbing
rarraayu,hastag nembus langit ubah fpi organisasi
rarraayu,rizieq penjara ruang komunikasi
rarraayu,tambur ditongkrongin polisi tentara mimpi logo bis rubah
rarraayu,isis jaya dukung isis keok beda mengomongnya
rarraayu,fpi ormas kuat hukum juli fpi
rarraayu,tembak mati teroris dunia internasional saudara wanita ah
rarraayu,minum hazelnut susu teh pakai toping boba
rarraayu,pakai program halusinasi motor bebas pajak
rarraayu,tulis murtad
rarraayu,sejarah republik indonesia natal menag terimakasih
rarraayu,bangun bohong tanah negara urus negara ribut kalah bib
rarraayu,sambut gus menag penuh harap intoleransi cari banser
rarraayu,partai dukung isis kejang kejang
rarraayu,vatikan
rarraayu,zona merah depok selesai selesai
rarraayu,suka ketemu kristen anggap tuhan pribadi tuhan sembah umat
rarraayu,beli toko alamat kurir
rarraayu,koleksi coret coret
rarraayu,islami
rarraayu,kriminal bawa senjata tajam aksi demo titik
rarraayu,cepat ngilangnya ninja konoha
rarraayu,senjata fpi tangan kosong pakai omong kosong otak kosong
rarraayu,depok parah rsui fase ban ventilator warga depok topi
rarraayu,rizieq tahan polda demo istana emis belas kasihan presiden iya tawa
rarraayu,kristen provokasi murah beda tingkat
rarraayu,doa semoga gelap tanah negara penjara
rarraayu,analogi beli otak restoran padang
rarraayu,mahfud anggap remeh salah langkah ridwan panggil polda lucu
rarraayu,ahok pakai followernya tameng paham beda iya
rarraayu,acara rizieq rusak reputasi
rarraayu,bangsa perang lawan israel putus damai indonesia
rarraayu,rekomendasi
rarraayu,percaya partai waris orba golkar
rarraayu,gaji mayoritas rakyat indonesia potong paruh gara gara pandemi eh dprd naikin gaji roket bangkai
rarraayu,titan depok cemil manusia cemil ayam geprek
rarraayu,nasi kotak polisi nasi kotak dibagiin demo
rarraayu,salah sembunyi rumah sakit anak waktu panggil indonesi
rarraayu,saudi karantina mandiri nafsu temu sapa
rarraayu,warga indonesia bodoh bodoh
rarraayu,kerumun massa bandara tebet tambur puncak waktu minggu mustahil lolos jerat hukum
rarraayu,rizieq orasi ajak fansboynya dukung isis terang terang
rarraayu,pepet polisi lembek
rarraayu,ente sombong belaga mahir junjung ente sembunyi
rarraayu,cocok kasih chiesa
rarraayu,rizieq tingkat dialog sidik polda metro dialog kapolri tingkat apala
rarraayu,fpi isis beda fpi memegang senapan
rarraayu,imam teriak penggal penggal wajar berani bawa katana clurit
rarraayu,memegang gelas udara berani serang tua acara
rarraayu,anak buah mati dijadikan tameng susah markas
rarraayu,bidadari jual
rarraayu,aduh sayang lari kirim polisi ketemu bidadari
rarraayu,percaya polisi ketimbang organisasi bibit teroris fpi
rarraayu,kasih cupang hidup air keran campur daun ketapang
rarraayu,pimpin belaga heroik pakai kasar gilir hukum sembunyi rumah sakit anak tawa
rarraayu,kantor bini lembut ribu paket bansos kemensos administrasi bansos
rarraayu,sayup sayup dengar suara bumi milik tuhan
rarraayu,komedi
rarraayu,tindak aksi cepat tebangpiih
rarraayu,admin sosmednya libur sabtu minggu presiden mengetik adminnya bosan
rarraayu,iya admin coba tonton video makam teroris santoso tahun ribu tonton teriak
rarraayu,iya tembus jalan karet
rarraayu,pizza jamur pikir keras korelasi gambar tulis
rarraayu,nama tukang obat wajar buram gudang obat
rarraayu,rumah sakit gudang obat revolusi akhlak dokter
rarraayu,nama tukang obat maklum gudang tawa
rarraayu,cucu rasul buram pintu tawa sumpah gila bib
rarraayu,jalan tikus margo kota putar ujung jalan margonda margo kota
rarraayu,pilih isolasi rumah sakit anak bodoh
rarraayu,batal
rarraayu,iya dokter kadang pikir urus drama wanita sakit kepala
rarraayu,domain web blok perintah diblacklist satgas
rarraayu,komunitas koin koin edcnya tahun dikel
rarraayu,tutup akun deh model mengulangi
rarraayu,melarang saudara beli rumah citayem kasih marketin
rarraayu,profesional demokrasi dukung profesional khilafah anti demokrasi konyol manusia
rarraayu,aneh cemil kucing logo halal kucing agama
rarraayu,satpol ppnya mutasi bayi sitter
rarraayu,rizieq berani hina polisi berani hina tentara ditungguin kabarny
rarraayu,hormat pangdam jaya bibit teroris
rarraayu,pasu raja singa berani lawan jemaat gereja topi santa janda nikita misi
rarraayu,fpi beringas lawan komunitas gereja janda gilir digeruduk tentara mewek keong
rarraayu,aparat pura pura sakit besok
rarraayu,tukang mangkir jejak
rarraayu,cie dukung separatis
rarraayu,maklum nama kuno
rarraayu,tweet bawa bawa nama ahok katrol nama rizik yaelah
rarraayu,parah dudung gara gara nurunin baliho sembah baliho ngomel twitter
rarraayu,pangdam jaya suruh urus natuna nama pangdam jaya ruang lingkup
rarraayu,pasang baliho iya bayar pajak reklame mudah copot
rarraayu,kaum sembah baliho kejang kejang bayar pajak reklame mudah copot
rarraayu,imam bicara penggal penggal disamperin tni tiarap
rarraayu,copot baliho ilegal wajah residivis rendah tni bagus tni
rarraayu,pasang baliho bayar ppn negara baliho ilegal copot
rarraayu,baliho ilegal bayar ppn copot
rarraayu,pangdam jaya perintah pasu jalan tambur nama mati imam beser perintah
rarraayu,kadrun tugas pangdam jiper iya jiper
rarraayu,konsekuensi sih rijik teriak penggal penggal iya disamperin tni konsekuensi iya
rarraayu,sampah visual layak copot
rarraayu,imam tambur berani ngeledekin pangdam
rarraayu,opini bagus tadz ayo utama sabung ayam
rarraayu,tni tambur fansboynya rijik dadak kejang kejang
rarraayu,bilang uang jatuh langit tunjukkan berita heehehe
rarraayu,temu tarik agama
rarraayu,tonton video youtuber afrika konten bilang salah sulit kuliah saudara
rarraayu,smu sekolah kristen guru agama menjelekkan agama islam
rarraayu,urgensi rizieq jalan jalan program ceramah
rarraayu,umat taat tuhan taat perintah sih iri geng barbar tambur
rarraayu,tidur duduk sibuk
rarraayu,batal
rarraayu,garis turun iman bos daud salomo
rarraayu,sih peduli heran daud salomo yahudi
rarraayu,daud garis turun yakub situ pisah
rarraayu,salah jenderal fatal sih tolak wibawa polisi hancur injak injak ormas
rarraayu,anggota tni didik mati medan perang mundur aib susah
rarraayu,susah payah rintis karir jenderal ketemu geng tambur ubah badut
rarraayu,badut nasional tambur pesta cocok
rarraayu,hilang respek bnpb satgas corona eneg baca kalimat bela saudara
rarraayu,corona tingkat tahun satgas gagal mundur
rarraayu,negara keok ormas agama bandara terlih
rarraayu,dunia agama kristen ajar hubung manusia
rarraayu,sempurna pakai tuhan pakai sempurna rencana
rarraayu,polisi besok izin acara resepsi sesuai pritikil kisihitin
rarraayu,jemput ramai bandara arak ramai jalan raya menikah anak fasilitas negara
rarraayu,himbauan karyawan ajar rumah tangga
rarraayu,kutip alkitab sembarang serang lawan politik hina hidup zul
rarraayu,polisi henti acara bebek tolak polisi jakarta takut saudara
rarraayu,urus tolak polisi jakarta ubah patung
rarraayu,senin hidup normal buka penuh mall sekolah kantor
rarraayu,batal
rarraayu,negara kalah ormas gera mitos
rarraayu,lho ormas ormas suka acak thr usaha jelang
rarraayu,kantor tambur markas surat ormas thr
rarraayu,maaf saudara laki cari pinjeman nutup pinjol cicil motor trik
rarraayu,jalan raya blokir parkir motor
rarraayu,mall sekolah kantor buka total utama kuat kuat imunitas
rarraayu,aparat negara tindak takut katain kafir disumpahin neraka
rarraayu,pelototin nang abbusive maki marah obrolan
rarraayu,indonesia negara sekuler tengah matang heran ruu
rarraayu,besok wakil smun depok klarifikasi pilih ulang ketua osis teknis buka
rarraayu,saudara edc dinar nilai tukar sampah lepas komunita
rarraayu,setuju ribut dubes australia
rarraayu,smun depok tolong iya sekolah negeri tingkat medioker ras ketua osis iman entot
rarraayu,wapres bilang prancis ajar toleransi indonesia dagel
rarraayu,bintang mahaputera cocok drama
rarraayu,mandor bodoh gedung roboh
rarraayu,ngerusak bandara ngerusak warung tegal ngerusak kafe ngerusak gereja
rarraayu,fanatisme sempit banding lurus bodoh
rarraayu,revolusi akhlak setia pasang utama gila janda
rarraayu,partai dukung overclaim
rarraayu,bisnis utama kerah massa jual wajar fansnya bondong bondong turun
rarraayu,nu susah payah jaga gereja kelompok sampah hobi kirim bom
rarraayu,bisnis jual kuat massa massa iya otomatis rusak citra
rarraayu,dukung butuh aksi aksi menyusahkan bilang eks
rarraayu,dinar dinar scam simpang tanda
rarraayu,ibadah natal jaga polisi discreening pakai logam detektor bangga
rarraayu,hidup akun parkir konsumen perilaku
rarraayu,serang kaum sekuler dimusuhin serang gereja konyol kadrun kadrun perancis
rarraayu,gen milenial usia si saudara tahun milenial
rarraayu,malu sales ekonomi lesu sulit capai target
rarraayu,cucu rasul deportasi
rarraayu,edccash uang permainan anggota anggota balut mining koin cyrpto tahun
rarraayu,agama damai singgung umat agama
rarraayu,hukum nista pancasila hina hindu bal hina kristen hina matahari
rarraayu,metode baptis baptis semprot
rarraayu,umat kristen indonesia gereja natal ngelewatin logam detektor jaga pol
rarraayu,kapasitas otak tengah sendok saudara wanita
rarraayu,kantor udara minum aqua wifi kencang microwave sepen
rarraayu,kasih nomor jual mahal pogba malu
rarraayu,ormas rajin hina peluk agama protes hina agama lelucon
rarraayu,bayangkan juve lawan mil juve menang gol lgsng goreng juve panitia liga
rarraayu,volume toa dikecilin singgung umat mayoritas
rarraayu,diketawain vanuatu
rarraayu,ah senggol kaum sekuler lgsng bilang luka luka toa saudara
rarraayu,hubung umat barbar doyan bunuh charlie hebdo singgung agama
rarraayu,konyol hukum barbar abad bawa abad
rarraayu,somad bilang salib jin kafir iya garing garing garing
rarraayu,vanuatu mengomentari urus papua ras adil
rarraayu,meniru arie untung ditaro lantai foto habis dimasuki lemari
rarraayu,milu suara kuno kuno tinggal
rarraayu,boikot french cium
rarraayu,iya indonesia diskriminasi minoritas malu an
rarraayu,ayo turun jalan selagi bahan demo
rarraayu,halah loncat
rarraayu,dunia kuliner restoran negara maju fokus higienitas indonesia ngeributin halal haram halal haram
rarraayu,saudara wanita mahal
rarraayu,suharto tebak
rarraayu,bingung mute kosa baca opini kolom komen ganggu akun jual
rarraayu,lucu nama coret buku hidup gara gara canda password server tetangga
rarraayu,sidang putus dasar regulasi uefa lagipula larang napoli turin menang wo
rarraayu,bakso tikus paman cemil bakso pakai daging tikus malu
rarraayu,tolong juve kontrak utama utama bintang
rarraayu,sih tua utama timnas kalah buffon
rarraayu,bina demo usia
rarraayu,kristen jalur popmie
rarraayu,gempor jalan
rarraayu,juta beli apartemen tipe studio uang beli rumah tapak pinggir depok
rarraayu,sangka umpan receh ngejaring ikan
rarraayu,sempurna
rarraayu,puan cemil geprek bensu payudara kasih paha
rarraayu,dengar suara rekan puan dengar suara netizen twitter mute
rarraayu,ngejar omset
rarraayu,drama laurentis murah dukung pembenci juve buta regulasi uefa tengah pandemi
rarraayu,demokrasi
rarraayu,raja matuidi
rarraayu,target kaum milenial habis borong kuno
rarraayu,cheating jacob tabok
rarraayu,passionnya maling bogem desa
rarraayu,ngaduk bodoh
rarraayu,agama hikmat
rarraayu,agnelli survei kesiap lahan dokumen jamin mil
rarraayu,mil minjem uang bangun stadion
rarraayu,titit potong pakai dirayain pakai konser
rarraayu,anggap komunisme bangkit definisi komunisme pokok sep
rarraayu,urus urus
rarraayu,gelandang pirlo skema
rarraayu,tinggal berita jabat menko multitalent
rarraayu,raja luhut mediasi virus hasil minggu
rarraayu,bagus kalah buruk anak laki
rarraayu,batal
rarraayu,heran birokrasi dki zona merah tengah
rarraayu,fansnya teriak juve bayar wasit eks direktur eks latih eks utama juve ambil
rarraayu,tenang masyarakat bilang zombie sembuh
rarraayu,mds beking ormas turin
rarraayu,april pakai scuba tonton video viral ulas jelek kualitas scuba perintah
rarraayu,juve butuh uang tolak kecuali barter pakai mbabpe
rarraayu,amrik obrolan cina pakai aplikasi obrolan iya
rarraayu,komplain suara toa wihara bakar aksi
rarraayu,jihad
rarraayu,uu ulama sertifikasi ketat ulama negara
rarraayu,harap juve ambil mandzu selagi pekerjaan ngerekrut giroud
rarraayu,batal
rarraayu,breefing
rarraayu,singkat roh kudus roh tuhan turun bumi
rarraayu,balikin mandzukic klop
rarraayu,numpang angkat piala liga musim cadang
rarraayu,saudara laki giroud melawak gudang senjata mimpi juara ucl musim deh giroud striker
rarraayu,batal
rarraayu,dunia lupa tragedi drama messi suarez undur
rarraayu,partai komunis bajing
rarraayu,kain sisa pabrik garmen jahit sambung
rarraayu,pergi merrynya bicara sedih
rarraayu,higuain pergi slot kosong mckennie isi slot kosong higuain admin
rarraayu,gara gara juve pakai slot non ue
rarraayu,nabung wisata israel ken jerusalem
rarraayu,maju dikit tentara israel jaga
rarraayu,kenal nyaman pacar mantu pegawai negeri sipil
rarraayu,dukung pks
rarraayu,rajin motong tanam rambat bersihin debu lantai rumput rumah bagus
rarraayu,batal
rarraayu,tahun fabio quagliarella scored arguably coolest tembak weve
rarraayu,dengar tips memiara kelinci pasang suka kucing
rarraayu,cengcengan dunia penggemar bola hubung nama klub hidup
rarraayu,rumit mengatur mengatur tweet situ polisi moral
rarraayu,si an longer versi
rarraayu,minimal serang netizen setuju
rarraayu,ormas area
rarraayu,tertawa hati
rarraayu,tahun piala ucl iya butuh hoki angkat piala ucl
rarraayu,anak tahun baca tulis himpun lain-lain tahun
rarraayu,messi pindah juve diributin fansboynya nomor dybala
rarraayu,tinggal tahun waktu pergi madrid takut tahun gratis transfer
rarraayu,konsumsi turun drastis tengah pandemi mobilitas lumpuh stok
rarraayu,sejuk muka saudara laki sih
rarraayu,intimidasi indonesia minoritas iba
rarraayu,agama anti kritik kritik agama lucu
rarraayu,minoritas hidup syarat nurut mayoritas ibad
rarraayu,valentino rossi jatuh near saudara wanita
rarraayu,prihatin tahun capai mamam lipat
rarraayu,utama tua rekrut
rarraayu,titik
rarraayu,jalan adil depok rumah arco ibadah hibur kendi
rarraayu,bibi wafat ibadah hibur rumah bayangkan
rarraayu,khilafah lindung umat agama halah logo salib sensian boro lindung
rarraayu,ibadah bakti keluarga rumah tahun disamperin warga rt mie
rarraayu,indonesia setia hamas
rarraayu,juve bayar ajar hati hati kontrak utama uzur
rarraayu,tonton episode animenya besok baca episode manganya manganya detail angkat anime
rarraayu,nama bonuci
rarraayu,umpama umpama iya undang menikah tulis nama istri keran
rarraayu,sarri rumah istri pah juventus sarri oke
rarraayu,halusinasi admin iya
rarraayu,dybala an artis performing his hebat seni
rarraayu,tricyclebut went salah
rarraayu,film durasi selai rangkum menit bakat trailer
rarraayu,kesal fungsi flyover putar arah
rarraayu,samsat kuning
rarraayu,saking prestasi gelar receh mvp didpt dybala diributin cari hadiah hibur
rarraayu,campioni
rarraayu,salah pakai nmax
rarraayu,ribut whatsapp gara gara jempol kaki
rarraayu,kecuali tahun klub duo mil capai prestasi juara iya apa-apa
rarraayu,cerewet prestasi serie juve eks latih eks direktur juve rekrut cemil jorok
rarraayu,genap tahun penggemar duo mil cerewet wasit besok tahun
rarraayu,primo scudetto
rarraayu,hubung jual kolom komentar numpang jual titip jual mute
rarraayu,batal
rarraayu,beda tipu desa
rarraayu,dengar lagu lampu merah siang terik terik sumpah otomatis emosi
rarraayu,jamin suporter kadrun fc akam bantu polisi telkomsel lepas tangan
rarraayu,ob pitsa topi
rarraayu,pasu bicara
rarraayu,turun jalan margonda jalan lurus blok saudara kanan blok
rarraayu,gelap
rarraayu,mahir nyebrang margonda nyebrang jalan indonesia mudah percaya
rarraayu,kemarin pilih prabowo hancur
rarraayu,ketua kecebong pakai baju hitam
rarraayu,photos belalang swarms images kenya pakistan india nepal yen dimana places experie
rarraayu,nyasarnya stasiun citayem deh takjub
rarraayu,rampok mantan motivator
rarraayu,fanatisme sempit banding lurus bodoh canda agama warga amri
rarraayu,bagikan sembilan bahan pokok birokrasi ngumpulin data
rarraayu,cinta agama rendah wanita jawa pakai buka umpama permen bungkus
rarraayu,profesional pakai tutup duluan hakim profesional pakai buka huni neraka
rarraayu,smu kenal siswa kelas salah teman kenal
rarraayu,pesan gabung beda restoran susah langgan sopir ngirit
rarraayu,depok dimensi walikota warga aneh aneh
rarraayu,kumpar berita tribun
rarraayu,koin rumah juta beli juta koin kasih
rarraayu,teman cerita angkutan umum tengah jalan supirnya mungut suara
rarraayu,pusing baca
rarraayu,kesal baca template
rarraayu,jembatan dagang asesoris telepon gantung id kartu masker pakai
rarraayu,rumah rheinhard sinaga iya
rarraayu,depok sarang pks heran rasial beli rumah kontrak
rarraayu,pria jarang beli celana paksa beli celana sa
rarraayu,asa
rarraayu,pondok petir salah bojongsari iya batas depok tangsel nasib citayem tawa
rarraayu,cari ros
rarraayu,kreativitas pjanic mentok
rarraayu,dokter spesialis bedah sepatu dadak panjat sosial pandemi
rarraayu,pesona kotak apartemen
rarraayu,nama jarang pakai nama kitab belah alkitab
rarraayu,fanatisme agama luas laut iman tengah sendok cemil
rarraayu,panji sang tualang
rarraayu,dengar orasi surabaya youtube
rarraayu,potong ayam beli geprek bensu lipat jahat
rarraayu,hina warga cilodong
rarraayu,sesal jalan tikus ramai
rarraayu,putar seblak jahanam belok kiri jembatan lewatin kolong tol
rarraayu,objek wisata citayem
rarraayu,kaum
rarraayu,iya tuhan anak coret saudara gumam
rarraayu,anggap bahasa saudara laki pakai muslim saudara laki ras saudara laki
rarraayu,batal
rarraayu,true cinta dies gets stronger waktu unless kacau bagus
rarraayu,bahasa saudara laki saudara laki agama islam kristen pakai bahasa saudara laki
rarraayu,suku fanatik agama sesimple sih
rarraayu,suku inferior huahahaha
rarraayu,benteng fanatisme sempit argumen adat
rarraayu,bible bahasa saudara laki tahun
rarraayu,hak lembaga alkitab indonesia terjemah bible bahasa hak gubernur su
rarraayu,bukti saudara laki menang fanatik kualitas iman ager ager
rarraayu,shithouse
rarraayu,ramai
rarraayu,lawan diskriminasi ras dukung diskriminasi non muslim pimpin ibukota
rarraayu,gadis seleksi seleksi tawa
rarraayu,grandmas genes sungguh salin pasta
rarraayu,jajah jepang belanda jajah arabia
rarraayu,terimakasih
rarraayu,raya kristiani tulis almasih kitab kenal almasih oia
rarraayu,baca alkitab versi arab tulis yasua hongkong
rarraayu,beda
rarraayu,tuhan sembah masjid
rarraayu,status bebas syarat pandemi ngumpulin massa nunda
rarraayu,thr hak karyawan hak ormas kontribusi usaha tahun thr
rarraayu,jual jasa servis telepon seluler tawar jasa pinggir jalan kawasan pusat grosir cililitan pgc jakarta lan
rarraayu,tunggu bulat
rarraayu,hibur ayo ge retweet
rarraayu,apel
rarraayu,hebat juang etnis tionghoa sengaja hilang sejarah nangsa indonesia buku ajar sekolah tahun
rarraayu,tangis taxi sopir spain has taken patients rsud gratis biaya telepon
rarraayu,puisi
rarraayu,perintah ambil sikap tangan corona januari babak bur yasudahlah
rarraayu,cari sopir tua motor butut sopir butuh tolong
rarraayu,suara kasur
rarraayu,batal
rarraayu,tertanda petisi anggur libur budak kapitalis tanggal merah harga
rarraayu,rakyat februari perintah sibuk promosi pariwisata
rarraayu,adil sosial anggota polri
rarraayu,lelah gila lelah sumpah
rarraayu,batal
rarraayu,streaming minggu kemarin pendeta bilang tonton streaming khotbah sel
rarraayu,bodoh agama
rarraayu,utama whatsapp iya
rarraayu,lupa olahraga jaga daya tahan lawan corona gays
rarraayu,belaga akrab panggil sahabat bos anjeng
rarraayu,indonesia takut virus corona takut pilih pimpin beda agama
rarraayu,iya wisata halal aceh tonton atraksi cambuk manusia
rarraayu,temu wanita butuh mujizat sihir
rarraayu,grafis liar basah markets selling animals bangkok despite larang over fears
rarraayu,bebas ngetweet
rarraayu,layak santet
rarraayu,fakta sejarah dokrin agama sinkron
rarraayu,paksa agama patuh larang agama dibuatla
rarraayu,nakut suka cemil daging babi berita palsu cacing pita tradisi indonesia
rarraayu,cemil santap konsekuensi
rarraayu,daging dunia ditakutin
rarraayu,jebol mui aneh pikir
rarraayu,walkot bloon
rarraayu,teluk gong jakarta dagang grosir sembilan bahan pokok jual bayar mahal layan
rarraayu,garam senapan irl butuh
rarraayu,tolong ingatin kyai pimpin negara pimpin agama
rarraayu,duniawi surgawi imbang betol
rarraayu,salah saudara laki psikiater
rarraayu,pacar disuka
rarraayu,arab
rarraayu,maling pergok maling
rarraayu,karakter scorpio sagi bertolakbelakang riset sih paman
rarraayu,milik cats tonton anime
rarraayu,jilbab batas mode
rarraayu,melarang sayang mantan
rarraayu,video bagus tari pria
rarraayu,sih hormat sopir tolak tolong dicancel menyusahkan langgan
rarraayu,ngejar episode oktober si saudara desember kemarin tawa semangat
rarraayu,dunia bingung
rarraayu,menikah pacar
rarraayu,malu kwi komentar sejuk gundul
rarraayu,masya tuhan lur jiglok
rarraayu,batal
rarraayu,mentang mentang beban program kacau pilih menteri kacau
rarraayu,tawa
rarraayu,eh buset cemplung sumber grup facebook sopir gojek
rarraayu,tonton lions sentuh rumput waktu
rarraayu,bujuk baikin dewasa
rarraayu,oh iya nama sjw teroris
rarraayu,sopir telepon telepon centre batal ambil
rarraayu,kencing unta kunci
rarraayu,vaksin semprot vaksin bodoh
rarraayu,bomboclaat
rarraayu,susah beda kritis malas baca artikel
rarraayu,mcd saudara wanita ojek online beli lgsng pergi antre ojolnya ojek online
rarraayu,nyala bumi has happened
rarraayu,tni nyemai awan laut pulau jawa
rarraayu,iya terang dpr tvri mola gana sih
rarraayu,batal
rarraayu,foto muka foto lrt program loncat dongkrak elektabilitas
rarraayu,komentator pegang together via
rarraayu,ayo bubur ayam
rarraayu,liga indonesia sesuai jati bangsa acara baku hantam wasit tanding
rarraayu,si misi si
rarraayu,hubung mentok restu tua
rarraayu,coppa italia sesuai jati bangsa kuno kampungan
rarraayu,bayangkan saudara laki rekam kecoa terbang tega
rarraayu,kuat kuno kampungan tvri kuat sih
rarraayu,tim
rarraayu,mengajari ikan renang
rarraayu,pribadi frontal tawa
rarraayu,bahagia sederhana instruktur transfer ilmu siswa terima terbang ber
rarraayu,tumpang takut sopir bawa motor tawa
rarraayu,batal
rarraayu,seledri pakai
rarraayu,tvri dikuasain kuno persepsi jebak jaman jaya tvri kelakuanny
rarraayu,tailah kuno pakai bawa bawa norma sosial generasi biadab
rarraayu,stok bendera palestina kibar kibarin demo
rarraayu,coba juve penggemar mengoceh tujuh tujuh malam
rarraayu,penjara sik heran
rarraayu,harap pimpin hasil jual klausa intimidasi mayat
rarraayu,isuzu harimau kumbang jalan setuju sukses
rarraayu,umat agama suruh hormat simbol agama kera
rarraayu,mudah gajah terbang ketimbang jkw resmi gereja
rarraayu,jonan kereta gratis tiket turun lompat peron malu
rarraayu,oh iya ajar agama perkosa wanita pakai baj
rarraayu,senang senang derita warga
rarraayu,gereja tiberias ibadah cabang saudara laki tuhan suka canda
rarraayu,timur tengah bilang saudara tetangga lapar tutup
rarraayu,hidup imbang yin perilaku jelek jalan tawa
