username,tweet
selftalker,si nyaman enough called nyaman daerah choices might pimpin kalah harga buruk might kalah myself
selftalker,bodoh started percaya couldn tell si iman comforting myself illusions
selftalker,bahagia berterimakasih enough bela isu deep sangkal nyaman myself ilusi
selftalker,mie putih kari endeus
selftalker,nods smirks
selftalker,jenis mudah expresses cinta through tried pegang putra told loves several times gave smiles burst tears
selftalker,baca putra si tidur starting myself terbaik
selftalker,terimakasih
selftalker,bagikan putra si penuh name nyala media sosial few tutup relatives shared his nama panggil untung nama lengkap anak keponya diempanin
selftalker,iya ngekspos nama lengkap anak media sosial indonesians sungguh butuh basic lessons nyala simpan pribadi nyala media sosial era
selftalker,harap pesan reaches lindung exposing milik terbaik else ll kalah tanah tonton hancur
selftalker,ah nia anggun ketua
selftalker,hooh loh bayang andyc iya inspirasi andika rindu pita wkwkkwkwkw
selftalker,hobahh
selftalker,penasaran peran ussy has cantik sophisticated bakat troubled webtoon
selftalker,jawa barat wacana pindah kota
selftalker,waktu lari beli beli impulsif beli gitar warna book pensil warna lain-lain waktu nyibukin barang nang lelah negatif emosi an emosi si embraced
selftalker,si effin tahun twitting stuffs counting
selftalker,titik dimana anyone suasana beda lately
selftalker,ngamuk
selftalker,unggah partum cerita sungguh penuh drama kinda inspirasi tulis turun nyala blog later myself
selftalker,bayi arrived telepon baterai lasts days waktu use
selftalker,tawa yass sungguh tunggu rumah
selftalker,sih susah ngejalanin percaya nyenggol nyenggol percaya hidup
selftalker,heran beliau heran iya buang uang rumus
selftalker,jodoh roti
selftalker,mesti pande ambil hati inang simatua dohot calon eda semoga semoga iya eda
selftalker,dasar alam edak boru batak cari jodoh nyebut boru lengkap boru ompung marga ompung boru boru
selftalker,doa kabul
selftalker,paham jelasin dampak papua lepas indonesia pulau jawa ngeremehin papua lho
selftalker,jujur sungguh bunga nyala indonesian movies sungguh puas tonton quite asa
selftalker,terima kasih informasi
selftalker,terjemah badan kait pikir lembaga bidang bahasa terjemah resmi nomenklatur
selftalker,terjemah bekraf bmkg agen terjemah bpkp agen
selftalker,senang ulang tahun saudara milik jalan brings bahagia berkat excitements
selftalker,prestasi gila bangga bangga maaf iya iya iya
selftalker,pikir
selftalker,deh bolak bilang dulunya
selftalker,merdeka utopis
selftalker,oh iya iya tonton sakit bagus informasi
selftalker,kibar bendera tahun iya bawa baki tahun jawa tengah
selftalker,til
selftalker,untung enough english guru ajar nyala dasar sekolah si mudah ve ajar hormat tuan
selftalker,umat agama damai saudara suka hina anut agama percaya beda nasihat saudara hina diam diam disamain
selftalker,anggota dpr yaela
selftalker,batal
selftalker,imajiner teman cases happened children aman baca grown
selftalker,lho langkah tegak tangan kaki serentak iya gerak tonton kibar bendera pusaka
selftalker,rumah baked cookies
selftalker,iya arah ubah buruh manusia hati nurani setuju berat buruh
selftalker,elemen burger
selftalker,tawa
selftalker,sungguh bagus sombong unfollowed
selftalker,rumah nyala goverment si biaya
selftalker,sih malas iya bodoh kenal menang retweeting bodoh tweet bodoh eek kucing bohong dipungutin
selftalker,waktu perih ambil cemil diabisin acara gilir ambil cemil sisa nasi kuah cerita omong omong
selftalker,indonesia woke sedih fakta si lindung ourselves ladies harap behave kontrol latest
selftalker,iya leceh bentuk iya salah sisi mijit giat libat kontak fisik laki indonesia kepala reaktif kepala proteksi pilih terap wanita akal
selftalker,mercusuar underrated iya dibandingin lagu lagu hitsnya album mantra mantra bagus
selftalker,jarang jatuh cinta dengar buah lagu lagu indonesia angin puja hujan payung teduh mercusuar kunto aji salah daftar putar
selftalker,mercusuar pribadi favorit jembatan fails memakai gigil dengernya pakai hs
selftalker,aduh suara bicara
selftalker,sreg terjemah sila
selftalker,cinta milik gempa bumi tunggu senjata sehat champ
selftalker,tengah kelas approves
selftalker,jiwa diy fakta oke bhay
selftalker,batal
selftalker,kaset anak ganti ganti takbir nyantai apik teriak teriak
selftalker,selai masjid masjid rumah isi suara anak anak takbir dik mbok tidur senja
selftalker,putus minum romantis drinks suka rem minum boba coklat gula bentar gula badan
selftalker,astaga transaksi difollow iya saudara wanita datangin kantor topednya tokopedia telepon pusat cs
selftalker,kemarin ikhlasin sih mahal barang
selftalker,oke saudara wanita mudah mudah terima kasih iya saudara wanita
selftalker,bekas jual sedih rindu kuliner kalimantan susah nyarinya mbak soto banjar
selftalker,aduh gusti nu agung rindu tengah mati soto banjar
selftalker,tweet tweet sembah tukang ngutang pikir butuh pikir bantu usak itikad
selftalker,rich solely hardly latih myself kontrol impuls tinggal hidup senang
selftalker,urus buruk iya
selftalker,oh jual toped jual ngotot barang kirim kondisi kalah terima barang kemas rusak benda medis waktu buka barang asli
selftalker,benci pinjam uang benci pinjam lupa debts si paid whether si ranjau maaf maaf
selftalker,sungguh terang malas identik uang follows waktu harap tolong baca financially stabil
selftalker,hambat tahap pusat resolusi pakai fitur bantu selesai urus jual jelasin chatnya sepakat dana
selftalker,butuh selesai urus dijelasin urus dana selesai sih wasn salah terimakasih
selftalker,tunggu dana rumit urus uang butuh cepat habis selesai tutup toped akun belanja situ
selftalker,pikir ganggu turned hebat suasana hati dorong maaf terimakasih sungguh saved
selftalker,sila rugi alami mati listrik pulau jawa benda area asip rumah sakit bisnis mrt lrt area rugi mati listrik bilang banding
selftalker,sungguh gedek pulau jawa urus nyonya listrik milik sumber area komplain hasil batu bara boro empati isi otak komplain
selftalker,iya iya jakarta pulau jawa pusat indonesia wajar sambat nyonya listrik rugi mati listrik area tawa mati listrik ngerugiinnya crybabies
selftalker,seri gone uang
selftalker,sepi baca sepi baca si usaha
selftalker,gara gara harga tiket leceh seksual norak mbleber
selftalker,mudah mudah pikir twice parit once coba keras takluk harap nila
selftalker,jaman registrasi simcard pakai nomor ktp sih data duduk ngetwit sayang twitnya lelep malas nyarinya
selftalker,hospitalized rsud rooms mostly nyaman bangkit nurses fajar lambat malam
selftalker,wakakakakak pilih rute alternatif jalan darat alias jarak pendek mbok opsi manado balikpapan medan ambon jayapura tarik
selftalker,si laziness ketidakpedulian
selftalker,dasar any astrological tanda baperan any astrological tanda keren stfu nobody cares milik tanda milik astrological signs teori sampah
selftalker,tengah selai gempa
