username,tweet
selftalker,sosial medias memakai sakit titik gugup whenever buka henti takut dunia gerak fast fast saudara wanita kedip
selftalker,jaga gelisah dikit lagu autoplay kepala gelisah
selftalker,lately baringan kasur selimut utama telepon
selftalker,somebody memakai tolong
selftalker,kelebat pikir sengaja iya
selftalker,pikir usaha maaf mesti izin mie ngelola dana klien nekat pakai usaha mie milik pacar pacar daftar ojk
selftalker,tuhan knows bohong
selftalker,baca supernova seri karya dek lestari hidup serius buku pengaruh views nyala hidup berat
selftalker,drama pergi
selftalker,saudara wanita selebtwit referensi lagu total buru
selftalker,si tahun acak penulis poor total
selftalker,kuceritain
selftalker,aplikasi gojek user ramah iya cari sejarah pesan rumit
selftalker,instagram isi ss an twitter
selftalker,keras kepala ngakuin corona sangkal
selftalker,surat cinta pribadi obrolan sedia sayang salah fatal layak surat cinta layak
selftalker,lega sulit lepas genggam erat
selftalker,kuda gojek waktu virus pecah
selftalker,neraka bocor bekas sik
selftalker,baca nyala jalur except maaf pergi look else ll hancur tahun
selftalker,malam selesai pptx dipresentasiin senin besok
selftalker,persis bilang suami berita televisi
selftalker,iri jalan hidup
selftalker,hidup jalan
selftalker,suruh presentasi pikir template slidenya pikir isi
selftalker,twitter ajar cinta tikai gelut beranda
selftalker,umum adat batak urus simpan kontak telepon tulis nama gadis sayang kasih nama cantik tua
selftalker,senang ulang tahun musik cinta nyanyi whose suara fail tenang buruk suasana hati tolong consider indonesia once pandemi si over
selftalker,sumpah wouldn jenis situasi
selftalker,mudah desember balikpapan mesti pakai kepel uji pulang desa cemil
selftalker,wished waktu menang istirahat turun two lurus days filled tears sedih tears aren ranjau
selftalker,saudara kalah memories
selftalker,peristiwa decided tinggal instagram
selftalker,luka sembuh sempurna ampun
selftalker,aren lari
selftalker,emosi ubun ubun hempas sayang tutup turun
selftalker,kalah tidur gagal konsentrat si pergi telepon
selftalker,psikolog altruis butuh psikolog sobat qismin
selftalker,waktu hidup hidup tinggal neraka doing
selftalker,pikir tidur bawa mimpi dengar kemarin kolaborasi mimpi
selftalker,hindar diagnose eh jembrengin artikel kinda gelisah shite
selftalker,alabama arkansas
selftalker,malas cari video beranda
selftalker,sih saudara wanita saudara wanita tas somehow ganggu iya vibenya
selftalker,lahir pantai tinggal kota pantai kering laut laut
selftalker,perhati anak anak twitter nampaknya paham teori pilih pasang hidup dampak turun angka cerai coba ah pantau tren tahun
selftalker,batal
selftalker,usaha serah iya kadang serah butuh usaha
selftalker,bosan delete media sosial takut hibur
selftalker,kalimat
selftalker,pria
selftalker,hormat tuan karya tani generasi an tumbuh
selftalker,google milik name milik favourite colour estetika non collage pics memakai milik estetika
selftalker,suka situasi mual muntah
selftalker,reboot
selftalker,kadang suka bodoh bodoh
selftalker,ngaw
selftalker,beranda gemas
selftalker,bicara suami perbarui isi lemari baju tahun
selftalker,batal
selftalker,eh lucu
selftalker,tanda idc oh did tanda
selftalker,kuritwit setuju sabar
selftalker,batal
selftalker,jarang nyetir jakarta jalan baca peta arah mon maaf
selftalker,bahagia followernya bebas tulis tweet pakai bahasa
selftalker,tanda readku webtoon lenyap niat baca malas gara gara lupa baca suek
selftalker,motivasi malas bayar malas
selftalker,penat motivasi badan bajing corona
selftalker,cantik mental negara bagus bentuk
selftalker,terima kasih pinterest rindu jalan jalan pakai kaos jeans basic sepatu kets
selftalker,oh risiko taking harga paying
selftalker,sih cari kaos polos lebar susah gusti
selftalker,tanggal waktu instead rambut bondol rambut rambut mendekin rambut
selftalker,stan
selftalker,mantengin twitter lelah lelah
selftalker,kritik menerima debat sengaco ngaconya kritik merespons ejek cerewet dialog ngritiknya sopan
selftalker,keren
selftalker,lupa
selftalker,pikir perempuan indonesia leceh minimal catcalling kentang ngalamin leceh kelas pakai sekolah seragam informasi tuhan si sake
selftalker,situasi kondisi normal diam bengong kamar senang rileks seling muak gila
selftalker,ahahahhahhaa duga
selftalker,yuhu
selftalker,sedih cinta sadar hati patah udara tumpah
selftalker,hobi mantengin foto pandang pinterest
selftalker,kasur anak puas gelundung ujung ujung rewel tidur
selftalker,layla majnun sempurna sakit pahit brokenhearted
selftalker,marie marie marie baca kilau mutiara
selftalker,gerak kasihan tuhan iblis
selftalker,dress tanktop baju transparan persentase tarik
selftalker,nila harga harga porsi nasi goreng beli pakai sistem po ripiunya niscaya objektip ditambahin kecap
selftalker,pedas pedas panas tipis tipis bibir tenggorok cemil porsi sih kerupuk dikit
selftalker,cinta lemak lemak lemak krenyess gigit tangis ikhlas telan cepat cepat potong daging lemak pelit raja sisa digadoin nasi habis malu
selftalker,nasgornya oily dipanasin minyak bilang hotel nasi goreng dagang umum unik sih rempah cocok lauk
selftalker,lunas penasaran cimakaci admin nasgornya slep meja cemil ai bolelah iya ripiu rating daku rating masakan handal ulas ala saudara ros tret
selftalker,peduli selai waktu milik selesai sakit suka
selftalker,sakit bis duduk musik suka tangan lipat santai pangku pandang buang kosong jendela kepala penuh pikir
selftalker,ngeshuffle main lagu lagu spotify muncul langit abu abu versi akapela nyeri nyeri hati
selftalker,jempol kaki kejatohan kertas pelek
selftalker,kuat foto
selftalker,kadang terbaik hindar argumentations diam
selftalker,tawa gusti
selftalker,salah suka batak
selftalker,kutip tweet tweet tell milik puncak vegetables buncis sawi putih kangkung
selftalker,kesal astaga baca
selftalker,ashique gamenya
selftalker,bruno utama jam
selftalker,terawang psbb jakarta nasib
selftalker,batal
selftalker,jujur kemarin kecewa presiden sungguh greget pandemi habis blio ngegas menteri menteri senang mudah mudah waktu bijak greget
selftalker,coba makan malam mall bawa alat cemil tumblr tisu basah tisu kering tangan sanitizer bawa periksa suhu kasih tangan sanitizer duduk deketan rumit
selftalker,haihalo saudara laki semoga sesal followback
selftalker,apaka lambat
selftalker,hometownnya
selftalker,weyy weyy bahas bekel cemil
selftalker,tim cuci tim cuci balut cuci cepat cium bau balut cuci suka bau anyir darah menstruasi
selftalker,tuhan sungguh gaib
selftalker,sungguh betapa malas indonesia baca paham baca ngegas salah beli
selftalker,dengar iya
selftalker,sah
selftalker,dbdnya foggingnya
selftalker,rindu hidup sederhana bahagia rindu pantai sulit hidup
selftalker,kalah tuan eh
selftalker,haihalo an buka
selftalker,oke
selftalker,tarik patah hati
selftalker,henti
selftalker,untung mengkhayal gratis bayar mati
selftalker,saudara wanita asa appreciated
selftalker,saudara pilih spending waktu nyala twitter over instagram anytime
selftalker,kelompok obrolan keluarga palembang batak
selftalker,buruk publisitas publisitas
selftalker,whatever bbn sukses marketing era media sosial eksposur faktor dukung buruk publisitas publisitas tenar mahal tenar penasaran
selftalker,bilang harga mahal sungguh cuci mulut kotak harga iya wajar mewah
selftalker,tolak tweet julid paham bittersweet najla tenar jual cuci mulut kotak kemarin jail periksa harga kisar oke aneh klaim pakai bahan premium
selftalker,selamat tinggal selamat tinggal gelas sayang
selftalker,bajing tawa
selftalker,along wajan alumunium
selftalker,contoh
selftalker,contoh iya emoticon beda suara tulis situasi normal cenderung santai situasi normal cenderung santai bicara ramah bicara gembira
selftalker,sadar tulis suara pesan tulis obrolan suara suka sembarang pakai tanda baca iya
selftalker,batal
selftalker,menstruasi mercury mundur bencana
selftalker,habis tulis tweet kait sungguh nang
selftalker,gila
selftalker,lucu
selftalker,zuko
selftalker,points
selftalker,enough waktu cinta myself si cked
selftalker,minutes waktu took bolak-balik between rumah waktu milik
selftalker,retweeted
selftalker,si an hubung pikir hubung hitam putih either baca hubung cinta
selftalker,turun milik harap masyarakat akal negara duduk tingkat indonesia
selftalker,kanker menang kanker hati serang likely
selftalker,bangun tidur beban beban hidup nang
selftalker,pikir si an tuhan cinta manusia senang
selftalker,looking ketidakpercayaan
selftalker,logged mati instagram coba tahan mari uninstall sosial media
selftalker,wujud ikan dor dor merk dagang
selftalker,emosional attachments iya pergi ck
selftalker,has potentials tolong retweet buah rt bantu ubah nasib
selftalker,personally jamin kualitas loyalitas coba jobfair terap via situs cari kendala usia latar didik
selftalker,twitter tolong milik sihir lowong admin lulus alam proyek administrator tahun infoin iya tell sedih cerita desperately butuh keluarga situasi
selftalker,anak yatim nyala daftar
selftalker,overthinkingmu toyor kepala
selftalker,potong rambut
selftalker,twitter senang lucu fail become
selftalker,ulang tahun jokowi
selftalker,ahahahahhaa bodoh
selftalker,saking gerah selai mindahin jemur takut subuh subuh hujan
selftalker,chukhahae
selftalker,slogan muncul cemil puas beritahu teman kecewa beritahu
selftalker,tinggal tua salah tugas kuat ngupas bawang pakai nang
selftalker,phpin sebangke bangkenya ujung ujung menikah
selftalker,norak busuk iya ditutupi
selftalker,segoku onok toppinge
selftalker,wakakakaka asam
selftalker,bodoh pagi manasin donat meses magicom coklat lumer
selftalker,startled
selftalker,selai anak bayi balitanya tetangga utama teriak teriak rumah
selftalker,panggil jumat masjid rumah mandi ayo mandi rapi pergi masjid lupa pakai masker bawa sajadah tubuh bersih
selftalker,goreng ikan ditepungin bau cireng cireng rindu
selftalker,sih ganti foto ktp
selftalker,suka deh fitur fitur suara based suara maskulin deh paman paman
selftalker,bagus izin simpan wallpaper telepon
selftalker,gosip indonesian lgbt ih sih jijik tonton drama korea lgbtnya iya cerita lgbtnya malu sungguh lipat standar drama korea
selftalker,ve had enough duka kalah percaya
selftalker,dreams hancur true bahagia peacefully
selftalker,buruk suasana hati parah piknik
selftalker,tua pinginnya anak sekolah bagus tua bela bain ngetatin biaya hidup nyekolahin anak oke iya pilih sesuai anggar sesuai anggar kualitas
selftalker,butthurt casenya saudara wanita sekar proses hamil salin sesuai anggar milik teliti anak canda
selftalker,opsi bpjs sc bangkrut salin biaya lahir dicover keri teman teman lelucon
selftalker,hamil biaya konsul dokter oke juta juta biaya hamil usia anak faktor sakit bawa juta juta anak lahir sehat selamat
selftalker,belalak saudara wanita sekar jouska baca rusa biaya salin quite makes
selftalker,seseibuk negeri antah antah
selftalker,embracing negativity fine embracing racun positivity
selftalker,mangga biji mawar duri manusia maksa indah utuh
selftalker,serious nyala separating kayu chopsticks
selftalker,nyambi dagang sebentar beli
selftalker,si necessary ringkas ve learnt
selftalker,hobi cari dimarahi puas
selftalker,indah kadang suka lemas massimo toricelli
selftalker,urus waras dokter twitter penuh rekan jawat dokter dokter iya
selftalker,etapi fan
selftalker,dokter dokter twitter aneh aneh
selftalker,coba merah doorz temu oyo gara cari tiket dot com
selftalker,selai siang anak wajib hukum tidur siang selai siang anak utama
selftalker,oyo langgan ai bandung nyaman lumayan strategis bandung inap situ
selftalker,etapi bebas sih hidup tenang ramai
selftalker,sayang agama indonesian ayo ah rumit pilih available religions filled milik warganegara si id imani iman iman simpan hati si anyone si bisnis
selftalker,untung santai bodoh
selftalker,rumah maret kemarin beli lipen bijik dipakai gara rumah masker
selftalker,used tell myself
selftalker,iya kendrick
selftalker,persis
selftalker,diskusi
selftalker,tarik
selftalker,delete instagram psbb
selftalker,baca replynya bilang twitnya serius lucu sih
selftalker,mantan nongol mimpi
selftalker,tatap hening topik pas bom selesai selesai
selftalker,everytime told baca goin dengar soundcloud pas
selftalker,baca manusia coping mekanisme tahan hidup naluri masak
selftalker,pikir situasi kondisi normal otak sempit
selftalker,sungguh frustrasi
selftalker,gabung kereta musik
selftalker,putting bruno utama si songs nyala ulang
selftalker,pasuk waktu indonesia pikir
selftalker,tarik
selftalker,wonder lagu sounds bagus
selftalker,milik pesta billie eilish
selftalker,gantung bahagia candid bahagia gantung bahagia bahagia
selftalker,batal
selftalker,intoxicating cipta dangerously kusut technicolor dreams such gaib phrases jatuh cinta
selftalker,uang changes
selftalker,selamat pagi zoom
selftalker,tinggal whatever makes bahagia fokus nyala milik ketidakbahagiaan tim
selftalker,ganja tagih kenal dulunya ganja rekreasional pakai sekal henti drama henti rokok tembakau si organik kuatir
selftalker,haus ribut hidup ribut
selftalker,linkin taman gnr ratu coldplay hilang dr pandang hijau sih
selftalker,butuh fitur nyala whatsapp larang tulis any status
selftalker,marah pakai diam obat diam ambil waktu keren myself turun diam obat tolong bawa ngamuk antem lega
selftalker,entering bruno utama jam mode sibuk milik pikir any ganggu
selftalker,salah habis cemil
selftalker,twitter senang
selftalker,ngumpat pagi
selftalker,decide buka milik profesi kredibilitas taruh media sosial nunjukin norak iya pikir xx oke oke
selftalker,sih warna kulit gadang gadang cawapres teman temannya
selftalker,indah indeed
selftalker,media sosial santai sih lelah media sosial hepi hepinya
selftalker,berkat corona timbang golongan putih candidates
selftalker,total akun aktif peduli gratis cerewet twitter
selftalker,twitter teman iya fol henti ikuti dimasalahin bahagia teman twitter bebas mbacotnya
selftalker,semalu maluin coveran hapus nilai sejarah worries mantan crushes senang hati nikah
selftalker,soundcloud saksi jalan cinta sih tutup mantan hancur tutup mantan hancur tutup dimana mantan hancur encountered each covers involving paksu sahabat dating days
selftalker,yalord mendengarkan soundcloud tahun monangis saking malu
selftalker,pindah jakarta wabah tinggal sucks
selftalker,baca replynya ngegampangin korban stalker teror hilang waras semoga saudara laki kuat survivor teror psikologis mantan pacar
selftalker,tonton langit kastil cengang serius jenis cengang
selftalker,informasi selai operasional raja trans besok senin bekas operasi iya terima kasih
selftalker,maaf percaya nama jodoh tanda bebas pilih
selftalker,pilih sikap isu santer amriki kontribusi
selftalker,sih tawa
selftalker,beli rumah bekas rombak total lawan beli rumah mahal
selftalker,pusing dadak butuh anak butuh
selftalker,publik places buka waras atur sih goyah datengin komplain komparasi rumah ibadah buka ampuh
selftalker,made
selftalker,esjewe dimanamana
selftalker,tinggal zona merah pindah balikpapan karir jebak suruh mati
selftalker,lantai tipe cocok pakai kaos bujur bodysize proporsional langsing iya
selftalker,ngobrol teman grup ngebayangin ngantor tanggal bayang suasana selai cemil siang kuningan si frikkin corona protokol able terap
selftalker,wisata kuliner surabaya
selftalker,igs nama kirim warna disamain latar ditag notif nama menyaru kilas jaga kesal dikirimin hampers
selftalker,unggah foto hampers harga bilang terimakasih via japri
selftalker,pikir tahun si ramadan diam tahun dengar firecrackers kids laughters
selftalker,hahahahahahaa sial sesebundahh
selftalker,iya tular dokter ji suka sengat si
selftalker,salah salah mudah senang
selftalker,salah mall buka ramai ramai belanja salah pakai perkosa
selftalker,situasi alas rumah butuh sambung hidup
selftalker,paham mesti maklum rumah beli baju biarpun beli baju tahun beli simpan uang
selftalker,diam sekuelnya
selftalker,jelang lebaran tahun jarang ketemu whatsapp cinta shareloc iya
selftalker,hahahaa suka malkist kejut temu coba tiramisu deh
selftalker,sebentar coba cari ah rindu eyeliner pakai cair tangan mahir terimakasih saudara wanita rexy
selftalker,dibiarkan buka melempem sebentar murah jail nyomot rahang bosan jail habis bijik
selftalker,coba cari shopee
selftalker,cocok lembek ujung produksi iya
selftalker,setuju salah lawan maybelline temu lawan maybelline
selftalker,daya imut microhouses
selftalker,hampers tab searchnya instagram iklan nongol iklan hampers
selftalker,indonesia kawan kebal ll mati sooner harap
selftalker,tonton womc episode kuat pusing dokter marah marah produser rese ampun negatif poor soul
selftalker,dbd lupa parah hubung sih
selftalker,yalord baca ketawa jaman naposo
selftalker,simbiosis manusia mutualisme iya parasitisme
selftalker,tua anak anak utama petas ramai ramai lapang lupa tarawih senja
selftalker,bawa rumah malas mengurus ganti
selftalker,pakai listrik pascabayar kejut tagih bengkak tugas catat pacar tagih lipat thr bayar sebentar
selftalker,unggah telanjang pikir private message vp tonton salin pikir cinta jual cinta jual
selftalker,masak deh banding masakan mami max inti masak bapake tano bilang hasil
selftalker,lumayan sombong
selftalker,oh dikasitau masakan mantap jarang cenderung masak
selftalker,salah bodoh
selftalker,pagi sabar uji
selftalker,batal
selftalker,si telanjang pikir private message silakeun silakeun
selftalker,siang ngebenerin blog si sempurna saudara wanita puas asa temu tarik
selftalker,rumah kulit muka nafas rumah pakai pelembab toner beda vcon pakai bedak bayi anak ngalis rumit mekap kulit senang
selftalker,sarap any waktu wan makan hack roti tawar sari roti lipat lembut energen vanila terimakasih later
selftalker,pakai masker idungku kitik kitik
selftalker,dingin selai bersin bersin cemana negara musim
selftalker,baca otomatis nyanyi sial
selftalker,sarat pribadi hidup bagikan layak anak peduli peduli kadang bingung media sosial
selftalker,hormat hasil bakat everywhere multitalented rare meanwhile bagus
selftalker,senang gugup gugup bruno utama rilis lagu fangirl mode
selftalker,curi curi waktu refresh blog wifi bagus anak bangun wifi salah anak tidur selesai selesai
selftalker,replynya beda gantung situasi kondisi baca nikah iya nyaman setuju komitmen meniqa iya komitmen over cinta luntur
selftalker,sen gofood sopir ambil saudara laki virdaus pacar jasa banding bekas
selftalker,habis mandi lahir
selftalker,iya jaga sehat
selftalker,huruf susa
selftalker,batal
selftalker,ve listening salah billie eilish si songs times discovered idontwannabeyouanymore cinta jenis tunes
selftalker,balon lepas
selftalker,listening letting pergi daftar putar nyala spotify nyala pikir bajing sosial medias bosan
selftalker,twitter lite lucu twitter aplikasi
selftalker,suka via tulis zoom gugup
selftalker,meja versi rumah gerah rapat siang bolong ai pingsan
selftalker,surat penuh versi censored versi
selftalker,dengar takut minimum aktivitas gemuk
selftalker,tulang
selftalker,spaces butuh
selftalker,contoh tweet suara
selftalker,bukti gadis gadis cerdas rata rata
selftalker,jual masker medis whatsapp cerita tulis murah meriah ribu murmernya masker medis ribu murah meriah hongkong
selftalker,utas utas pakai dispill infotainmentqu psbb
selftalker,ember air bakar
selftalker,libur saing cuti lahir
selftalker,afterfour dihidupin
selftalker,kantor staf kibas bos
selftalker,goyang tangan milik setan
selftalker,tantang instagram
selftalker,hutang uang ikhlas hutang sakit hati nope ikhlasin decide otherwise
selftalker,suka aice
selftalker,selera magnum
selftalker,rindu cemil lapo
selftalker,vienetta drama gara pasar ribu beli harga bayar mahal beli vienetta beli magnum haagen dazs paksu ngobrolin vienetta siang
selftalker,minat sih temu
selftalker,minat coba vienetta
selftalker,iya daftar eksperimen coba
selftalker,selphie usagi dulunya emo anak bodoh anak bodoh emo saudara wanita friendster
selftalker,rekan rekan profesi ivan lanin
selftalker,suami pusing anak suka lasak susah dipakein baju diam diam ayah korsel baju adek
selftalker,told iya suasana bahasa bukti
selftalker,sambal bajak abc kemas pakai botol pedas sambal botol pedas
selftalker,hamdulilah rindu
selftalker,sih bayi drama cemil
selftalker,malam teman cerita gelisah kacau parah corona hindar rumah sakit ketemu kj
selftalker,ll tuai tabur cinta salur marah
selftalker,marah jenis saudara senang tuang bensin turun milik api
selftalker,jalan komplek konsisten fisik jarak lapang utama bola kadang dengar suara ngobrol ketawa ketawa anak utama
selftalker,balada enggan masak
selftalker,kemarin sih akun instagram jual beku makan bel semwa iklan instagram akun akun jual beku makan bingung beli
selftalker,tulis ubah suasana drastis inner lingkar drastis hilang minat dar ngobrol basa basi
selftalker,senang hemat waktu iya siksa tahan vibenya cocok cari sengaja comes instantly everytime temu
selftalker,along menang kadang si bab nyala making
selftalker,bertakhyul pikir bertakhyul paham bahasa suasana helped nyaring lingkar
selftalker,nila bosan pergi indicome
selftalker,milik agama rituals menang tolong si along otak milik
selftalker,konsumsi gula rumah tangga indonesia sih panik gula harga konsumsi rumah gula kilo habis habis
selftalker,rindu jajan
selftalker,manis sih tulus jual
selftalker,milik tiada bearable kuatir
selftalker,baca tweets jenis glenn fredly enough memakai inspirasi
selftalker,pandemi over ll doing commited sins
selftalker,saudara wanita anyone saudara wanita socializing
selftalker,pahit realistis kadang kadang beda tipis
selftalker,glenn fredly si suara utama suara pemuda tega favorit tidur istirahat damai
selftalker,perks rumah kaos bujur mini pendek handuk ngebungkus rambut basah
selftalker,twitter
selftalker,pandang pulang pergi rindu
selftalker,utama ukulele menyanyikan bayi cengo dengar nyanyi
selftalker,bosan tingkat mainin ukulele
selftalker,moh tinggal tuku mangan wakakakkak
selftalker,mbok pikir sakti
selftalker,biarkan suami gondrong bantu potongin rambut
selftalker,akun titip jual nasi kuning kalimantan bekas
selftalker,suamik telur dadar lembut rahasia
selftalker,oh kejut
selftalker,fck
selftalker,iya cuci piring bengong cuci piring
selftalker,rumah harga waktu cuci piring cuci piring gratis pikir
selftalker,batal
selftalker,pandemi pikir answers tahan memakai answers realitas
selftalker,coba mikirnya uang uang uang
selftalker,hijau ijoan deh any mentioned warna nyala comments bagus
selftalker,bohong introvert gadis has bagus suasana hati lately
selftalker,tahun pulang tahun niat pulang waktu pecah corona posisi bawa hitung pulang banding tular mari sabar
selftalker,mendengarkan rekam suara soundcloud sembari cemil ego bangga
selftalker,larang hahahahahaha harap nyala temu temu si pergi nyala
selftalker,gelisah asa
selftalker,jenis senang kinda butuh
selftalker,jarang sakit sakit cengeng
selftalker,saudara wanita
selftalker,mantan anak tiktok temu video utama tiktok lengos malu anak bodoh
selftalker,lessons indonesians butuh nyaring informations empati hormat pribadi
selftalker,bahasa inggris kecap manis kecap asin gelap soy saus cahaya soy saus
selftalker,tawa
selftalker,temu asam lambung gila hancur
selftalker,oh ironi
selftalker,such restless malam
selftalker,sagittarian sifat cinta bebas
selftalker,berat kubur kandung sembilan lahir saksi
selftalker,batal
selftalker,friday tahun mimpi buruk nyala elm jalan freddy krueger memakai marionettes children
selftalker,rendah bragging
selftalker,lamun bis jendela mendung gerbang senja gerimis gegas akustik telinga jakarta keras lembut
selftalker,baca has an obsesi over against moral standar masyarakat baca tinggal
selftalker,mental sehat lawan moralitas
selftalker,konsumtif muncul misqueen
selftalker,radarada insekyur foto foto selebgram seliwer
selftalker,saudara bagikan informasi pesan
selftalker,commuting si dingin raining diluar sit bis pikir lari kepala bruno utama si suara both ears hidup doesn buruk titik
selftalker,poor souls
selftalker,bangkrut tahun si java jazz festival terima menang able dengar mr utama tenang suara sedih
selftalker,awakened clogged hidung gagal tidur tulis turun monday
selftalker,temu harta si had akal existed
selftalker,took secs
selftalker,mumma si hilang eden
selftalker,although jompo tengah malam convos used cinta iya later malam deeper
selftalker,lingkar cahaya kenal baca cerita peluk butuh nasihat komentar semoga lega iya ll stronger
selftalker,situasi salah dimana sweetly ll senyum dimana
selftalker,cari senjata kuat cincin hidup pulih biarpun minum def obat melawan def obat hidup obat
selftalker,gemas
selftalker,hibur
selftalker,somehow pikir harry potter film marathon
selftalker,teman teman sungguh anak miskin
selftalker,four les shivers turun tulang
selftalker,sesar trauma hamil
selftalker,sih iya selesai tele tele
selftalker,suami mendengarkan telemarketer niat beli dengar rekening suami potong iur asuransi bilang telepon sih telemarketer
selftalker,tonton perempuan tanah jahanam selamat tinggal bioskop agustus kemarin
selftalker,tonton ulang nang iya tonton
selftalker,batal
selftalker,si easier pikir proses
selftalker,til
selftalker,kinda imut emojis milik sejarah milik pergi january february maret april june july agustus september october november december lulus milik teman main
selftalker,didn tanda jenis sakit
selftalker,habis uang nyala terbaik senang anymore use uang isu
selftalker,twitter aplikasi jebak nyala burung logo menang proses use twitter browser sucks
selftalker,username
selftalker,ajar anak seks didik si waktu penjara anak goblo ajar seks sumber salah
selftalker,kadang teman saudara saudara
selftalker,rumah tengah senja kabar berita nelpon bilang jalan hotel hotel selai siang periksa
selftalker,happiest nyala bumi tonight showered milik tulus cinta perhati apresiasi pegang tangan rangkul si besok manja wanita milik hidup
selftalker,cinta hujan diluar si bicara senang jatuh cinta each doesn suara sugary romantis suara milik jenis romantis
selftalker,diam two talking hati hati lembut voices gazing each si listening talking
