username,tweet
selftalker,takut cocok cocok kantong
selftalker,tawa
selftalker,cemil selai selai lapar rapat sih between energi kuras pikir
selftalker,aot maret episode tanggal rilis rilis
selftalker,jual desain dekstop organizer iya
selftalker,bosan suka desktop organizer bosan buka pc laptop
selftalker,rutinin baca renung tuhan hati tenang
selftalker,suka keringetan keringetan muka ai gatal gatal
selftalker,diam salah bicara salah bicara
selftalker,bingung sih laki laki lembut perempuan isn basic wanita gently
selftalker,daftar putar radio bruno utama pagi tunes sih suka
selftalker,jual soul washed tangan saudara wanita nights senang
selftalker,iya suci belaga dibaikin
selftalker,tinggal an laut buruk ones bagus ones si few clicks isi malas bodoh pilih milik
selftalker,nyeri lambung depresi
selftalker,cemil lari hidup kotoran
selftalker,bahagia
selftalker,nang aprilio manganang
selftalker,tunggu laki laki menang hakim tangan aprilia manganang
selftalker,lately dengar bagus mati accompanied through keras times lasts si arus favorit album pikir bagikan favorit
selftalker,butuh relax coba terimakasih later
selftalker,persis kuliah menyadari sungguh pintar balas
selftalker,ciwi ciwi cantik cantik sih insekyur
selftalker,garis hela rambut lcd laptop resah
selftalker,gelisah
selftalker,tulis nama jelasin setuju ujug ujug basa basi doesn terap inner lingkar
selftalker,cinta jakarta malam
selftalker,hitung an hasil kah turun kesitu
selftalker,pemerintah kota behind tenang hidup kd tuha jalan
selftalker,hahahahahha seksi keluh
selftalker,hahahahha cemana jft seksi botol
selftalker,pantau manatau rekan jawat keluh duluan
selftalker,berhubungan nang baca
selftalker,had
selftalker,hidup jalan bajing
selftalker,lupa manusia
selftalker,kadang si waktu bagus mati
selftalker,suka sei sapi
selftalker,sayang twitter tolong memakai tombol peka memakai lipat klik sengaja hitting tombol scrolling benci
selftalker,butuh enough
selftalker,tanda pakai spasi
selftalker,komentar akun pegawai negeri sipil anak ingusan asli berani takjub
selftalker,tonton aot sempurna waktu beranda berita sampah selamat tinggal nikmat aot damai sibuk feeding milik hidup sampah
selftalker,boro boro libur ai pulang desa rindu keluarga
selftalker,sesal tonton aot henti yalord seru sih
selftalker,kpop
selftalker,cemerlang mudah ide ajar english
selftalker,setuju sih cuci piring terapeutik mesti makan prep masak cuci piring menyebalkan
selftalker,acak
selftalker,privasi kamus
selftalker,dada sakit usually along symptomps described nyala tweet sakit jujur kinda kuatir
selftalker,alam pendek nafas everytime hirup si sumbat respiratory sistem everytime hembus dengar desis suara doesn alam several times
selftalker,alam rambut rugi realized didn ubah any rambut products used reduce rambut rugi noticed rugi rambut
selftalker,bicara corona kinda lately months stated negatif catat comorbid
selftalker,none rada indra budak cinta
selftalker,terima kasih hibur saudara laki such rollercoaster si an enjoyable tunggu cerita
selftalker,david drama raja romantis acts omong kosong percaya tolong berhenti si asked indra tunggu look kesal
selftalker,gila jahat lalim iblis minder cemil harta selagi mati bawa kain kafan kubur
selftalker,dunia doa semoga karma cepat cepat cepat sakit sakit
selftalker,lucu bajing
selftalker,umbi hidup umbi berat kecuali esmelon umbi pikir mati mati
selftalker,wrote turun corona jalan blog two sedia link second unggah
selftalker,rumah rumah urus kantor mesti urus rumah suka dadak payudara
selftalker,suka payudara sih susah minimal
selftalker,insecurenya rambut muka
selftalker,nyala insta masak arsitektur desain digital seni isi
selftalker,gerah whatsapp tidur lantai menempel dinding
selftalker,benarkan rawat kulit rezim mursidah nan mudah cari
selftalker,cahaya maksimal ctk
selftalker,pagi pagi ciprat energi negatif sial
selftalker,sedih baca cerita sedih baca komentar komennya
selftalker,tru
selftalker,survived corona beda corona umum flu sincerely harap covidiots virus possible si milik bodoh argumen
selftalker,harap rencana putar david setoxic racun def waktu benci fictional karakter tulang
selftalker,tulis turun corona jalan nyala blog had gulir whatsapp tanda certain dates dukung events
selftalker,bobok bayi rumah selai mandi
selftalker,saudara kepala turun dakwa si clearly salah unggul
selftalker,smb mentok agung metro
selftalker,papar pakai analogi seks
selftalker,kos kos
selftalker,si fcked pilih between bahagia tanggung
selftalker,iya ngandalin cuti istirahat usaha susah ngijinin pegawai mengambil jatah annual tinggal hak pegawai
selftalker,yasalam astaga iya iya indra iya
selftalker,mentor harrased si anak
selftalker,cinta songs gelap dingin kamar si raining diluar asa terbaik asa
selftalker,kalah kalah drama korea ngecut episode
selftalker,tawa
selftalker,indra malu malu gemoy saudara laki gives perspectives api
selftalker,suami anak tantrum sekian diamkan bujuk bujuk manja detik iya iya anak ayah sayang anak kantuk sayang
selftalker,terimakasih saudara laki cerita told iya tulis mesmerizing
selftalker,ah cerita cerita cerita positif pikir ayo ayo saudara laki
selftalker,pengirim kkn desa
selftalker,tertawa sadar betapa khawatir hidup
selftalker,eh perempuan jenis kelamin ganti teori
selftalker,baca gugup gugup perempuan teori hati
selftalker,iya terimakasih
selftalker,cari sih informasi banjir bekas waktu dilema kantor
selftalker,doing
selftalker,salah hujan hujan nebar racun lapar
selftalker,anak kasih nama
selftalker,gila bekas hujan henti semoga banjir
selftalker,tangan nasi goreng teri medan
selftalker,baca tubir twitter
selftalker,hibur pandemi melihati foto wisata cantik desain rumah bagus pinterest
selftalker,keluh suami
selftalker,terima kasih minder media sosial bagus iya pengirim
selftalker,nyaman ngebaca nama tulis huruf kapital
selftalker,senang fakta nama panggil anak batak nama umum pakai batak keluarga bingung kasih nama paham bilang bagus
selftalker,detik bayang anak gerak mudah mudah kasih nama batak unik nama saudara laki
selftalker,throwback times name boys kuat buah nama
selftalker,pikir si putri name anggun lelucon
selftalker,uh pikir butuh sosial media
selftalker,anak gtm flu nihil motivasy masak
selftalker,hasil pantau screenshot tebar beranda
selftalker,foto profil utama clubhouse mapan rupawan iya
selftalker,saudara laki kagum kagum utas daya ketrampilan olah karakter rangkum tunggu deh pokoknyaa
selftalker,tidur mampet
selftalker,saudara laki gila sih tell beda each tweet mesmerizing tolong
selftalker,adek adek muda pintar tipu bingung sedih hormat
selftalker,titip saudara laki sebentar
selftalker,akun twitter facebook instagram gabung akun whatsapp snapchat linkedin telegram tiktok belok milik
selftalker,bosan instagram
selftalker,mbok paham kantor alih alih maksa hasil tes pacar negatif juta negatipnya
selftalker,dengar milik spotify albums daftar putar religiously milik suara harfiah indah
selftalker,gaya saudara wanita celup nyelup nongol boing boing boing titik
selftalker,batak anak lahir ban sumbang nama anak dewasa anak luntur nama bagus bagus ganti sih
selftalker,favorit suara
selftalker,mr utama jam
selftalker,taruh nyala takhta alih tempe si posisi cireng baca bagus
selftalker,belaga belaga kopi nikmat asam lambung
selftalker,paham si liberating media dimana sepenuh ekspresi themselves whatever dunia bebas muak lengkung si bebas sags
selftalker,kinda pikir bong sosial media era
selftalker,naskah si pria moved irl
selftalker,had disturbing mimpi told myself bangun woke mimpi woke alarm surreal
selftalker,had dreamception malam
selftalker,minyak numis bumbu sdm gantung nasi bagus pakai nasi dingin suhu ruang
selftalker,nurun bakat masak nelpon masak digimanain
selftalker,bumbu ala saudara laki saudara laki coba satisfying
selftalker,berhubungan hasil improvisasi campur campur ajaib tuang suasana hati ajaib
selftalker,bos rules reminders
selftalker,mie goreng saudara laki saudara laki ditungguin gilir ditungguin
selftalker,anggar subdirektorat januari refocusing sisa zoom temu tahun
selftalker,waktu
selftalker,yaelah bahas isu pelatuk pelatuk belaga keras pelatuk isi lagu asosiasi lagu
selftalker,iya sih pasrah waktu batuk sesak cemil kondisi mia mia bicara hati sembuh minum obat
selftalker,antisipasi saudara laki masyarakat
selftalker,alam anosmia parosmia phantosmia neraka minggu
selftalker,cemil warung rumah cemil restoran iya saksi
selftalker,baca baca si suasana
selftalker,usia gloriously
selftalker,kalah english ketrampilan bagus
selftalker,buluh diffuser iya storynya scented lilin
selftalker,cabai hijau andaliman butuh hebat sambal andaliman resep
selftalker,jujur starting cinta wfo rumah situasi waktu keluarga kalah asa kembang suka towards dapur
selftalker,anggota keluarga pulang jalan peluk otomatis mandi gih nemplak nemplok isolasi mandiri sedih
selftalker,yahahahahaha asli rindu camil rapat zoom snacknya swadaya
selftalker,lelah kadang baca beranda twitter vibenya cenderung negatif
selftalker,sadar kenyang ngemil cemil berat jalan berat
selftalker,tahun old ajar si called whatsapp gb
selftalker,reminds shawol era jonghyun bias
selftalker,batal
selftalker,sadar habis papas artis hilang nyala recognizing faces
selftalker,pegawai negeri sipil tatap
selftalker,umur jatuh kesandung
selftalker,dapur pulau sadar dapur dipakein
selftalker,midsommar tonton apose sih
selftalker,salah bintang sedih sih sedih sedih mbrebes mil
selftalker,lepas kolesterol nikmat daging daging lemak
selftalker,kesal suka nyebut keluarga pikir susah anggota keluarga
selftalker,coba lembut cookies
selftalker,pitbull
selftalker,materai palsuin sebentar palsuin otak kriminal
selftalker,bahasa bicara campur campur bahasa enggres protes malas ajar bahasa enggres iri ajar
selftalker,susah paham baca elektronik baca cetak iya
selftalker,aduh rindu mie cakalang kuah goreng
selftalker,kunci instaworthy rumah
selftalker,tinggal kota bayik rewel jelang tengah senja anteng diputerin instrumental ngediffuse minyak lavender gaya
selftalker,yaela pakai kursus anak jaman pintar pintar bahasa inggris modal youtube utama permainan
selftalker,paham pergi cari saksi yehuwa saksi jehova jehova si witnesses
selftalker,umur tengah si ngepel rumah backpain
selftalker,eh tarno rtv televisi syukur semoga beliau sehat
selftalker,kadang dilema anak anak jaman bahasa inggris lancar khawatir anak ajar bahasa indonesia terlambat sisi takut anak pidato tunda diajari bahasa terapi ngongkos
selftalker,anak yatim favorit tonton prekuelnya sih sekuel
selftalker,tim habis masak nafsu cemil
selftalker,janji briefing bareng spiderman canda
selftalker,kemarin konsumsi azithromycin sakit
selftalker,contoh sultan fifa
selftalker,raya hujan henti pagi
selftalker,aduh sih temu offline cerita teman niat temu temu positif pulang temu hadir isoman
selftalker,terima kasih
selftalker,gila iya malu marah marah muda marah marah muda pusing kepala
selftalker,fase malu sebentar throwback jaman jaman militan
selftalker,fandom mbok iya dikalahin
selftalker,penggemar kpop jelek imagenya nyaring bunyi media sosial protes disamain
selftalker,every phobic refers ekstrim takut benci sederhana use istilah kondisi ekstrim
selftalker,ain teman teman abusing xenophobic
selftalker,ciwi ciwi jaman iya bagus bagus si saudara look usia
selftalker,atur tanah baca duduk nyala si basic memakai malu fail
selftalker,iya saudara wanita saudara wanita embara kesal sih bilang merendahkan
selftalker,bal kesal kesal saudara wanita saudara wanita murica ditampol sistem imigrasi lemah
selftalker,iya iya sih saudara wanita murica habis indonesia manfaatin jalan ramai bal perlahan bal hilang tanah
selftalker,bullied bullies iya saudara wanita saudara wanita murica
selftalker,nyinyir dagang saudara wanita uang gembira sih
selftalker,beranda pantau dagang pamer pamer uang pantau dagang dagang senior nyinyir dagang bilang dagang fomo iya nama senior
selftalker,tengah january surga heard any bagus berita had buruk berita berita bagus berita indeed
selftalker,sending virtual peluk si terbaik through keras times semoga damai luka
selftalker,sungguh sabar baca nikmat digital baca tunggu longer pegang book senjata
selftalker,tunggu ngetwit lagu gigi
selftalker,sawan sembah
selftalker,dasar manusia suka populer
selftalker,suci moly
selftalker,nama pakai ee hawa tengah east sih
selftalker,permainan ve selesai persona
selftalker,shopee periksa tanggal cantik
selftalker,salah deng habis juta
selftalker,asli sih corona dompet jerit rumah sakit isoman rumah habis juta juta sisa
selftalker,meant pilih carelessly bawa bahaya maaf didn clearly
selftalker,jahat harap bagus untung hasn sih tahun
selftalker,masak nasi goreng pakai sambal instan lupa cabai habis senang tahun
selftalker,sate kambing sen gofud tahun si malam keluarga makan malam keluarga husband si unjung anyone buka rumah guests
selftalker,informasi kejut
selftalker,istirahat damai
selftalker,an ide resolusi
selftalker,introduce milik name menang
selftalker,takut tingkat rumah otomatis tenggorok seret
selftalker,berhubungan berhubungan sembari tatap jejer piring cuci
selftalker,percaya iya toko toko mall beli
selftalker,sekian tahun bekas nasi goreng kantin rumah sakit hermina bekas debat
selftalker,gosip sikap tetangga warga sih kemarin rikues puskesmas nginfoin rt warga
selftalker,iya tidur kamar kasur suami
selftalker,christmas raya keluarga tahun struggling against cov dec tahun pergi habis separated rooms sempurna waktu introspeksi refleksi celebrate christmas rendah hati
selftalker,hormat berani jalan jalan situasi
selftalker,parents hospitalized both sungguh sungguh harap buruk berita menang any buruk
selftalker,dicatat
selftalker,pacar khawatir hasil pacarnya sesuai harap baca optimis terimakasih
selftalker,kinda wonder abt suami konfirmasi positif sehat keluh cepat antigen negatif iya pacar
selftalker,pulang libur bawa leholeh bawa sakit
selftalker,tweet kucingbot langgar daging poin melawak lucu
selftalker,tarik
selftalker,temu jenis damai sorak sorai pergi through corona sebar alam medications corona
selftalker,apaqa gila nasihat nihil pasien corona utama keluarga
selftalker,batal
selftalker,ramai syarat bal takut takut pasien positif corona hilang nafsu jalan jalan
selftalker,perempuan hamil sumbang plasma konvalesen
selftalker,buruk berita lately takut dengar notifikasi whatsapp
selftalker,negatif suami positif senang
selftalker,an bagus berita
selftalker,jalan jalan situasi hak komplain corona selesai selesai libur
selftalker,iya sih tetangga dajjal tetangga dajjal dajjal
selftalker,selamat putra si jalan paman lupa looked saudara ambil rumah ungsi rumah paman tante corona
selftalker,lingkar cahaya positif corona positif berat iya badan sakit sakit tahan iya sebentar badan sembuh deh ayo semangat ayo
selftalker,waktu anak tinggal bilang rumah tolak layat nyeritain ulang layat kasihtau layat
selftalker,salah pakai setuju vaksin henti sebar virus vaksin distribusi rata butuh waktu nyetop sebar virus
selftalker,koreksi vaksin efektif sekian persen populasi vaksin kebal vaksin digratisin capai angka minimum
selftalker,kemarin pikir ngevaksin keluarga pakai moderna pfizer sake kualitas iya pikir vaksin mihil mihil ngevaksin
selftalker,vaksin gratis vaksin bayar bayar vaksin bayar vaksin
selftalker,malas tonton korea
selftalker,niat mudik tahun tahun mudik tanggal oke tiket oke minggu pergi suami corona
selftalker,positif positif corona hasrat nekat jalan jalan lenyap nyap wan anywhere else rumah husband putra si christmas harap tahun
selftalker,tonton iya nontong hitam cermin
selftalker,poda dinyanyikan edo kondologit bagus daftar putar bagus bagus timur nyanyi lagu batak
selftalker,sesal jajan jajan corona rugi
selftalker,senang fakta baca peta nyetir modal google maps tahun tinggal aktivitas jabodetabek
selftalker,able selesai makan wangi nasi dingin tolerable nasi panas semoga sembuh amin amin amin
selftalker,nyonya babi panggang ajala sehat
selftalker,pergi cemil senang least si makan
selftalker,terimakasih
selftalker,sembuh sih nama parosmia normal heard anosmia parosmia
selftalker,cium bau bau cium salah bau nasi mesti bau minyak kayu putih mesti lain-lain buruk kuat cium bau nasi panas lempar
selftalker,desember pasang pohon natal tahun susah
selftalker,marah marah nganjing anjingin bawa
selftalker,sih ide natal diucapin selamat natal
selftalker,isolasi mandiri berat rindu anak takut ketemu anak
selftalker,sadar sono eriko cerita kunjung indonesia keren
selftalker,iya
selftalker,sadar kadang sembrono malas rumit sakit laknat pinginnya diam rebah kamar memegang kasur
selftalker,anosmia mikirnya jajan
selftalker,corona gejala mild none pilih cemil sehat cemil senang cemil sehat cemil senang sehat
selftalker,terbaik
selftalker,cakes ve tasted michelle toko roti si blueberry kue tops fond cakes selesai tengah
selftalker,kalah kalah binge tonton anime netflix senang
selftalker,days pergi semangat
selftalker,corona jaga pikir positif hepi hepi cemil saudara wanita naj
selftalker,butuh malam lampu beli diffuser humidifier beli malam lampu diffuser instead both once
selftalker,urus
selftalker,jenguk hilang eden jenguk lahir tano keluarga saham peduli berani harap maaf berani
selftalker,sungguh sungguh harap waktu tuhan belas kasihan harap menang
selftalker,terimakasih spending minutes tahun nyala
selftalker,kepel gejala sih semangat kesal
selftalker,si tidur terimakasih tuhan si sakit tonton juang his sakit
selftalker,lupa ulang tahun husband corona suspects kondisi ambil peduli sakit husband urus heavy kepala sneezes second titik gila gila
selftalker,corona separates putra runtuh ulang tahun runtuh libur rencana runtuh mental stabilitas puncak izin gila bajing si sake
selftalker,bersin tisu tangan sanitizer ulang
selftalker,anak twitter ngeri
selftalker,otomatis temu utas rekomendasi parfum
selftalker,benci instahram
selftalker,bilang rumah cuti maju tampol
selftalker,bekas gerah bajing bangsatin
selftalker,butuh dimana tidur main games tonton oke drama baca baca webtoons
selftalker,anomali indonesian whatsapp tukar
selftalker,batal
selftalker,lately ve talking myself an selftalker
selftalker,ajar waras kadang abai peduli wajib peduli
selftalker,two positif menang memakai anyone senang told milik uji harap told milik pacar uji hasil
selftalker,corona bayi jarang ajak jalan ajak jalan lupa kejut riweuh catat nyala malam
selftalker,iya gusti benci daya
selftalker,terima kasih corona berkat weekendku libur kejar kejar tunda semester psbb
selftalker,suka ngeplay lagu lagu laptop rekomendasi lagu sreg didenger spotify dengar lagu lagu
selftalker,larang indonesia mudik susah suruh hianat adat istiadat perintah himbau protokol sehat rumit larang larang mudik
selftalker,bekas utara informasi
selftalker,dokter bantu rtnya kah informasi ngabarin terimakasih dokter
selftalker,dokter dokter infomasi konsultan keluarga daerah bekas jakarta timur mahal bantu informasi dokter terima kasih
selftalker,mati hidup
selftalker,harap hidup happier
selftalker,ubah pikir iya semoga temu damai lepas pegang sengaja lepas
selftalker,gantung sudut pandang gelas isi tengah gelas tengah penuh tengah kosong
selftalker,paham buka hati obat bangun dinding tinggi tinggi
selftalker,simpan emosi hati untung menyakiti badan
selftalker,tuhan tuhan
selftalker,any reincarnate saudara pria an empath
selftalker,titik milik jaga mati virus diam intai si behind kantor meja tulis
selftalker,kabar anak kantor meja persis positif corona takut sih ketemu badan kasih sih menikah
selftalker,bekas sih selai subuh gerah
selftalker,aduh andai printilan tetek bengek golong selesai saudara cinta ulas uu ciptaker
selftalker,bukti baca draf an halaman bukti baca myself senyumi
selftalker,gugus unlocked gugus ciptaker
selftalker,suka sinar matahari jendela penuh ac ruang mobil
selftalker,cuci mulut memakai waktu bangkit cuci mulut toko cuci mulut toko mawar toko roti begins
selftalker,ghaniyya ghazi gem
selftalker,told husband bawa putra balikpapan sungguh buruk happened
selftalker,tonton jorok jorok ah kejut tonton video bersihin karang gigi
selftalker,cuci mulut memakai waktu bangkit cuci mulut toko cuci mulut toko mawar toko roti begins
selftalker,iya kasihan
selftalker,sih minat iya wisata negara ngejual palsu tengara
selftalker,anak gtm ketrampilan masak
selftalker,cepat selesai cepat oktober selamat bebas
selftalker,minimal kenal positif corona fuckin virus tutup
selftalker,gara gara pasang foto jaman cari cari foto paham pacar
selftalker,percaya mimpi carries pesan
selftalker,tanggal tanggal ketemu perdana resmi status panggil sayang iya
selftalker,gave frikkin goosebumps
selftalker,diinvite kibas sekolah minggu anak
selftalker,wifi putus betapa boros konsumsi internetku
selftalker,terrifying baca baca positif lantai xx circulating nyala kibas
selftalker,bangun pergi locked turun starts besok
selftalker,suasana hati hancur ancuran target september boro boro urus tengah mati karir suram lembah miskin
selftalker,salah anggap harga
selftalker,marah dibalikin pakai salah kemarin kemarin dimaafkan
selftalker,hilang nafsu cemil senja
selftalker,lyfxux
selftalker,untung misqueen libur boro boro puncak smb gugus gugus libur
selftalker,tolong cerah film mudik pikir kah
selftalker,serius asking bioskop buka tonton bioskop berani tenang nontonnya hormat sih iya
selftalker,soto lamongan ceker panas koentji nyeri
selftalker,uang rangkum daftar rusa butuh saking muat tulis twitter
selftalker,deadline nyala october loads si tutup mustahil hobi nyemangatin
selftalker,oh lupa tugas anak paham rugi urus hidup harga privasi
selftalker,suami dasar prinsip pilih sih anak tugas suami sisi positif negatif opsi anak mudah mudah prinsip
selftalker,suami ditanyain anak laki laki izinin rokok tato tarik
selftalker,si singa anak ulang tahun ngundang corona sensasi st ulang tahun repot dekor rumah sen nasi kuning
selftalker,si twitter
selftalker,beli sadar bedak kuning warna kulit muka kuning leher putih telur kuning putih
selftalker,gita bahana nusantara tahun lit
selftalker,buru lucu lucu ngehias rumah
selftalker,takos seraya buai daftar putar
selftalker,sungguh any alas cinta myself bajing benci
selftalker,paham nasi goreng bekas balikpapan nasi goreng tara nasi goreng hermina
selftalker,ngitung beli nasi goreng pakai gofood beda temu muas nasi goreng hermina
selftalker,nasi goreng nonresto bekas nasi goreng belah rumah sakit hermina bekas
selftalker,iya iya sih situ gedung belah
selftalker,bah merk loh merk kantor
selftalker,izin badan fit bos dikirimin jadwal wfo pesan optimalisasi sedih
selftalker,taruh nyala bio
selftalker,kaum akar rumput kantor ai gugup gugup gedung gedung belah korban jiwa positif corona akar rumput ngelus payudara banya banya doa
selftalker,himbauannya fit kantor responnya
selftalker,takut berat kondisi sehat pakai topeng rumah percaya tolong berhenti inisiatif rumah jumat cegah bos mereply foto jadwal piket wfo
selftalker,si normativity
selftalker,tolong hati ambil
selftalker,sehat sehat sehat
selftalker,pakai laptop toshiba awet rewel rewel ganti isi daya sulit
selftalker,krl rute lewatin stasiun tanah saudara laki otomatis terimakasih
selftalker,took vit sih ambil regularly several days amit amiit
selftalker,temp bau kalah any either comorbid amit amit infected otg
selftalker,lelah mengurus bayi chores rumah wfo stressing pakai topeng buka cemil minum
selftalker,tenggorok kering siang temu kering perih batuk batuk dahak sih candid takut
selftalker,nikmat lasts saudara saudara wanita excitementnya senyum malas oh gembira muda
selftalker,mipan zuzuzu zuzuzu mipan yakakus nyamnyamnyam mipan
selftalker,super percaya interaksi asing baca
selftalker,menyimak berita corona utama petak umpet dengar kabar nongol bilang boo gedung kantor tetangga anosmia
selftalker,coba
selftalker,bangkai dengar ngiang ngiang derita
selftalker,malam minggu selai ngadepin laptop buka
selftalker,sim antre
selftalker,nama vika lemah video video donat instagram
selftalker,habis bersihin telinga bersin bersin kesal
selftalker,rindu baca utas commentnya ngebuka lapak
selftalker,rini si temu amsterdam nyala ulang syahdu lagu
selftalker,saudara wanita tumpah sirkal kelompok jual netpliks spotipai iya taman utama sial rusuh twitter
selftalker,salah salah ngejejelin kotoran muka
selftalker,bangun tidur kepala sakit bagus
selftalker,tell pikir gone
selftalker,gantung
selftalker,nasional istri pamer olredi
selftalker,santai pengirim fokus situ waktu sadar temu
selftalker,tarik coba bayang hidup rumah pandemi cepat jenuh banding hidup rumah konvensional
selftalker,minggu uninstall instagram niat pasang kadang buka pakai browser menit diclose eneg ikhlas abisin menit masak mie
selftalker,bajing doesn bunuh memakai stronger
selftalker,lagu didenger iya
selftalker,kenal belanja online pergi label terima menghancurkan sampah buang paham secareless data pribadi
selftalker,lagu lagu weeknd jodoh
selftalker,instagram installed twitter installed both telepon
selftalker,gila sugab banget
selftalker,def rt
selftalker,kayapa pulang coba
selftalker,used mini book made wanted
selftalker,kejar kejar desak lari sembunyi
selftalker,hidup fantasi
selftalker,percaya ambil turun ampun gila sih memegang pedang jabat selesai
selftalker,angin rayu kencang ekspos pohon rimbun pucuk salah mudah dispot dicombo deras mudah akses informasi gila si mudah bawa turun
selftalker,terang paham kejar posisi jabat leluasa nempatin jabat malas pikir tanggung konsekuensi dihadapin salah ambil tindak
selftalker,coba
selftalker,hati amin
selftalker,pagi pandang heartwarming saudara laki gojek nasi bungkus kakek tua pulung karung bawa
selftalker,kering makan lapar tidur
selftalker,oh album tangan over sih senang tunenya memakai sidang iya cocok songs jane
selftalker,yalord kesal kesal
selftalker,dengar ulang album songs jane merah tua penasaran lagu lagu songs jane kental hawa sexynya saudara senang taruh songs seks sidang si bgm
selftalker,pek pek tahun tahun tahun jeda seok gerak
selftalker,had panik serang lemas kujur badan butuh tidur
