username,tweet
timutiimuti,tawa sebentar ceritain whatsapp iya bebb
timutiimuti,gara drama kargo tawa
timutiimuti,gratis
timutiimuti,bapack asrama tyull tawa
timutiimuti,gara mengurus mutasi motor alhamdulillah keliling surabaya selamat tinggal
timutiimuti,tawa mutia sangka kamar kamar yaya yaya bilang lem
timutiimuti,tahun hengkang asrama saudara laki jaga ciwi bubay
timutiimuti,whoaa kayaknya surabaya ubah tawa
timutiimuti,tawa bayi
timutiimuti,salah ketik purin nama
timutiimuti,pikir sih tawa heuu rentan iya rizz jaga pola cemil
timutiimuti,busett apakabar kurus rizkaa
timutiimuti,hilang kunci kos
timutiimuti,busett sungg untung libur sibuk dim
timutiimuti,parah wepe
timutiimuti,heran akses informasi salah manusia sempit liang kubur
timutiimuti,sisi efek gara presenter konferensi doktor semoga tular deh iya
timutiimuti,kejut si keren terimakasih heads
timutiimuti,fitur desain ideasnya powerpoint cihuy
timutiimuti,tragedi februari habis
timutiimuti,tawa lucu sih teman angkat ipar
timutiimuti,mudah interaksi ketemu tawa
timutiimuti,cari domisili saudara wanita purin mudah tawa
timutiimuti,tawa kutip retweet bantu promosi gabisaa
timutiimuti,tawa uni percaya cari calon ipar terimakasih
timutiimuti,yoll tawa zbl
timutiimuti,hee menerima pasangan suami istri kasih nasib pacar
timutiimuti,buka pinterest cari tawa
timutiimuti,okee siss waduu tawa polos
timutiimuti,bagus infoo terima kasih yoll ktpku sudut kelupas muka kentankku ngeblur tawa
timutiimuti,batal
timutiimuti,tampar dedeh waktu mengatur mengatur waktu
timutiimuti,tawa kayaknya susah konsisten ngee
timutiimuti,suasana revisi perjuangin majalah jujur berat pundak
timutiimuti,revisi struggling iya bunda saran beliau
timutiimuti,tawa produk saudara ramah kantong coba bujuk mami ngee rambat teman mami tawa
timutiimuti,beban tua
timutiimuti,nama lengkap persentase kesiap doa tekad bismillah
timutiimuti,pil tawa jalan mual gara jijiquee ken lemparin jari te
timutiimuti,tawa pakai otak pikir iya pil ngeselinn
timutiimuti,nyelip oto belah kiri kironyo kalua muntahnyo muncrat
timutiimuti,muntah berentiin mobil muntah pinggir jalan mobil jalan muntah
timutiimuti,tanggal ekstra hati motor usaha hati muntah
timutiimuti,ditawarin remaja sjs angkatin container bilang bawa tawa independen wanita turun
timutiimuti,webtoon true indah seojun suho sih seojun santai utama betiga bareng suho jukyung
timutiimuti,rutinitas padang bukittinggi mampir syukur beli bungkus sate ketupat ayah
timutiimuti,seojun si terkait ve had three pria kasih sayang though both brothers
timutiimuti,sopan sih sopir gojek umur saudara laki panggil tawa su
timutiimuti,daya wifi tmp kp dibatesin untung ojan tawa
timutiimuti,decide minum kopi gara begadang takut bablas temu sebentar sakit ndredeg perut
timutiimuti,kopi hasil kopi hitam tawa gagal
timutiimuti,lelah tengah tahun
timutiimuti,buah salah izin pergi ayah duluan otomatis diizinin
timutiimuti,andai jatuh suho seojun nyelametin tawa
timutiimuti,ajar grandma utama jaman old utama pakai gundu nama
timutiimuti,sen pakai goshop ngee tawa
timutiimuti,ngabisin salak iya saudara untung biji ketelen tawa
timutiimuti,bhaiqq tonton episode tunda tahun
timutiimuti,alhamdulillah untung ngilangnya iya sungg tawa
timutiimuti,tawa santuyy nyala pergi malam episode tawa hajar pakai pustaka rombak tawa
timutiimuti,tawa sinisini racun true indah
timutiimuti,betull sutradara ngemas tawa
timutiimuti,sih sel tawa tim suho amann penasaran webtoonnya
timutiimuti,sel
timutiimuti,lovelinenya seojun sujin tepuk belah tangan sel
timutiimuti,makna lirik lagu lari nguatin jiwa kalah harap
timutiimuti,tawa rumah nomor sih sen shopee minjem nomor rumah tetangga tawa
timutiimuti,parah tawa nomor
timutiimuti,lesgo
timutiimuti,libur libur natal
timutiimuti,padang yayy tawa bukit yukla reii bukit
timutiimuti,ikott
timutiimuti,sua rilis webtoon tsoa drakornya tim suho seojun tawa
timutiimuti,pulang yayy
timutiimuti,candid jalan buntu nembus bypass oke
timutiimuti,sekian kacamata memakai transisi ngeblur lambat gera
timutiimuti,sih mbak tawa pintar cari lagunyaa
timutiimuti,ftv tonton sih mbak sinema elektronik indosiar emot an video backsoundn
timutiimuti,akun tawa
timutiimuti,hoo shopeepay tawa
timutiimuti,kejut menarique evoucher shopee bentuk tawa
timutiimuti,tolong bundd racunin rekomendasi bank biaya admin tawa
timutiimuti,tawa pakai jenius transfer bank dana sih biaya admin malesh
timutiimuti,uninstall jeni tawa saldo rupiah
timutiimuti,musim unicorn tolong
timutiimuti,seminar proposal panique euy gara koneksi
timutiimuti,taman panorama ngee menit bukit apit tawa
timutiimuti,bukittinggi coba rumah deh lumayan cuci nikmat alun kicau burung
timutiimuti,sekolah sih sakit kesana bareng sepupu buru matahari benam cir
timutiimuti,minggu pengin segar alam cari sepi mudah al
timutiimuti,kemarin besok bolos bimbing les terla
timutiimuti,sih chulsan sen vanila latte
timutiimuti,salah fokus kulit laptop dos sadar tumpu stiker
timutiimuti,coba resep bubur koko kuliner bubur saudara laki dudung langkah sih koko
timutiimuti,oke kak shopeenya paris parfum resmi
timutiimuti,pikir jajan grosir bantu pacar jual qill tawa coba rusak deh
timutiimuti,iya mbak gantung usaha ngamen seengg
timutiimuti,tawa mbak terkadang polos logis zakat oke
timutiimuti,blak an iya mbak tawa pikir ngedume
timutiimuti,wokee marr terima kasih sarannyaa
timutiimuti,temu drama korea tawa
timutiimuti,tawa jipyeong contoh malu
timutiimuti,tawa least direndahin dulunya susah
timutiimuti,chairul tanjung loh indonesia sih kayaknya
timutiimuti,pilih tengah cari mapan hidup susah han ji pyeong tawa
timutiimuti,tawa baa samo wak eh
timutiimuti,tawa tetangga rumah bagus pensiun pacar ngoper
timutiimuti,malamehan saudara heran rumah tetangga percaya biadab
timutiimuti,iya pujj suka banget kompleks rumah rumah
timutiimuti,saran bagus marr terimakasih masukannyaa omong omong mengaku panti asuh bagus rusak huehe
timutiimuti,tolak titik bilang ayah bohong ges looping bilang ayah
timutiimuti,fisik maaf pilih tahan hidup jual sesuai kem
timutiimuti,eh modal jual ayah teriak kasiko saudara rumah apak
timutiimuti,malas merespons pagi ua
timutiimuti,rumah jarang sih minggu pintu
timutiimuti,acak kenal rumah kasih uang
timutiimuti,yaallah innalillahi whatsapp inna ilaihi rojiun
timutiimuti,whoaa waktu rumah dijadikan teduh tebang
timutiimuti,iya pann minggu hujan minggu hujan
timutiimuti,hujann tawa
timutiimuti,iya sesak kak
timutiimuti,suntuk rumah pokok sebentar sakit motor keliling pir belanja aciak al
timutiimuti,jail pandu instagram tawa mengetik lebar tinggal cemil bentar kesave tulis hikss
timutiimuti,iya ngee bagikan via fleete generatenya link spotify sih malu kayaknya sih
timutiimuti,irham kodein purin tuh tawa
timutiimuti,ngescreenshot selai angka cantik tawa
timutiimuti,mantap dumss
timutiimuti,hoalaa ngajuk kayaknya kota
timutiimuti,jann tawa
timutiimuti,tawa mantul tren
timutiimuti,tawa kemarin naruh udara botol
timutiimuti,malu terima kasih ngeek
timutiimuti,busett kejam wkwkwkkw
timutiimuti,sih lawan malas ngecommit tawa
timutiimuti,upgrade workspace hidupin daftar putar starbucks youtube jalan ninjaku nongki ruma
timutiimuti,baiqla padang rutin gempa naruh sumber kode tesis github
timutiimuti,kriteria calon mantu idam ngee hidup tawa
timutiimuti,padang tawa masak mlg
timutiimuti,tipikal gadis realistis saha
timutiimuti,tawa halmeoni nenek dalmi pikk
timutiimuti,parah yola halmeoni bilang biadab
timutiimuti,tawa dos aji selagi porsi sengsara tim halmeoni
timutiimuti,tawa sehat igtv kak kayaknya episode nont
timutiimuti,least hanjip lega nyatain dalmi ikhlas
timutiimuti,startup dana investor gagal hacking kantor chulsan memutuskan bunuh
timutiimuti,rencana putar prolog episode hasil padu analisis iman usman zahid tebak iman usman sih ayo
timutiimuti,suka nolaknya sih saha tawa elegan etik independen wanita
timutiimuti,episode refleks pukpukin jipyeong sesak posisi pacar pukpuk online
timutiimuti,ridd tawa dos paham deep ajar
timutiimuti,jnt dabes ngirimin lauk jnt periksa bongkar
timutiimuti,tawa iya paham istilah mertua
timutiimuti,kodingan jebak ken seo dal mie tolong nam san tawa
timutiimuti,ken model rambut yoona tawa
timutiimuti,tawa penasaran mone bilang uju
timutiimuti,susu korea bentuk bubuk si
timutiimuti,habis neriakin sahut saudara laki kurir panggil panggil responsif kayaknya
timutiimuti,gonta ganti posisi barang kamar bayang
timutiimuti,twitter tolong milik sihir teman teman bantu bantu bagikan rt tweet teman hilang
timutiimuti,tawa alami
timutiimuti,juang dal mie cari investor aware skala saudara
timutiimuti,terimakasih infonyaa alternatif tmp streaming malu
timutiimuti,kapal dodal realistis alur tawa saudara wanita episode dalmi han
timutiimuti,netflix sih tawa buka halaman startup episode tawa
timutiimuti,cari episode utama halaman streamingnya muncul jail edit manual urlnya eh non
timutiimuti,kayaknya san cocok tipikal gadis peka ngee tawa jipyeong peka
timutiimuti,si racun
timutiimuti,kadang sarkasme bragging rendah beda
timutiimuti,warga dijadikan ftv escetepe nyala video
timutiimuti,dengar daftar putar korean kopi toko makeover kamar kafe suasana tertawa jiwa rumah rebah dasar
timutiimuti,tiri menang injae nunjuk anak kandung ceo alam pagi kor
timutiimuti,tawa setujuu kayaknya nada startup episode
timutiimuti,ngee juang darah miris kantor samsan tech saudara
timutiimuti,ehehehe promosiinnya sih naa bilang
timutiimuti,bisnis pov hadirin naikin interaksi presenter hadirin copywritingny
timutiimuti,teliti pov jelasin latar paham awam kontribusi usulann
timutiimuti,presentasi seo dalmi episode keren tepuk tangan tonton ulas presentasi
timutiimuti,episode gantung ulas episode ambyar jiwa tahan penasaran
timutiimuti,informasi konten saudara wanita dicatat sih parenting diterapin tua
timutiimuti,prinsip hidup kenal salah berani nolak
timutiimuti,kecill
timutiimuti,kejut padang zona oren gara maps kota padang kasih warna kuning
timutiimuti,kadang coba mengerti orgnya mengerti mengerti
timutiimuti,kejut beda tahun bias harap tawa halusinasi tingkat
timutiimuti,tawa pakai jeans oke sih aneh bawa jalan tawa
timutiimuti,setuju tawwaf itb bosan
timutiimuti,tawa hormat makenya
timutiimuti,tawa celana saudara kulot kulot dukung testing
timutiimuti,bukik ribut diss tawa mutia yarsi mutia bilang pakai piyama tawa
timutiimuti,rekomendasi tubuh pijat pdg niss tawa
timutiimuti,realita pakai dasi warna bentuk piyama pakai
timutiimuti,poni takut sebentar dahi bruntusan
timutiimuti,psbb eidds bandara buka tawa
timutiimuti,tawa iyanih bedd sungkem online kakanyaa
timutiimuti,monang tawa kemarin backup data cepat dik
timutiimuti,yaallah diinstall ulang data dibackup saudara laki servisnyaa sadar
timutiimuti,tasya revina menghujat saudara wanita
timutiimuti,tawa jaman kenal tiktok
timutiimuti,tawa salah buah manfaat
timutiimuti,bodoh backup gung tawa
timutiimuti,untung alam igung tawa guru temu
timutiimuti,ulang tawa alhamdulillah backupnya lengkap
timutiimuti,iya gungg untung cadang
timutiimuti,tawa siapp terimakasih saran saudara laki perbackupan
timutiimuti,bas naruh github tawa parah sih
timutiimuti,tolong gung helpp
timutiimuti,gungg yolls brainstorming tawa
timutiimuti,tawa informasi lengkap sih penn
timutiimuti,monangg kodingan tesis hilang gara pasang ulang oke backingan drive
timutiimuti,indah rsud daftar putar
timutiimuti,pindah negara
timutiimuti,sih tugas sekolah digoogling hpku kentank data seluler an tawa
timutiimuti,memakai sih waktu sekolah pikir googling sih
timutiimuti,oke
timutiimuti,urus kait komitmen janji hitam putih
timutiimuti,pakai masker kain sungg jerawat parah gara masker medis chemical ingredientsnyaa
timutiimuti,humor batas nenek bilang solat gara
timutiimuti,desa sehat belanja jalan kaki padang pakai motor iya jalan panash
timutiimuti,oktober desember teransos utama media sosial gara fokus tugas gaya benera
timutiimuti,gadis waktu butuh hitam janda
timutiimuti,tunggu duet tiktok puan mahal hormat
timutiimuti,dibalikin misuh jawa kebayangngomongnyapakeaksenmedok
timutiimuti,terima kasih benny terima kasih wakil suara rakyat usaha lawan suara suara kawan
timutiimuti,tolak
timutiimuti,batal
timutiimuti,dom harga ribu kak
timutiimuti,haloo sendernyaa tawa berani teman
timutiimuti,tawa botol murah jual segituu
timutiimuti,haloo dimasuki botol omong omong susu
timutiimuti,pimpin nan mulia deret angka angka korban pandemi angka anggur angka mie
timutiimuti,alhamdulillah tuhan tutuik kada
timutiimuti,ciek tambuah sapuluah
timutiimuti,edisi rumah cemil padang
timutiimuti,susah bilang banting
timutiimuti,insyaallah aman ntee utama permainan pakai komunikasi
timutiimuti,iyasih ngee tawa sepeda
timutiimuti,taragak sepeda bukit apit lapang kantin heuu
timutiimuti,iya rezz omong omong kepel rez
timutiimuti,tes padang rez gratis
timutiimuti,andai juta masyarakat indonesia celup saudara wanita nana bicara kursi kosong tawa
timutiimuti,lkomsel buka integraa
timutiimuti,tikus
timutiimuti,dideact ngee
timutiimuti,pikir waktu paksa sih kadang teman lucu hairstyleny
timutiimuti,suruh pakai jilbab roo tawa diam lepas pasang lepas pasang
timutiimuti,yukyukk cemil baso aci
timutiimuti,sabtu sabtu rip libur
timutiimuti,batal
timutiimuti,tangis surabaya
timutiimuti,area kayoon cc
timutiimuti,suasana hati dorong sih selai kasih sop ilerr keos
timutiimuti,isolasi mandiri
timutiimuti,nawaitu begadang dispill cerita horor pikir
timutiimuti,lagu lemon pohon diplay waktu kelas les joko viral tiktok gara among
timutiimuti,susah iya nerapin surat al alaq dasar egois
timutiimuti,hindar angsa jalan utama pacman
timutiimuti,diss tawa
timutiimuti,admin feenya ambil sekian persen harga produk sih cuannya fikk si
timutiimuti,pilih sisi sellernya uang tawa
timutiimuti,sindir teman pakai istilah adarusa tawa
timutiimuti,sedih
timutiimuti,grup whatsapp pyurr tawa
timutiimuti,pilih online pribadi codenya marr
timutiimuti,server
timutiimuti,orientasi studi pengenalan kampus bentak orientasi studi pengenalan kampus minecraft
timutiimuti,ngee cemil tawa
timutiimuti,habis bakar kalori keliling cari tmp cetak terbit bakso bakar bakso flavornya gaku
timutiimuti,google pakai masker
timutiimuti,ketrampilan angkat galon dispenser hilang
timutiimuti,latih mental ketidakamanan tawa
timutiimuti,super waktu rumah selai pakai ootd kuliah masker faceshield sih
timutiimuti,safeflight ntee
timutiimuti,corona dekett semoga psbb jakarta ringan kerj
timutiimuti,pasang hazmat tular tenyata ditest pasien positif tenaga medis kendi
timutiimuti,hazmat pasien corona cerita waktu tenaga medis lengah misi
timutiimuti,posisi bukittinggi hawa dingin pakai ac rumah sakit
timutiimuti,rem euy dengar alam etek tenaga medis igd memakai hazmat apd bayangkan
timutiimuti,pagi mimpi bukittinggi berkumpul bareng ciwi bubay pantai iya bukittinggi pantai eh sakit
timutiimuti,eh thinkingnya huruf
timutiimuti,ngepost accepted konferensi linkedin sih unggah status whatsapp positif thingking mungk
timutiimuti,tawa waktu bannernya atur laporin bedd
timutiimuti,tawa satpas sim atur ktp asli eh
timutiimuti,naruh wishlish belanja keranjang bookmarks google chrome
timutiimuti,pandemi gembira buka shopee kecuali beli barang pakai beli barang titip
timutiimuti,yuhu ridd html outputnya estetik gantung ngaturnya puas tawa
timutiimuti,iya ridd html dasar ridd ajar seru tuh
timutiimuti,ajar html ridd java naskah sederhana waktu kuliah ajar sekolah sih tawa
timutiimuti,tjakepp solved tawa
timutiimuti,cnn dek omong omong tawa
timutiimuti,pusing mengurus skck tawa
timutiimuti,syedapnyee
timutiimuti,normal normal normal sih pasar lalang pakai masker
timutiimuti,tawa iya eii waktu kos addict sehat makan suka susu kedelai pria
timutiimuti,yuhuu sann
timutiimuti,video konferensi video gagal tawa
timutiimuti,kayaknya gemayy deh cardnyaa
timutiimuti,mantap ridd sukses dagangannyaa insyaallah lakuu
timutiimuti,baju nlc
timutiimuti,copywriting utas sann tiktok andri sadipa contoh
timutiimuti,ajar copywriting sembunyi selling techniques coba terbaik laksana tolong maju
timutiimuti,tawa wokee syiap sungg
timutiimuti,lempar ken iya sann samping tawa
timutiimuti,besok subuh toilet setor kayaknya ngee tawa
timutiimuti,whoaa sungg
timutiimuti,cemilan sakit bakso brownies kolak pisang perut raba bilang oh gendut
timutiimuti,marr tawa tiktoknya bella poarch duet nongol fypku tawa
timutiimuti,racun soph aspin kirim tawa
timutiimuti,dinding hidung kelupas rizz tawa
timutiimuti,menikah abgmu sungg
timutiimuti,tesis progres saudara wanita tawa
timutiimuti,pilih muka lucu kah tawa
timutiimuti,kendur belaga an rajin
timutiimuti,siss kertas pkpl tawa
timutiimuti,korean name permainan facebook dipakai jail ketik keyboard
timutiimuti,sila diss utama pdg tawa
timutiimuti,cerita rumah ayah bareng beda pulang
timutiimuti,tawa paraparaa
timutiimuti,solat sopan gempa kencang smooth
timutiimuti,rindu jull hiyaa tawa
timutiimuti,amin yaallah semoga nyusull
timutiimuti,eh waitt selubung tawa
timutiimuti,jual shopeenya ayo pann
timutiimuti,iya jann tahun
timutiimuti,iya naa alhamdulillah malu
timutiimuti,shopee minimum gratis ongkirnya diturunin dumss tawa
timutiimuti,salah fokus angka nama filenya cantik
timutiimuti,malam mimpi cekek hidup mati ken ngucap syahadat pikir
timutiimuti,juang piknik ala pangkas rumput taman manual alhasil lutut gel
timutiimuti,pukpuk napii semoga iya pikk eh tawa
timutiimuti,alhamdulillah fikk
timutiimuti,status whatsapp teman kantor rindu rindu ketemu clientnya sih rindu nikmat jalan
timutiimuti,belah kiri berisik biadab
timutiimuti,hikmah telkomsel area sumatra terimakasih informasi tiqq
timutiimuti,hansaplast menutupi gelang tangan lebar gelang tangan hansaplast
timutiimuti,tawa ongkos kirim gojek uang jajan waktu
timutiimuti,pikir uang jajan kids jaman iya
timutiimuti,eh link
timutiimuti,haloo sendernyaa kemas ganti harga isi
timutiimuti,pinn dosen mutia tawa
timutiimuti,sikolah nio titip obrolan tawa
timutiimuti,alhamdulillah beli kemarin donasi terimakasih pesan donasi
timutiimuti,tawa oke bas selamat juang
timutiimuti,konten pasang yeaji jelajah instagram ngelike otomatis muncul bas
timutiimuti,gara ulya semangat dinyanyikan bayi hiu bayi hiu hiu hiu grandma hiu grandpa hiu
timutiimuti,monmaap nastar lebaran diincer nyisa
timutiimuti,tawa ancak buek bana goklin
timutiimuti,dikasitau iya tawa tuh
timutiimuti,insyaallah beli donasi saudara lebanon po besok beli
timutiimuti,gara lupa sih
timutiimuti,korban threadnya universitas
timutiimuti,amin semoga mudah usul mitt
timutiimuti,paragraf jelasin paragraf teliti kait solusi mitt
timutiimuti,yaallah area kos surabaya
timutiimuti,komentar dipikian tawa
timutiimuti,terkait wanita gaya jilbab pamer dahi cantik tingkat persen
timutiimuti,pasar ketemu gila sodok pantat waktu jaman tpa merinding hih
timutiimuti,buah rumah cemil konsep outdoor sedia galon galon belah kanan tulis udara minum bela
timutiimuti,iya ngee tangis pelan motor
timutiimuti,pakai indih skuyy tawa
timutiimuti,celaka rel kereta api jalur miring
timutiimuti,yoii tawa
timutiimuti,waktu temu proyek manajer saudara laki pdg ditanyain internetnya informasi
timutiimuti,jas osis smansa lepas logo pakai sidang
timutiimuti,tawa panggil chingu chagiya
timutiimuti,tawa
timutiimuti,eomma tawa
timutiimuti,sedii dengar kabar makju agustus jaga kos
timutiimuti,ayo cus pesan
timutiimuti,bukann saus caramelnya gula aren si
timutiimuti,cerita habis webinar dimasuki grup ppt presentasi obrolan grup buka buka
timutiimuti,iya mbak stnkku nama pakai nama milik sebelumnyaa tangis
timutiimuti,mengurus stnk tahun terlambat tahun minjem ktp
timutiimuti,profesi tawa untung minus iya rivv
timutiimuti,ohya sadar
timutiimuti,profesi bau sah tawa
timutiimuti,sefruit salah minum kopi malam tidur
timutiimuti,habis menikah saudara pdg surabaya bawa rendang diabisin teman ph tawa
timutiimuti,sial harga untung sisa tengah
timutiimuti,gila oat madu pisang kantuk kelas pagi kenyang siang coba sarapa
timutiimuti,iya pil tawa tahun belah
timutiimuti,tahun kemarin tes kampus tawa
timutiimuti,tim jihoo gara suka rambut gu jun pyo tawa rambut keriting tim gu jun pyo
timutiimuti,tawa ikuiklah dis wakil hati sakit
timutiimuti,nikmat lagu siti nurhaliza sedih lagu diremix video debat cewek
timutiimuti,keceknyo rabuik namonyo tawa
timutiimuti,andrea
timutiimuti,bagus alur maju mundur kilas cerita rela
timutiimuti,balas tarung
timutiimuti,rumah jalan pacu sinyal pusing mobil relaxa selamat
timutiimuti,sehat ridd tawa
timutiimuti,baju ala bawa pulang baju pakai pulang kemeja seminar proposal online baju lebaran po
timutiimuti,nasib pulang kemarin bawa baju ala pergi bingung saking dikit baju pergi rumah
timutiimuti,panggil ibadah poo lapar
timutiimuti,tunggul hitam maju tawa syin
timutiimuti,mie ayam jember harga oke
timutiimuti,yoklah putar tawa
timutiimuti,beda iko diagiah saudara kado awet semoga pahala ikuik batam
timutiimuti,kado sidang partikel kado baca pita bungkus buket bunga kumanfaatin hias kado
timutiimuti,yuk jalan
timutiimuti,kirim ciekk
timutiimuti,tonton kemarin kopi
timutiimuti,jaehak karisma wkwm
timutiimuti,rumah pantai goals rumah penuh rumah bangun pdg jiper
timutiimuti,coba wilgoz si resep
timutiimuti,bbf mimpi tinggi ttby hosplay
timutiimuti,formnya saudara tinggal tawa
timutiimuti,mupengnya ulya lucu kasih tawa ontinya salah pamer cemil cemil suka tawa
timutiimuti,bubur ayam saudara laki dudung sih gass
timutiimuti,tawa pantau taruih tunggu gosip ribut gosip anak ketek ancak tuh
timutiimuti,lambe turah anak kicik lu
timutiimuti,tawa akun iya difollow
timutiimuti,bicara jijik tawa candasay
timutiimuti,accnya saudara laki instagram mutualan
timutiimuti,iyanih dosa bayar pakai denda tawa
timutiimuti,ken ganti ukhti ngeri ganti tawa
timutiimuti,otomatis pajak motor terlambat tahun
timutiimuti,jalan kertajaya euy tawa
timutiimuti,lee admin ho psj
timutiimuti,gara status whatsapp tawa coba besok ganti
timutiimuti,dakek rumah
timutiimuti,omong omong direktur saudara laki muka buibu jual bakar putih rintis tawa pacar sej
timutiimuti,ngeship tawa semoga mobil detektif oh layar
timutiimuti,khatam tonton itaewon kelas tawa sih selesai gara wifi ccd
timutiimuti,tawa instagram direpost
timutiimuti,tawa tweetku diretweet saudara andien kayaknya twitter artis selebgram ramah deh
timutiimuti,tawa pikir
timutiimuti,gabung menikmati cemil tonton mukbang
timutiimuti,jilbab nahda suasana ruang ajk
timutiimuti,tawa riz jilat ludah
timutiimuti,riz bantu edit kertas tawa
timutiimuti,layouting temu kertas halaman tabel bentuk gambar
timutiimuti,ekspresi kamar temu
timutiimuti,huahaha syiap sel cemil mie ayam
timutiimuti,iya sel tawa acar timun cabai rawit sih cemil pasang mie ayam sawi tawa
timutiimuti,surabaya sayur acar sel sumpah sadar tawa
timutiimuti,kdm humor anjlok taman saesungjae saeuju saerupin saeripin saerucing
timutiimuti,sisi admin akun instagram ayah tawa
timutiimuti,weightlifting peri kim bok joo tarung kuat wanita bong sekolah sih eii tawa
timutiimuti,resepnyo tuh
timutiimuti,selagi ribut bos epan insyaallah aman pinn tawa
timutiimuti,rooftop pangeran gara ngeracunin teman tonton waktu bekas bahan tonton bar
timutiimuti,maps jarak tmp sewa jip tawa sesak syekalii
timutiimuti,habis bromo kemarin singgah kesini
timutiimuti,mienya yayy ayam gara mutia bumbu tawa
timutiimuti,pagi pikir ken bisnis jual mie gaco tawa mie gaco pdg mie
timutiimuti,sila cerita qaqaa
timutiimuti,ambil nunjukin jalur rumah jalan ngasitau jalan jalur merah sih
timutiimuti,senang fakta saudara tawa setuju
timutiimuti,tawa senja ramai
timutiimuti,timingnyo pin tawa ancak comeback senja
timutiimuti,waa judul lagu bedd terimakasih informasi bedd malu
timutiimuti,kece bendung tawa bagus utama drum kece tawa
timutiimuti,sih tawa
timutiimuti,hoalaa area jalur batas kota iya tawa
timutiimuti,indomaret saudara tawa
timutiimuti,aman
timutiimuti,mobil goyang reii pasar santai ragu gempa tawa
timutiimuti,nasi goreng sih krupuknya dijadikan sendok cemil bareng nasi nasi uduk bubur ayam
timutiimuti,iya yarr tawa kuah sate cemil krupuk
timutiimuti,salah ketik yar ngehighlight kuah sate padang malu
timutiimuti,lkmw ding salah ketik
timutiimuti,kuah sate padang kaleng tawa dibandingin jual waktu lkmm mahasiswa tidur
timutiimuti,tawa santai null
timutiimuti,tweet tawa
timutiimuti,parah buram rumah tawa
timutiimuti,tweet pujj iyasih sudut pandang beda anggep negatif  hak istimewa
timutiimuti,puj tawa tweetnya nambahin sukses  hak istimewa
timutiimuti,otak beliau cerdas beliau manfaat  hak istimewa  hak istimewa
timutiimuti, hak istimewa wajar disalahin sih film habibie ainun eyang habibie waktu muda bilang
timutiimuti,terlambat gabung tawa tonton daftar harga cari tonton
timutiimuti,jail googling harga putra iya jin gara channet youtube jatuh pingsan cuplik pacar saudara
timutiimuti,es rumput laut campur eskrim mantulita babanero
timutiimuti,muka anak hilang bel tawa
timutiimuti,indonesia saudara laki dek tawa
timutiimuti,kudenger bicara mie ketawa tawa
timutiimuti,fikk tawa pesan iya fikk malu
timutiimuti,gelap cerita tiktok kamar mandi bayang lagu
timutiimuti,bom bom
timutiimuti,iya pujj si kontribusi teliti golong minor si tuntut nem
timutiimuti,si pujj fokus teliti
timutiimuti,problematika anak tawa
timutiimuti,pronunciationnya jowonya tok tawa
timutiimuti,responsif gadis saudara laki bagus tawa
timutiimuti,takut cuy selai gadang ramai
timutiimuti,tahun jalan kuliah si daftar gelisah kuliah gelisah cari metode
timutiimuti,rakum tok tawa
timutiimuti,tawa lumayan diskon ilegal
timutiimuti,sembunyi kursi mobil bayar tiket tawa
timutiimuti,iya saudara laki tawa istilah sains kompatibel indonesia
timutiimuti,pura pura suka rez
timutiimuti,hadeu mbak berat salah iya mbak
timutiimuti,eh kaca deh ulas kertas biomedik hasil terjemah wwo optimisasi gelombang udara dibenerin
timutiimuti,rada gemas temu referensi google polos terjemah periksa baca hancur
timutiimuti,kenal komunikasi bagus sih null
timutiimuti,tidaak dosbingku non huehe
timutiimuti,saudara jarjit singh
timutiimuti,keluyur jalan jalan mal berkumpul bareng teman teman mampir http
