username,tweet
timutiimuti,setidaknyo mamasoan daripado medok korea eh
timutiimuti,ketik komentar sih gantung suasana hati tulis ketik tawa
timutiimuti,tawa ribut sobok kato saudara laki nyambuang jo logat korea tanotis lupo
timutiimuti,iyanih pikir ngerekam cuy tawa gara harap buah tawa waktu
timutiimuti,indonesia sabar iya saudara laki saba ayo pakai logat saudara laki kokoreaan
timutiimuti,rajin pintar
timutiimuti,kadang ngeblank kumat bimbing takut lupa nginget tulis cakap konsul
timutiimuti,tukang paket kos ngegas tawa
timutiimuti,bodoh pelihara naa
timutiimuti,definisi ajining ing lathi
timutiimuti,fess
timutiimuti,kawan kebal sumber drg irvanda mulyaningsih olahraga instagram izin bagikan iya genggis
timutiimuti,wahwah gosip umum saudara laki saudara mengomongnya tawa
timutiimuti,tawa rebah pikir revisi
timutiimuti,saudara laki tawa
timutiimuti,kutida lebaran rusak revisi tawa
timutiimuti,mantan uji ndredeg pyurr tawa
timutiimuti,revisi
timutiimuti,garis teman bimbing ayo besok habis kelas konsul revisi nyentuh revisi
timutiimuti,tutup dikabarin puj tawa yasudalah
timutiimuti,salah saudara laki kreatif
timutiimuti,sen ganti nan lamo diantar iko gantinyo
timutiimuti,putus kopi ganti tidur selai es durian jalan semoga rumah cair deh tawa
timutiimuti,sehat konsumsi yonn
timutiimuti,dilema ken ngegrabfood es durian kopi
timutiimuti,terkait sinema elektronik indosiar titik rsnya tawa orkay rawat ruang vip
timutiimuti,tulah bantu rumah
timutiimuti,dikabarin nih tawa
timutiimuti,ambyar
timutiimuti,yoi pil tawa omong omong syemangat seminar minggu depann
timutiimuti,kilas suami isyana lee tae oh jaman sih tawa
timutiimuti,dedlen rajin edit video tawa
timutiimuti,video bantu rumah tangga eii tawa idam banget
timutiimuti,kim gelandang tawa
timutiimuti,suka kpop tawa
timutiimuti,ngesave sayang pakai tulis hangul tawa
timutiimuti,santai tugas susah tawa
timutiimuti,kantor naa tawa
timutiimuti,penyet nama kol pil tawa nama tawa
timutiimuti,alhamdulillah pil
timutiimuti,selesai bangun candi terbit drama korea tumpuk
timutiimuti,temu komentar yotube paman dedi tirta tulis keren
timutiimuti,ganti laptop
timutiimuti,rindu nongki mcd siang ramadhan pacar tawa
timutiimuti,betull syekalii difermentasiin tawa
timutiimuti,dunnolah yonn tawa lobak sungguh jarang jual kol akrab diblg lobak tawa
timutiimuti,padang nama lobak
timutiimuti,lambuang kuciang tuhan kebal tawa
timutiimuti,ampun sentil pakar perkochengan tawa
timutiimuti,tawa iya editor tawa iya kak mulan kundang peleset malin kundang tawa
timutiimuti,pikir mitt begadang
timutiimuti,yoii beban hidup tidur tawa ngalamin
timutiimuti,instagram pengirim
timutiimuti,cepat lelah mudah gila
timutiimuti,menang juara tawa dispill inge nama janer su
timutiimuti,tawa iya sungg video lomba ciri tawa
timutiimuti,tugas sih puyy video lomba tawa
timutiimuti,tawa wajah ngeek
timutiimuti,hubung kerudung video dipost intro iya ges footage lucu
timutiimuti,throwback editing video tawa edited modal film kenal adobe premi
timutiimuti,gara penasaran guru indonesia kelas semester bongkar aju tugas cari nama beliau eh
timutiimuti,kentank iya mit tawa
timutiimuti,tawa terkait iya cakk
timutiimuti,tarawih sahur bareng keluarga tahun alhamdulillah tahun
timutiimuti,tawa episode gara memenya nongol beranda tawa adegan canda sedih
timutiimuti,iya tangis tonton film sedih nang tonton cloy episode ambyar
timutiimuti,tunggu kabar mbak tawa
timutiimuti,lebar an lebaran sayang tawa
timutiimuti,iya dek lamun ombak pergi nasional sederhana tawa pikir coba nasi kapau
timutiimuti,tawa betull suka simpang raya sederhana lamun ombak kenal nila sih saudara laki tawa
timutiimuti,sebentar saing ayam jazz yogyakarta sub tawa
timutiimuti,iya rajin rawat kulit an jerawat muncul
timutiimuti,richeese asli arang dijadikan ayam indie qil warna kopi senja
timutiimuti,warna suci ayam pop simpang raya kasih nama ayam batu
timutiimuti,dasar netijen tawa
timutiimuti,tawa saudara wanita pelakornya mahir iya tawa
timutiimuti,berat coba antagonis iya tawa
timutiimuti,saudara laki saudara laki drama korea wkwkkwk
timutiimuti,cocok tanam
timutiimuti,tawa semangat gess
timutiimuti,upil nyante drama korea tawa
timutiimuti,mimpi putar libur menikah teman tengah wabah mimpi
timutiimuti,ngee tawa ngeralate pelakornya mulan tonton ngee
timutiimuti,pelakornya anggota dpr iya ngee tertawa
timutiimuti,tonton balas yoll tawa
timutiimuti,sial
timutiimuti,tawa jarang buka telepon jann
timutiimuti,mantul beterai telepon subuh
timutiimuti,untung kuliah online dosen mahasiswa kompak hidupin video tawa
timutiimuti,seblak versi tteokbokki tawa
timutiimuti,karbohidrat dlmnya tawa
timutiimuti,batal
timutiimuti,rawat kulit lapis malam goo hye matahari jaman bbf
timutiimuti,weeh mantaapp mutia garansi umur hidup terima kasih informasi yayy
timutiimuti,tawa ganti bawa bukti beli yayy
timutiimuti,tawa tok saudara laki belikan tawa
timutiimuti,bawa bukti beli iya dhil
timutiimuti,whoaa ganti tutup dhil
timutiimuti,tupperware hilang tutup tupperware patah untung marah
timutiimuti,tahun muda umur euyy
timutiimuti,wakakak woke megg fallaw baliqq
timutiimuti,tawa eh lupaa igku mutiard megg
timutiimuti,buna panutan tawa omong omong mutualan instagram iya megg tawa
timutiimuti,tonton sinema elektronik selingkuh dunia dengar selingkuh cerai
timutiimuti,rachel vennya deh tawa
timutiimuti,tawa okede tambahkan wishlist deh
timutiimuti,viral iya drakornya tawa itaewon kelas tonton
timutiimuti,betapa garis temu pisah tipis setip batas waktu
timutiimuti,tahun cinta waktu tunggu pintu buka persa
timutiimuti,belaga deactive
timutiimuti,instastory abel piknik keluarga rumah wawas gazeboan taman belah rumah tawa
timutiimuti,beli tanah pdg eii tawa bangun rumah
timutiimuti,gara berita muncul poin pacar tawa kasih dibully mental rusa gara
timutiimuti,tonton cloy pyurr sebentar sedih kecepetan selesai tawa
timutiimuti,tawa
timutiimuti,isolasi yonn
timutiimuti,sayang naa tertawa jemur sakit naa
timutiimuti,kaca broo tawa situ alam
timutiimuti,dikirimin link zoom temu via kendur selai notifnya selai eh
timutiimuti,sih suka riz tawa suka
timutiimuti,nan pacar percaya wkwkk
timutiimuti,beda konteks rizz suka serius tawa realistis foto
timutiimuti,jemur menit belang parah naudzu iya wajar sih suhu gelar
timutiimuti,dekati dar suka sih nama ngegebet tawa
timutiimuti,koto tangah positif yaallah
timutiimuti,paket smartfren youtube xl netflix tawa
timutiimuti,pukpuk
timutiimuti,rumah wifi beli xl gb nad tawa
timutiimuti,ngeplay musik joox pakai daftar putar gaji semangat wfhnya habis gaji
timutiimuti,wkwwk nunggunya okedee sebentar coba terimakasih informasi naad ehe
timutiimuti,nama anak beliau yug tawa
timutiimuti,yuhuu mangats naa
timutiimuti,lupa sisih uang thr tawa
timutiimuti,wkkwkw lapor tinggi naa iya naa alhamdulillah
timutiimuti,iya mak area jangkit ngelapor minimal rt
timutiimuti,tawa sih mitt semoga salah data aulia tawa
timutiimuti,iya damm pantau
timutiimuti,tawa iya mitt ngasitau nama
timutiimuti,tawa periksa suhu tubuh sebentar lapor dinkes mak
timutiimuti,suhu termometer nad nadd tunggu suhu termometer muncul tawa kiri
timutiimuti,semoga salah data heuheu
timutiimuti,taragak es durian
timutiimuti,kemarin chatan nama ubah
timutiimuti,periksa suhu tubuh mandiri jepitin termometer ketiak kiri ketiak kanan
timutiimuti,tawa kreatif cel
timutiimuti,sosoan noob menari mahir heuu
timutiimuti,pulang fikk
timutiimuti,drama isolationnya
timutiimuti,eksekusi reii tawa ijab kabul online
timutiimuti,subhanallah alhamdulillah allahuakbar
timutiimuti,ayo marr zumba online tawa
timutiimuti,sial tawa rentang dibb
timutiimuti,tawa maleh tadanga kalua beko
timutiimuti,tawa syikat sungg
timutiimuti,coba zumba bugar selai lelah kelas tubuh tempur tugas
timutiimuti,dijadikan canda nangess
timutiimuti,tawa kasih baku hantam sung cetus
timutiimuti,tawa monggo lanjutkan qoo pastiin teriak droplets iya qoo tawa
timutiimuti,tawa aqil challengenya bel
timutiimuti,isolasi tawa hormat qoo tegar kamar tertawa omong omong
timutiimuti,tawa sih kasih diantar
timutiimuti,tawa sungg nikmat tawa
timutiimuti,tawa ketik jelajah twitter besok sebentar ketemu
timutiimuti,tawa bilang bagus saudara laki
timutiimuti,kamar qoo wkwkwkkw
timutiimuti,cegah mudah sih makan instagram wkwkwkk
timutiimuti,eh bilang prima iya tawa yaampun lupa sinn
timutiimuti,yoyo
timutiimuti,karantina habis zumba terbit lontong gulai
timutiimuti,iya nadd kamis
timutiimuti,sumatera bicara konteks selesai jawa bicara kontek
timutiimuti,mutia sedih
timutiimuti,ayo zumba online tawa
timutiimuti,bilang ganjil bilang prima renti tolong
timutiimuti,tawa berat sih selamat menjalani kak lapor dinkes padang via whatsapp
timutiimuti,kemarin nadd tawa tangis berat sih menjalani selamat tawa
timutiimuti,iya naad kamar jemur baju kemarin pakai kamar tawa
timutiimuti,baku hantam bakso geprek cemil pil tawa
timutiimuti,karantina cemil diantar tawa kamar piring sih
timutiimuti,deadliner suasana tawa
timutiimuti,surabaya ubah redzone positif perbarui an
timutiimuti,si alas pulang protokol kampus menjalani protokol versi
timutiimuti,si karantina april tahun least menikmati sahur buka bareng keluarga
timutiimuti,definisi anak durhaka ketemu tua peluk teletubbies
timutiimuti,saking randomnya masak nasi goreng pakai sawi putih masak tumis sawi putih udang numi
timutiimuti,diam rumah impi medis juang tangan pasien diam rumah dite
timutiimuti,deh
timutiimuti,iya
timutiimuti,kalender akademik gaar mei
timutiimuti,lockdown semester
timutiimuti,wacana
timutiimuti,iya saudara laki tawa
timutiimuti,parah maspip
timutiimuti,lockdown semester
timutiimuti,iya tawa tawa ceribel geprek tape lain-lain tawa
timutiimuti,tawa peleset chef iya ro tawa
timutiimuti,ganti pakai madu coklat gula turr tawa
timutiimuti,tanda suruh konsumsi gula tawa
timutiimuti,bebb
timutiimuti,batal
timutiimuti,kemarin testing massal corona logika ajar negara angka tajam
timutiimuti,jatuh darat nyala reii wajib tonton tuh tawa
timutiimuti,gara video tonton drakornya tawa euyy sedih tawa
timutiimuti,yuhuu rumah ndell
timutiimuti,tawa enggalah ndell takut virus bawa sebentar
timutiimuti,tawa kabar wfhmu ndell
timutiimuti,efek weeks karantina tawa
timutiimuti,jatuh darat nyala
timutiimuti,ayah duta zoom awan temu
timutiimuti,tawa episode nih
timutiimuti,afternya qaa ramai tawa
timutiimuti,hoalaa tawa kosong aman iya hann
timutiimuti,jalan han sepi tawa nih
timutiimuti,kak sesak wisprilnya ganti mesti gabung wisjul coba
timutiimuti,eii tua rentan virus
timutiimuti,inisiator ngurangin sebar virus langkah potensi selamat dunia
timutiimuti,ayo baca ajar italy jujur ngeyel pulang ken tes corona tahan ort
timutiimuti,tawa syiaap syin
timutiimuti,bucinnya tawa
timutiimuti,tawa tenkyu pilss chilling jenak
timutiimuti,drama korea sayang tawa
timutiimuti,nimbun cari uang tawa
timutiimuti,efek budak cinta jatuh darat nyala
timutiimuti,untung ramai tawa
timutiimuti,keluarga corona kerabat corona sayang corona semoga
timutiimuti,daritadi hidung gatal garuk hidung pakai tisu selamat
timutiimuti,kacao
timutiimuti,ayam diungkep pendam
timutiimuti,makhluk super higienis tawa
timutiimuti,libur minggu suruh ken pulang dibolehin meminimalisir virus halusinasi pikir
timutiimuti,tawa iyasih ngeremote minggu pencil pulang desa tawa
timutiimuti,pencil pil tawa pencil sih harap officially rumah tawa
timutiimuti,anak sultan terkait
timutiimuti,minggu kemarin mikirnya jatim aman tawa kemarin menhub
timutiimuti,kasih wisuda starter baca rias baju foto studio inap
timutiimuti,paragede jaguang
timutiimuti,tawa monggo dicobaa
timutiimuti,jail coba tes pribadi suka hasil sih mbti hasil mbti mahasiswa
timutiimuti,realized humans imperfect sisi paksa anyone sempurna based nyala ver
timutiimuti,ajar milik mistakes selamat si nasihat coba positif
timutiimuti,referensi temu cari konsep beda jodoh insyaal
timutiimuti,eh ide tulis lauhul mahfuz ukh skenario
timutiimuti,effortnya ukh sungguh jodoh tulis lauhul mahfuz tari
timutiimuti,tawa syemangat anaa sungguh cari ide susah cari jodoh
timutiimuti,setuju
timutiimuti,tawa pil
timutiimuti,kucing rumah lelah manusia tawa
timutiimuti,tawa bawain naa
timutiimuti,tertawa tugas naa
timutiimuti,lamak
timutiimuti,aiola putih deret depot ning belah rumah waktu mlg tertawa
timutiimuti,coba rujak cingur bodoh waktu doyan
timutiimuti,humans mantap saudara wanita
timutiimuti,hoiya tawa rbtcnya
timutiimuti,tc isi plasa supeno aula profesor handayani kantin tc laboratorium warung internet
timutiimuti,deadline usul jiwa tertrigger
timutiimuti,coba bugar null tawa mantaapp
timutiimuti,umur beliau kuliah kuliah si tawa
timutiimuti,umur saudara laki nggo roo tawa
timutiimuti,iya pil gila sumber asam lambung
timutiimuti,malas gerak mitt keluh cemil tawa sistem gojek ken kas bintang wkwkk
timutiimuti,kecewa paket cemil kasih stiker rapuh buka bungkus untung lelah
timutiimuti,cegah virus corona makan buah sayur tidur minum udara putih hangat cuku
timutiimuti,tunggu hypenya wishlist tawa
timutiimuti,cepat sih ilangnya
timutiimuti,hidupin lampu sen kanan belok kiri
timutiimuti,pdg true iya  true
timutiimuti,mendengarkan nabe ngobrol lebar ngobrol makju mudeng inti semoga salah tafsir tawa
timutiimuti,instagram explorejawatimur tawa
timutiimuti,masihh tawa vscode laptop
timutiimuti,istirahat sebentar siss lembur workhour imbang tawa
timutiimuti,muka tua umur signifikan sih misi
timutiimuti,batal
timutiimuti,titip paketin tawa
timutiimuti,jaman titis nia rahmadani sadonyo wkwm
timutiimuti,mudah googling
timutiimuti,busett deh aman masker kain bunuh cuci pakai aman tawa
timutiimuti,ditanyain pabos lari darimana gara matiin whatsapp tawa tahun hidupin
timutiimuti,gakuku baca
timutiimuti,waktu sangka milik buru buru pikir karen
timutiimuti,disubmit sebentar rez tawa
timutiimuti,iya kertas jelma komik novel bosan baca tawa
timutiimuti,tawa bantuaknyo tuhan saudara mancoret rafi
timutiimuti,ribut beko tulis rafi ci cayang tawa
timutiimuti,dosen iya habis kuliah si gakuku mantap tawa doakeun
timutiimuti,definisi intern misogyny sih dengar
timutiimuti,tawa pindah domisili pindah disuka iya bas
timutiimuti,tolak ratih bas tawa
timutiimuti,eakk iya sayang dibenerin papernya tawa doa yaww
timutiimuti,omong omong kabar jiki tawa
timutiimuti,epl sayang tangis
timutiimuti,lem
timutiimuti,tolak kertas terbit sesak euy
timutiimuti,merayakan kasih sayang iya sayang tolak
timutiimuti,gaya pakai iya alhamdulillah
timutiimuti,rusak
timutiimuti,whoaa ikuti iya pilss tawa
timutiimuti,gara ngumpulin tugas drive pakai tutup logo
timutiimuti,yupss dikit samping gang kosnya upil
timutiimuti,iya naa wkwkkwk salah ketik tawa tmp jual buah an kosnya upil naa murah semut euyy
timutiimuti,varian lemon kurma chia benih sdm kurma almond
timutiimuti,saudara wanita overnight oat tawa pakai chia benih madu almond perisa stroberi baca selai
timutiimuti,nerapin hidup sehat ala guru zaidul akbar dijugde makju cemil aneh tawa
timutiimuti,mayoutfit
timutiimuti,tim angka terkait
timutiimuti,tawa coba mandiri online akun hilang sih dinonaktifin
timutiimuti,transaksi saldo rp nonaktif otomatis sih
timutiimuti,dom surabaya iya pengirim
timutiimuti,amin
timutiimuti,sg diliatin ayah tawa alhamdulillah singgung
timutiimuti,tawa mantul bakat promosiinnya banding saudara laki saudara wanita jenius mall
timutiimuti,saldo juta transaksi iya
timutiimuti,ulas saudara wanita jenius
timutiimuti,tikus betina kasih kontak iya yon
timutiimuti,tawa ndredeg jalan
timutiimuti,teras kos pikir tawa
timutiimuti,beli cemil bungkus tunggu sengaja anak tikus jalan hati sungguh ter
timutiimuti,tidur uss kopi
timutiimuti,ampun qaqaa
timutiimuti,bowo ketawa utama rusak
timutiimuti,bagus sih tawa
timutiimuti,iya iya pergi publik linkedin saudara wanita tawa
timutiimuti,peka malas menanggapi rusak
timutiimuti,tawa ndredeg collab ratu
timutiimuti,malas ngasitau saudara wanita tawa
timutiimuti,coba gulir chatnya iya saudara wanita kasitau tawa
timutiimuti,ayo collab tiktokan tawa frame
timutiimuti,lingkar cahaya mutiatul alpenliebe tawa
timutiimuti,tawa tawa baca yaallah
timutiimuti,heran deh kasitau
timutiimuti,bijak saudara laki
timutiimuti,tawa sebentar maspip kalah viral toilet
timutiimuti,sengaja cepat sub ngeblank tawa
timutiimuti,tawa kecepetan tempo
timutiimuti,buru buru lelah istirahat hidup cepat nikmat pelan pelan
timutiimuti,pasang video tari tiktok rekam pakai kamera tawa eh colong inst
timutiimuti,kemarin sengaja buka email kampus terbit jurnal kirim hasil revisi barus
timutiimuti,rumah bayang pacar iya pyurr tawa
timutiimuti,butuh tubuh gula gram selai iya sila minum dosis minum
timutiimuti,indah vlogger parah ngilanginnya coba baca
timutiimuti,rumah gara lupa kasih iya tawa
timutiimuti,tengah later lemon kurma delima kemarin rutin minum sih varian
timutiimuti,aman iya maspipp janlup pakai masker
timutiimuti,panjat sosial panjat sosial iya
timutiimuti,ayo saudara laki anysongchallenge tawa
timutiimuti,semester ambil sks semester ambil usul publikasi usul tesis tesis tawa
timutiimuti,iya galigaman pemprovnya
timutiimuti,si semester
timutiimuti,virus corona inkubasi andal alat detektor demam bandara demam saudara
timutiimuti,lelah yaallah lindung keluarga sanak saudara warga sumbar amin
timutiimuti,tawa jaman ngidol mimpi ketemu anggota suju pyurr
timutiimuti,ohiya wkwwkwk akutuu gaya tidur
timutiimuti,eh kuat sihir sih iya tertawa monmaap
timutiimuti,starter pergi ransel backpack ofc boneka bantal tidur gel sweter
timutiimuti,janlup mie aceh bebb malu
timutiimuti,whoaa asiknyaa jalan
timutiimuti,tawa wangi
timutiimuti,selamat koo cocok dosen tawa
timutiimuti,terbang tawa semoga ketemu mandi
timutiimuti,hoo ketemu saudara morgan tawa
timutiimuti,pasang instagram saudara tasyi kue lapis manis tawa
timutiimuti,riasw kak wkwkkwkw
timutiimuti,semangat hanaa
timutiimuti,tahun tawa
timutiimuti,tawa iya saudara alhamdulillah
timutiimuti,saudara wkwkwkkw tahun
timutiimuti,mushola rumah pil tawa buibu tetangga gitulo tawa
timutiimuti,hoho tok
timutiimuti,tahan cemil malam eh selai nyonya sempol tawa eits sombs saudara
timutiimuti,edit photoscape tua
timutiimuti,tawa oke subb overdosis tawa
timutiimuti,minum larut segar pakai baca minum habis tawa
timutiimuti,wokee terimakasih saran mitt ehe
timutiimuti,baca sih saudara wanita mitt googling memakai sariawan mala
timutiimuti,albothyl aman sih sariawan lanjur beli saudara wanita oke aman
timutiimuti,beibb
timutiimuti,susah hanyut suasana tonton film sedih sukses mewek euy
timutiimuti,rujuk nio saudara tht tawa
timutiimuti,dtgnya weekday libur kuliah pagi kalah cepat
timutiimuti,tawa yadumss
timutiimuti,boyband korea bas informasi periksa
timutiimuti,mon maaf jiwa kokoreaanku minus parah tawa
timutiimuti,tahun sambat wifi ccd drastis semoga iya
timutiimuti,parah fikk tawa
timutiimuti,ujung kiri terkait
timutiimuti,cinta bersemi uhuy
timutiimuti,hadeu inner putih sayang tinggal padang
timutiimuti,laahh kobisa jaahh
timutiimuti,waa iya yoll lebaran harga ubah
timutiimuti,yoll kobisaa ih
timutiimuti,ken tawa
timutiimuti,habis jija
timutiimuti,batal
timutiimuti,aneh berani muncul gul tawa
timutiimuti,rencana twis baca komennya wkwkwkkwkw
timutiimuti,makan instagram ajadeh tawa gayabanget hahahihinya sih tangis sambat twitter tawa
timutiimuti,amin
timutiimuti,tawa pulang null minggu kemarin surabaya
timutiimuti,tawa ayo kais uang kota pahlawan
timutiimuti,tawa pulang
timutiimuti,rindu sepeda nichh
timutiimuti,lupa ragu homenya
timutiimuti,efek minggu rumah jalan kantor bablas solat pager kantor dorong geser
timutiimuti,pindah kota selai mandi
timutiimuti,hujan minggu sakit rebah selimut
timutiimuti,akun twitter kasih baku hantam
timutiimuti,ide ambil nilai senam olahraga nih tawa
timutiimuti,ebuseett haji
timutiimuti,ayo fikk sebentar bantal bicara kamar tawa
timutiimuti,insiden paan tawa
timutiimuti,tol tawa
timutiimuti,tawa
timutiimuti,tawa bas
timutiimuti,tawa pyur antisosial akutuu
timutiimuti,iya utama tawa
timutiimuti,problematika pelangi umum kampus dengar sih
timutiimuti,mantap saudara laki
timutiimuti,tawa doa semoga timing meetup bukittiggi tawa
timutiimuti,nambahin tawa tahap eii tawa
timutiimuti,goo nyonya pisang panggang
timutiimuti,kuykuy reuni bukittinggi tawa
timutiimuti,teman kampus ngek tawa
timutiimuti,tawa ketemu peni rsam
timutiimuti,bukittinggi saking meetup mantuls
timutiimuti,kantor desa utama keranjang anak tawa
timutiimuti,suka sila kerusi temu sempurna kursi
timutiimuti,jarak rumah cgv kilometer film selai jalan selai tawa terimakasih lampu lintas hijau terlambat deh tawa
timutiimuti,mahal bandara
timutiimuti,tanggal spesial sejarah bilang
timutiimuti,rutinitas gor agus hormat maraton jogging beli jilbab
timutiimuti,guu idam banget
timutiimuti,syukur saudara wanita tawa
timutiimuti,manusia salah niat
timutiimuti,dongeng tidur perempuan berdiri kaki debat rumah tangga lawan wanita karir layak
timutiimuti,ulyi disiying siying
timutiimuti,munafik sikap suka bela
timutiimuti,tawa iya rez berat eh tawa
timutiimuti,rindu iya rez tawa
timutiimuti,iya mbak majuu
timutiimuti,whoaa waktu deh subb coba berani coba aneh tawa terimakasih sub infonyaa
timutiimuti,tawa mundur iya mbak waktu solatt
timutiimuti,subb segar
timutiimuti,iya mbak tawa terlambat iya mbak
timutiimuti,tawa makas informasi rezz ehe
timutiimuti,lemon semangka
timutiimuti,lemon kurma
timutiimuti,lemon sari kurma
timutiimuti,udara infus
timutiimuti,isya selai isya pdg selai selai
timutiimuti,kuasa pepet serah kertas via telepon saking magernya buka laptop tawa
timutiimuti,saminggu
timutiimuti,tawa iyasih mitt
timutiimuti,tawa mitt sisa nih ehe
timutiimuti,sabtu bisuak insyaallah
timutiimuti,iya naa malu alhamdulillah
timutiimuti,terimakasih mbak
timutiimuti,iya mbak tanggal iya mbak tawa ngambis
timutiimuti,yess izin pulang nyala api ngejer promosi tiket
timutiimuti,safa tawa
timutiimuti,waa alhamdulillah semoga lancar bekas iya ayo ehe
timutiimuti,clear ayo
timutiimuti,bagus saudara laki menteri
timutiimuti,congraduats
timutiimuti,senang holiyay kais pundi pundi uang
timutiimuti,kantor keringetan untung sepi bau badan sih kecover
timutiimuti,tingkat sksdku utama keranjang bareng anak kompleks kantor tawa
timutiimuti,threadnya tawa
timutiimuti,yippiee cocwitnyaa
timutiimuti,pulang ngepump ayo yakalikapanpulang
timutiimuti,minggu nyala twitter mentions retweet oke retweet capai total balasan milik
timutiimuti,kacau sih sih dirut gundik et al
timutiimuti,tawa dibangsatin sebentar diapakan kak
timutiimuti,paras
timutiimuti,ayam telur susu products
timutiimuti,biadab gonggong khafi
timutiimuti,bubur saudara laki dudung labiah lamak
timutiimuti,tawa cocok dek
timutiimuti,baca wattpad dek tawa
timutiimuti,panas surabaya qaqaa
timutiimuti,congraduats rivv
timutiimuti,pintu buka lapor buru tawa
timutiimuti,gara kertas parkir palang buka bayar saudara
timutiimuti,batal
timutiimuti,palang parkir detik musuh
timutiimuti,isi kuesioner baca komentar hubung isi tawa efek kontaminasi teliti
timutiimuti,butuh caffeine gantung
timutiimuti,culun selai malam ambyar
timutiimuti,habis sakit trodd
timutiimuti,butuhin salju wkwkkwkw
timutiimuti,guru baca orasi menteri didik budaya cercah cahaya ujung lorong
timutiimuti,lingkar cahaya budak cinta rawat kulit sedia rawat kulit mini sample asli rawat kulit enth
timutiimuti,ayo buka followback ayo paham rules disave suka link profil rt pinned tweet
timutiimuti,trod wakakak
timutiimuti,wkwkwkwwk iya
timutiimuti,sungguh sungguh butuh tinggal kos surabaya ac
timutiimuti,pakai titik obat pakai acnoc jerawat mendem jerawat muncul
timutiimuti,pdf menghilangkan bruntusan
