username,created_at,text
Abdee,2021-01-10 18:24:02,"Edufair di Palu, 33 Perguruan Tinggi Dilibatkan https://t.co/YQgJxP9Tb6 https://t.co/wf8oz1daHD"
Abdee,2021-01-10 12:25:02,Pemkab Parimo Siapkan Dua Hektar Lahan untuk Makam Jenazah Pasien Covid-19 https://t.co/VTSEjdbxLf https://t.co/ba7079KDS3
Abdee,2021-01-10 06:50:02,"Melawan Saat Hendak Ditangkap, Seorang Remaja Pelaku Curas di Palu Didor Polisi https://t.co/txA3nU7yRs https://t.co/5uXtly49WE"
Abdee,2021-01-09 12:22:34,"Siap-siap, Vaksinasi Covid-19 di Parigi Moutong Dimulai 14 Januari 2021 Mendatang https://t.co/BV48sVQX4u https://t.co/V1qCMB4NlT"
Abdee,2021-01-09 12:22:33,"Siap jadi Ormas, Relawan Merah Putih Sulteng Gelar Mubes https://t.co/sG0rFC4PWj https://t.co/qJ0PRn59CP"
Abdee,2021-01-08 15:52:32,"Positif Covid-19 Tapi Olahraga di Jalan Raya, Wagub Sulteng Diprotes Warga https://t.co/4YMhnPl82z https://t.co/VpH0oFZmBc"
Abdee,2021-01-08 06:19:32,"Sah, Nur Rahmatu Pimpin Kadin Sulteng Periode 2020-2025 https://t.co/PcBUyU25z9 https://t.co/E18abOpykL"
Abdee,2021-01-07 21:21:02,DPRD Palu Temukan Banyak Pekerjaan Fisik APBD 2020 Belum Rampung https://t.co/9jTY6gL0LN https://t.co/UwhwsfV0lx
Abdee,2021-01-07 15:50:03,"74 Pejabat di Parigi Moutong Positif Covid-19, Jubir Satgas: Itu Hasil Swab Massal https://t.co/ZWZeEsKunp https://t.co/LVgOCusgES"
Abdee,2021-01-07 03:17:03,"Positif Covid-19, Gubernur dan Wakil Gubernur Sulteng Isolasi Mandiri https://t.co/JUfKuRHG97 https://t.co/X6QbWuwAal"
Abdee,2021-01-06 21:19:03,"Geger Penemuan Bangkai Kapal di Perairan Donggala, Berikut Penjelasan Kepolisian https://t.co/Cgs4DWCa6b https://t.co/ZQwiPKpRSH"
Abdee,2021-01-06 15:12:03,"Data Pelanggaran Lalulintas di 2020, Satlantas Polres Palu: Tilang 3.551 dan Teguran 1.776 https://t.co/51FJRUTH4v https://t.co/5vO3FQW6Wv"
Abdee,2021-01-06 03:15:02,"Inflasi di Sulteng Tahun 2020 Sebesar 1,62%, Kota Palu Catat Inflasi Tertinggi https://t.co/bp1veDZaUO https://t.co/u7ZbPufqA3"
Abdee,2021-01-05 21:17:02,"Update Covid-19 di Sulteng: Bertambah 94 Kasus Baru, 52 Sembuh dan 3 Meninggal Dunia https://t.co/qcf2BVCbEM https://t.co/xkiezpEgTF"
Abdee,2021-01-05 15:09:03,"Mulai Besok, Masuk Palu Wajib Tunjukkan Rapid Anti Gen https://t.co/0MyzDPfqOC https://t.co/r7t2AHJaT1"
Abdee,2021-01-05 03:13:02,Vaksin Covid-19 untuk Sulteng Tiba di Palu https://t.co/s3PPrFeQ6p https://t.co/9kVYSgY4qj
Abdee,2021-01-04 21:14:03,"Gempa Tektonik 4.9 SR di Morowali, Sejumlah Rumah Warga di Bahodopi Mengalami Kerusakan https://t.co/XPQqFQ7ND3 https://t.co/3qaCOIahES"
Abdee,2021-01-04 12:11:02,Kepala BKPSDM Parigi Moutong: Zulfinasran Satu dari Tiga Pejabat yang Dinyatakan Lulus Seleksi https://t.co/claHTAX9Dc https://t.co/TVkoItCt5L
Abdee,2021-01-03 21:13:03,"Update Covid-19 di Sulteng: Bertambah 67 Kasus Baru, 31 Sembuh dan 3 Meninggal Dunia https://t.co/feTBOc3aID https://t.co/600vNQ9662"
Abdee,2021-01-03 21:13:02,Pecinta Motor King Deklarasikan Klubnya di Dolo Selatan https://t.co/00M6dR2xQW https://t.co/AH4iWx9Ovs
Abdee,2021-01-03 12:08:02,Sekkab Parigi Moutong: Jabatan Bukan Hadiah dan Akan Dipertanggungjawabkan Dunia Akhirat https://t.co/nbW3WZoTNm
Abdee,2021-01-02 15:13:03,Pemdes Lembobelala di Morowali Utara Bentuk Gugus Tugas Cegah Penyebaran COVID-19 https://t.co/UYB8QI3Ip3 https://t.co/SntcgJvA9t
Abdee,2021-01-02 15:13:02,"Tambang PT Trio Kencana Seluas 15.725 Hektar di Parigi Moutong, FMMT: Dampaknya Buruk https://t.co/VjUAatUaXO https://t.co/T0H6njgLvs"
Abdee,2021-01-01 15:11:33,Perindo Dorong Pemkot Palu Percepat Berlakukan PSBB https://t.co/e0cY4tAp78 https://t.co/Vgvy7T5nQH
Abdee,2021-01-01 15:11:33,"Selain TNI-Polri, Pengamanan Malam Pergantian Tahun di Morowali Libatkan Satpol PP dan Dishub https://t.co/zU15CIK3LH https://t.co/tQdS9O1SQJ"
Abdee,2021-01-01 15:11:32,"Pengamanan Malam Pergantian Tahun, Polda Sulteng Kerahkan 933 Personel https://t.co/pFR5C428O4 https://t.co/3c12Ed9I6g"
Abdee,2020-12-31 15:10:04,BNNP Sulteng Ungkap 19 Kasus Peredaran Narkoba Selama Tahun 2020 https://t.co/Kf07F9ywsu https://t.co/zHLV13dPrO
Abdee,2020-12-31 15:10:04,"Kasus Narkotika di Parigi Moutong Meningkat 31,8 Persen Sepanjang 2020 https://t.co/fkudg6p13g https://t.co/lITabcHNwp"
Abdee,2020-12-31 15:10:03,"Asik Pesta Sabu di Kos-kosan, Dua Pengedar Narkoba di Morowali Dibekuk Polisi https://t.co/jGh6JMDQMO https://t.co/KbUeerKFMs"
Abdee,2020-12-30 15:09:04,"Protokol Kesehatan di Tolitoli Diperketat, Berikut Edaran Bupati Moh Saleh Bantilan https://t.co/ARQxFPGXAf https://t.co/TAZnwsz8WI"
Abdee,2020-12-30 15:09:03,"Jelang Musda KADIN, HIPMI Sulteng Siapkan Kader Terbaik https://t.co/DUdsNqCX2Z https://t.co/ZzCn5852rO"
Abdee,2020-12-30 15:09:02,Update COVID-19 Sulteng Per 29 Desember 2020: Bertambah 81 Kasus Baru dan 45 Sembuh https://t.co/Z6n66kIlAd
Abdee,2020-12-29 15:05:34,"Covid-19 Meningkat, Masuk Sulteng Wajib Tunjukkan Rapid Antigen https://t.co/ajuHHkKvkB https://t.co/iKV9PmQPgC"
Abdee,2020-12-29 15:05:33,"Puluhan Tenaga Pendidik Terpapar Corona, Disdik Palu Tunda Rencana Pembelajaran Tatap Muka https://t.co/Wo2jA9efmd https://t.co/1WuZyLIxAH"
Abdee,2020-12-29 15:05:32,"Cerita Seorang Perawat Mengubah Kebiasaannya, Antara Merawat Pasien COVID-19 dan Keluarga https://t.co/gen2hiqUkx https://t.co/UIMwFSbJ0j"
Abdee,2020-12-28 15:03:04,BNN Palu Ungkap 2 Kasus Narkoba Selama Tahun 2020 https://t.co/0WUrkRtcC5 https://t.co/4j7aKTL4f3
Abdee,2020-12-28 15:03:03,BPOM Palu Musnahkan 6.011 Picis Obat dan Makanan Ilegal https://t.co/WY6fTc0MiO https://t.co/jzYfyGaAkI
Abdee,2020-12-28 15:03:02,Bukit Salena Palu Kian Ramai Dikunjungi Wisatawan Saat Libur Natal dan Akhir Tahun https://t.co/VdeMP5MxYe https://t.co/lA5fJyOg4x
Abdee,2020-12-27 15:01:04,Warga Lanjut Usia Kawatuna Palu Antusias Ikut Posyandu Lansia di Tengah Pandemi https://t.co/JQO7DnKegS https://t.co/3rxtJuOGa6
Abdee,2020-12-27 15:01:03,"Update Covid-19 di Sulteng: Bertambah 54 Kasus Baru, 10 Sembuh, dan 1 Meninggal Dunia https://t.co/mnuVa1l2fT https://t.co/dIsxKAhC9k"
Abdee,2020-12-27 15:01:02,"Muskot Perbakin Palu, Irsan Satria Terpilih Secara Aklamasi https://t.co/uO00tvrEAv https://t.co/pHtlJPOI1e"
Abdee,2020-12-26 14:56:33,Mantan Bupati Poso Piet Inkiriwang Tutup Usia https://t.co/SefBHjl8ph https://t.co/vutj9ttjRD
Abdee,2020-12-26 14:56:32,"Update Covid-19 di Sulteng: Bertambah 42 Kasus Baru, 14 Sembuh dan 1 Meninggal Dunia https://t.co/Z0zQLWs0Ju https://t.co/6QCWkVfQMh"
Abdee,2020-12-26 05:59:02,Berburu Rupiah di Pasar Kaget Palu saat Musim Pagebluk https://t.co/ngcVFN1qjR https://t.co/PaVq63ScYh
Abdee,2020-12-25 09:03:33,Kegiatan Rutin Polsek Bahodopi Amankan 34 Motor dan Sampaikan Maklumat Kapolri https://t.co/wD7LhzUJKY https://t.co/ztQAySaDro
Abdee,2020-12-24 15:05:33,12 Narapidana Lapas Parigi Dapat Remisi Khusus Natal https://t.co/DHQwXseqEi https://t.co/Tt9OuT69K6
Abdee,2020-12-24 15:05:32,207 Narapidana Dapat Remisi Khusus Natal https://t.co/21Qvm0W5DC https://t.co/gimzEWxwI8
Abdee,2020-12-24 08:33:02,"Dianggap Tidak Sesuai Standar, BPK Diminta Periksa Rehab Kantor DPRD Palu https://t.co/BeuCGHaIdV https://t.co/VAUYd91LQ4"
Abdee,2020-12-23 15:04:32,BNN Poso Libatkan Netizen Cegah Peredaran Narkoba https://t.co/vNrFvSjPuO
Abdee,2020-12-23 12:04:03,"Resmob Polres Tolitoli Bekuk Terduga Pelaku Pencurian Uang Tunai Rp 9,5 Juta https://t.co/atdQ8AwO9o https://t.co/al2m01Zg1T"
Abdee,2020-12-23 08:31:03,"Dukung Kelancaran Operasi Lilin Tinombala, Bank Mandiri Palu Berikan 1000 Masker untuk Polda Sulteng https://t.co/lD2eh6snGM https://t.co/Eopaa4Kz2S"
Abdee,2020-12-22 14:31:02,Pemuda 23 Tahun di Parigi Moutong Dilaporkan Hilang Saat Melaut https://t.co/POSWynRv0O https://t.co/bFvP0KEj7N
Abdee,2020-12-22 11:29:33,"Operasi Yustisi, 83 Warga Palu Tak Pakai Masker Diberi Sanksi Sosial https://t.co/4xgKHXiTiu https://t.co/6fmMD14rOp"
Abdee,2020-12-22 08:29:03,"Bertambah 27 Kasus Baru, Covid-19 di Sulteng Tembus Angka 2.800 https://t.co/L6S5Cpmviy https://t.co/FcA5NTUPRT"
Abdee,2020-12-21 14:24:32,"Sempat Vakum Akibat Pandemi, Road Race Sukses Digelar di Morowali https://t.co/WDhg0SPvoN https://t.co/iQmziGFzMg"
Abdee,2020-12-21 11:26:02,Polres Palu Musnahkan 19 Kg Sabu https://t.co/BX78t0SPog https://t.co/swmvxV7vMH
Abdee,2020-12-21 08:27:32,Polda Sulteng Perketat Pengamanan Natal dan Tahun Baru https://t.co/Ai6vG1LD9Q https://t.co/S0CiQl2xdQ
Abdee,2020-12-20 11:31:03,"Patroli di Laut Palu, Ditpolairud-BKSDA Sulteng Ingatkan Warga Ancaman Buaya dan Corona https://t.co/IVqpgfwf6Q https://t.co/5WLgomcypC"
Abdee,2020-12-19 20:36:32,2.300 Tenaga Honorer di Pemkab Bangkep Jadi Peserta BPJS Ketenagakerjaan di 2021 https://t.co/0oVwyOLyZq https://t.co/4kp6PREkmC
Abdee,2020-12-19 17:29:02,"Akibat Cuaca Buruk, Seorang Nelayan di Parigi Moutong Dilaporkan Hilang Saat Melaut https://t.co/DXEoN5clsx https://t.co/OSpJMHPCKo"
Abdee,2020-12-19 05:30:33,"Berkah di Tengah Pandemi, Pendapatan Nelayan Talise Kota Palu Meningkat Pesat https://t.co/QBEf8zSjkD https://t.co/s4slVYhbwJ"
Abdee,2020-12-18 20:34:32,"Edarkan Sabu, Seorang Pria Asal Sulawesi Selatan Dibekuk Polisi di Morowali https://t.co/8gPYlEZ1Kd https://t.co/YC5FP0hxkx"
Abdee,2020-12-18 14:33:03,"Tetapkan Rekapitulasi Suara Pilkada Palu, KPU Beri Waktu 3 x 24 Jam Paslon Ajukan Gugatan ke MK https://t.co/JpbCto7lip https://t.co/l52AqDp5AX"
Abdee,2020-12-18 05:27:32,OJK Nilai Sektor Jasa Keuangan Stabil dan Terjaga https://t.co/14ZBmXL25x https://t.co/rDN7gp5WAC
Abdee,2020-12-17 20:33:02,Pemenuhan Hak Penyintas Jadi Prioritas Awal Hadi-Reny https://t.co/Et9DBFJLqE https://t.co/GA2y9JgwKJ
Abdee,2020-12-17 14:31:02,"Update Covid-19 Sulteng Per 17 Desember 2020: Ketambahan 39 Kasus Baru, 11 Sembuh dan 2 Meninggal https://t.co/JLxcRORLJE https://t.co/rDdMSTKyui"
Abdee,2020-12-17 05:25:02,Partisipasi Pemilih Penyandang Disabilitas Kota Palu Turun Drastis di Pilkada 2020 https://t.co/GlKbgKTONb https://t.co/lPNET8kzG0
Abdee,2020-12-16 17:29:02,"Update Covid-19 Sulteng Per 16 Desember 2020: Bertambah 57 Kasus Baru, 1 Meninggal dan 19 Sembuh https://t.co/C3702AjfCw https://t.co/CBuuPXnXdu"
Abdee,2020-12-16 11:30:33,Kapolres Sigi Pastikan Keamanan Proses Rekapitulasi Pilkada https://t.co/6pm2P2BA3i https://t.co/k5vUmS92pL
Abdee,2020-12-16 05:23:03,"Peringati Hari Juang TNI AD 2020, Kodim Poso dan Pangdam XIII Merdeka Gelar Doa Bersama https://t.co/O9QjcEMT8J https://t.co/GvYSSgDVHL"
Abdee,2020-12-15 17:27:03,Bawaslu Sigi Pantau Proses Rekapitulasi Suara https://t.co/k2AHCyC3S9 https://t.co/FilIWBtpC0
Abdee,2020-12-15 11:28:32,"Di Tengah Pandemi, DPMD Jadikan Desa Dampal Donggala Percontohan Balai Belajar Kampung https://t.co/pLzAfoJXmZ https://t.co/2q4tuMd0Bm"
Abdee,2020-12-14 20:24:02,Polres Sigi Kawal Ketat Pendistribusian 34 Kotak Suara https://t.co/koaPeRHAVa https://t.co/P5HfDWQthn
Abdee,2020-12-14 17:24:02,Tokoh Agama Poso Nyatakan Mendukung BNN Berantas Narkoba https://t.co/yi57bTss03 https://t.co/UG3DJd9j9i
Abdee,2020-12-14 11:25:02,Kejari Banggai Siap Sukseskan PEN https://t.co/d3uML7Ce9f https://t.co/vE9j9XfOSw
Abdee,2020-12-13 14:25:03,BNN Poso Bagi-bagi 250 Masker dan Kampanyekan Upaya Pencegahan Covid-19 https://t.co/bHEUnx5v2K https://t.co/Oh7VF0aop6
Abdee,2020-12-13 14:25:02,Pengkot Perbakin Palu Akan Gelar Muskot Ke III https://t.co/C8KGAuN6Kd https://t.co/FcIH4xqfFX
Abdee,2020-12-13 08:24:03,BRI Poso Dukung Kegiatan Positif E-Sports https://t.co/BBz6zT9Rjz https://t.co/Ku9xq0odes
Abdee,2020-12-12 14:22:03,17 Tim Terbaik PUBG Berkompetisi Dalam Turnamen Resmi PB ESI Poso https://t.co/meUcC7XgWG https://t.co/2bV15ISacc
Abdee,2020-12-12 14:22:02,UPT KPH Dolago-Tanggunung Promosikan Produk Kelompok Tani Hutan https://t.co/PaeGBiU1pU https://t.co/ehomaPjHFH
Abdee,2020-12-12 08:22:02,Polres Palu Patroli Siang Malam Monitoring Logistik Pilkada https://t.co/MJexIMACGz https://t.co/xOZmZDUs8b
Abdee,2020-12-11 14:19:04,"Jelang Sidang Kode Etik, Anggota DKPP dan Komisioner KPU Sulteng Jalani Rapid Test https://t.co/lwdyfTvA8w https://t.co/g0FSMtwGnR"
Abdee,2020-12-11 14:19:03,Polsek Banawa Amankan Puluhan Botol Miras di Donggala https://t.co/qsgeFjxsZm https://t.co/ry5RPTDmaY
Abdee,2020-12-11 08:20:02,Transdata Pastikan Kemenangan Hadi-Reny di Pilkada Kota Palu https://t.co/9qfgG1XNKV https://t.co/QBzhjzIxcZ
Abdee,2020-12-10 14:17:33,Bapilu Hanura Sulteng Tegaskan Raih Kemenangan di 8 Daerah Pada Pilkada Serentak 2020 https://t.co/CHUygYPLlo https://t.co/kiTFLX5Of2
Abdee,2020-12-10 14:17:32,"Ucapkan Selamat Kepada Hadi-Reny, Aristan Titipkan Pesan Korban Bencana https://t.co/A9FRB3SaBb https://t.co/xG9Lc88fhO"
Abdee,2020-12-10 08:18:03,Terdakwa Kasus Pencemaran Nama Baik Bupati Poso Divonis 10 Bulan Penjara https://t.co/0RTFcmzQDT https://t.co/F6fWk5UD3V
Abdee,2020-12-09 14:15:03,"Hari Anti Korupsi, Kejati Sulteng Paparkan Capaian Kinerja Bidang Pidsus https://t.co/X5HepSl2bw https://t.co/AFBnRlLdxa"
Abdee,2020-12-09 11:15:02,"Menang Telak versi Quick Count, Cagub Rusdi Mastura akan Gelar Selebrasi https://t.co/IAyLDF1Idi https://t.co/EvjgtwpLNP"
Abdee,2020-12-09 08:16:02,"Selesai Gunakan Hak Pilih, Ini Pesan 2 Calon Gubernur Sulteng https://t.co/daBTHrckwf https://t.co/WpHsxZDKEa"
Abdee,2020-12-08 14:13:32,Polres Tolitoli Kawal Pendistribusian Logistik Pilkada 2020 https://t.co/FWgXaf7XwH https://t.co/Hht8pwUd0P
Abdee,2020-12-08 11:13:03,Polsek Sirenja Lakukan Pengamanan di 45 TPS https://t.co/AePDgy95or https://t.co/3INuwSU8U7
Abdee,2020-12-08 08:14:33,Tim Advokasi Hukum Das Beramal Laporkan Video 19 Detik Paslon Verna-Yasin https://t.co/ROVPg2iScB https://t.co/fMR1S9316w
Abdee,2020-12-07 14:11:02,"H-2 Pilkada 2020, PAM TPS Bahodopi Gelar Apel Siaga https://t.co/90nmLOWmfv https://t.co/luPhxDWvG1"
Abdee,2020-12-07 11:10:33,"Sulit Dapatkan Fasilitas Hemodialisa, Begini Harapan Pasien Cuci Darah Bagi Bupati Poso Terpilih https://t.co/T4BroOy3VC https://t.co/LBvSMwVKNL"
Abdee,2020-12-07 08:13:02,"Ops Mantap Praja 2020, Polda Sulteng Terima 400 Personel BKO Brimob Nusantara https://t.co/G0yjI9XOIR https://t.co/jPwyxyEspx"
Abdee,2020-12-06 14:05:33,Distribusi Logistik Pilkada di Tawaeli dan Palu Utara Dijaga Ketat Polisi https://t.co/iEuul0YVNd https://t.co/ksouP9JQ5t
Abdee,2020-12-06 11:07:03,"Sosialisasikan Pendidikan Pemilih, KPU Poso Sasar Organisasi Kepemudaan https://t.co/XCP3mDenZl https://t.co/Shq4ZMbSZx"
Abdee,2020-12-05 17:09:03,"Upacara HUT Morowali ke-21 Digelar Sederhana, Bupati: SDM Kunci Keberhasilan dan Kesuksesan Masa Depan https://t.co/lZkMRPS2Bl https://t.co/ZIFuaMfTB7"
Abdee,2020-12-05 11:09:03,372 Personel Dikerahkan untuk Mengamankan Pilkada Sigi https://t.co/u1B4JmO3rx https://t.co/Xlvlm14PSU
Abdee,2020-12-04 20:12:04,Polres Palu Beri Pembekalan Petugas Linmas Jelang Pilkada Serentak 2020 https://t.co/syhEJ4UvXg https://t.co/CS9HySVRQJ
Abdee,2020-12-04 14:05:33,"Inflasi di Sulteng Capai 0,09 Persen Selama November 2020 https://t.co/LpzDLFPPxQ https://t.co/viqWLrbzq0"
Abdee,2020-12-04 11:06:02,Gubernur Sulteng Resmikan Kantor Cabang Parigi https://t.co/E2TC0T9FHw https://t.co/Zm63OcVX1F
Abdee,2020-12-03 20:10:03,"Edukasi Prokes Pilkada 2020 Lewat Game Among Us, Tiffanny Ardillah Juarai Lomba KPU Sulteng https://t.co/Ug63dbiGes https://t.co/VK8dY7jDS2"
Abdee,2020-12-03 11:02:34,Doa Lintas Iman Berkumandang untuk Korban Kekejaman Terorisme di Lembantongoa Sigi https://t.co/TcHUy400XB https://t.co/BXTF93NfLT
Abdee,2020-12-03 11:02:33,PJS Bupati Poso Minta Pendukung Paslon Jaga Keamanan Jelang Pilkada https://t.co/eSfOzoxMwr https://t.co/1kXoX4lQxK
Abdee,2020-12-02 20:08:03,Gubernur Minta Aparat Segera Tumpas Teroris di Sulteng https://t.co/nkrlrCHcPn https://t.co/x2mgUGvOIn
Abdee,2020-12-02 11:01:04,Pemerintah Akan Bangun Kembali Rumah di Lembantongoa Sigi yang Dibakar Kelompok MIT https://t.co/1dsFNFUius https://t.co/FnwIvAjcbr
Abdee,2020-12-02 11:01:03,"Oktober 2020, Ekspor dan Impor di Sulteng Sama-Sama Jeblok https://t.co/V5TZYGfWMp https://t.co/LdmsnnaLsF"
Abdee,2020-12-01 20:07:03,Update Covid-19 Sulteng Per 1 Desember 2020: Bertambah 12 Kasus Baru dan 37 Sembuh https://t.co/MxXW9Yreva https://t.co/dRxc4Xrie4
Abdee,2020-12-01 10:59:04,"Pasukan Khusus dari Panglima TNI Tiba di Palu, Aparat Optimis Tumpas Ali Kalora Cs https://t.co/DTDFE8LT2U https://t.co/rpDR5tINmL"
Abdee,2020-12-01 10:59:03,KPU Donggala Simulasikan Pemungutan Suara Pilgub https://t.co/xopHgbA7Nx https://t.co/Jj1XadgD4D
Abdee,2020-11-30 20:05:03,"Bertemu Kapolda, Ini Pernyataan Sikap Tokoh Lintas Agama Sulteng Terkait Pembunuhan 4 Orang Warga di Lembantongoa Sigi https://t.co/CQtMKQvL3x https://t.co/argj6kjTev"
Abdee,2020-11-30 10:57:33,"Pembunuhan di Lembantongoa Sigi, KNPI Palu: Sangat Mencederai Rasa Kemanusiaan https://t.co/cF9TYU7iZs https://t.co/RCf1h3UWjX"
Abdee,2020-11-30 10:57:32,Pemilik 19 Kg Sabu di Palu Merupakan Bapak dan Anak yang Diduga Jaringan Internasional https://t.co/aL7qw5Vpyy https://t.co/VglnNxXRvQ
Abdee,2020-11-29 20:03:33,"Sehari, Basarnas Terima Laporan 6 Nelayan di Parigi Moutong Dikabarkan Hilang https://t.co/IHeJRyxNBc https://t.co/1SYY5nZD1i"
Abdee,2020-11-29 02:10:02,"Pembunuhan 4 Warga Sigi, Komnas HAM: Seluruh Masyarakat Sulteng Jangan Terprovokasi https://t.co/PgRQ5bheKe https://t.co/NJPmERjTCE"
Abdee,2020-11-28 20:09:03,Seorang Nelayan Asal Paranggi Dikabarkan Hanyut di Perairan Bolano https://t.co/0nXOYXc8y7 https://t.co/oATVrmos6v
Abdee,2020-11-28 11:04:03,"4 Warga Lembantongoa Sigi Tewas Dibunuh OTK, Penduduk Sekitar Kini Mengungsi https://t.co/srFo8bBDlb https://t.co/QA6ggYN3Js"
Abdee,2020-11-27 20:08:03,"Polres Palu Temukan Teh Cina Berisi 19 Kilogram Sabu, Pemiliknya Seorang Pemuda 26 Tahun https://t.co/oGjKDrGevt https://t.co/Pdd5qSHkHm"
Abdee,2020-11-27 20:08:02,"Update Covid-19 Sulteng Per 27-11-2020: Ketambahan 39 Kasus Baru, 2 Meninggal, 34 Sembuh https://t.co/30Val9Juwi https://t.co/lIgcWT0cR0"
Abdee,2020-11-27 11:02:33,"Terima Laporan Tuntutan Kasus Narkoba di Kejati Tak Sesuai Aturan, Kejagung: Sulteng Salah Satunya https://t.co/IJQEk95Esx https://t.co/j63gCZznV9"
Abdee,2020-11-26 20:07:03,"Update Covid-19 Sulteng Per 26-11-2020: Ketambahan 13 Kasus Baru, 2 Meninggal dan 36 Sembuh https://t.co/QgV524B6mR https://t.co/kClfNsZwU0"
Abdee,2020-11-26 20:07:02,Breaking News: Gudang di Jalan Tanamea Kota Palu Terbakar https://t.co/o08rUgreNp https://t.co/rEAcBc2XJP
Abdee,2020-11-26 11:01:02,"Update Covid-19 Sulteng Per 25-11-2020: Ketambahan 55 Kasus Baru, 4 Meninggal dan 12 Sembuh https://t.co/3lUs57Gq37 https://t.co/bwfBC4By0e"
Abdee,2020-11-25 20:04:33,"Cegah Covid-19, Ruang Pelipatan dan Sortir Surat Suara Pilkada Toli Toli Disemprot Disinfektan https://t.co/2kQjbLPU4u https://t.co/mSqOsdQM50"
Abdee,2020-11-25 20:04:33,Bawaslu Catat 68 Kasus Pelanggaran Netralitas ASN di Pilkada Sulteng 2020 https://t.co/IsGfAUVmlF https://t.co/s2TMMxwIsn
Abdee,2020-11-25 10:59:02,‘La Bolong’ Buaya Ukuran 4 Meter di Sojol Berhasil Dievakuasi BKSDA Sulteng https://t.co/F9vRNHGwYr https://t.co/7c1x1sBHF4
Abdee,2020-11-24 20:02:34,"Jelang Pilkada 2020, Personel Polres Palu Diberi Pelatihan Pengendalian Massa https://t.co/cC60cHJnpe https://t.co/iuSDoiw5uR"
Abdee,2020-11-24 20:02:33,Acuh Terhadap Protap Penyebab Tingginya Kasus Corona di Poso https://t.co/MC6fWczKx8 https://t.co/Oi1yobHCfX
Abdee,2020-11-24 07:59:01,"Jelang Pilkada, Polres Toli Toli Razia Penginapan dan Tempat Hiburan Malam https://t.co/CxsmRHSOsN https://t.co/7ziQu29uz1"
Abdee,2020-11-23 20:01:03,BRI Poso Serahkan Beasiswa Bantuan Indonesia Cerdas untuk Mahasiswa UNSIMAR dan STIKES Husada Mandiri https://t.co/JJvichxdLB https://t.co/ao4KMZ5Tic
Abdee,2020-11-23 20:01:02,Lima Warga Donggala Terjaring Razia di Palu Akibat Membawa Sabu https://t.co/jB8LnVznW9 https://t.co/7MK2r4loUa
Abdee,2020-11-23 07:56:33,"Diduga Pengguna dan Pengedar Sabu, Tujuh Perempuan di Palu Diamankan Polisi https://t.co/YOMN7gYpZs https://t.co/QEcLUj65rz"
Abdee,2020-11-22 19:59:03,Pemkab Parigi Moutong dan DPRD Setujui KUA dan PPAS APBD Tahun Anggaran 2021 https://t.co/GRgYKzTx7l https://t.co/MqhEhtg3ps
Abdee,2020-11-22 19:59:02,Warkop Sudimari K5 Siapkan Wifi dan Permainan Biliard Gratis https://t.co/ZffXB0woXb https://t.co/IwFMF8He4q
Abdee,2020-11-22 07:54:02,Panin Peduli Bantu Rumah Ibadah dan Diffabel https://t.co/VwuwqaTRsJ https://t.co/ci8W5vFLQw
Abdee,2020-11-21 19:58:04,PT Bank Mega Syariah Palu Dorong Progam Digital Banking untuk Berikan Edukasi Nasabah https://t.co/Xs3XkII6oB https://t.co/t4wmjuJsu8
Abdee,2020-11-21 19:58:02,"Update Covid-19 Sulteng Per 20-11-2020: Ketambahan 59 Kasus Baru, 4 Meninggal dan 4 Sembuh https://t.co/gL6m1WpYSH https://t.co/v0xj7YChxN"
Abdee,2020-11-21 07:51:32,Update Covid-19 Sulteng Per 20-11-2020: Ketambahan 4 Kasus Baru dan 23 Dinyatakan Sembuh https://t.co/VREwPFLvIx https://t.co/DDpUSKPKrc
Abdee,2020-11-20 16:55:34,"Terkonfirmasi Positif Covid-19, Kondisi Kesehatan Anwar Hafid Mulai Membaik https://t.co/OS5PsPnAqc https://t.co/ikeFYM5hn7"
Abdee,2020-11-20 16:55:33,ACT Sulteng Kukuhkan Pengurus MPPI https://t.co/3gzakwc8kL https://t.co/eilpKlmrsg
Abdee,2020-11-20 07:50:02,Panglima TNI Dikukuhkan Sebagai Ketua Umum FORKI https://t.co/ceadRV14RM https://t.co/12e73zXL5C
Abdee,2020-11-19 16:53:04,"Oktober 2020, Sulteng Inflasi 0,26 Persen https://t.co/JSIui4ZHT8 https://t.co/GMrdo9PRTH"
Abdee,2020-11-19 16:53:03,"Job Matching SMK N 3 Palu, Legakan Para Pencari Kerja di Tengah Pandemi https://t.co/DikkjfpH2U https://t.co/T0pMdpx16V"
Abdee,2020-11-19 07:47:33,"Dikuburkan Polisi, Makam Terduga Teroris Akan Digali Lagi oleh Keluarga https://t.co/pe8sVPAKWq https://t.co/nJQTIc12io"
Abdee,2020-11-18 16:51:34,8 Bulan Raih 68 Medali Nasional https://t.co/h4ROKwsDn2 https://t.co/C2e2K4iiSC
Abdee,2020-11-18 16:51:33,Kodim 1307 Poso Gelar Kegiatan Peningkatan Kemampuan APKOWIL Para Babinsa https://t.co/00G0Z8mOfS https://t.co/A020PE0Swf
Abdee,2020-11-18 07:44:32,Dua Jenazah Anggota MIT Poso Tiba di RS Bhayangkara Polda Sulteng https://t.co/hYB8gn9t0l https://t.co/xEhPuymVj2
Abdee,2020-11-17 16:48:02,Bea Cukai Palu Tindak Pabrik Pembuat Minuman Alkohol Ilegal di Pengawu https://t.co/cbqdy3gk4A https://t.co/o293YoxIeu
Abdee,2020-11-17 10:49:32,"Kepala BNN Poso Terkonfirmasi Covid-19, Aktifitas Perkantoran Ditutup Sementara https://t.co/gtaouYwdAq https://t.co/zukWLeCdIx"
Abdee,2020-11-17 07:42:33,"Sempat Dikepung di Mamboro, Dua Anggota Kelompok MIT Tewas Tertembak di Parigi Moutong https://t.co/cmnc0gQnIW https://t.co/bqvxq3m8Nk"
Abdee,2020-11-16 16:45:33,Plt Bupati Sigi Sampaikan Nota Pengantar R-APBD 2021 https://t.co/lULfea0O6m https://t.co/NT8gK8rh81
Abdee,2020-11-16 10:45:32,Korem 132 Tadulako Rebut Juara Satu Open Turnamen Tenis Siranindi Vl 2020 https://t.co/jirpdMWxcc https://t.co/uqqTXmB4G0
Abdee,2020-11-15 19:44:03,KAHMI Touna Bangun Graha Insan Cita https://t.co/h18bvGhuKZ https://t.co/DiYt2EbBZp
Abdee,2020-11-15 16:43:02,Update Covid-19 Per Tanggal 14 November 2020: 8 Kasus Baru dan 21 Dinyatakan Sembuh https://t.co/LrzXsddwD4 https://t.co/eJFvGFpJOa
Abdee,2020-11-15 10:43:03,Ratusan Personel Polisi Disiagakan Dalam Debat Terbuka Putaran II Cagub dan Cawagub Sulteng https://t.co/UNtdcfLHfx https://t.co/DVj0do5tO0
Abdee,2020-11-14 19:37:03,223 Pemuda Terbaik Sulteng Lulus Seleksi Bintara Polri https://t.co/JN1gxmbQ0w https://t.co/no6gtUpDnA
Abdee,2020-11-14 10:41:02,PDIP Alihkan Dukungan ke Paslon Darmin-Amjad di Pilkada Poso https://t.co/fQbIvFzngl https://t.co/VOx1WIhBv8
Abdee,2020-11-14 10:41:02,"Niat Tulus Mengangkat Pelaku UKM, Eddy Siap Bertarung Rebut Ketum HIPMI Poso https://t.co/8Qg8EGm6fs https://t.co/IK0Sa4TTLh"
Abdee,2020-11-13 19:34:03,Aliansi Sulteng Sebut 33.982 KK Belum Miliki Hunian Layak Pasca 2 Tahun Bencana https://t.co/x3LBjSsVtW https://t.co/kY7u4NdClg
Abdee,2020-11-13 10:39:03,PT. Hengjaya Mineralindo Diminta Keluarkan Cetak Biru PPM https://t.co/RrqsxUICSQ https://t.co/YtobvviSmZ
Abdee,2020-11-13 10:39:02,Pemda Poso Kembali Terima Piagam Penghargaan Opini WTP Tahun 2019 https://t.co/9vQxhiQX9j https://t.co/lAk92O10zy
Abdee,2020-11-12 19:32:02,Satlantas Polres Palu Bagikan 5000 Masker Selama Operasi Zebra https://t.co/7RfBCORsHn https://t.co/hPyZoQKh49
Abdee,2020-11-12 10:37:34,"Worshop Marketing Online Berakhir, Pelaku IKM Dikawal Hingga Program Berhasil https://t.co/KG1Sz2Gh5H https://t.co/tPCleKGWAf"
Abdee,2020-11-12 10:37:33,Wabup Badrun Nggai Kukuhkan Pengurus Komda Lansia Parigi Moutong https://t.co/b1XhtYGZKI https://t.co/BHDJL1KmC7
Abdee,2020-11-11 19:30:33,"Tingkatkan Disiplin Anggota, Sie Propam Polres Palu Gelar Gaktibplin https://t.co/TO18MlpeTa https://t.co/UFEiWjrW40"
Abdee,2020-11-11 10:36:03,"SPN Morowali Gelar Aksi Unjukrasa, Desak Pemerintah Naikan Upah Minimum https://t.co/0lc3jNNTDP https://t.co/qWcXaBNtTy"
Abdee,2020-11-11 10:36:02,Pengunjung Taman Likuefaksi Sigi Wajib Terapkan Prokes https://t.co/nfwJ86ieRM https://t.co/zIZwXnQGme
Abdee,2020-11-10 19:29:03,"Jadi Terdakwa, Yahdi Basma Bisa Diberhentikan Sementara sebagai Anggota DPRD Sulteng https://t.co/lnkPeuDXs6 https://t.co/88PbjSHfhz"
Abdee,2020-11-10 10:33:03,"Kunker ke Palu, Doni Monardo Minta Warga Patuhi Larangan Membangun di Kawasan Zona Merah https://t.co/JtDXXcEILY https://t.co/FI3i4z5cqe"
Abdee,2020-11-10 10:33:02,Luncurkan Forum KEREN Sulteng Dirangkai Tabur Bunga di TMP https://t.co/70hxBBZ6xg https://t.co/rSy8EzLOKH
Abdee,2020-11-09 19:27:33,20 Personel Polisi Amankan Kampanye Hidayat-Bartho di Tawaeli https://t.co/bMcSZM5CyV https://t.co/Vity2z7pDg
Abdee,2020-11-09 10:30:03,54 Dosen Tarbiyah Universitas IAIN Palu Diberi Pelatihan Menulis Jurnal International https://t.co/TNfBAJNJ72 https://t.co/rMGu6WAIaT
Abdee,2020-11-09 10:30:03,Operasi Pencarian 4 Korban Tenggelam di Perairan Banggai Laut Dihentikan https://t.co/oHvKqxT4da https://t.co/oNKX6smuNk
Abdee,2020-11-08 19:26:03,"Sulteng Ketambahan 59 Pasien Positif Covid-19, Morowali Sumbang 21 Kasus https://t.co/zXs6x2iyM3 https://t.co/MmOKEeJ2JO"
Abdee,2020-11-08 10:28:03,Upaya Guru di Palu Ajak Peserta Didik Torehkan Prestasi di Tengah Pandemi https://t.co/0nPUH9fuZ0 https://t.co/3m833mr8tZ
