username,created_at,text
Abdee,2021-03-21 14:14:34,BNN Palu Gandeng Lembaga Adat Tekan Peredaran Narkoba https://t.co/LBdiJFyODz https://t.co/xCcI1jtQ10
Abdee,2021-03-20 17:20:04,DPW Perindo Sulteng Mulai Lakukan Pembenahan https://t.co/qdAEdYmMZh https://t.co/seh7goFg2j
Abdee,2021-03-19 23:16:02,2.000 Lebih Guru di Kota Palu Telah Jalani Vaksinasi Covid-19 https://t.co/Grr6ejZnxi
Abdee,2021-03-19 23:16:02,"Muscab ISSI Palu, Helmy Umar Terpilih Secara Aklamasi https://t.co/c3eoRUqVJD"
Abdee,2021-03-18 17:01:04,Sulteng Dukung Jenderal Listyo Sigit Jadi Ketum PB ISSI https://t.co/PXpiQbDNn5 https://t.co/OfmGpuRsg7
Abdee,2021-03-18 10:56:05,DPRD Parigi Moutong Laksanakan Vaksinasi Covid-19 Tahap Pertama https://t.co/8QNHEJZMrr https://t.co/gxeGSqFVvu
Abdee,2021-03-18 10:56:04,"Kejari Morowali Musnahkan 34,83111 Gram Sabu dan 760 Butir Pil THD https://t.co/WSeZ6iSox7 https://t.co/P4NQWFxnGe"
Abdee,2021-03-17 13:58:04,Pemkot Palu Tunda Pembelajaran Tatap Muka di Bulan April https://t.co/0XBlyMktRj https://t.co/0VPPWo3kpI
Abdee,2021-03-17 10:54:34,DPD Demokrat Sulteng Serahkan Dokumen Sah ke Kemenkumham https://t.co/FnaWMeguwl https://t.co/4DN5zLrE03
Abdee,2021-03-17 10:54:33,Giliran Wartawan di Palu Disuntik Vaksin Covid-19 https://t.co/ljwiRrKnRB https://t.co/GelIhoIAOu
Abdee,2021-03-16 13:55:03,Disperindag Palu Ingatkan Jual Gas 3 Kg di Atas HET Akan Disanksi https://t.co/dHylp3sqzN https://t.co/RrjHXdv5Da
Abdee,2021-03-16 07:52:35,Disperindag Palu Lakukan Pengawasan Bahan Pokok Jelang Ramadhan https://t.co/BtKAA8X6ud https://t.co/sbQmJpIkb1
Abdee,2021-03-16 07:52:33,340 Personel Polres Poso Divaksinasi Covid-19 Tahap Pertama https://t.co/YfzeidZ3xq https://t.co/JnEvhAWvun
Abdee,2021-03-15 10:54:06,Kalla Toyota Ajak Warga Manfaatkan Program PPnBM 0% https://t.co/Zwya9tUM0V https://t.co/eAkVqzewcy
Abdee,2021-03-15 07:50:35,Saka Bhayangkara Polsek Dolo Siap Respon Bencana https://t.co/NDyy7fWbvA https://t.co/w9CfZl3jHz
Abdee,2021-03-15 07:50:34,"Lolos Seleksi SIP, 34 Personel Polda Sulteng Berangkat Pendidikan https://t.co/3woIsZwST6 https://t.co/BuxJ6v8Zj9"
Abdee,2021-03-13 19:58:33,Aplikasi Pengaduan Masyarakat Segera Diluncurkan Pemkot Palu https://t.co/FR1faTOQyP https://t.co/WR2FXpk14O
Abdee,2021-03-12 20:02:05,"Sambut Nyepi Tahun Saka 1943, Umat Hindu di Palu Ibadah Melasti Terbatas https://t.co/bhLasAhio9 https://t.co/oxhuGUlD9H"
Abdee,2021-03-12 20:02:03,Satu Operator Alat Berat Ditahan Polisi Terkait Kasus PETI Buranga https://t.co/suZ0VuRHBx https://t.co/o4IoPQyRlM
Abdee,2021-03-12 13:55:33,"Penyelesaian Polemik PT Poso Energy dan Warga, Wabup Yasin: Prioritas Pemda https://t.co/zaj4lYeMwl https://t.co/ocduljWO0I"
Abdee,2021-03-11 19:59:33,"Viral Video Bocah Dipaksa Orang Tua Berjualan, Anggota DPRD Palu Ingatkan Ini https://t.co/wIIaEN69c8 https://t.co/S6UdC42CSs"
Abdee,2021-03-11 16:59:02,"Dukung Kreativitas Milenial, Walikota Palu Akan Bangun Gedung Kesenian https://t.co/zjS4EnR1vK https://t.co/uD8F8px485"
Abdee,2021-03-10 20:00:03,"Lagi, Polsek Bahodopi Ringkus Dua Orang Pengedar Sabu di Kos-kosan Bahomakmur https://t.co/6zLTHaHpSA https://t.co/W6XOtxayEd"
Abdee,2021-03-10 16:58:04,"Berdayakan Masyarakat Lokal, Lukito: PT SCEM Jadi Tumpuan Prekonomian https://t.co/mDsQaQsGk1 https://t.co/8JyTBEpIzv"
Abdee,2021-03-10 16:58:03,"Seorang Bocah Diduga Pengemis Diamankan Satpol PP, Trisno: Dia Dipaksa https://t.co/Mtxtqlm7mz https://t.co/vi0EKwJaQO"
Abdee,2021-03-09 19:56:04,"Lokasi Huntap Masih Bermasalah, Pihak-pihak Tak Becus Harus Dievaluasi https://t.co/DigwyLYIk9 https://t.co/01faIrVDHE"
Abdee,2021-03-09 16:56:05,Dinas PMPTSP Morowali Tempati Kantor Baru https://t.co/F7mCLRTckQ https://t.co/uoa9e3iHr1
Abdee,2021-03-09 16:56:03,Paripurna DPRD Morowali Agendakan Pembahasan Penyampaian Pokok Pikiran https://t.co/v9BEDweYDB https://t.co/0qwq9eSJbx
Abdee,2021-03-08 17:00:04,Mimbar Bebas Solidaritas Perjuangan Perempuan Palu Peringati Internasional Women’s Day https://t.co/EWNphei2m6 https://t.co/bYgmxucvrb
Abdee,2021-03-08 07:56:03,"Luhut Minta Tak Ada Pembangunan Infrastruktur di Palu, Walikota: Pak Menteri Harus Lebih Bijak https://t.co/ynChegUhyU https://t.co/13yVEAt3CL"
Abdee,2021-03-08 07:56:03,"Pemadaman Listrik di Morowali Memprihatinkan, Anwar Hafid: Butuh Kerjasama Pemda dan PLN https://t.co/5mNEx4zfNX https://t.co/W9w5ooEcIE"
Abdee,2021-03-07 16:58:31,Kolom Anda : IMPLEMENTASI KEPEMIMPINAN MELALUI KETELADANAN ( LEADING BY EXAMPLE ) https://t.co/nm5tLORCIj
Abdee,2021-03-06 19:57:03,OTK Penembak Nelayan di Morowali Ternyata Petugas PSDKP Bitung yang Menyamar https://t.co/vBcjBAZgkG https://t.co/sqra7rEW2q
Abdee,2021-03-06 19:57:02,"Tekan Angka Kekerasan Terhadap Anak, DP3A Sulteng: Butuh Peran Organisasi Perempuan https://t.co/5TpQUOmXCC https://t.co/HEWeP3LVD6"
Abdee,2021-03-06 16:56:33,Komunitas Trash https://t.co/auhINY7CQV Bersihkan Sampah di Bantaran Sungai Pondo Palu https://t.co/RQUbNBqMda https://t.co/ogFiWxGbsA
Abdee,2021-03-05 17:02:33,Seorang Perawat di Morowali Meninggal Dunia Usai Terseret Minibus https://t.co/lvHbGHCxz5 https://t.co/2BgEIIhRMt
Abdee,2021-03-05 17:02:32,SDC Mengutuk Keras Aksi Penembakan Nelayan di Morowali https://t.co/RJgiVqSUMc https://t.co/kAVU8FjnCs
Abdee,2021-03-05 08:03:02,Warga Bahodopi Temukan Mayat Anak Terbawa Arus Sungai https://t.co/Xm0SDwriqT https://t.co/hNZn9r6hQM
Abdee,2021-03-04 14:07:03,"Anwar Hafid : Pemilik Suara Partai Demokrat Sulteng Solid Dukung AHY, Tolak Rencana KLB Ilegal Inkonstitusional https://t.co/pvb4mLqB1P https://t.co/fXn6uggL95"
Abdee,2021-03-04 11:09:32,Tiga Kapal Penangkap Ikan di Morowali Diamankan https://t.co/7QcfbK7Ebh https://t.co/dqNUKd9RjJ
Abdee,2021-03-03 17:11:33,Mayoritas Pengurus DPD &amp; DPC Partai Demokrat Masih Solid Dibawah Kepemimpinan Anwar Hafid https://t.co/tchYJgHMI1 https://t.co/bPeACh4PkJ
Abdee,2021-03-03 14:05:03,"Kontak Senjata dengan Kelompok Ali Kalora di Poso, Satu Anggota Brimob Gugur https://t.co/ajlkQ0gSS9 https://t.co/3OuZl0QgJV"
Abdee,2021-03-03 11:07:04,"Jelang Ramadhan Huntap Pombewe masih Bermasalah, Balai P2W Sulteng Disebut Tak Berdaya https://t.co/wsZNSjjNm8 https://t.co/2FJurcBUFA"
Abdee,2021-03-02 17:07:33,"Tersisa Sembilan Orang, Kapolda Sulteng Sayangkan Masih Ada Simpatisan DPO MIT Poso https://t.co/2xGFFdkiv5 https://t.co/Ctl5pr2YhT"
Abdee,2021-03-02 11:05:33,"Musrenbang RKPD 2021 Balaesang, Makmur : Wujudkan Visi Misi Bupati Donggala https://t.co/ZriR4OU0Sl https://t.co/69oNRPKImP"
Abdee,2021-03-02 11:05:32,Guru Honorer di Poso Ini Mampu Biayai Kuliah S2 dari Profesi Ojol https://t.co/B17NGbkuDe https://t.co/pfHc9kV70O
Abdee,2021-03-01 14:04:03,"Lima Komisoner KPU Poso Mulai Diperiksa DKPP, Pengadu: Jika Pelanggarannya Fatal, Kami Minta Dipecat https://t.co/l5HWTE8fTQ https://t.co/1plddlJcVa"
Abdee,2021-03-01 11:04:03,Tim SAR Temukan Satu Jenazah yang Tertimbun di Lokasi Longsor PETI Buranga https://t.co/cPlYYxvHhR https://t.co/i8sWk3zPb2
Abdee,2021-03-01 11:04:02,"Anniversary ke-3, Ancyra Hotel Poso Sediakan Kamar Promo Diskon 15 Persen https://t.co/u2L1t81qGB https://t.co/jij0ywOZHO"
Abdee,2021-02-28 14:03:33,"Polsek Bungku Tengah Gelar KRYD, Sebanyak 94 Botol Cap Tikus Disita https://t.co/4WBsMmDPpj https://t.co/EM7jYh9u3S"
Abdee,2021-02-27 17:03:33,"Polsek Bungku Tengah Akan Operasi dan Patroli Secara Rutin, Kapolsek: Mari Jaga Kepercayaan Masyarakat https://t.co/ZSX0ToDW3E https://t.co/Yn4dGKDXIL"
Abdee,2021-02-27 17:03:33,"MLM Ourcitrus Hadir di Poso, Member Disebut Bisa Raup Omzet Hingga Ratusan Juta Rupiah https://t.co/enNSX6bIWE https://t.co/M1iEiPvK46"
Abdee,2021-02-27 14:02:03,VIDEO: Petugas SAR Temukan Potongan Tubuh di Lokasi Longsor PETI Buranga https://t.co/MxudFmqXJw https://t.co/1kNNpHCCiM
Abdee,2021-02-26 16:59:04,Walhi Temukan 14 Excavator di Tambang Emas Ilegal Parigi Moutong https://t.co/ijFQxlnkX8 https://t.co/mwB0OMEYlc
Abdee,2021-02-26 16:59:03,VIDEO: Polisi akan Lakukan Proses Hukum Pasca Longsor di PETI Buranga https://t.co/wwTd5IN1it https://t.co/aerhT2Pb25
Abdee,2021-02-26 14:00:02,"Ekspor Perdana 2021, 1,6 Ton Rempah-rempah Sulteng Terbang ke Negeri Matahari Terbit https://t.co/VJSGNkXdVu"
Abdee,2021-02-25 16:58:04,Polisi Janji Usut Peristiwa Longsor di Lokasi PETI Buranga https://t.co/PZ5MIFqnRt https://t.co/XNSm9Nqg6i
Abdee,2021-02-25 16:58:03,Pemda dan Aparat Diminta Segera Tutup Tambang Ilegal di Parigi Moutong https://t.co/0MExzfhBzn https://t.co/oe6w8hOd1C
Abdee,2021-02-25 13:58:03,Pencarian Puluhan Korban Tertimbun Longsor di PETI Buranga Terkendala Lumpur https://t.co/GLTUgxd44R https://t.co/waKLgueGPy
Abdee,2021-02-24 16:55:03,"Pimpin Sertijab, Kapolres Banggai : Dilantik, Harus Siap Diganti https://t.co/FvtX9h0Hb7 https://t.co/eR7cyD5S3c"
Abdee,2021-02-24 16:55:02,"Pasien di RSUD Undata Beli Perlengkapan Cuci Darah Mandiri, Ada Apa? https://t.co/lm2lkjcxrg https://t.co/rlrlqCtQzi"
Abdee,2021-02-24 13:56:02,Polsek Bahodopi Ringkus Pemuda Pengedar Sabu di Kos-kosan Bahomakmur https://t.co/gNkV3mZo1f https://t.co/TWvAw4udON
Abdee,2021-02-23 16:53:03,Polres Morowali Gelar Sertijab Empat Kasat dan Satu Kapolsek https://t.co/ngrDeQXXpv https://t.co/5yTiL4V4N3
Abdee,2021-02-23 13:54:04,"Berpamitan, Darmin ke Pimpinan OPD : Layani Masyarakat Poso Sepenuh Hati https://t.co/TymE8VPWp4 https://t.co/qhCDyYiEu0"
Abdee,2021-02-23 13:54:03,PLN Ampana Jamin Tak Ada Pemadaman Listrik di Bulan Ramadhan https://t.co/hRNX61g0cT https://t.co/oY7XVWnXE4
Abdee,2021-02-22 13:52:05,Turun Tangan Bersihkan Sampah Menumpuk di Lokasi Likuifaksi Balaroa Palu https://t.co/y731c9SOyp https://t.co/ypnFqbyxas
Abdee,2021-02-22 13:52:04,"HPSN 2021 di Morowali, Desa Didorong Jadi Pilot Project TPS3R https://t.co/FrJYghL2ry https://t.co/eKBU4UnpS2"
Abdee,2021-02-22 13:52:03,KONI Poso : Esports Harus Bisa Merangkul Pemuda Berprestasi https://t.co/BmcvrrCsRn https://t.co/HlgA9zqQLB
Abdee,2021-02-21 13:50:04,"Atasi Krisis Air Bersih, PT CPM-Bakrie Amanah Salurkan Alat Pemurni Air https://t.co/55gyw0KwDm https://t.co/B2Dgg4v1zC"
Abdee,2021-02-21 13:50:03,"Kunjungan Kerja Panglima TNI dan Kapolri, Danlanal Palu: Pengejaran Kelompok MIT Masih Terus Dilakukan https://t.co/58BDXpgdGn https://t.co/sTwmuN5Fzt"
Abdee,2021-02-21 13:50:02,"Talk Show Manfaat Bantuan Sosial, PWI Poso Hadirkan Dinsos dan PT Pos https://t.co/DbH3B36SXZ https://t.co/Q3pKameEOh"
Abdee,2021-02-20 10:59:04,Hadi-Reni Ditetapkan Jadi Walikota dan Wakil Walikota Palu https://t.co/NufRVwLr1r https://t.co/xj5dHXP27j
Abdee,2021-02-20 10:59:02,KPU Tetapkan Verna-Yasin Pemenang Pilkada Serentak Poso https://t.co/lRKUKxifJA https://t.co/ro3DLkmh0W
Abdee,2021-02-19 19:53:03,Pengurus MUI Bungku Dorong Pengurusan Jenazah Sebagai Materi Agama Anak Didik https://t.co/C83bHNfwW7 https://t.co/qTE1mABjBJ
Abdee,2021-02-19 10:56:04,Kejari Palu Tetapkan Tiga Tersangka Kasus Dugaan Korupsi Pembebasan Lahan Jembatan Lalove https://t.co/dLWpgFmjge https://t.co/hPm4e7d0pY
Abdee,2021-02-19 10:56:03,"Musrenbang Bungku Pesisir, Wabup Najamudin : Realisasi Program Dilakukan Secara Bertahap https://t.co/fZ0W3GF9td https://t.co/8lcbHKsppI"
Abdee,2021-02-18 16:53:03,Peternak Ayam Palu Keluhkan Anjloknya Harga Telur https://t.co/luultHTN9Y https://t.co/XnbjYNvlkE
Abdee,2021-02-18 10:53:34,"Sikapi Kenaikan Harga Gas Elpiji 3 Kg, DPRD dan Pemkab Morowali Gelar RDP https://t.co/7Z2TVPd27w https://t.co/ZBWvqCAhah"
Abdee,2021-02-18 10:53:33,"Gelar Strong Poin Arus Lalulintas, Satlantas Polres Morowali Tetap Beri Imbauan Prokes https://t.co/T0dbjBXSuh https://t.co/dQxziK0rH3"
Abdee,2021-02-17 16:51:03,"Gelar Strong Poin Arus Lalulintas, Satlantas Polres Morowali Tetap Beri Imbauan Prokes https://t.co/A6XZbNeksR https://t.co/Rq6GXSMPP4"
Abdee,2021-02-17 10:52:03,DPRD FC Taklukkan PT IMIP FC dengan Skor 5-3 Melalui Drama Adu Finalty https://t.co/cAm4vNNXPd https://t.co/lZxOPsxM6r
Abdee,2021-02-17 10:52:02,Pengendara Motor Asal Palu Meninggal Dunia Akibat Tabrakan dengan Minibus https://t.co/CQiea9J8C2 https://t.co/cDBo3PQnXY
Abdee,2021-02-16 10:50:05,Danlanal Palu Hadiri Vidcon Rapim TNI-Polri di Mapolda Sulteng https://t.co/bqjGurxgX8 https://t.co/MH0VXxGaAw
Abdee,2021-02-16 10:50:04,"Buka Musrenbang Bungku Barat, Najamudin : Harus Terakomodir dalam Visi Misi https://t.co/xMcgZsvMHv https://t.co/papEvfEFMg"
Abdee,2021-02-16 10:50:03,Sayutin Budianto : Pemkab dan Polres Parigi Moutong Harus Lakukan Investigasi PETI Buranga https://t.co/OYw5Yadx2h https://t.co/NKA0S0mPwI
Abdee,2021-02-15 10:47:04,"Kasus Surat Rapid Palsu, Polres Palu Masih Lakukan Proses Penyelidikan https://t.co/wHJGKWABWd https://t.co/1IxiwpfraH"
Abdee,2021-02-15 10:47:03,"Buka Kembali Pendaftaran Stimulan, BPBD Palu: Ini untuk yang Belum Terdaftar https://t.co/r0yJQSmRLX https://t.co/9h6AcsEsbf"
Abdee,2021-02-15 10:47:02,Begini Skenario Vaksinasi untuk Lansia di Sulteng https://t.co/hsJPqncZhu https://t.co/1utPCAjN1e
Abdee,2021-02-13 19:56:04,"Tak Ada Penataan, Jalan Poros Sulteng-Sultra Terhalang Lumpur Tambang PT CBP https://t.co/xVUeCle6Ga https://t.co/CGjBOJQveG"
Abdee,2021-02-13 19:56:02,"Morut dan Touna Belum Masuk Daftar Putusan Sela Perkara Pilkada di MK, Ada Apa? https://t.co/FMFUw8DNPg https://t.co/wr63XGxtP8"
Abdee,2021-02-12 16:53:02,Melihat Lebih Dekat Perayaan Tahun Baru Imlek di Kota Palu https://t.co/3pwGFhL956 https://t.co/bfr0AvZT21
Abdee,2021-02-12 04:56:33,"Meresahkan, Klinik Agung Palu Minta Polisi Usut Tuntas Oknum Pembuat Surat Rapid Palsu https://t.co/376L4Nu6Oj https://t.co/3ZNXiaDlAP"
Abdee,2021-02-12 04:56:32,"Peringati HPN, PWI Banggai Gelar Kampanye Kewaspadaan Transmisi Lokal Covid-19 di Kalangan Wartawan https://t.co/EQu6xp8iRJ https://t.co/2xGZhiers2"
Abdee,2021-02-11 13:49:33,"Peringatan HPN 2021, Kapolres Poso Ajak Wartawan Bangun Sinergitas https://t.co/YxeaK6axlZ https://t.co/kUFdVxhh9b"
Abdee,2021-02-11 04:54:03,Komorbid Jadi Kendala Vaksinasi Covid-19 untuk Nakes di Palu https://t.co/ak4n3wMhcw https://t.co/pR4ZNycOTd
Abdee,2021-02-11 04:54:02,Omzet Penjualan Pernak-Pernik Imlek di Palu Menurun Akibat Pandemi https://t.co/iTJWi59JaK https://t.co/CF2w8nAXUV
Abdee,2021-02-10 13:48:03,Ketua DPC PDI-P Parigi Moutong Resmi Jadi Tahanan Jaksa https://t.co/07x6c692d2 https://t.co/7vylCHbmLB
Abdee,2021-02-10 04:51:34,One Care Nutrisi Nusantara Salurkan Bantuan Sayur-sayuran Bagi Korban Gempa Sulbar https://t.co/w8aGvxC13n https://t.co/W7Xl2C6Op4
Abdee,2021-02-10 04:51:33,"Kunjungi UNTAD Palu, Sakinah Aljufri Serahkan Bantuan Beasiswa https://t.co/NcfS6bz5VN https://t.co/xyF5vsSrQn"
Abdee,2021-02-09 10:47:32,Rumah dan Gedung Pasar di Pulau Dua Morowali Roboh Dihantam Puting Beliung https://t.co/ZtwkKwAGmV https://t.co/qhWLUBY8xJ
Abdee,2021-02-09 04:49:33,"Ungkap Sindikat Peredaran Narkoba Internasional, Sembilan Personel Polsek Balesang Dapat Penghargaan https://t.co/Xyhk7Jx8Kx https://t.co/2TDGAZIfUA"
Abdee,2021-02-09 04:49:32,Sayutin Budianto : Informasi Vaksinasi Covid-19 di Parigi Moutong Jangan Batasi https://t.co/LKMazS2raE https://t.co/gMqvMHTUSk
Abdee,2021-02-07 16:49:05,DKPP RI Dipastikan Segera Menggelar Sidang Sengketa Pilkada Poso https://t.co/sd1ytGRbuO https://t.co/M5p6yECJrB
Abdee,2021-02-07 16:49:04,"Polres Morowali Operasi Rutin, Imbau Masyarakat Tetap Patuhi Protokol Covid-19 https://t.co/7lCQ9w8I0l https://t.co/Q2tThJF8LG"
Abdee,2021-02-07 16:49:03,Intip Kesibukan Warga Tionghoa Palu Sambut Tahun Sapi di Kala Pandemi https://t.co/u0zowHwK1C https://t.co/cCDgO7Mbss
Abdee,2021-02-06 13:46:02,Menilik Masalah Sampah di Palu yang Kian Pelik https://t.co/UmCc9NCawn https://t.co/c0Mr4o0iUN
Abdee,2021-02-05 19:48:34,Ratusan Warga di Parigi Moutong Terjaring Operasi Yustisi https://t.co/CDMbEhfXl4 https://t.co/upE9JH4VDE
Abdee,2021-02-05 19:48:33,Personel Gabungan di Morowali Lakukan Penyemprotan Disinfektan https://t.co/LEk1KwX8wx https://t.co/abXukjaT87
Abdee,2021-02-05 13:43:32,"Tak Bisa Bayar Utang, Ibu Ini Lapor Dijambret https://t.co/Y9X01MKwjg https://t.co/wodh3Tis7r"
Abdee,2021-02-04 19:46:03,Sayutin Budianto : Pemkab Parigi Moutong Harus Berhati-hati soal Dana Rp30 Miliar https://t.co/TzKwPMGAAT https://t.co/I3p6n6RDDE
Abdee,2021-02-04 19:46:02,Polisi Tangkap Lima Terduga Judi Kartu Remi di Parigi Moutong https://t.co/KvhW2os4BP https://t.co/GLD57Q1Lrz
Abdee,2021-02-04 13:41:32,"Akui Belajar Jarak Jauh Tidak Maksimal, Dinas Pendidikan Poso: Keselamatan Siswa Lebih Berarti https://t.co/8WrgzlGEdF https://t.co/zrjI0B5EFP"
Abdee,2021-02-03 19:44:03,Begal Bermodus Hipnotis Bikin Resah Warga Bahodopi https://t.co/VKOWPp3mU8 https://t.co/qzN51ckuyL
Abdee,2021-02-03 19:44:02,"Curi Kulkas, Oknum ASN di Tolitoli Ditangkap Polisi https://t.co/ETu85ZsPYy https://t.co/vgOzo2KGl7"
Abdee,2021-02-03 13:38:03,Pelaksanaan Ibadah Haji 2021 Masih Tunggu Keputusan Menteri https://t.co/YEQKtWXjps https://t.co/CQrjcrMapG
Abdee,2021-02-02 19:42:33,Polisi Janji Tindak Tegas Aksi Balapan Liar di Poso https://t.co/HEeXDbjPg9 https://t.co/DlpswCo8ey
Abdee,2021-02-02 19:42:32,Patroli Polres Morowali Sambangi Tempat Keramaian dan Beri Imbauan Prokes https://t.co/AUZzKcBOWp https://t.co/2t5ZpNT4w4
Abdee,2021-02-02 13:36:02,Bank Muamalat Luncurkan Fitur QRIS di Aplikasi Mobile Banking https://t.co/elra4FCux1 https://t.co/3eeBDBA0dW
Abdee,2021-02-01 19:40:04,Pemkot Palu Alokasikan Dana Penanganan Covid-19 Rp1 Miliar Lebih https://t.co/YGaU2m4e0D https://t.co/mq2Bg8Png1
Abdee,2021-02-01 19:40:03,Polres Poso Tangkap Terduga Pelaku Curanmor https://t.co/DbjzMQB6ua https://t.co/8LyqGx16PY
Abdee,2021-02-01 13:34:03,HIPMI Siap Bantu Kembangkan Potensi Wisata di Donggala https://t.co/HAFVbDzdMS https://t.co/XG5XzNHUwN
Abdee,2021-01-31 19:38:03,Kodim 1311 Morowali Bagi-bagi 10.000 Masker dan Kampanyekan Prokes https://t.co/l02O6srAAQ
Abdee,2021-01-31 19:38:03,"Tidak Gunakan Masker, Puluhan Warga Palu Terjaring Razia https://t.co/tJGG651FYu https://t.co/kS0XIyP9gc"
Abdee,2021-01-31 10:39:04,Kodim 1307 Poso Gelar Patroli Penanganan Covid 19 https://t.co/7AYTYH4i24 https://t.co/eXef8JkZXi
Abdee,2021-01-30 16:10:04,Polres Morowali Bersihkan Lingkungan Objek Wisata Fafobaho Bungku https://t.co/i4JDGuPqN6 https://t.co/lqCEZ8KUn0
Abdee,2021-01-30 16:10:03,"Raba Payudara Siswi SMA, Pria Beristri di Poso Ini Ditangkap Polisi https://t.co/yGiQdl83De https://t.co/ovwwi6NZpT"
Abdee,2021-01-30 10:10:32,PHRI Beri Kesempatan Vaksinasi Industri Hotel dan Restoran di Sulteng https://t.co/TtD3mIg6RO https://t.co/x6QM6EfRxh
Abdee,2021-01-29 13:15:02,KPP Pratama Palu Canangkan Pembangunan Zona Integritas Bebas Korupsi https://t.co/TCgObD3kko https://t.co/u1H5O82OLm
Abdee,2021-01-29 07:13:32,"Kasus Jembatan IV Palu, Kejati Sulteng Bantah Dugaan Jaksa Terima Proyek https://t.co/Dh06dMZfa1 https://t.co/vdzGo8rkrC"
Abdee,2021-01-28 16:11:33,The Rainforest Alliance dan Pemkab Poso Gelar Lokakarya Regional https://t.co/a33HeZgz4o https://t.co/EYHBkQZCKv
Abdee,2021-01-28 07:09:33,Nakes di Palu Mulai Disuntik Vaksin Covid-19 Dosis Kedua https://t.co/GTS8liJ7y4 https://t.co/t4gJEOi14S
Abdee,2021-01-28 07:09:32,"Heboh, Warga Temukan Serpihan Pesawat di Perairan Donggala https://t.co/D0dbPIdjtg https://t.co/X714BrZGG7"
Abdee,2021-01-27 16:07:33,Polisi Ringkus Terduga Pencurian dan Pembakaran Rumah https://t.co/pYhL1Jv9fE https://t.co/ev46WjW5XM
Abdee,2021-01-27 07:01:34,"Aktifitas Kegempaan Meningkat, Masyarakat Diminta Tidak Panik https://t.co/ymsFq409WY https://t.co/ftJUjrEjGo"
Abdee,2021-01-27 07:01:33,Kapolri dan Gubernur Sulteng Terpilih Diminta Tindak Tegas Aktivitas Tambang Ilegal https://t.co/YrwHLig3zM https://t.co/cuss8YVeTr
Abdee,2021-01-26 16:05:04,"Bersinergi Kawal Keutuhan NKRI, Polres Banggai Pasang Spanduk TNI-Polri Solid https://t.co/WuzY9hxzs2 https://t.co/bcZWOoOdG4"
Abdee,2021-01-25 19:03:03,Tim Resmob Polres Parigi Moutong Tangkap 2 Terduga Pelaku Curanmor https://t.co/duhrENAyqK https://t.co/OsV6dm19Uu
Abdee,2021-01-25 19:03:02,Warga Palu Masih Lakukan Aksi Galang Dana untuk Korban Gempa di Sulawesi Barat https://t.co/ubXaieqv1u
Abdee,2021-01-25 16:02:33,"Minta Jajaran Tingkatkan Patroli dan Razia Pekat, Kapolres Banggai: Berikan Imbauan Secara Humanis https://t.co/SqilMXVgrE https://t.co/im4CQsjUfD"
Abdee,2021-01-24 19:00:04,Mantan Kades Tampiala Terancam Kurungan Penjara Seumur Hidup https://t.co/I44VR0m3vc https://t.co/tZpf2JsQSc
Abdee,2021-01-24 19:00:03,"Banggai Dinyatakan Zona Merah, 694 Orang Terkonfirmasi Covid-19 https://t.co/8I03aUYLs3 https://t.co/U7M7qvvOyL"
Abdee,2021-01-24 16:00:33,"Tengah Asyik Berjudi Kartu Remi, 4 Warga di Diamankan Sat Reskrim Polres Banggai https://t.co/eVAYZOtLwP https://t.co/hxmbF2vfp0"
Abdee,2021-01-23 16:33:04,"Grebek Judi Sabung Ayam di Taopa, Polsek Moutong Amankan Seorang Warga dan Sejumlah Barang Bukti https://t.co/uiJj4f0ryZ https://t.co/FHcbK9Bsrf"
Abdee,2021-01-23 16:33:03,Masjid Baiturrahman yang Roboh Akibat Gempa 28 September di Palu Pembangunannya Dimulakan https://t.co/ktRCt1alNK https://t.co/51x7Kah6NK
Abdee,2021-01-22 22:02:03,"Duh, Sekolah di Parigi Moutong Ini Ambruk Akibat Diterjang Angin Puting Beliung https://t.co/kfa4FUVZmO https://t.co/GpF7MKXBxz"
Abdee,2021-01-22 13:31:34,Sensus Penduduk 2020 di Sulteng: Jumlah Laki-laki Lebih Banyak Dibandingkan Perempuan https://t.co/aJ0oHzXdpP https://t.co/Ue5iJrCmxV
Abdee,2021-01-22 13:31:33,Alumni SMA Negeri 4 Palu Bagi-bagi Makanan Gratis di Tengah Pandemi Covid-19 https://t.co/N9q2ly8H15 https://t.co/Bgg5LmvQMA
Abdee,2021-01-21 22:00:02,Tim Medis NasDem Sulteng Fasilitasi Korban Gempa di Daerah Terpencil Sulbar https://t.co/BzGLZhLGdB
Abdee,2021-01-21 13:29:04,IAIN Palu Salurkan Bantuan Sembako dan Kebutuhan Anak Penyintas Gempa Sulawesi Barat https://t.co/5ehqYq2HO7 https://t.co/QQAtdDafJD
Abdee,2021-01-21 13:29:03,"Dilarang Ambil Gambar Saat Buka Kotak Suara, KPU Touna Disoroti Penggugat https://t.co/G6hhGNkm45 https://t.co/QtYDOBS0ch"
Abdee,2021-01-20 21:58:03,Petugas Medis Parigi Moutong Beri Pelayanan Kesehatan untuk Korban Gempa di Majene https://t.co/Y0Ff2Vlmug https://t.co/iKnX3Ikh7o
Abdee,2021-01-20 13:26:03,Golkar Sulteng Serahkan Bantuan Korban Gempa Sulbar https://t.co/NqHTm2RuU7 https://t.co/duyjdItFtv
Abdee,2021-01-20 13:26:02,Polda Sulteng Target 300 Kantong Darah untuk Korban Gempa Sulbar https://t.co/dzKRHHhTjf
Abdee,2021-01-19 21:55:33,15 Truk Bantuan NasDem Gelombang Kedua Tiba di Sulbar https://t.co/bnMmt6pN66 https://t.co/585SMGtvkV
Abdee,2021-01-19 13:24:02,Ketersediaan Elpiji Bagi Korban Gempa Sulbar Dipastikan Aman https://t.co/ovD5fpOXVu https://t.co/lKWPEF435K
Abdee,2021-01-19 13:24:02,Pecinta Motor Trail Palu Bantu Korban Gempa di Sulbar https://t.co/tPMWY5atDb https://t.co/tdVtFwhmsz
Abdee,2021-01-18 21:53:02,"Dongkrak Produksi Pertanian Masyarakat Sigi Pasca Bencana, YPI Perkenalkan Mesin Tanam Padi dan Buat Demoplot https://t.co/QOMdpy0nBZ https://t.co/wK6Po58Dij"
Abdee,2021-01-18 13:21:33,"Sebagai Wujud Kepedulian, PT. Welmy Pratama Indah Berikan Bantuan Bagi Korban Bencana Gempa Sulbar https://t.co/KR8j4Rp15a https://t.co/6ScHgC6Vrq"
Abdee,2021-01-18 13:21:32,"Abaikan Protokol Kesehatan, Warga Pengungsi Seruduk Rujab Wabup Mamuju Demi Bantuan Logistik https://t.co/ZytPIC8OP3 https://t.co/hOB79lWgWC"
Abdee,2021-01-17 21:51:03,Polda Sulteng Sterilkan Jalur Bansos Palu-Mamuju https://t.co/rnjVGKlKib https://t.co/aM17r7oJHT
Abdee,2021-01-17 13:20:33,"KPA Khatulistiwa Tanam 5.000 Bibit Mangrove, Dikemas dalam Bentuk Camping Ground, Ada Diskusi soal Lingkungan https://t.co/uqA8KfNSR1 https://t.co/e44Xg9aG9B"
Abdee,2021-01-17 13:20:32,"Aksi Bersih-bersih Sampah Komunitas Trash Volunteer Palu, Rifaldi: Kami Direspon Baik Masyarakat https://t.co/0qXBv9WRO5 https://t.co/s8svtrSl9E"
Abdee,2021-01-16 21:49:03,DPW NasDem Sulteng Kirim 11 Personel Rescue untuk Misi Kemanusian di Sulbar https://t.co/KlZRJ8KKFB https://t.co/oTgAPl5SBx
Abdee,2021-01-16 13:19:04,"Grand Maleo, Hotel Terbesar di Sulbar Jadi Saksi Bisu Keganasan Gempa M 6,2 https://t.co/uf4h5GmlIa https://t.co/w3Rxlm5Bfl"
Abdee,2021-01-16 13:19:02,"Bantu Korban Gempa Bumi di Sulbar, Dinsos Parigi Moutong Kirim TAGANA https://t.co/zqChKWpB59 https://t.co/393yVIz3jJ"
Abdee,2021-01-15 21:47:32,19 Pejabat Poso Telah Lakukan Vaksin Covid-19 https://t.co/QXqSE7TEn5 https://t.co/AcSmO3l1PT
Abdee,2021-01-15 13:17:03,"Gempabumi Tektonik 6,2 SR Mengguncang Majene Jum’at Subuh, Banyak Bangunan Roboh https://t.co/efOK072OnQ https://t.co/PYjUA14P9t"
Abdee,2021-01-15 13:17:03,"Sekolah Penerima BOS di Parigi Moutong Diberikan Bimtek, Adrudin: Kepsek dan Guru Minim Informasi https://t.co/Bf3cWxw0IZ https://t.co/afjZJzVti1"
Abdee,2021-01-14 21:45:02,Instruksi Gubernur Jadi Pepesan Kosong di Area Perbatasan https://t.co/aHHkJBDeJq https://t.co/FRDE2Hx3mf
Abdee,2021-01-14 13:14:34,Bank Mega Syariah Palu Targetkan Pembiayaan Capai 50 Miliar di 2021 https://t.co/FpnucyFc5y https://t.co/L6gjkvSjyf
Abdee,2021-01-14 13:14:33,Rumah Sakit di Sulteng Diminta Tambah 30 Persen Kapasitas Tempat Tidur untuk Pasien Covid-19 https://t.co/Y9A0PnS4yn https://t.co/vDSdggcmNa
Abdee,2021-01-13 21:43:32,Polisi Tangkap Dua Pembobol Website Universitas Tadulako https://t.co/Qzx0nHR10B https://t.co/4JFeEEFADz
Abdee,2021-01-13 13:12:33,"5.740 Dosis Vaksin Covid-19 untuk Palu Telah Terdistribusi, Nakes Siap Disuntik? https://t.co/6A0LAxrdev https://t.co/n6dWGfPOX2"
Abdee,2021-01-13 13:12:32,"80 Juta Dana Tabungan di BCA Palu Raib, Kuasa Hukum: Kami Akan Tempuh Jalur Hukum Jika Masalah Tak Selesai https://t.co/93YXByjAzg https://t.co/y0x6BuR6jQ"
Abdee,2021-01-12 21:41:02,Persiapan Jelang Vaksinasi Covid-19 Tahap Pertama di Palu https://t.co/6euXzo0JO8 https://t.co/NSE1s2HOk9
Abdee,2021-01-12 09:45:03,"40 Tahun Rusak Parah, Jalan di Desa Walandano Donggala Akhirnya Mulai Diperbaiki https://t.co/Q2HHCw3ju9 https://t.co/kogpAP7LqO"
Abdee,2021-01-11 21:48:03,"Polres Parigi Moutong dan Jajarannya Siap Divaksinasi Covid-19, Andi Batara: Itu Perintah https://t.co/49dwg3Vsmi https://t.co/EIGKtUTTiU"
Abdee,2021-01-11 09:50:02,Penemuan Bayi Laki-Laki yang Bikin Geger Warga Mamboro Didapati Dalam Kardus Bekas https://t.co/bIHIaWySaD https://t.co/SBYy1Z8hZe
