username,created_at,text
Abdee,2020-09-07 15:12:32,Penerimaan Negara Capai Rp 1.028 T hingga Agustus 2020 https://t.co/vU1geD48sT https://t.co/mL22ren2jC
Abdee,2020-09-07 07:14:03,Empat Balon Pilkada Palu Mulai Jalani Pemeriksaan Kesehatan https://t.co/XimeOC11qU https://t.co/skuc0lWlvm
Abdee,2020-09-06 18:44:32,"Tantang Tiga Kandidat Pilkada Palu, Jagoan Golkar-Gerindra Daftar ke KPU https://t.co/vPtfDl2RsI https://t.co/qm82mUxjia"
Abdee,2020-09-06 15:11:33,Calon Lawan Gibran Diantar Ribuan Orang Daftar Pilkada Solo https://t.co/fHIfNAMHiR https://t.co/UT9m7CxgIC
Abdee,2020-09-05 21:05:03,Polda Sulteng Kirim 6 Personilnya untuk Misi Perdamaian PBB https://t.co/i5m24iQvxu https://t.co/jO41E8tQDh
Abdee,2020-09-05 15:10:04,Pertamina Beri Pelatihan ke Pengajar Anak Berkebutuhan Khusus https://t.co/mGkgg17PJi https://t.co/EWSrRSoTKx
Abdee,2020-09-05 15:10:03,PDIP Soal Massa Gibran dan Bobby: Pesta Bikin Lupa Bahaya https://t.co/viCUviLEZz https://t.co/SrCUG8OrLv
Abdee,2020-09-04 21:02:32,"Tahapan Pendaftaran Bapaslon, KPU Poso Dijaga Ketat Polisi https://t.co/RYUZpIMf2y https://t.co/nq64xagOvI"
Abdee,2020-09-04 15:08:04,"Siagakan 200 Personel di KPU Palu, Kapolres Palu: Tak Terapkan Prokes Dibubarkan https://t.co/zwV3Tg4MHd https://t.co/9r5xe8L6SG"
Abdee,2020-09-04 15:08:03,"Masa Dinas Masih 10,6 Tahun, Hidayat Lamakarate Pilih Maju Gubernur Sulteng https://t.co/C9Ocozsujj https://t.co/u4wo7ddYJd"
Abdee,2020-09-03 21:01:32,"Golkar dan Hanura Resmi Usung Cudi-Ma’mun, Pilkada Sulteng Kembali Dipastikan Head to Head https://t.co/5iNHjJ7hts https://t.co/Mf7j2apj9a"
Abdee,2020-09-03 15:05:34,Puluhan Warga Probolinggo Datangi RSUD Tak Terima 2 Pasien Divonis COVID-19 https://t.co/ciw9yopuS0 https://t.co/MOr38nvrGf
Abdee,2020-09-03 15:05:33,Istana Dorong Kasus Jerinx Diproses Adil dan Transparan https://t.co/xZOYUlD17W https://t.co/yWs29ZvtIM
Abdee,2020-09-02 21:00:02,"Ratusan Kader NasDem Bumi Raya Dilantik, Ketua DPD: Instruksi DPP Dijalankan Tanpa Terkecuali https://t.co/6jd5epKmhO https://t.co/Nv0kj93OYK"
Abdee,2020-09-02 15:03:04,"Edarkan Sabu, Seorang Nenek dan Dua Orang Paruh Baya di Tawaeli Ditangkap Polisi https://t.co/0AZf01zlO8 https://t.co/cfYmOALNHj"
Abdee,2020-09-02 15:03:03,Banggar Minta Disdikbud Sulteng Prioritaskan Anggaran untuk Peningkatan SDM https://t.co/pVb26Wka84 https://t.co/xqI0bKOEnc
Abdee,2020-09-01 20:26:33,Kerugian Materil Akibat Kebakaran di Kampus STISIP PB Palu Belum Ditaksirkan https://t.co/kzWtr122Cv https://t.co/WibDpbirDf
Abdee,2020-09-01 15:01:05,"Indonesia di Ambang Resesi, Ini Kata Pengusaha di Banten https://t.co/Wvu4SfWud9 https://t.co/MRQjPWXfA5"
Abdee,2020-09-01 15:01:03,KontraS: Seret TNI Penyerang Polsek Ciracas ke Peradilan Umum https://t.co/g5nlV4XOXU https://t.co/DWgc6fRcFX
Abdee,2020-08-31 20:23:33,KPU Sulteng Persiapkan Pendaftaran Bakal Calon Gubernur/Wakil Gubernur https://t.co/CjMCackrBM https://t.co/s1vgQw8CY8
Abdee,2020-08-31 14:59:04,"Ratusan Santri Positif Covid, Banyuwangi Karantina Pesantren https://t.co/WHvTtEChJl https://t.co/uVrHoc8Gec"
Abdee,2020-08-31 14:59:02,Buruh Tambak di Bulukumba Sulsel Tewas Ditikam Saat Pacaran https://t.co/NLEZkSCeRs https://t.co/Tylf5kIlaS
Abdee,2020-08-30 20:21:33,Ombudsman Soroti Pembangunan Tanggul Laut Palu Yang Belum Memiliki Izin https://t.co/Ztkx811eKJ https://t.co/U7q7aHqBH5
Abdee,2020-08-30 14:23:04,"Targetkan Bebas Stunting 2021, Ini Upaya Pemkab Sigi https://t.co/bEi5AnZP28 https://t.co/KEWXnifxq9"
Abdee,2020-08-30 14:23:03,YPI dan CRS Bagikan 1.348 Tas Siaga Bencana di 6 Desa/Kelurahan https://t.co/X4MJgAZk3W https://t.co/7mXfxPOHqr
Abdee,2020-08-29 20:20:02,DPW PKS Sulteng Serahkan B1KWK ke 8 Bapaslon https://t.co/D7OIoCZMyg https://t.co/UnpMsiIn8Q
Abdee,2020-08-29 14:21:33,4 Atlet Hapkido Sulteng Ikut Kejurnas Online Terbuka https://t.co/soyWTm61Vm https://t.co/0ypsOQ8Zo3
Abdee,2020-08-29 14:21:33,"Siap Mundur Sebagai ASN, Hidayat Lamakarate: Ini Bukti Keseriusan Saya Maju Pilgub https://t.co/9wKs99w2Rb https://t.co/q0sc1Tb5YC"
Abdee,2020-08-28 18:08:32,Pemkab Parimo Targetkan Penurunan Stunting 15 Persen di 2020 https://t.co/BJEFvS6ncB https://t.co/eoAZtmoawn
Abdee,2020-08-28 14:19:34,"Sosialisasi Sekolah Ramah Anak, Wakil Bupati Morowali: Menjaga dan Melindungi Anak Menjadi Prioritas https://t.co/lrkYg9ejXo https://t.co/w6UCDnhU7p"
Abdee,2020-08-28 14:19:33,"Pilgub Sulteng, PDIP Resmi Usung Hidayat-Bartho https://t.co/Tx3VxXSovi https://t.co/Y8NEIWTgsw"
Abdee,2020-08-27 18:06:02,"Sekolah di Poso Dibuka Kembali September 2020, TK/PAUD Dijadwalkan November https://t.co/6npH9cp0En https://t.co/0N5yxcoTJW"
Abdee,2020-08-27 14:17:04,Bangganya Penjual Es Gabus di Surabaya Biayai Anak hingga Sarjana https://t.co/7MYDBA0Eec https://t.co/EMFooPnM6u
Abdee,2020-08-27 14:17:03,Nadiem Geser Anggaran Organisasi Penggerak Buat Pulsa Guru https://t.co/pYC6TUEo2o https://t.co/QmtdBCS9W2
Abdee,2020-08-26 18:04:03,Disdik Palu Targetkan September Sekolah Telah Mulai Belajar Tatap Muka https://t.co/SYeLEuD57H https://t.co/A3pgX1TskF
Abdee,2020-08-26 12:02:04,"Jokowi: Takut Korupsi Jangan karena Penjara, Tapi Neraka https://t.co/aEObUgsTN0 https://t.co/z9yUnoa8BQ"
Abdee,2020-08-26 12:02:04,Walikota Palu Gelar Dzikir dan Syukuran Atas Peresmian Jembatan Lalove https://t.co/9lpzJk7aqQ https://t.co/p9uJa5Zq9I
Abdee,2020-08-25 17:27:02,"Tingkatkan Ketangguhan Masyarakat, YPI-CRS Bagikan Ribuan Poster Kesiapsiagaan Bencana di Donggala https://t.co/tEtlKpFBbH https://t.co/2jhtp80ZuB"
Abdee,2020-08-25 11:27:02,"Menderita di Huntara, Penyintas Loli Donggala Tuntut Kepastian Huntap https://t.co/008wZnhXWG"
Abdee,2020-08-25 11:27:02,Polres Banggai Intesifkan Latihan TFG Jelang Pilkada Serentak 2020 https://t.co/9haZDRCpsH
Abdee,2020-08-24 17:24:33,8 Daerah Ajukan Pinjaman Rp12 T ke Pemerintah Pusat Tahun Ini https://t.co/9ALKMW5mln https://t.co/nTvDqiJ1jR
Abdee,2020-08-24 11:25:02,Sepasang Remaja Terjun ke Sungai Musi karena Dilarang Pacaran Ditemukan Tewas https://t.co/WZesUAVnH1 https://t.co/I7r27blUgU
Abdee,2020-08-24 05:25:02,Delapan Pejabat Teras Lingkup Polda Sulteng Resmi Dilantik https://t.co/W2q8C8jh7W
Abdee,2020-08-23 17:22:33,Pantai Tanjung Karang Donggala Ramai Dikunjungi Warga di Tengah Pandemi Corona https://t.co/qorf4dFnGS https://t.co/ADuOjWfE5I
Abdee,2020-08-23 11:23:03,Kereta Api Bandara Yogyakarta Kembali Beroperasi https://t.co/qdqIvh4cy6 https://t.co/D0EH2qmAHF
Abdee,2020-08-23 04:50:02,"Kurangi Resiko Bencana, YPI-CRS Pasang Rambu Bencana Untuk Warga Sigi https://t.co/cZJYh4j3lO https://t.co/5SeuYf2Aef"
Abdee,2020-08-22 11:32:02,"Muswil RAPI 08 Banggai Digelar, Wabup Mustar: Pemkab Siap Bersinergi https://t.co/t1roOqNiUR https://t.co/274O07bBBG"
Abdee,2020-08-22 08:21:02,"Ditangkap Polisi Terkait Ganja, Drummer J-Rocks: Gue Korban https://t.co/8t7cidnKCK https://t.co/m7m3AvWlIt"
Abdee,2020-08-22 04:48:32,"Gempa Magnitudo 5,0 Guncang Sigi, Masyarakat Diimbau Tidak Panik https://t.co/Ounb46Rm3J https://t.co/CddxPKstWQ"
Abdee,2020-08-21 11:29:04,Polsek Bunta Sita 14 Kantong Miras dan Amankan Belasan Motor https://t.co/tdyhnzJXWB https://t.co/eaLrL1FvgA
Abdee,2020-08-21 08:19:03,Jasa Influencer dan Pesan Bias Pemerintah ke Masyarakat https://t.co/Om5EHbk2zB https://t.co/5weQ0iRmsP
Abdee,2020-08-21 04:46:32,"Di-rapid Test Covid-19 saat akan Temui Gubernur, Tiga Presiden BEM di Gorontalo Malah Reaktif https://t.co/SWpeXa9WsQ https://t.co/h1Dq3Kg3ee"
Abdee,2020-08-20 11:27:02,KAMI di Pusaran Orang-orang Kalah dan Peluru Kritik ke Jokowi https://t.co/99nLTNel10 https://t.co/fwgjlzJEtB
Abdee,2020-08-20 08:17:02,"Palu Siap Topang Perpindahan Ibu Kota Negara, Walikota : Selatan Kawasan Wisata, Utara Kawasan Buah https://t.co/kqM52FYtYQ https://t.co/vvSmT4NPzt"
Abdee,2020-08-20 04:44:33,"Diduga Lakukan Pencurian Uang Senilai Rp80 Juta, Seorang Pria Ditangkap Polisi https://t.co/3gqI6ZBX7V https://t.co/WkZAFEszi7"
Abdee,2020-08-19 11:22:02,"Karaoke di Surabaya Tawarkan LC untuk Prostitusi, Seorang Mami Jadi Tersangka https://t.co/PUg9VBd6PS https://t.co/Dg8jZNiLD5"
Abdee,2020-08-19 07:41:02,"Tinggalkan Kursi Kapolda Sulteng, Syafril Nursal Dilamar Jadi Cawagub Jambi Dampingi Petahana https://t.co/FkFjcn9ZaZ https://t.co/GLQpdyiaeG"
Abdee,2020-08-19 04:41:03,"Dilantik, Firdaus Resmi Jabat Wakajati Sulteng https://t.co/YkFCdkP7fs https://t.co/mB7lrjKxov"
Abdee,2020-08-18 11:19:03,"Impor Anjlok 32 Persen, Bukti Permintaan Domestik Merosot https://t.co/vJDmceR5aF https://t.co/KJfo08Suwk"
Abdee,2020-08-18 07:35:02,Alesandro Delpiero Ditemukan Tewas Gantung Diri di Lorong Brendi https://t.co/jD2JtYV3R1 https://t.co/Hz0AZ5VMVq
Abdee,2020-08-18 04:36:02,DTPH Sulteng Sebut Kurangnya Komoditas Bawang di Sulawesi Tengah https://t.co/o4zLGYphJc https://t.co/8MxcR04COg
Abdee,2020-08-17 11:16:03,Mega dan SBY Ikuti Upacara 17 Agustus Virtual Istana Merdeka https://t.co/SBCN2qP5bj https://t.co/w3sO3KQcRp
Abdee,2020-08-17 07:02:32,"Peringati HUT RI ke-75, Gubernur Sulteng Bagi 1.200 Paket HHBK Sekaligus Buka Gerai KPH https://t.co/TCH84Z3VGa https://t.co/BnXskyteNk"
Abdee,2020-08-17 04:03:03,"Tingkatkan Partisipasi Pemilih, KPU Palu Adakan Lomba Mural dan Cerdas Cermat https://t.co/y2M2R6QKA0 https://t.co/OyS12h3oSP"
Abdee,2020-08-16 11:14:02,Kapolres Morowali Pimpin Sertijab Sejumlah Pejabatnya https://t.co/vULWfYxFFr https://t.co/rcli2WwwT4
Abdee,2020-08-15 19:03:03,"150 Personil BKO Mabes TNI Tiba di Palu, Kapolda Sulteng Optimis Atasi Kelompok MIT Poso https://t.co/wKL6nLCpUx https://t.co/Mc597kZzlH"
Abdee,2020-08-15 19:03:02,"Pejabat Eselon III dan IV di Parimo Diwarning, Wajib Penuhi Hal Ini https://t.co/2ytbgR1wet https://t.co/idZuK1ERQr"
Abdee,2020-08-15 11:11:03,"Jenderal Polisi, Jaksa, dan Pengacara Terseret Kasus Djoktjan https://t.co/lwKrh4K2RG https://t.co/uSZLxCUdAQ"
Abdee,2020-08-14 19:00:03,Paripurna DPRD Morowali Agendakan Penyerahan KUPA dan PPAS-KUA https://t.co/BcB9cEbMwj https://t.co/T6yxOizZeM
Abdee,2020-08-14 19:00:02,Himbauan TNI Bagi Warga Palu Luangkan Waktu 3 Menit Nyanyikan Lagu Indonesia Raya Sambut HUT RI Ke-75 https://t.co/tPkJrF0WfA https://t.co/2U6rW5f7km
Abdee,2020-08-14 11:07:32,"Dalam Rangka HUT RI ke-75, Bank Bukopin Hadirkan Program Deposito Merdeka Seru https://t.co/IBwkpRHu2W https://t.co/WXWk1zzr08"
Abdee,2020-08-13 18:58:04,KPU Morowali Utara Jamin Hak Pilih Warga di Bawah Umur https://t.co/L51RYagK3W https://t.co/gFl6AY8gc0
Abdee,2020-08-13 18:58:02,KPU Donggala Bimtek Penyusunan Daftar Pemilih Hasil Pemutakhiran https://t.co/c1ZVEQoMcU https://t.co/a9xsMN1fpY
Abdee,2020-08-13 09:55:32,Penegak Hukum Diminta Selediki Dugaan Proyek Fiktif SD Negeri 1 Tatura https://t.co/3CcEJOF5B2 https://t.co/oWPcX0HcV1
Abdee,2020-08-12 18:54:03,"Kisruh Lahan Sawit, PT. Mamuang Somasi Petani, WALHI Sulteng: Hentikan Kriminalisasi Petani https://t.co/1wIPe0NysV https://t.co/GTavxssceW"
Abdee,2020-08-12 18:54:02,Bawaslu Sulteng Temukan Warga Tak Miliki Dokumen Kependudukan di Parimo https://t.co/HXUb1Trx2s https://t.co/qyNxRcsdZt
Abdee,2020-08-12 09:53:02,Partai Berkarya : Logo yang Tertera di Brosur Salah Satu Cagub itu Ilegal https://t.co/eCNW0SRduj https://t.co/ksKtZaFBf0
Abdee,2020-08-11 18:51:05,"Tuntut Hasil Invert Tanah Objek Reforma Agraria, Petani Sigi: Pandemi Covid Membuktikan Yang Bisa Bertahan Hanya Petani https://t.co/nRqaoOjC77 https://t.co/fCZc9wwQVD"
Abdee,2020-08-11 18:51:04,Basarnas Palu Gelar Simulasi penanganan korban dengan Tema Semangat ‘45 lawan Covid-19 https://t.co/D7HIxRn0VJ https://t.co/HdcO3eNROx
Abdee,2020-08-11 09:50:03,Komnas HAM Sulteng Soroti Pelibatan TNI dalam Pemberantasan Terorisme https://t.co/7SgeGVKXLb https://t.co/UC6oC0BQEB
Abdee,2020-08-10 18:48:33,Kepala BNPT Imbau Waspadai Kemungkinan Perbuatan Teror saat Pilkada di Sulteng https://t.co/MzObuIeY68 https://t.co/GePc0VidDM
Abdee,2020-08-10 18:48:32,Okupansi Hotel Santika Palu 42% Selama Juli https://t.co/keXqwVyUl1 https://t.co/w2tIbwMjLh
Abdee,2020-08-10 09:48:02,Gerindra Sulteng Tegaskan Prabowo Dipilih Secara Demokratis https://t.co/ztiTUL8sVh https://t.co/gVzpOVfmp9
Abdee,2020-08-09 18:45:33,"Dua Warga Poso Disandera Kelompok MIT, Satu Diantaranya Meninggal Dunia https://t.co/qCGTvlclwz https://t.co/PMT59zPiVx"
Abdee,2020-08-09 18:45:32,"Nelayan Asal Ampibabo Hilang, Lokasinya Hanya Sekitar 2 Jam dari Touna https://t.co/aeMZe9X6uj https://t.co/AKvmLpnNGr"
Abdee,2020-08-09 06:46:02,ACT Sulteng Salurkan Pangan Gratis Bagi Warga Palu https://t.co/0Pa2wVyQJg https://t.co/fQMfJl4Ul1
Abdee,2020-08-08 18:12:33,Banjir Bandang di Kulawi Rusak Rumah Warga https://t.co/BEmRVTRv86 https://t.co/d1nIljNnPa
Abdee,2020-08-08 12:43:03,Demokrat Soal Ekonomi Minus dengan Perppu: Apalagi Alasannya? https://t.co/PRWQP5HRyW https://t.co/bnwsnbnOkA
Abdee,2020-08-07 18:09:34,"Peringati Hut Polwan Ke-72, Polda Sulteng Bantu Bibit Ikan dan Tomat Kepada Warga Donggala https://t.co/pVX3ZJmZGc https://t.co/4nS4dVWcUS"
Abdee,2020-08-07 18:09:33,"Antara Suhardi, Si Pengrajin Meubel Alumunium dan Desakan Keberpihakan APBD https://t.co/smZkBiRyFh https://t.co/zGzQ3HTXCo"
Abdee,2020-08-07 12:40:03,"Hendak Jual Sabu, Pria Asal Toli-toli Dibekuk Polisi https://t.co/qG210ZD9X4 https://t.co/Z0HZ8ZCRO7"
Abdee,2020-08-06 18:07:02,"Palasa Tertinggi Kasus Malaria di 2019, Kini Turun Drastis Jadi 3 Kasus https://t.co/w8n80ADXAS https://t.co/wVeLgAu70i"
Abdee,2020-08-06 18:07:01,"Front Penyelamat Sumber Daya Alam Sulteng, Tuntut Hentikan Operasi Dua Tambang Ilegal di Morut https://t.co/2cFkk5EsrW https://t.co/jkzzACuH7s"
Abdee,2020-08-06 12:37:33,Jokowi Sampaikan Duka Cita atas Ledakan di Libanon https://t.co/KFnvuNNekW https://t.co/yOT4Rdq8Jf
Abdee,2020-08-05 18:03:35,Bank Muamalat Terapkan Cash Management System Guna Mudahkan Akses Transaksi Nasabah https://t.co/fgQXk3EQep https://t.co/eKfuz4Ubq0
Abdee,2020-08-05 18:03:34,Petugas PPDP dan PPS Diminta Cermat Menginput Data https://t.co/OCqiYgT8d5 https://t.co/Ef3VU1c8cb
Abdee,2020-08-05 12:34:33,"Buruh Kawasan Industri Morowali Berunjukrasa, Dedy: Perusahaan Tetap Prioritaskan Karyawan https://t.co/bSj12ERL3b https://t.co/1KicINnWiK"
Abdee,2020-08-04 18:00:05,Pemprov Sulteng Dorong Bawang Putih Jadi Komoditas Unggulan Sigi https://t.co/tGrvjCxqdR https://t.co/I4h3XqsxjF
Abdee,2020-08-04 18:00:03,"Resesnya Dihadiri Banyak Orang, Ahmad Ali Ingatkan Kader Nasdem https://t.co/Ivgmq2ygQK https://t.co/cLyEpgIfGV"
Abdee,2020-08-04 12:32:02,Sekilas Cerita Suasana Malam Takbiran Idul Adha di Posko Pengungsian Korban Banjir Luwu Utara https://t.co/fpaKsOUNMP https://t.co/lvnWV5AYr6
Abdee,2020-08-03 17:57:05,"Terlibat Narkoba dan Perselingkuhan, Empat Personil Polda Sulteng Dipecat https://t.co/f0X2ZCP1tG https://t.co/XAi7uO0HUI"
Abdee,2020-08-03 17:57:04,Walikota Palu Resmikan Dua Mushola Bantuan BNI https://t.co/efKwRNhcWQ https://t.co/Ko0tJIdlSA
Abdee,2020-08-03 08:57:02,"Kapasitas Fiskal Sulteng Masuk Kategori Sangat Rendah, PR Pemimpin Baru https://t.co/6MK7gEbJum https://t.co/r44g94gtOE"
Abdee,2020-08-02 17:54:33,"Hilang di Pegunungan Mepanga, Dua Bocah Kakak Beradik Belum Ditemukan https://t.co/wESJAG0pI7 https://t.co/Y6TuT1q2yA"
Abdee,2020-08-02 17:54:32,Aparat Gabungan Bakar Tempat Sabung Ayam di Bahodopi https://t.co/vbPws5WQGl https://t.co/BTEV9LzB9R
Abdee,2020-08-02 08:51:02,PT CPM Salurkan Hewan Kurban di Lima Kelurahan di Palu https://t.co/IfyxMn6ppb https://t.co/oW6f7r2RtY
Abdee,2020-08-01 11:49:03,"Viral Karena Warna Rambut, Ini Alasan Wawali Palu Pasha https://t.co/B1WbSPsOTN https://t.co/ZzsY6aYFUi"
Abdee,2020-07-31 17:48:05,"Sedang Pesta Sabu, Oknum Wartawan di Parimo Diciduk Polisi https://t.co/tt7MFPf2JP https://t.co/0CWXX5FnJ9"
Abdee,2020-07-31 17:48:03,"Sembelih 14 Sapi dan 220 Kambing, ACT Sulteng Sulteng Gandeng Lembaga Asal Turki dan BMH https://t.co/Q2Iwy2DWoY https://t.co/y7CO26EnZ8"
Abdee,2020-07-31 11:46:02,"Anwar Hafid Butuh Dua Kursi Lagi, Tiga Parpol Ini Harapannya https://t.co/VjNMViz7rK https://t.co/f2wEZKlFkh"
Abdee,2020-07-30 17:45:34,IMIP Bagikan 29 Ekor Sapi Kurban https://t.co/pVVz3Z4yYe https://t.co/4BwVq867uC
Abdee,2020-07-30 17:45:33,"Rindu Suasana Takbiran, Ribuan Warga Poso Pawai Berkendara Sambut Idul Adha 1441 H https://t.co/QkQ8x2Z1Ce https://t.co/emstMWLjDu"
Abdee,2020-07-30 11:43:34,Pedagang Hewan Kurban di Palu Resahkan Sepinya Pembeli Jelang Lebaran https://t.co/544vPm9EYc https://t.co/mPumkyCtH2
Abdee,2020-07-29 17:42:05,"Diduga Depresi, Seorang Warga di Bungku Tengah Ditemukan Tewas Gantung Diri https://t.co/5CQTqO6JXT https://t.co/Qs6JdANPxv"
Abdee,2020-07-29 17:42:03,"Sistim Pembelajaran di Parimo Gunakan Metode Luring, Begini Alasannya https://t.co/CkZqY5OUcq https://t.co/Yzvs0GjZsz"
Abdee,2020-07-29 11:39:32,"Gerindra Menunggu Rekomendasi PDIP, AS Optimistis Didukung Golkar dan PDIP https://t.co/idUgXV8oAx https://t.co/JZXcPxBMQe"
Abdee,2020-07-28 17:40:05,Horseback Archery 2020 Dilaksanakan Secara Streaming https://t.co/naIpQRPF74 https://t.co/aAMNa83zx5
Abdee,2020-07-28 17:40:04,"Jelang Muscab IV HIPMI Kota Palu, Inilah Kriteria Calon Ketua Umum https://t.co/1erDS4zeYj https://t.co/uqciNk6pth"
Abdee,2020-07-28 11:38:02,"Joppi : Bisa Jadi Hidayat Ketua PDI-P Palu, Jika Ashar Yahya Mundur https://t.co/KQSLrBaVH8 https://t.co/P7rI78AYrO"
Abdee,2020-07-27 17:36:03,"Peringati 29 Tahun Pengabdian, Alumni Akpol 1991 Salurkan 500 Paket Sembako https://t.co/dz8q24wcKz https://t.co/ooXSp6cxov"
Abdee,2020-07-27 17:36:02,"Huntap Satelit Belum Pasti, Penyintas Petobo Sementara Disarankan Tempati Huntap yang Telah Tersedia https://t.co/izJG2Jsn52 https://t.co/eOkwFu61jB"
Abdee,2020-07-27 11:34:04,"Loloskan Putera Sampoerna, Nadiem Dituding Pro Industri Rokok https://t.co/Kk2ztpKddJ https://t.co/Thpv2loojZ"
Abdee,2020-07-26 17:33:35,"Fraksi Nasdem Donggala Soroti Belum Dilantiknya 8 Kades, Mutasi ASN dan Bocah Gizi Buruk https://t.co/Wsz4AbNi1B https://t.co/ecerXm2tgg"
Abdee,2020-07-26 17:33:34,Ketua Garda Pemuda Nasdem Sulteng Farid Podungge Prakarsai Gerakan Poso Menanam https://t.co/v5vmfeCrk7 https://t.co/4E0B7EaMIz
Abdee,2020-07-26 11:29:32,Sepenggal Cerita Dibalik Aktifitas Relawan Gabungan Pecinta Alam Bantu Pengungsi Korban Banjir Bandang Luwu Utara https://t.co/z9jd2PUOOO https://t.co/Isclup2o6W
Abdee,2020-07-25 17:31:02,40 Lebih Peserta Hadiri Sosialisasi Pemutakhiran Data Pemilih di Poso https://t.co/394ajo0Vcd https://t.co/nkX1FczWgg
Abdee,2020-07-25 17:31:01,LIPI Ungkap Kunci Jepang Hadapi Covid: Kepatuhan Penduduk https://t.co/trvjIEfaRO https://t.co/56Va5KVxav
Abdee,2020-07-25 11:27:02,Laga Amal untuk Korban Banjir Diramaikan 2 Pemain Bintang https://t.co/D15hDebokg https://t.co/4LF1pK6od8
Abdee,2020-07-24 16:54:34,Boeing 747 Qantas Terbang Terakhir Kalinya dengan Rute Bergambar Kanguru https://t.co/zpinmCkIgm https://t.co/QaTbiUp6KY
Abdee,2020-07-24 16:54:33,"Purnomo Positif Covid, Istana Bakal Batasi Orang Temui Jokowi https://t.co/PQs3IgOcrc https://t.co/zgsFNhsfrj"
Abdee,2020-07-24 11:24:33,Lima Rumah Warga di Jalan Patimura Palu Ludes Terbakar https://t.co/IHCNCIonDz https://t.co/oxO4IQur3q
Abdee,2020-07-23 16:51:05,"Operasi Patuh Tinombala Polres Banggai, Pengendara Tak Pakai Masker akan Dirazia https://t.co/enYTVjx2nE https://t.co/3pY1kfuckT"
Abdee,2020-07-23 16:51:03,Seorang Pemuda Ditangkap Polisi Saat Menjual HP Hasil Curian https://t.co/YVrn92HdXv https://t.co/qiHKUTgJgi
Abdee,2020-07-23 10:49:03,Polres Palu Berhasil Ungkap Kasus Pencurian dengan 5 Terduga Pelaku https://t.co/BxrADc3KIL https://t.co/420IxkX2TK
Abdee,2020-07-22 16:48:35,"Tuding Gelapkan Dana BOS, Guru dan Staf SMPN 19 Palu Minta Walikota Ganti Kepsek https://t.co/9cjwXSKYIA https://t.co/WM7s95SQI2"
Abdee,2020-07-22 16:48:34,1.324 Jiwa Segera Terima Dana Santunan Duka Tahap II https://t.co/pmw7mOtufa https://t.co/B92JOPcM0v
Abdee,2020-07-22 10:47:03,Jokowi Kirim Bantuan Sembako untuk Korban Banjir Masamba https://t.co/r8lhL6p2zH https://t.co/3Dl4q9ERHj
Abdee,2020-07-21 16:44:35,"Klepon Disebut Jajanan Tak Islami, Pedagang di Pasuruan Meradang https://t.co/306MtHGGIS https://t.co/x1mhGoUwji"
Abdee,2020-07-21 16:44:34,Tanoto Bantah Terima Hibah Rp20 M dari Kemendikbud https://t.co/USEKjewLe6 https://t.co/zHDMfnNjnl
Abdee,2020-07-21 10:44:34,SMKN 2 Palu Tekankan Kreativitas Guru Selama Pandemi Covid-19 https://t.co/DF5nNzY5pz https://t.co/d0UhBeMuJE
Abdee,2020-07-20 16:42:34,Jokowi: Setiap Uang Rakyat Harus Dipertanggungjawabkan! https://t.co/0SbbxqooWy https://t.co/18upIZ4Ol0
Abdee,2020-07-20 16:42:33,BKF Jawab Dilema antara Kesehatan dan Ekonomi saat Corona https://t.co/QjAx91lbO2 https://t.co/gcWuK78ws6
Abdee,2020-07-20 10:42:04,"Lima Pengedar Sabu di Kayumalue Dibekuk Polisi, Dua Diantaranya Perempuan https://t.co/ueX6OQEFaI https://t.co/Fsnb3hIRYs"
Abdee,2020-07-19 16:39:34,"BPBD Parimo Lakukan Penyusunan Syarat DSP, Diantaranya Hunian Korban Banjir https://t.co/T0rFfgTxTA https://t.co/BBHNPSizPH"
Abdee,2020-07-19 16:39:33,"Gelar Kegiatan Rutin, Polres Morowali Amankan 15 Motor Berknalpot Bogar https://t.co/vcPrdtn7OV https://t.co/4Sfnx6nwIe"
Abdee,2020-07-19 10:39:33,"Gelar Apel Serentak, KPU Sigi Langsung Coklit di Dua Desa di Dolo https://t.co/4KY6Dt8JcY https://t.co/EaBshlCCkA"
Abdee,2020-07-18 15:33:02,"SKB CPNS Digelar September, Sesuai Protokol Covid-19 https://t.co/XH5DTQYdWZ https://t.co/svjTN2P5l7"
Abdee,2020-07-18 12:35:32,Komisi III Tetap Tunggu Wakil Ketua DPR soal Rapat Djoktjan https://t.co/USG4wurziv https://t.co/5YjlrNtJsY
Abdee,2020-07-18 09:35:33,"Gandeng Pesinetron Aldi Taher, Rusli Dg Palabbi Mengaku Tidak Bercita-cita Jadi Gubernur https://t.co/UqBuv1CMFX https://t.co/E2dNC0URVe"
Abdee,2020-07-17 12:33:03,"Pilkada Serentak, PDIP Resmi Usung Hidayat-Habsa https://t.co/0050qOC7F6 https://t.co/y0VaIfelvN"
Abdee,2020-07-17 12:33:02,BPBD : Jumlah Pengungsi Banjir Parimo Bertambah 1.638 Jiwa https://t.co/g5YHSaqIoC https://t.co/3BCYYN8T5F
Abdee,2020-07-17 09:33:32,"Fiber Optik Rusak Dihantam Banjir, Telkom: Jaringan Internet di Sigi Dipastikan Normal https://t.co/hXsqSH7hYp https://t.co/AJzCYRan6q"
Abdee,2020-07-16 11:59:03,FPI Sulteng Turun ke Lokasi Bencana Parimo Bersihkan Lumpur Banjir https://t.co/QW9DN45KON https://t.co/QriV90Sz2V
Abdee,2020-07-16 11:59:02,"Air Sungai Meluap di Bahodopi, Sejumlah Warga Dievakuasi https://t.co/sKxfVVeJQv https://t.co/aRUdjXCBpj"
Abdee,2020-07-16 08:58:32,"Sambut Hari Adhyaksa ke 60, Kejati Sulteng Bagikan Ratusan Paket Sembako https://t.co/8oqMziGdJw https://t.co/bDjD9Fe2HZ"
Abdee,2020-07-15 11:55:04,"Kunker ke Poso, Pangdam XIII Merdeka Resmikan Masjid Al-Hasanah https://t.co/yuBwsI6qMZ https://t.co/OCekSd7krY"
Abdee,2020-07-15 11:55:03,"Resmikan Kantor DPMPTSP Sulteng, Kepala BKPM: Pengusaha Tidak Boleh Mengatur Pemerintah https://t.co/4TB27NpvQg https://t.co/BBPmm2gQIQ"
Abdee,2020-07-15 08:57:02,KPU Morut Tunda Bimtek PPDP Dua Kecamatan https://t.co/Ee7ZxK5fep https://t.co/kwF8j0RD8A
Abdee,2020-07-14 11:21:04,Darmin Sigilipu Genggam SK Pasangan Calon Partai Golkar https://t.co/Xp9yrwLESJ https://t.co/aExCirPvND
Abdee,2020-07-14 11:21:03,"Dirawat 3 Bulan di RSPAD, Gubernur Papua Kini Sembuh dan Pulang ke Jayapura https://t.co/DPsSxFYV57 https://t.co/QawduzXkAX"
Abdee,2020-07-14 08:21:03,Sabhara Polres Banggai Patroli Rutin Sambil Bagi-bagi Masker https://t.co/t6pCytVUvI https://t.co/aohf6yVIjY
Abdee,2020-07-13 10:50:05,Ini Hasil Diagnosis Dokter Terkait Kematian Tersangka WN Prancis di Sel https://t.co/gC79fxyoIx https://t.co/0NbcpkWQDP
Abdee,2020-07-13 10:50:03,"Pesta Seks 37 Pelajar SMP saat Rayakan Ulang Tahun, Petugas Temukan Kondom dan Obat Kuat https://t.co/mxctWEUa8N https://t.co/p8f3A0FZcm"
Abdee,2020-07-13 07:45:03,3 Orang Tim SAR yang Hilang di Sungai Desa Tambayoli Ditemukan Selamat https://t.co/wTBiXMwHMj https://t.co/O6uzVyJAmq
Abdee,2020-07-12 10:44:04,"9 Tahun Mengabdi, dr Deni yang Meninggal COVID-19 Dikenal Low Profile https://t.co/7kgbDE9SIO https://t.co/BcUcLqdcr4"
Abdee,2020-07-12 10:44:03,PDIP Angkat Suara soal Isu Reshuffle Kabinet Jokowi https://t.co/ygSGCaxRgW https://t.co/N7KkJVmKFO
Abdee,2020-07-12 07:08:03,Disdik Kota Palu Keluarkan Instruksi Larangan Aktifitas Tatap Muka https://t.co/uNNFWftuc3 https://t.co/VzLtbO1bIa
Abdee,2020-07-11 10:41:34,"1,8 Juta Orang Positif Corona di Brasil, Lebih dari 70 Ribu Meninggal https://t.co/xQn43oKVKT https://t.co/PQEK1s1WhB"
Abdee,2020-07-11 10:41:33,Kasus Positif 70 Ribu dan Jurus Buntu Jokowi Lawan Corona https://t.co/DtWqSJwSiB https://t.co/BcESV5XIRQ
Abdee,2020-07-11 07:06:03,"Pasca Kebanjiran, RSUD Torabelo Sigi Tidak Lakukan Layanan Kesehatan https://t.co/XB2LZB0x3n https://t.co/Lmxx5D49xE"
Abdee,2020-07-10 10:40:05,"Penyiksaan Kuli, DPR Sebut Polisi Masih Berwatak Militer Orba https://t.co/XffIGVUEyE https://t.co/9XdNq5PdPV"
Abdee,2020-07-10 10:40:04,Damkar Kota Palu Dapat Bantuan Armada dari Jepang https://t.co/NoH3YUUSbQ https://t.co/JQGZWLAUsn
Abdee,2020-07-10 07:03:02,20 Tahanan Titipan Kejari Parimo Dipindahkan ke Lapas Kelas III Parigi https://t.co/Cu2h55DWu8 https://t.co/mNfAR8ErdI
Abdee,2020-07-09 10:38:05,Yasonna: Ada Negara Eropa Coba Suap Cegah Ekstradisi Maria https://t.co/nMUvLBKJn0 https://t.co/F0ZrTKo348
Abdee,2020-07-09 10:38:03,Kemendikbud Prediksi Hal-hal yang Berubah di Pendidikan Usai Pandemi https://t.co/TI4aPNGhrq https://t.co/z45BC9ZroL
Abdee,2020-07-09 06:59:32,"Peti Jenazah Pasien COVID Dibongkar Demi Istri Kedua, Polisi Amankan Provokator https://t.co/JrAJUe5bye https://t.co/Aaq5GRUuSF"
Abdee,2020-07-08 10:35:05,Seorang Pemuda Dibekuk Polisi Lantaran Mencuri Laptop https://t.co/lBvb3PmTGz https://t.co/kVWtMonPEY
Abdee,2020-07-08 10:35:03,Sulteng Dipastikan Ikuti Kejuaraan Futsal Piala Presiden https://t.co/wlvQsEnQ39 https://t.co/J679VkpQf7
Abdee,2020-07-08 06:58:03,Muhammad Irwan Resmi Nahkodai PCNU Sigi https://t.co/5DTfy3cRyJ https://t.co/BhF387svO4
Abdee,2020-07-07 10:32:04,2 Pria di Banggai Dibekuk Polisi Saat Transaksi Sabu https://t.co/LuAw5mkRAd https://t.co/YCRzRah2ud
Abdee,2020-07-07 10:32:03,"Pastikan Terbebas Covid-19, Komisioner dan Pegawai KPU Poso Jalani Rapid Test https://t.co/ZjagcDRxVV https://t.co/WJa6lvtxGl"
