username,created_at,text
Abdee,2021-06-07 15:11:08,Operasi Perburuan Teroris di Kawasan TNLL Berakibat Objek Wisata Ditutup dan Hambat Program Konservasi https://t.co/oqgohZWkRJ https://t.co/6BS46PaNh3
Abdee,2021-06-07 15:11:06,Komunitas Motor dan Penggiat Alam Bebas di Touna Kolaborasi Tanam Mangrove https://t.co/sWWTNCmlMb https://t.co/oPb2vnz3eQ
Abdee,2021-06-07 15:11:03,"Pandemi Covid-19, Bawaslu Sulteng Menginovasi Koperasi Konvensional ke Virtual https://t.co/HLgc8HcEF1 https://t.co/neAWbAOS83"
Abdee,2021-06-06 15:07:09,Geliat Peringatan Hari Lingkungan Hidup Sedunia di Pesisir Teluk Tomini Parigi Moutong https://t.co/zmFMQVeHj3 https://t.co/sTIpgSDgkT
Abdee,2021-06-06 15:07:06,Kelompok KUPS asal Alitupu Belajar Pascapanen Kopi di Dombu https://t.co/G5YBXDXW9a https://t.co/SRQtwCWCke
Abdee,2021-06-06 15:07:04,"Tengah Pendemi, Kalla Grup Luncurkan Toyota Raize di Palu https://t.co/RXEfupAi4n https://t.co/LZuGBvIkyh"
Abdee,2021-06-05 11:59:04,"Tuduh Mahasiswa Minta Uang ke BWSS II, Oknum Akitivis Dilapor ke Polda Gorontalo https://t.co/JUaqHmBEkB https://t.co/QiKOYTLbgP"
Abdee,2021-06-05 08:58:33,"DPD KNPI Morowali dan Balut Resmi Dibekukan, Ada Apa? https://t.co/MbFq9sh7rb https://t.co/HGQczcesVG"
Abdee,2021-06-05 05:57:04,12 Anak Terima Penghargaan Lomba Melukis Bertema Covid-19 dari Forest Programme III https://t.co/szmKSuPwhO https://t.co/nY8KlnSfAP
Abdee,2021-06-04 09:00:03,Rival “MAN” Himran Daur Ulang Lagu Legendaris Vose Sakaya https://t.co/B4e6rr3eZB https://t.co/kPGbrsRbj4
Abdee,2021-06-04 05:55:06,"Gelar Duta Narkoba di Tengah Pandemi, BNNP Sulteng Terpaksa Batasi Peserta https://t.co/YDW1Oo8zyF https://t.co/U8iLmWj6kz"
Abdee,2021-06-04 05:55:03,"Yang Hadir Hanya 9 Orang, Rapat Paripurna Pansus Covid-19 DPRD Touna Ditunda https://t.co/NbessKPphq https://t.co/guexfMg7Ys"
Abdee,2021-06-03 08:55:33,"Pastikan Pelayanan Optimal, Tim Saber Pungli Kunjungi Samsat Palu https://t.co/lmic6JzxM4 https://t.co/wTv7MI3mB9"
Abdee,2021-06-03 05:52:06,"Kasus Terorisme di Poso Bikin Warga Takut, Wabup Yasin : Kami akan Bertemu Presiden Jokowi https://t.co/bD1ae8R2h7 https://t.co/lpDEoTWo2f"
Abdee,2021-06-03 05:52:04,Kapolda Sulteng Targetkan 2 Bulan Berantas Kelompok MIT https://t.co/fcTshBSHvI https://t.co/Ld899dFUwd
Abdee,2021-06-02 08:46:03,Gubernur Sulteng Ajak Perusahaan Genjot Vaksinasi Gotong Royong https://t.co/mXmLSbVBFF
Abdee,2021-06-01 14:42:33,"Sebut Dana Stimulan Sudah Tersalurkan 96%, Walikota Palu: Tanggal 6 Insya Allah Selesai https://t.co/3ZaLlF2v86 https://t.co/xrnizJUpAq"
Abdee,2021-05-31 08:33:04,Wahyu Hidayat Sudirman Resmi Jabat Wakil Ketua I DPRD Morut https://t.co/2QLCESx4Oh https://t.co/65qXQVVW5p
Abdee,2021-05-30 13:58:33,"Reuni Alumni SMANSA Poso Angkatan 88, Raymon: Dulu Anwar Hafid Duduk di Belakang, Sekarang di Depan https://t.co/HyovSRx0dB https://t.co/AaV8twfoD9"
Abdee,2021-05-28 13:44:08,Abdee Negara Diangkat Jadi Komisaris PT Telkom Indonesia https://t.co/bUjEnnn9EF https://t.co/QAJxRMAdhi
Abdee,2021-05-28 13:44:06,"Kunker ke Poso dan Tojo Unauna, Panglima TNI dan Kapolri Perkuat Sinergitas https://t.co/MtBV2APKlA https://t.co/Kncrg2W3t0"
Abdee,2021-05-28 13:44:04,Wamen PUPR Sebut Pemkot Palu Tak Peduli Penyelesaian Huntap https://t.co/YkbU2L3RP0 https://t.co/qhZf9FiI1g
Abdee,2021-05-26 18:54:04,"Prosesi Ibadah Hari Raya Waisak di Kota Palu, Lakukan Pembatasan hingga Perketat Prokes https://t.co/rzh8XPlvGy https://t.co/t1Cl1GH1Rz"
Abdee,2021-05-25 18:50:06,"Kampung Tangguh, Kelurahan Birobuli Selatan Palu Kini Zero Kasus Covid-19 https://t.co/l29RFRopBB https://t.co/IEj79U0ybQ"
Abdee,2021-05-25 12:45:11,"Gempa Mag 2,9 Guncang Palu , Peserta RUPS-LB Bank Sulteng Berhamburan https://t.co/YM0zSNblH2 https://t.co/KpLIteJJZi"
Abdee,2021-05-25 12:45:08,"Silaturahmi Kebangsaan PKS-Nasdem Sulteng, Topiknya Dari Masalah Gempa Hingga Terorisme https://t.co/4ZWXN55guF https://t.co/6IV4VIZJmM"
Abdee,2021-05-24 18:46:04,"Tanah Kembali Digugat, Ketum PB Alkhairaat: Jangan Ganggu Singa Sedang Tidur https://t.co/nTOnmcc2c1 https://t.co/Fn5nP0mvdb"
Abdee,2021-05-24 12:41:35,"Tiga Kali Berturut-turut, Morut Raih Opini WTP dari BPK https://t.co/2wLQ8z8Do4 https://t.co/OwAlKorFlA"
Abdee,2021-05-24 12:41:34,Karyawan IMIP Mulai Jalani Vaksinasi Covid-19 https://t.co/JJm6xed3Ol https://t.co/remT6FPkI6
Abdee,2021-05-23 18:42:03,"Buaya Ukuran Jumbo kembali Ditangkap di Donggala, Warga: Masih Ada yang Besar https://t.co/PQBxjZ8qIk https://t.co/DyNnnffU3p"
Abdee,2021-05-23 12:38:34,12 Pegawai BPS yang Terpapar Covid-19 Telah Jalani Vaksinasi https://t.co/tLgJ6o7ii4
Abdee,2021-05-23 12:38:33,Polsek Toili Berikan Edukasi Pentingnya Prokes Melalui Operasi Yustisi https://t.co/r9H7WsoqEh https://t.co/NZog4jA9dc
Abdee,2021-05-22 18:32:06,"Kecam Aksi Terorisme, Pemuda Tentena Minta TNI-Polri Usut Kasus Poso https://t.co/Dx1DZp6Y4m https://t.co/6VY4B1iyxk"
Abdee,2021-05-22 12:32:03,42.500 Karyawan IMIP Siap Menerima Vaksin Covid-19 https://t.co/pzWMI8pdDH https://t.co/tFKdqpCdUl
Abdee,2021-05-22 06:29:34,30 Pegawai BNN Poso dapat Suntikan Vaksin Covid-19 https://t.co/xqmI6wsXXH https://t.co/Ropl068TcQ
Abdee,2021-05-21 15:30:03,"Unjuk Rasa Terkait Pemadaman Listrik, AMM Minta Kepala PLN Bungku Dicopot https://t.co/UjMuJcVorz https://t.co/LxN7EQE74d"
Abdee,2021-05-21 06:25:37,"Terduga Jambret Karyawan Bank di Poso Dibekuk Polisi, Ternyata Warga Ampana https://t.co/BskvKqUsmZ https://t.co/kISV3E3ak4"
Abdee,2021-05-21 06:25:35,"Temui Gubernur Longki, Kepala Bank BTN Cabang Palu Paparkan Hal Ini https://t.co/zzWrlSU4Wc https://t.co/gVSFO4bS9N"
Abdee,2021-05-20 15:26:03,102 Anggota Bhayangkari Polres Palu Ikuti Vaksinasi Dosis Pertama https://t.co/xdyeDvL6MS https://t.co/AbHd5cR2eY
Abdee,2021-05-20 06:23:05,"Polres Sigi Laksanakan K2YD, Imbau Semua Pengendara Patuh Protokol Kesehatan https://t.co/oOMwqRNiyh https://t.co/RShiAr92fh"
Abdee,2021-05-20 06:23:03,Dua Menteri Ekonomi Jokowi dan Kadin Sulteng Dukung ARS Pimpin Kadin Indonesia https://t.co/NBo5cb8l2v https://t.co/yl4TGXUkmr
Abdee,2021-05-19 15:23:04,Himpunan Petani Kamanuru Targetkan Penanaman Kopi 60 Hektar https://t.co/sQR0HAZfAz https://t.co/iCxofwZIe3
Abdee,2021-05-19 06:20:05,Pemda Poso Gandeng Tokoh Lintas Agama Bahas Kasus Terorisme https://t.co/Mpq2kzLcvD https://t.co/B6ewG6nrrc
Abdee,2021-05-19 06:20:03,Sigi Terima Penghargaan Terbaik Ketiga Penyusunan LKPD https://t.co/zdcS0HraJ8 https://t.co/GOg4AicaVu
Abdee,2021-05-18 15:19:36,"Percepat Pelayanan Perizinan, Dinas PMPTSP Morowali Lakukan Integrasi https://t.co/3kLY8q1XPZ https://t.co/RojjQCwxs3"
Abdee,2021-05-18 06:18:06,TNK No Mercy Juarai Turnamen Free Fire di Tentena https://t.co/V6RiR26Poc https://t.co/GKXJdxxt1v
Abdee,2021-05-18 06:18:04,"Anwar Hafid Bertemu Bupati Morowali, Tuntaskan Insfrastruktur Masjid Agung https://t.co/XzDlH7bzXk https://t.co/QTA9euh8qk"
Abdee,2021-05-17 15:16:07,"Tak Bersuara Soal Palestina, Rachmat Gobel Diminta Mundur dari Wakil Ketua DPR RI https://t.co/JL0Obt1r9o https://t.co/mbrkO9DZcn"
Abdee,2021-05-17 06:13:35,"Pasca Aksi Teroris MIT, Warga Lore Timur Trauma Berkebun https://t.co/vB2etib33R https://t.co/bs5q5upYEd"
Abdee,2021-05-17 06:13:34,"Belum Tunjukkan Ijasah S1, Imran Latjedi Terancam Batal jadi PAW Waket DPRD Sigi https://t.co/7kKR71tWfi https://t.co/5NFz5sp4CO"
Abdee,2021-05-14 18:00:07,Polisi Selidiki Penyebab Kebakaran Rujab Pimpinan DPRD Parigi Moutong https://t.co/uu9F2vUzqB https://t.co/g44x6Pa7nX
Abdee,2021-05-13 14:47:06,Rujab Ketua DPRD Parigi Moutong dan Wakilnya Ludes Terbakar https://t.co/JGecKrJ5Fv https://t.co/LR5DP4Rx6e
Abdee,2021-05-12 17:38:37,Sispek Tutup Ramadhan dengan Bersedekah https://t.co/19jm1xp3xB https://t.co/rcV7mWm1k6
Abdee,2021-05-10 20:04:07,Wartawan di Morowali Berbagi Paket Lebaran ke Kaum Dhuafa https://t.co/JM44dg5aUg https://t.co/5v8OHwmbXw
Abdee,2021-05-10 17:03:06,"Sertijab Polres Morowali, Berikut Nama-namanya https://t.co/eHTImGVm3O https://t.co/JXlkS6tCid"
Abdee,2021-05-10 17:03:04,Kodim 1311 Morowali Berikan Penghargaan ke Veteran dan Warakauri https://t.co/FjzsfQS0Ra https://t.co/edxORmG7xf
Abdee,2021-05-09 16:59:06,"Berbagi Kebaikan, LP4D Unsimar Poso Santuni Panti Asuhan dan Kaum Duafa https://t.co/sShvKW3ebt https://t.co/pED4ivkbYL"
Abdee,2021-05-09 16:59:05,"Reses, Sakinah Aljufri Serap Aspirasi Konstituennya https://t.co/UNkDHKmqEj https://t.co/8AGNlOZB5k"
Abdee,2021-05-09 14:00:04,Kapolres Morowali Cek Pos Pengamanan Idul Fitri https://t.co/Y5bfZnXBIM https://t.co/fpG6csnSWy
Abdee,2021-05-08 13:56:38,"Cegah Kanker Payudara, Astra Agro Gelar Agrovaria Lovepink https://t.co/e8nuFeRmiu https://t.co/FhcJQQduEn"
Abdee,2021-05-08 13:56:37,"Jelang Idul Fitri, PT IMIP Salurkan Paket Sembako dan Ribuan Masker ke Kaum Dhuafa https://t.co/Qqk07XexeL https://t.co/WKGYsThe9H"
Abdee,2021-05-08 13:56:35,"Peduli Sesama, HIPMI Poso Santuni Anak Yatim https://t.co/ubAS0I9QZL https://t.co/aP9YJgrz9W"
Abdee,2021-05-07 13:54:07,"Sidang Paripurna Ketiga DPRD Morowali, Hasil Reses Dianggarkan di APBD Perubahan 2021 https://t.co/tYlfO1C2wa https://t.co/vH8Cy0SENL"
Abdee,2021-05-07 13:54:05,KADIN Peduli Dorong Kesejahteraan Masyarakat di Bulan Ramadhan https://t.co/L5NiErSKtm https://t.co/OqAz04AYoP
Abdee,2021-05-07 13:54:03,Keluh Kesah Pedagang Pakaian Muslimah Palu di Masa Pandemi Selama Ramadhan https://t.co/GlSmHcstFX https://t.co/DLN0ZY0djP
Abdee,2021-05-06 13:51:09,Bupati Poso Izinkan Sholat Idul Fitri Berjamaah https://t.co/V4HxHMa5ch https://t.co/XLZ6xPznwc
Abdee,2021-05-06 13:51:08,Kapolres Poso: Pemudik yang Melintas di Perbatasan Akan Dipulangkan https://t.co/Y5NHmwOF3A https://t.co/7FOjkN7QG2
Abdee,2021-05-06 13:51:06,"Dua Gugatan Moeldoko Cs Ditolak Pengadilan, Mehbob : Berani Gugat Kenapa Tak Berani Hadir? https://t.co/PZ7pZSom1V https://t.co/XNTgHWMoVv"
Abdee,2021-05-05 13:47:08,"Potongan Donasi di Alfamidi Dikomplain, Disperindag Parigi Moutong Lakukan Sidak https://t.co/h8iYBLJMYs https://t.co/tRfBMVPJXl"
Abdee,2021-05-05 13:47:07,"Memutus Mata Rantai Covid-19, Samapta Polres Morowali Patroli Turjawali https://t.co/ntgXG7DVpP https://t.co/mAqYjOYaCr"
Abdee,2021-05-05 13:47:05,Belajar Tatap Muka di Poso Dilaksanakan Bulan Juli https://t.co/h7Sc5IQNS6 https://t.co/Cn6KOnbNBL
Abdee,2021-05-04 13:44:40,"H-7 Lebaran, Perusahaan Wajib Bayarkan THR https://t.co/Yws4H8SppE https://t.co/nQ660jG4kR"
Abdee,2021-05-04 13:44:38,Ini Wilayah di Sulteng yang Masyarakatnya Diperbolehkan Bepergian https://t.co/dT37n0a3IP https://t.co/HPjwEbfcDk
Abdee,2021-05-04 13:44:37,Pemda Touna Alokasikan Dana Rp300 Juta untuk Pasar Lelang Daerah https://t.co/PLNIdkT4c8 https://t.co/pUKHBTa8yb
Abdee,2021-05-03 13:41:05,Komunitas Pemuda di Poso Ini Bagikan Paket Makanan Sahur https://t.co/nJGdxGIRGB
Abdee,2021-05-03 13:41:03,"Tindaklanjuti Temuan BPK RI, Pemda Morowali Gelar Rakor https://t.co/cdIaO51Ghq"
Abdee,2021-05-03 13:41:03,"Tak Ada Lonjakan, Pelni Palu Berangkatkan 120 Penumpang H-3 Larangan Mudik https://t.co/PK2mmOl0Xx"
Abdee,2021-05-02 01:31:04,Esports Indonesia Poso Santuni Santri di Panti Asuhan Yayasan Faradhila https://t.co/RS7NtX19nR https://t.co/HpsVhbppHb
Abdee,2021-05-02 01:31:03,"May Day, SPIM Sampaikan Aspirasi Secara Dialogis https://t.co/03bYMKyd8H https://t.co/c2j9yJqOLu"
Abdee,2021-05-01 04:32:33,"Jelang Idul Fitri, Kapolda Sulteng akan Keluarkan Maklumat https://t.co/OIwbSedgPM https://t.co/cLmFKv7N64"
Abdee,2021-04-30 19:29:05,"Usai Dilantik jadi Bupati Morut, Delis Sebut akan Tancap Gas Full https://t.co/SlLOd4ExLE https://t.co/qVmxKKTUtv"
Abdee,2021-04-30 19:29:03,Kapolda Sulteng Minta Kelompok Teroris Ali Kalora Cs Menyerah https://t.co/Dy94YX2KNT https://t.co/gqyC7rFyaJ
Abdee,2021-04-30 04:29:03,Gubernur : Daerah-daerah yang Saling Berhubungan di Sulteng Bisa Mudik https://t.co/zfFRU0uMUY https://t.co/LtSnMxvMoQ
Abdee,2021-04-29 19:26:04,"Wabup Parigi Moutong Marah, 21 Pejabat Abaikan LHKPN https://t.co/M9vbXSwEwc https://t.co/oYFKmz3QEl"
Abdee,2021-04-29 19:26:03,BNN Poso Ajak Kaum Milenial Perangi Narkoba https://t.co/TFLhZgPVWl https://t.co/IXXqTRH1Zw
Abdee,2021-04-28 22:23:33,Musisi Sulteng di Jakarta Rilis Single Religi untuk Nuzulul Qur’an https://t.co/UeMevPZ1F3 https://t.co/NWSkq78m7W
Abdee,2021-04-28 19:23:05,"Panen Jagung Perdana, Petani di Jono Binaan YPI Hasilkan 6 Ton per Hektar https://t.co/a5ANu0G7kU https://t.co/DvzlK8oHiT"
Abdee,2021-04-28 19:23:04,"Safari Ramadan ke Sulteng, AHY: Pemikiran Ulama Sangat Dibutuhkan Negara https://t.co/Uv0HO2sAW9 https://t.co/Vu8D30wWlD"
Abdee,2021-04-27 22:15:35,"Realisasi PAD SKBS Parigi Moutong: Pengawasan Legislatif Lemah, Eksekutif Keliru https://t.co/G6skDCSSka https://t.co/0dGDF3N9rL"
Abdee,2021-04-27 13:11:35,Training Ramadhan https://t.co/SBEhPsR5FV https://t.co/WwUJTzTQ0Z
Abdee,2021-04-27 13:11:34,"Diduga Lecehkan Karyawan Perusahaan, WNA Asal Tiongkok di Morut Dilapor ke Polisi https://t.co/ZPvIf85Onr https://t.co/dPOLOmj9Gk"
Abdee,2021-04-26 16:08:04,"Buka Pintu Demokrat untuk Kubu KLB Moeldoko, AHY : I Forgive But Not Forget https://t.co/yhcaXIG9mU https://t.co/mp3ijFtvte"
Abdee,2021-04-26 13:08:05,Kebutuhan Uang Kartal di Sulteng Rp986 M Selama Ramadan dan Idul Fitri https://t.co/6OiVuCuR7o https://t.co/m6XOkrNlOu
Abdee,2021-04-26 13:08:04,Aktifitas Penumpang di Bandara Mutiara Sis Al-Jufrie Palu Diprediksi Menurun https://t.co/EKshTgLebK https://t.co/uSae7AMwdW
Abdee,2021-04-24 12:57:05,DPRD Sulteng Sosialisasikan Perda Nomor 8 Tahun 2019 https://t.co/RhoFTUu4u4 https://t.co/Apu1fsHpNT
Abdee,2021-04-24 12:57:03,"Belajar Dari Bencana Palu, Rizal: Perlu Adanya Revisi RTRW https://t.co/qZpm7DfHr8 https://t.co/4IwNDmuvof"
Abdee,2021-04-23 18:48:04,"Program Bupati Poso, Darmin Sigilipu: Jangan Hanya Janji Politik https://t.co/7TzJeTuMca https://t.co/mkhEwiBlLC"
Abdee,2021-04-23 09:49:05,"Buron, ASN Koruptor Jembatan Torate Donggala Diciduk di Kantor PU Binamarga Sulteng https://t.co/Bwtp6vNALP https://t.co/daBq9jQrGT"
Abdee,2021-04-23 09:49:03,"Tangani Musibah, Pemkot Palu Bentuk Satgas Reaksi Cepat https://t.co/D0qTy2fhng https://t.co/VYR5m6AyOf"
Abdee,2021-04-22 18:45:03,Warga Kelurahan di Palu Disanksi Rp1 Juta Jika Lakukan Ini https://t.co/CBXFf9hZJq https://t.co/ZPzDrL6pml
Abdee,2021-04-22 09:46:05,"Peringatan Hari Kartini, Reny A. Lamadjido: Perempuan Harus Berinovasi https://t.co/QmEFnYxzKa https://t.co/MrKOxgZ8HA"
Abdee,2021-04-22 09:46:03,Pembelajaran Tatap Muka Fisip Untad Palu Tunggu Keputusan Pemerintah https://t.co/ASF8Nt0xyl https://t.co/yfl2RjBa1K
Abdee,2021-04-21 18:42:04,Kisah Kartini Masa Kini Pejuang Pandemi https://t.co/pcWPwKwi5N https://t.co/NdzsIEmmSR
Abdee,2021-04-21 09:43:06,Gubernur Longki : Hari Kartini Dorong Pemangku Kepentingan Perhatikan Eksistensi Perempuan https://t.co/z6fpUCAGkk https://t.co/K5IHE4WJAx
Abdee,2021-04-21 09:43:04,Asa Ramadhan https://t.co/bsYCjWglrR https://t.co/Q4XQLuUjGe
Abdee,2021-04-20 18:39:04,Walikota Palu: ASN Pemkot Harus Disiplin https://t.co/FgLH6IamxW https://t.co/rnxnGIZG5Q
Abdee,2021-04-20 09:40:06,Pemkab Sigi-BNI Jajaki Kerjasama Smart City https://t.co/m2SlgEnMH1 https://t.co/MBiW8Q2KfI
Abdee,2021-04-20 09:40:04,Polres Morowali Sediakan Parkiran Khusus Penyandang Disabilitas https://t.co/J997NDq5jF https://t.co/0Vur4LeZE8
Abdee,2021-04-19 18:36:02,VIDEO : Nelayan Parimo Ditemukan di Gorontalo Setelah Dua Hari Hilang Dihantam Badai https://t.co/gotRakm7tv
Abdee,2021-04-19 09:36:07,Tafakur Ramadhan https://t.co/DqjGHEA4r0 https://t.co/MdiO31YcyI
Abdee,2021-04-19 09:36:04,"VIDEO : Cabuli Anak Tiri Berusia Lima Tahun, Pria di Parigi Diringkus Polisi https://t.co/HHB3VdeTrr https://t.co/pAEyg2r9qF"
Abdee,2021-04-18 18:33:04,Empat TPS di Morowali Utara Gelar PSU Pemilihan Bupati dan Wakil Bupati https://t.co/Kk2iUMBbuo https://t.co/W4YPitlJ5U
Abdee,2021-04-17 21:29:05,"Puting Beliung Terjang Desa Meko, Seorang Warga Ditemukan Meninggal https://t.co/3hNgrIbMzv https://t.co/pSOpTg4Ki0"
Abdee,2021-04-17 12:30:04,Richard Djanggola Dilantik jadi Penjabat Bupati Tojo Unauna https://t.co/QFIyotE3M4 https://t.co/IVk0ytX8si
Abdee,2021-04-17 12:30:03,Ramadhan Berkualitas https://t.co/dv64mHtYHr https://t.co/f2fghQumGl
Abdee,2021-04-16 21:27:03,Oknum Polisi Diduga Aniaya Dua Orang Anak di Parigi https://t.co/AT6ww9JBBw https://t.co/VRDYe2e7Me
Abdee,2021-04-16 12:26:05,Kejati Sulteng Tetapkan Satu Tersangka Lagi Dugaan Korupsi Jembatan Torate https://t.co/sGbVExZWoR https://t.co/oalF5pFcfu
Abdee,2021-04-16 12:26:03,"Tingkat Hunian Kamar Hotel di Sulteng Meningkat 1,13 Persen https://t.co/zeVhP2pBR6 https://t.co/bwzkXn0RhV"
Abdee,2021-04-15 18:20:05,Spirit Ramadhan https://t.co/Rm4Z4ajCWM https://t.co/5wh3lOOXgX
Abdee,2021-04-15 09:23:05,"Galungan Bertepatan Bulan Puasa, Umat Hindu di Palu Diajak Jaga Toleransi https://t.co/zIziau2YBY https://t.co/uOqSs3gIuW"
Abdee,2021-04-15 09:23:04,Pengendara Kembali Keluhkan Jalan Berlubang di Kecamatan Palu Selatan https://t.co/cRaDYs2QgW https://t.co/Hwd3lrDAb0
Abdee,2021-04-14 18:18:05,Buruan !! Hotel Ancyra Poso Sediakan Promo Ramadhan https://t.co/XA07g9Pc1O https://t.co/fqUi7xwZUF
Abdee,2021-04-14 09:16:04,"Maritim Menyapa Nelayan, Lanal Palu Siapkan KAL untuk Transportasi https://t.co/yYJ1AGFFA5 https://t.co/4IbfZy3qI0"
Abdee,2021-04-13 15:14:05,HUT ke-57 Sulawesi Tengah Diperingati Sederhana https://t.co/s3OxTaoLAz https://t.co/dZmd8bBE2T
Abdee,2021-04-13 15:14:04,"HMI Touna Minta Tidak Ada Pemadaman, PLN: Kita Defisit Daya https://t.co/Zlm6UoX3Ft https://t.co/YVjztlzGH0"
Abdee,2021-04-12 21:11:35,Polisi Amankan Sembilan Pasangan Mesum di Bahodopi https://t.co/yxJAAxLYMg https://t.co/1TelU1Faq2
Abdee,2021-04-12 15:11:35,Akhirnya Ramadhan Tiba https://t.co/MrW44gkDna https://t.co/EmrGzWKaLk
Abdee,2021-04-12 15:11:34,Rachmat Gobel Tantang Syarief Mbuinga Di Pilgub Gorontalo https://t.co/D6obP5XOzV https://t.co/FVKgGhUJYq
Abdee,2021-04-11 21:08:34,Pawai Obor Sambut Ramadhan di Poso Diikuti Ribuan Umat Islam https://t.co/I4SqjGKxhk https://t.co/qtjvZpetz5
Abdee,2021-04-11 15:09:05,"Sering Ditemukan Sajam di Blok Tahanan, Kalapas Askari: Itu Kreatif https://t.co/vRtlO0XjTH https://t.co/eP9PHLOMbO"
Abdee,2021-04-11 15:09:04,Arkom dan Penyintas Tompe Donggala Mulai Bangun Huntap https://t.co/Qbw2rm16Bu https://t.co/QZkvguEF0E
Abdee,2021-04-10 15:06:11,Forum PRB Sigi Perkuat Mekanisme Kerjasama dengan Pemangku Kepentingan https://t.co/T9MHwDZPhl https://t.co/SjUfgbMWZi
Abdee,2021-04-10 15:06:07,"Kasus Korupsi Jembatan V Palu, Jaksa: Kerugian Negara Rp2,4 Miliar https://t.co/2NxEE9m0sq https://t.co/2vIwGSozfV"
Abdee,2021-04-10 15:06:05,Rektor Unismuh Palu Rajindra Dilantik https://t.co/5BPe9ldjm5 https://t.co/g1DOMLnonN
Abdee,2021-04-09 15:03:05,KKNTT Sulteng Buka Posko Peduli Bencana Banjir Bandang NTT https://t.co/R8vyU5ilwc https://t.co/wCls8hOlDw
Abdee,2021-04-09 15:03:04,"Rapat Koordinasi Memasuki Ibadah Puasa, Pemcam Bungku Timur Berlakukan Empat Ketentuan https://t.co/zJoqtpIrq2 https://t.co/uE1x3kSDv0"
Abdee,2021-04-09 15:03:02,Pemkot Palu Siapkan Program Bedah Rumah Hingga Rumah Susun untuk Warga Kurang Mampu https://t.co/VttHpInfIR https://t.co/2KcTCiQpIa
Abdee,2021-04-08 15:00:06,Lima Gedung Ruang Praktek SMK di Palu dan Sigi Diresmikan https://t.co/9neux43xGW https://t.co/F9jUgA497j
Abdee,2021-04-08 15:00:05,Pengungsi Banjir Bandang Desa Beka Sudah Kembali ke Rumah https://t.co/3jEZsR0ZP7 https://t.co/2XU2w7ejPS
Abdee,2021-04-08 15:00:03,"BPC HIPMI Morowali Berkunjung ke Makassar, Ajak Pengusaha Berinvestasi di Daerah https://t.co/BJjzVh2pg6 https://t.co/UmaRleBVc9"
Abdee,2021-04-07 14:58:06,Pengurus PWI Poso Masa Bakti 2020-2023 Resmi Dilantik https://t.co/GqYtKpugP7 https://t.co/ujYjEpxemD
Abdee,2021-04-07 14:58:04,Sembilan Pejabat Pimpinan Tinggi Pratama Pemda Morowali Dilantik https://t.co/CPt13FbZSo https://t.co/IAFiXb1BzS
Abdee,2021-04-07 14:58:03,"Timbun Setengah Kilogram Sabu, Seorang Pria di Banggai Dibekuk Polisi https://t.co/KXnlZs8JVD https://t.co/Dso7PS0HsO"
Abdee,2021-04-06 14:55:36,"Anindya-Arsjad, Dua Caketum Dinilai Pantas Pimpin Kadin Indonesia https://t.co/uadT6ggatz https://t.co/G5PN6h4Rwx"
Abdee,2021-04-06 14:55:35,Disperindag Parigi Moutong Lakukan Tera Ulang di Dua SPBU https://t.co/ncApdsfNrt https://t.co/Uq1UDY968U
Abdee,2021-04-06 14:55:33,Pemda Morowali Targetkan Peningkatan Pajak Hingga Rp36 Miliar https://t.co/Su8qLxX8Y7 https://t.co/74wu9cJrhf
Abdee,2021-04-05 12:03:03,Persiapan Penggunaan Tes GeNose di Bandara Mutiara Sis Al-Jufri Palu https://t.co/RWE5xI3Ev2 https://t.co/Y14d1SaDDR
Abdee,2021-04-04 12:01:08,"Paskah 2021, Pastor Jefri Adrianus Imbau Jaga Kerukunan Antar Umat Beragama https://t.co/iy7ODigSZt https://t.co/g2dH7Foirw"
Abdee,2021-04-04 12:01:06,Tim Mobile Legends Asal Tentena Juarai Turnamen ESI Poso https://t.co/R0m6uDzAdh https://t.co/f5AtNA8oLQ
Abdee,2021-04-04 12:01:04,Kebijakan Pemda Morowali Melarang Pasar Ramadhan Disoroti https://t.co/bFe4eyLRL4 https://t.co/RBe3AI6JGl
Abdee,2021-04-03 09:03:03,Polres dan Kodim Gelar Patroli Skala Besar di Morowali https://t.co/9uMhcKSfU4 https://t.co/gG0t6BAbVG
Abdee,2021-04-02 17:32:05,20 Duta Promosi Kesehatan Covid-19 di Palu Dikukuhkan https://t.co/8utA2kl3Xs https://t.co/oFZYExSxFm
Abdee,2021-04-02 17:32:04,Anggota PFI Palu Sabet Gelar Photo of the Year APFI 2021 https://t.co/K18KaK8w6O https://t.co/MhE45SazCo
Abdee,2021-04-02 09:00:34,Parigi Moutong Terbaik Penanganan Stunting di Sulteng https://t.co/SjVEDJ7Vru https://t.co/NGQiy5aLaL
Abdee,2021-04-01 17:31:06,FKUB Sulteng Imbau Perketat Keamanan Perayaan Jumat Agung https://t.co/r8fGTF5wWn https://t.co/j11wqRpk1e
Abdee,2021-04-01 17:31:04,"Beri Dukungan Bagi Esports, Wabup Poso: Silahkan Berkarya https://t.co/JgE6Res3uk https://t.co/Wdu5UkjoHj"
Abdee,2021-04-01 08:59:03,Morowali Disebut Berpotensi Peredaran Narkoba https://t.co/P5W0I2IWKG https://t.co/IqZasBdQ7F
Abdee,2021-03-31 17:29:11,Wakil Ketua II DPRD Parigi Moutong Resmi Dijabat Alfres Tonggiroh https://t.co/sDolWxJ1EZ https://t.co/p5lwmXzFbR
Abdee,2021-03-31 17:29:09,LKPJ Walikota Palu: Realisasi PAD di 2020 Capai Rp260 Miliar https://t.co/YFaRMePZBM https://t.co/VUlBgoYOP5
Abdee,2021-03-31 08:56:33,SMP Negeri 7 Palu Sabet Empat Medali di Ajang Pasga Scout https://t.co/xcnYRoCk4R https://t.co/o83CnOvXM7
Abdee,2021-03-30 17:26:35,PMI Sulteng Kekurangan Stok Darah Selama Pandemi Covid-19 https://t.co/HUl5WQ7zBF https://t.co/wNaQFJzQ7O
Abdee,2021-03-30 17:26:33,"Jadi Syarat, Calon Jamaah Haji Lansia di Sulteng Mulai Divaksinasi Covid-19 https://t.co/N2MbgmxMeQ https://t.co/yMy1GRGPmI"
Abdee,2021-03-30 08:54:02,"Silaturahmi dengan Wartawan di Morowali, Danlanal Palu Ajak Bangun Sinergitas https://t.co/zRSJ9BJIQu"
Abdee,2021-03-29 17:24:03,MUI Palu Kutuk Keras Aksi Bom di Gereja Katedral Makassar https://t.co/vxRugmLzcU
Abdee,2021-03-29 17:24:02,Para Pelaku Bom Ikan di Kepulauan Togean Terus Diburu https://t.co/ZG5MfNl3Zc
Abdee,2021-03-29 08:52:04,Dukung Daur Ulang Plastik Sekali Pakai di Palu https://t.co/A3ILrZZiys https://t.co/yde6Sxgo6b
Abdee,2021-03-28 17:22:34,"Kecam Aksi Bom di Gereja Katedral Makassar, FKUB Morowali: Jangan Terprovokasi https://t.co/uYXjcvIvtK https://t.co/DnNy0N6R6E"
Abdee,2021-03-28 17:22:33,Kisruh Pemberhentian Sementara Wakil Ketua II DPRD Parigi Moutong https://t.co/rT1m16TACx https://t.co/MUVDEBuk43
Abdee,2021-03-27 17:34:06,"Morowali Masih Krisis Listrik, Anleg DPR RI Lakukan Pembicaraan di Suluttenggo https://t.co/XRGHVIgRyX https://t.co/oE6gdFmMyG"
Abdee,2021-03-27 14:29:03,"Tanggapi Keluhan Warga Birobuli Selatan, Ir. Elisa: Akan Lakukan Evaluasi https://t.co/MP5bMazMgY https://t.co/SqrN3yoSVg"
Abdee,2021-03-27 08:21:34,Ratusan Warga Terdampak Banjir Bandang di Beka Sigi https://t.co/vQEQtsDNj4 https://t.co/fbYSAz1EcY
Abdee,2021-03-26 17:29:03,Pembangunan Jembatan Jalan Lingkar Parigi Moutong Ditunda https://t.co/nD0gwOGzTt https://t.co/aebigF2Dwc
Abdee,2021-03-26 14:27:33,Bulog Sulteng Pastikan Stok Beras Aman untuk Tujuh Bulan Kedepan https://t.co/RGuCUzHNq1 https://t.co/6XAtitnJZB
Abdee,2021-03-26 08:20:05,"Antisipasi Pandemi, FIFGROUP Luncurkan Dana Bergulir untuk 588 UMKM Bersama 4 Lembaga Astra https://t.co/3cmDFBcFAo https://t.co/YuxzZfmYBk"
Abdee,2021-03-25 17:25:33,Lurah Tatura Selatan Imbau Masyarakat Waspadai Curanmor dan Narkoba https://t.co/6ju7U67PJQ https://t.co/Mz4nUvvAYu
Abdee,2021-03-25 14:25:02,"Tingkatkan Minat Baca Masyarakat, Forum TBM Poso Terbentuk https://t.co/t5AHDSnfqb https://t.co/HapKPoy3i8"
Abdee,2021-03-25 05:17:03,DPO Tersangka Kasus Korupsi Cristian Andi Pelang Tiba di Palu https://t.co/nUs0Tj12kf https://t.co/NlAm0jzL6X
Abdee,2021-03-24 17:19:33,"Innalillahi..Anggota DPRD Sulteng, Budi Luhur Larengi Dikabarkan Meninggal Dunia https://t.co/sxWKASXR6K https://t.co/aenymlcyEw"
Abdee,2021-03-24 14:21:05,"Gelar Aksi, Aliansi untuk Petani Lee Tolak Peninjauan Kembali PT. SPN https://t.co/IGYDn7TG9E https://t.co/sj6rrw2bN9"
Abdee,2021-03-23 17:25:33,Pemda Parimo Gandeng Kemenag dan Pengadilan Negeri Cegah Pernikahan Anak Usia Dini https://t.co/JGtITFdwXq
Abdee,2021-03-23 14:18:35,"Reses di Parigi Moutong, Zalzulmida Djanggola Ingatkan Ini Kepada Masyarakat https://t.co/pgq7jWzwCU https://t.co/2Ffhhi1xLt"
Abdee,2021-03-23 14:18:34,DPRD Parigi Moutong Gelar RDP Validasi Data Masyarakat Prasejahtera https://t.co/kLPysPzHzV https://t.co/MzUlpzZr6j
Abdee,2021-03-22 17:23:33,"Temui Wawali Palu, Tim Dokter Tanggap Bencana Tawarkan Program Mobile OK https://t.co/J2gV4Xgpey https://t.co/52OrPD39ii"
Abdee,2021-03-22 14:17:04,"Kasus Kekerasan Terhadap Jurnalis Alsih Ditutup, Kapolres Palu Minta Maaf https://t.co/Iu2ClZxt5O https://t.co/bTAnLfXc6k"
Abdee,2021-03-22 14:17:03,Moeldoko Diminta Tak Jadikan Reforma Agraria Pengalih Isu Masalahnya di Partai Demokrat https://t.co/MUY9KzBzOU https://t.co/GynvAwoZUE
Abdee,2021-03-21 17:22:03,Kodim 1311 Morowali Lakukan Vaksinasi Covid-19 Tahap II https://t.co/kUMXJCic0Y https://t.co/vxk4CiZCLF
Abdee,2021-03-21 14:14:35,"Sampaikan Permohonan Maaf Kepada Wartawan, Wijaya: Petugasnya Sudah Diperiksa https://t.co/cM2y4dSg1W https://t.co/8JRsfLptgs"
